Authors,Author(s) ID,Title,Year,Source tittle,Cited by,DOI,Country,Document Type,City,Access Type,aggregationType,EID
Pastor-Satorras R.,,Epidemic dynamics in finite size scale-free networks,2002,"Physical Review E - Statistical Physics, Plasmas, Fluids, and Related Interdisciplinary Topics",522,10.1103/PhysRevE.65.035108,Spain,Article,Barcelona,0,Journal,2-s2.0-41349112686
Pastor-Satorras R.,,Immunization of complex networks,2002,"Physical Review E - Statistical Physics, Plasmas, Fluids, and Related Interdisciplinary Topics",799,10.1103/PhysRevE.65.036104,Spain,Article,Barcelona,0,Journal,2-s2.0-41349106738
Newman M.,,Assortative Mixing in Networks,2002,Physical Review Letters,3012,10.1103/PhysRevLett.89.208701,United States,Article,Ann Arbor,0,Journal,2-s2.0-18744389789
Pastor-Satorras R.,,Dynamical and correlation properties of the internet,2001,Physical Review Letters,146,10.1103/PhysRevLett.87.258701,Spain,Article,Barcelona,0,Journal,2-s2.0-85037202831
Zanette D.H.,,Critical behavior of propagation on small-world networks,2001,"Physical Review E - Statistical, Nonlinear, and Soft Matter Physics",225,,Argentina,Article,San Carlos de Bariloche,0,Journal,2-s2.0-0035510399
Dorogovtsev S.N.,,Giant strongly connected component of directed networks,2001,"Physical Review E - Statistical, Nonlinear, and Soft Matter Physics",217,,Portugal;Russian Federation,Article,Porto;Saint Petersburg (ex Leningrad),0,Journal,2-s2.0-17744419466
Newman M.E.J.,,Random graphs with arbitrary degree distributions and their applications,2001,"Physical Review E - Statistical, Nonlinear, and Soft Matter Physics",2213,,United States;United States,Article,Santa Fe;Ithaca,0,Journal,2-s2.0-0035420732
Liljeros F.,,Social networks: The web of human sexual contacts,2001,Nature,1172,10.1038/35082140,Sweden,Article,Stockholm,0,Journal,2-s2.0-0035927795
Lloyd A.,,How viruses spread among computers and people,2001,Science,473,10.1126/science.1061076,United States,Short Survey,Princeton,0,Journal,2-s2.0-0035907006
Lloyd A.,,Destabilization of epidemic models with the inclusion of realistic distributions of infectious periods,2001,Proceedings of the Royal Society B: Biological Sciences,152,10.1098/rspb.2001.1599,United States,Article,Princeton,0,Journal,2-s2.0-0035820841
Cohen R.,,Breakdown of the internet under intentional attack,2001,Physical Review Letters,1004,10.1103/PhysRevLett.86.3682,Israel,Article,Ramat Gan,0,Journal,2-s2.0-0035896667
Pastor-Satorras R.,,Epidemic spreading in scale-free networks,2001,Physical Review Letters,3738,10.1103/PhysRevLett.86.3200,Spain,Article,Barcelona,0,Journal,2-s2.0-0035794256
Kuperman M.,,Small world effect in an epidemiological model,2001,Physical Review Letters,435,10.1103/PhysRevLett.86.2909,Argentina,Article,San Carlos de Bariloche,0,Journal,2-s2.0-4243756311
Lloyd A.,,Realistic distributions of infectious periods in epidemic models: Changing patterns of persistence and dynamics,2001,Theoretical Population Biology,204,10.1006/tpbi.2001.1525,United States,Article,Princeton,0,Journal,2-s2.0-0034799244
May R.M.,,Infection dynamics on scale-free networks,2001,"Physical Review E - Statistical, Nonlinear, and Soft Matter Physics",552,10.1103/PhysRevE.64.066112,United Kingdom,Article,Oxford,0,Journal,2-s2.0-0035689341
Pastor-Satorras R.,,Epidemic dynamics and endemic states in complex networks,2001,"Physical Review E - Statistical Physics, Plasmas, Fluids, and Related Interdisciplinary Topics",1153,10.1103/PhysRevE.63.066117,Spain,Article,Barcelona,0,Journal,2-s2.0-0035363452
Domingos P.,,Mining the network value of customers,2001,Proceedings of the Seventh ACM SIGKDD International Conference on Knowledge Discovery and Data Mining,1681,10.1145/502512.502525,United States,Conference Paper,Seattle,0,Conference Proceeding,2-s2.0-0035789667
Callaway D.,,Network robustness and fragility: percolation on random graphs,2000,Physical Review Letters,1632,10.1103/PhysRevLett.85.5468,United States,Article,Ithaca,0,Journal,2-s2.0-4243939794
Dorogovtsev S.,,Structure of growing networks with preferential linking,2000,Physical Review Letters,933,10.1103/PhysRevLett.85.4633,Portugal;Russian Federation,Article,Porto;Saint Petersburg (ex Leningrad),0,Journal,2-s2.0-0034310713
Cohen R.,,Resilience of the Internet to random breakdowns,2000,Physical Review Letters,1644,10.1103/PhysRevLett.85.4626,Israel,Article,Ramat Gan,0,Journal,2-s2.0-0034323311
Moore C.,,Epidemics and percolation in small-world networks,2000,"Physical Review E - Statistical Physics, Plasmas, Fluids, and Related Interdisciplinary Topics",664,10.1103/PhysRevE.61.5678,United States;Mexico,Article,Albuquerque;,0,Journal,2-s2.0-0034186340
Hethcote H.,,Mathematics of infectious diseases,2000,SIAM Review,2759,10.1137/S0036144500371907,United States,Article,Iowa City,0,Journal,2-s2.0-0034486891
Monasson R.,,"Diffusion, localization and dispersion relations on ""small-world"" lattices",1999,European Physical Journal B,202,10.1007/s100510051038,France,Article,Paris,0,Journal,2-s2.0-0000111267
Barabási A.,,Emergence of scaling in random networks,1999,Science,22122,10.1126/science.286.5439.509,United States,Article,Notre Dame,0,Journal,2-s2.0-0038483826
Keeling M.,,The effects of local spatial structure on epidemiological invasions,1999,Proceedings of the Royal Society B: Biological Sciences,543,10.1098/rspb.1999.0716,United Kingdom,Article,Cambridge,0,Journal,2-s2.0-0033594451
Krone S.M.,,The two-stage contact process,1999,Annals of Applied Probability,26,10.1214/aoap/1029962745,United States,Article,Moscow,1,Journal,2-s2.0-0033425034
Watts D.J.,,Collective dynamics of 'small-world9 networks,1998,Nature,25779,10.1038/30918,United States,Article,Ithaca,0,Journal,2-s2.0-0032482432
Dunbar R.,,The social brain hypothesis,1998,Evolutionary Anthropology,1353,10.1002/(SICI)1520-6505(1998)6:5<178::AID-EVAN5>3.0.CO;2-8,,Article,,0,Journal,2-s2.0-0032221027
Keeling M.,,Disease extinction and community size: Modeling the persistence of measles,1997,Science,282,10.1126/science.275.5296.65,United Kingdom,Article,Cambridge,0,Journal,2-s2.0-0031015249
Grenfell B.,,(Meta) population dynamics of infectious diseases,1997,Trends in Ecology and Evolution,282,10.1016/S0169-5347(97)01174-9,United Kingdom,Review,Cambridge,0,Journal,2-s2.0-0031418824
Ball F.,,Epidemics with two levels of mixing,1997,Annals of Applied Probability,342,10.1214/aoap/1034625252,United Kingdom,Article,Nottingham,1,Journal,2-s2.0-0031285152
Sattenspiel L.,,A structured epidemic model incorporating geographic mobility among regions,1995,Mathematical Biosciences,174,10.1016/0025-5564(94)00068-B,United States,Article,Columbia,0,Journal,2-s2.0-0028989477
Molloy M.,,A critical point for random graphs with a given degree sequence,1995,Random Structures &amp; Algorithms,1427,10.1002/rsa.3240060204,United States,Article,Pittsburgh,0,Journal,2-s2.0-84990671447
Flahault A.,,A Method for Assessing The Global Spread of Hiv-1 Infection Based on Air Travel,1992,Mathematical Population Studies,46,10.1080/08898489209525336,France,Article,Paris,0,Journal,2-s2.0-17544390067
Ben-Avraham D.,,"Mean-field (n,m)-cluster approximation for lattice models",1992,Physical Review A,86,10.1103/PhysRevA.45.8358,Germany,Article,Heidelberg,0,Journal,2-s2.0-0001013597
Bikhchandani S.,,"A theory of fads, fashion, custom, and cultural change as informational cascades",1992,Journal of Political Economy,2851,10.1086/261849,United States,Article,Los Angeles,0,Journal,2-s2.0-27744568768
Blythe S.,,Variable infectiousness in HFV transmission models,1988,Mathematical Medicine and Biology,69,10.1093/imammb/5.3.181,United Kingdom,Article,London,0,Journal,2-s2.0-77957182005
A. Rvachev L.,,A mathematical model for the global spread of influenza,1985,Mathematical Biosciences,339,10.1016/0025-5564(85)90064-1,Russian Federation,Article,Moscow,0,Journal,2-s2.0-0022394032
Grassberger P.,,On the critical behavior of the general epidemic process and dynamical percolation,1983,Mathematical Biosciences,422,10.1016/0025-5564(82)90036-0,Germany;Israel,Article,Wuppertal;Rehovot,0,Journal,2-s2.0-0020737985
Seidman S.,,Network structure and minimum degree,1983,Social Networks,901,10.1016/0378-8733(83)90028-X,United States,Article,Fairfax,0,Journal,2-s2.0-0000488788
Bender E.,,The asymptotic number of labeled graphs with given degree sequences,1978,"Journal of Combinatorial Theory, Series A",555,10.1016/0097-3165(78)90059-6,United States,Article,San Diego,1,Journal,2-s2.0-0000664045
Gillespie D.,,Exact stochastic simulation of coupled chemical reactions,1977,Journal of Physical Chemistry,6199,10.1021/j100540a008,United States,Conference Paper,China Lake,0,Journal,2-s2.0-33645429016
Ludwig D.,,Final size distribution for epidemics,1975,Mathematical Biosciences,72,10.1016/0025-5564(75)90119-4,United States,Article,New York,0,Journal,2-s2.0-0016636706
Goffman W.,,Mathematical approach to the spread of scientific ideas - The history of mast cell research,1966,Nature,81,10.1038/212449a0,United States,Article,Cleveland,0,Journal,2-s2.0-0014031322
Daley D.,,Stochastic rumours,1965,IMA Journal of Applied Mathematics (Institute of Mathematics and Its Applications),309,10.1093/imamat/1.1.42,United Kingdom,Article,Cambridge,0,Journal,2-s2.0-0008904616
Goffman W.,,Generalization of epidemic theory: An application to the transmission of ideas,1964,Nature,183,10.1038/204225a0,United States,Article,Cleveland,0,Journal,2-s2.0-0001146495
Daley D.,,Epidemics and Rumours [49],1964,Nature,312,10.1038/2041118a0,United Kingdom,Letter,Cambridge,0,Journal,2-s2.0-4143136066
Solomonoff R.,,Connectivity of random nets,1951,The Bulletin of Mathematical Biophysics,191,10.1007/BF02478357,United States,Article,Chicago,0,Journal,2-s2.0-51649210138
