Authors,Author(s) ID,Title,Year,Source tittle,Cited by,DOI,Country,Document Type,City,Access Type,aggregationType,EID
Schumm P.,,Epidemic spreading on weighted contact networks,2007,"Proceedings of the Bio-Inspired Models of Network, Information, and Computing Systems, Bionetics 2007",17,10.1109/BIMNICS.2007.4610111,United States,Conference Paper,Manhattan,0,Conference Proceeding,2-s2.0-53149092902
Centola D.,,Complex contagions and the weakness of long ties,2007,American Journal of Sociology,704,10.1086/521848,United States,Article,Cambridge,0,Journal,2-s2.0-38949109629
Weber S.,,Generation of arbitrarily two-point-correlated random networks,2007,"Physical Review E - Statistical, Nonlinear, and Soft Matter Physics",37,10.1103/PhysRevE.76.046111,Germany,Article,Darmstadt,0,Journal,2-s2.0-35348938162
Colizza V.,,Invasion threshold in heterogeneous metapopulation networks,2007,Physical Review Letters,192,10.1103/PhysRevLett.99.148701,Italy,Article,Turin,0,Journal,2-s2.0-35148817863
Kenah E.,,Second look at the spread of epidemics on networks,2007,"Physical Review E - Statistical, Nonlinear, and Soft Matter Physics",143,10.1103/PhysRevE.76.036113,United States,Article,Boston,0,Journal,2-s2.0-34848857029
Zhou J.,,Influence of network structure on rumor propagation,2007,"Physics Letters, Section A: General, Atomic and Solid State Physics",140,10.1016/j.physleta.2007.01.094,China,Article,Shanghai,0,Journal,2-s2.0-34548031635
Zhao H.,,Modular effects on epidemic dynamics in small-world networks,2007,EPL,14,10.1209/0295-5075/79/38002,China,Article,Beijing,0,Journal,2-s2.0-79051470770
Christakis N.,,The spread of obesity in a large social network over 32 years,2007,New England Journal of Medicine,2894,10.1056/NEJMsa066082,United States;United States;United States,Article,Cambridge;Cambridge;Boston,0,Journal,2-s2.0-34547170053
Miller J.C.,,Epidemic size and probability in populations with heterogeneous infectivity and susceptibility,2007,"Physical Review E - Statistical, Nonlinear, and Soft Matter Physics",99,10.1103/PhysRevE.76.010101,United States,Article,Los Alamos,0,Journal,2-s2.0-34547378068
Ahnert S.E.,,Ensemble approach to the analysis of weighted networks,2007,"Physical Review E - Statistical, Nonlinear, and Soft Matter Physics",34,10.1103/PhysRevE.76.016101,France,Article,Paris,0,Journal,2-s2.0-34547303329
Riley S.,,Large-scale spatial-transmission models of infectious disease,2007,Science,333,10.1126/science.1134695,Hong Kong,Review,,0,Journal,2-s2.0-34249883600
Gleeson J.P.,,Seed size strongly affects cascades on random networks,2007,"Physical Review E - Statistical, Nonlinear, and Soft Matter Physics",131,10.1103/PhysRevE.75.056103,Ireland,Article,Cork,0,Journal,2-s2.0-34248227402
Leskovec J.,,The dynamics of viral marketing,2007,ACM Transactions on the Web,1025,10.1145/1232722.1232727,United States,Article,Pittsburgh,0,Journal,2-s2.0-34248550159
Onnela J.,,Structure and tie strengths in mobile communication networks,2007,Proceedings of the National Academy of Sciences of the United States of America,1134,10.1073/pnas.0610245104,Finland;United Kingdom,Article,Espoo;Oxford,1,Journal,2-s2.0-34250628484
Cross P.C.,,Utility of R<inf>0</inf> as a predictor of disease invasion in structured populations,2007,Journal of the Royal Society Interface,67,10.1098/rsif.2006.0185,United States,Article,Bozeman,0,Journal,2-s2.0-34047180040
Vazquez A.,,Impact of non-poissonian activity patterns on spreading processes,2007,Physical Review Letters,240,10.1103/PhysRevLett.98.158702,United States,Article,Princeton,0,Journal,2-s2.0-34147159602
Colizza V.,,Reaction-diffusion processes and metapopulation models in heterogeneous networks,2007,Nature Physics,416,10.1038/nphys560,Italy;United States,Article,Turin;Bloomington,0,Journal,2-s2.0-34047175259
Galstyan A.,,Cascading dynamics in modular networks,2007,"Physical Review E - Statistical, Nonlinear, and Soft Matter Physics",56,10.1103/PhysRevE.75.036109,United States,Article,Marina del Rey,0,Journal,2-s2.0-33947690618
Vazquez A.,,Epidemic outbreaks on structured populations,2007,Journal of Theoretical Biology,29,10.1016/j.jtbi.2006.09.018,United States,Article,Princeton,0,Journal,2-s2.0-33846799101
Trapman P.,,On analytical approaches to epidemics on networks,2007,Theoretical Population Biology,66,10.1016/j.tpb.2006.11.002,Netherlands;Netherlands,Article,Utrecht;Amsterdam,0,Journal,2-s2.0-33846566796
Yan G.,,Collective synchronization induced by epidemic dynamics on complex networks with communities,2007,"Physical Review E - Statistical, Nonlinear, and Soft Matter Physics",96,10.1103/PhysRevE.75.016108,China,Article,Hefei,0,Journal,2-s2.0-33846628195
Centola D.,,Cascade dynamics of complex propagation,2007,Physica A: Statistical Mechanics and its Applications,175,10.1016/j.physa.2006.06.018,United States;United States,Article,New York;Ithaca,0,Journal,2-s2.0-33751170904
Nekovee M.,,Theory of rumour spreading in complex social networks,2007,Physica A: Statistical Mechanics and its Applications,444,10.1016/j.physa.2006.07.017,United Kingdom,Article,Ipswich,0,Journal,2-s2.0-33751310571
Huang W.,,Epidemic spreading in scale-free networks with community structure,2007,Journal of Statistical Mechanics: Theory and Experiment,55,10.1088/1742-5468/2007/01/P01014,China,Article,Chengdu,0,Journal,2-s2.0-37649031862
Leskovec J.,,Patterns of cascading behavior in large blog graphs,2007,Proceedings of the 7th SIAM International Conference on Data Mining,261,10.1137/1.9781611972771.60,United States,Conference Paper,Pittsburgh,1,Conference Proceeding,2-s2.0-44449113476
Colizza V.,,Modeling the worldwide spread of pandemic influenza: Baseline case and containment interventions,2007,PLoS Medicine,420,10.1371/journal.pmed.0040013,Italy;United States,Article,Turin;Bloomington,1,Journal,2-s2.0-33846670320
Costa L.,,Characterization of complex networks: A survey of measurements,2007,Advances in Physics,1372,10.1080/00018730601170527,Brazil,Review,Sao Paulo,0,Journal,2-s2.0-33947724499
Hu K.,,Immunization for scale-free networks by random walker,2006,Chinese Physics,25,10.1088/1009-1963/15/12/003,China,Article,Xiangtan,0,Journal,2-s2.0-33846091099
Ahn Y.Y.,,Epidemic dynamics of two species of interacting particles on scale-free networks,2006,"Physical Review E - Statistical, Nonlinear, and Soft Matter Physics",36,10.1103/PhysRevE.74.066113,South Korea,Article,Yusong,0,Journal,2-s2.0-33845803656
Serrano M.A.,,Correlations in weighted networks,2006,"Physical Review E - Statistical, Nonlinear, and Soft Matter Physics",53,10.1103/PhysRevE.74.055101,Italy;United States,Article,Turin;Bloomington,0,Journal,2-s2.0-33750996142
Stauffer A.O.,,Dissemination strategy for immunizing scale-free networks,2006,"Physical Review E - Statistical, Nonlinear, and Soft Matter Physics",16,10.1103/PhysRevE.74.056105,Brazil,Article,Rio de Janeiro,0,Journal,2-s2.0-33750705304
Masuda N.,,Multi-state epidemic processes on complex networks,2006,Journal of Theoretical Biology,60,10.1016/j.jtbi.2006.06.010,Japan,Article,Wako,0,Journal,2-s2.0-33749074260
Serrano M.A.,,Percolation and epidemic thresholds in clustered networks,2006,Physical Review Letters,136,10.1103/PhysRevLett.97.088701,United States,Article,Bloomington,0,Journal,2-s2.0-33747656394
Cooper B.,,Delaying the international spread of pandemic influenza,2006,PLoS Medicine,189,10.1371/journal.pmed.0030212,United Kingdom,Article,London,1,Journal,2-s2.0-33745615112
Meyers L.,,Predicting epidemics on directed contact networks,2006,Journal of Theoretical Biology,174,10.1016/j.jtbi.2005.10.004,United States;United States,Article,Santa Fe;Austin,0,Journal,2-s2.0-33646271598
Vojta T.,,"Rare region effects at classical, quantum and nonequilibrium phase transitions",2006,Journal of Physics A: Mathematical and General,264,10.1088/0305-4470/39/22/R01,United States,Article,Rolla,0,Journal,2-s2.0-33646893732
Gross T.,,Epidemic dynamics on an adaptive network,2006,Physical Review Letters,535,10.1103/PhysRevLett.96.208701,Germany,Article,Potsdam,1,Journal,2-s2.0-33646855384
Bettencourt L.,,The power of a good idea: Quantitative modeling of the spread of ideas from epidemiological models,2006,Physica A: Statistical Mechanics and its Applications,224,10.1016/j.physa.2005.08.083,United States,Article,Los Alamos,0,Journal,2-s2.0-33645136546
Hollingsworth T.,,Will travel restrictions control the international spread of pandemic influenza? [3],2006,Nature Medicine,103,10.1038/nm0506-497,United Kingdom,Letter,London,0,Journal,2-s2.0-33646541387
Viboud C.,,"Synchrony, waves, and spatial hierarchies in the spread of influenza",2006,Science,490,10.1126/science.1125237,United States,Article,Bethesda,1,Journal,2-s2.0-33646006370
Karsai M.,,Nonequilibrium phase transitions and finite-size scaling in weighted scale-free networks,2006,"Physical Review E - Statistical, Nonlinear, and Soft Matter Physics",41,10.1103/PhysRevE.73.036116,Hungary,Article,Szeged,0,Journal,2-s2.0-33645014174
Colizza V.,,The role of the airline transportation network in the prediction and predictability of global epidemics,2006,Proceedings of the National Academy of Sciences of the United States of America,608,10.1073/pnas.0510525103,United States,Article,Bloomington,1,Journal,2-s2.0-33144474437
Boccaletti S.,,Complex networks: Structure and dynamics,2006,Physics Reports,6606,10.1016/j.physrep.2005.10.009,Italy,Review,Sesto Fiorentino,0,Journal,2-s2.0-31344474880
Castellano C.,,Non-mean-field behavior of the contact process on scale-free networks,2006,Physical Review Letters,99,10.1103/PhysRevLett.96.038701,Italy,Article,Rome,0,Journal,2-s2.0-32644465412
Gómez-Gardeñes J.,,Immunization of real complex communication networks,2006,European Physical Journal B,71,10.1140/epjb/e2006-00041-1,Spain,Article,Zaragoza,0,Journal,2-s2.0-32944479194
Adar E.,,Tracking information epidemics in blogspace,2005,"Proceedings - 2005 IEEE/WIC/ACM InternationalConference on Web Intelligence, WI 2005",277,10.1109/WI.2005.151,United States,Conference Paper,Palo Alto,0,Conference Proceeding,2-s2.0-33748871742
Hui P.,,Pocket switched networks and human mobility in conference environments,2005,"Proceedings of the ACM SIGCOMM 2005 Workshop on Delay-Tolerant Networking, WDTN 2005",739,10.1145/1080139.1080142,United Kingdom;United Kingdom,Conference Paper,Belfast;Cambridge,0,Conference Proceeding,2-s2.0-84885799779
Oliveira J.,,Darwin and Einstein correspondence patterns,2005,Nature,295,10.1038/4371251a,Portugal;United States,Article,Aveiro;Notre Dame,0,Journal,2-s2.0-27644509210
Liu Z.,,Epidemic spreading in community networks,2005,Europhysics Letters,176,10.1209/epl/i2004-10550-5,China;Hong Kong,Article,Shanghai;,0,Journal,2-s2.0-27444434464
Ganesh A.,,The effect of network topology on the spread of epidemics,2005,Proceedings - IEEE INFOCOM,478,10.1109/INFCOM.2005.1498374,United Kingdom,Conference Paper,Cambridge,0,Conference Proceeding,2-s2.0-25844439630
Stauffer D.,,Diffusion in scale-free networks with annealed disorder,2005,"Physical Review E - Statistical, Nonlinear, and Soft Matter Physics",25,10.1103/PhysRevE.72.046128,United States,Article,Los Angeles,0,Journal,2-s2.0-28844471612
Ferguson N.M.,,Strategies for containing an emerging influenza pandemic in Southeast Asia,2005,Nature,1212,10.1038/nature04017,United Kingdom,Article,London,0,Journal,2-s2.0-23844436610
Newman M.,,Threshold effects for two pathogens spreading on a network,2005,Physical Review Letters,158,10.1103/PhysRevLett.95.108701,United States;United States,Article,Santa Fe;Ann Arbor,0,Journal,2-s2.0-27144516752
Gil S.,,Optimal disorder for segregation in annealed small worlds,2005,European Physical Journal B,7,10.1140/epjb/e2005-00319-8,Argentina,Article,San Carlos de Bariloche,0,Journal,2-s2.0-26444563835
Ángeles Serrano M.,,Tuning clustering in random networks with arbitrary degree distributions,2005,"Physical Review E - Statistical, Nonlinear, and Soft Matter Physics",91,10.1103/PhysRevE.72.036133,United States,Article,Bloomington,0,Journal,2-s2.0-28844479734
Longini I.,,Containing pandemic influenza at the source,2005,Science,867,10.1126/science.1115717,United States,Article,Atlanta,0,Journal,2-s2.0-23644457957
Watts D.,,"Multiscale, resurgent epidemics in a hierarchical metapopulation model",2005,Proceedings of the National Academy of Sciences of the United States of America,171,10.1073/pnas.0501226102,United States;United States,Article,Santa Fe;New York,1,Journal,2-s2.0-23844456922
Barthélemy M.,,Dynamical patterns of epidemic outbreaks in complex heterogeneous networks,2005,Journal of Theoretical Biology,301,10.1016/j.jtbi.2005.01.011,France,Article,Bruyeres-les-Chatel,0,Journal,2-s2.0-18044384806
Boguñá M.,,Generalized percolation in random directed networks,2005,"Physical Review E - Statistical, Nonlinear, and Soft Matter Physics",81,10.1103/PhysRevE.72.016106,Spain,Article,Barcelona,0,Journal,2-s2.0-27244434945
Cross P.,,Duelling timescales of host movement and disease recovery determine invasion of disease in structured populations,2005,Ecology Letters,144,10.1111/j.1461-0248.2005.00760.x,United States;United States,Review,Berkeley;Reston,0,Journal,2-s2.0-20444420879
Onnela J.P.,,Intensity and coherence of motifs in weighted complex networks,2005,"Physical Review E - Statistical, Nonlinear, and Soft Matter Physics",509,10.1103/PhysRevE.71.065103,Finland,Article,Espoo,0,Journal,2-s2.0-27944480531
Holme P.,,Network reachability of real-world contact sequences,2005,"Physical Review E - Statistical, Nonlinear, and Soft Matter Physics",138,10.1103/PhysRevE.71.046119,United States,Article,Ann Arbor,0,Journal,2-s2.0-41349102707
Yan G.,,Epidemic spread in weighted scale-free networks,2005,Chinese Physics Letters,188,10.1088/0256-307X/22/2/068,China,Article,Hefei,0,Journal,2-s2.0-21144433206
Catanzaro M.,,Generation of uncorrelated random scale-free networks 027103,2005,"Physical Review E - Statistical, Nonlinear, and Soft Matter Physics",470,10.1103/PhysRevE.71.027103,Spain,Article,Barcelona,0,Journal,2-s2.0-34548491989
Small M.,,Small world and scale free model of transmission of SARS,2005,International Journal of Bifurcation and Chaos in Applied Sciences and Engineering,64,10.1142/S0218127405012776,Hong Kong,Article,Kowloon,0,Journal,2-s2.0-22144471199
De Oliveira M.M.,,How to simulate the quasistationary state,2005,"Physical Review E - Statistical, Nonlinear, and Soft Matter Physics",94,10.1103/PhysRevE.71.016129,Brazil,Article,Belo Horizonte,0,Journal,2-s2.0-37649030092
Keeling M.,,Networks and epidemic models,2005,Journal of the Royal Society Interface,863,10.1098/rsif.2005.0051,United Kingdom,Review,Coventry,1,Journal,2-s2.0-33646893242
Holme P.,,Efficient local strategies for vaccination and network attack,2004,Europhysics Letters,101,10.1209/epl/i2004-10286-2,Sweden;United States,Article,Umea;Ann Arbor,0,Journal,2-s2.0-10944269222
Hufnagel L.,,Forecast and control of epidemics in a globalized world,2004,Proceedings of the National Academy of Sciences of the United States of America,621,10.1073/pnas.0308344101,,Article,,1,Journal,2-s2.0-6344221308
Barrat A.,,Weighted evolving networks: Coupling topology and weight dynamics,2004,Physical Review Letters,501,10.1103/PhysRevLett.92.228701,France,Article,Saint-Aubin,0,Journal,2-s2.0-3042709447
Joo J.,,Behavior of susceptible-infected-susceptible epidemics on heterogeneous networks with saturation,2004,"Physical Review E - Statistical, Nonlinear, and Soft Matter Physics",68,10.1103/PhysRevE.69.066105,United States,Article,New Brunswick,0,Journal,2-s2.0-33751230072
Moreno Y.,,Dynamics of rumor spreading in complex networks,2004,"Physical Review E - Statistical, Nonlinear, and Soft Matter Physics",482,10.1103/PhysRevE.69.066130,Spain,Article,Zaragoza,0,Journal,2-s2.0-42749098327
Dodds P.S.,,Universal behavior in a generalized model of contagion,2004,Physical Review Letters,320,10.1103/PhysRevLett.92.218701,United States,Article,New York,0,Journal,2-s2.0-3142519922
Eubank S.,,Modelling disease outbreaks in realistic urban social networks,2004,Nature,1155,10.1038/nature02541,United States,Article,Los Alamos,0,Journal,2-s2.0-2442686815
Grais R.,,Modeling the spread of annual influenza epidemics in the U.S.: The potential role of air travel,2004,Health Care Management Science,81,10.1023/B:HCMS.0000020652.38181.da,United States;France,Article,Baltimore;Paris,0,Journal,2-s2.0-2642580090
Moreno Y.,,Efficiency and reliability of epidemic data dissemination in complex networks,2004,"Physical Review E - Statistical, Nonlinear, and Soft Matter Physics",96,,Spain,Article,Zaragoza,0,Journal,2-s2.0-42749108922
Barthélemy M.,,Velocity and hierarchical spread of epidemic outbreaks in scale-free networks,2004,Physical review letters,491,,France,Article,Bruyeres-les-Chatel,0,Journal,2-s2.0-2942573513
Gallos L.,,Absence of kinetic effects in reaction-diffusion processes in scale-free networks,2004,Physical Review Letters,70,10.1103/PhysRevLett.92.138301,Greece,Article,Thessaloniki,0,Journal,2-s2.0-2342638826
Noh J.,,Random Walks on Complex Networks,2004,Physical Review Letters,718,10.1103/PhysRevLett.92.118701,South Korea,Article,Daejeon,0,Journal,2-s2.0-2342616749
Barrat A.,,The architecture of complex weighted networks,2004,Proceedings of the National Academy of Sciences of the United States of America,2202,10.1073/pnas.0400087101,France,Article,Orsay,1,Journal,2-s2.0-1642308591
Boguñá M.,,Cut-offs and finite size effects in scale-free networks,2004,European Physical Journal B,243,10.1140/epjb/e2004-00038-8,Spain,Conference Paper,Barcelona,0,Journal,2-s2.0-2942566660
Maslov S.,,Detection of topological patterns in complex networks: Correlation profile of the internet,2004,Physica A: Statistical Mechanics and its Applications,235,10.1016/j.physa.2003.06.002,United States,Article,Upton,0,Journal,2-s2.0-0347759844
Liu J.,,The spread of disease with birth and death on networks,2004,Journal of Statistical Mechanics: Theory and Experiment,50,10.1088/1742-5468/2004/08/P08008,China;China,Article,Beijing;Beijing,0,Journal,2-s2.0-78649559394
Hanski I.,,"Ecology, Genetics and Evolution of Metapopulations",2004,"Ecology, Genetics and Evolution of Metapopulations",548,10.1016/B978-0-12-323448-3.X5000-4,Finland,Book,Helsinki,0,Book,2-s2.0-67249083171
Olinky R.,,Unexpected epidemic thresholds in heterogeneous networks: The role of disease transmission,2004,"Physical Review E - Statistical Physics, Plasmas, Fluids, and Related Interdisciplinary Topics",118,10.1103/PhysRevE.70.030902,Israel,Article,Tel Aviv-Yafo,0,Journal,2-s2.0-37649032448
Wang Y.,,Epidemic spreading in real networks: An eigenvalue viewpoint,2003,Proceedings of the IEEE Symposium on Reliable Distributed Systems,504,10.1109/RELDIS.2003.1238052,United States,Conference Paper,Pittsburgh,0,Conference Proceeding,2-s2.0-27644462218
Kempe D.,,Maximizing the spread of influence through a social network,2003,Proceedings of the ACM SIGKDD International Conference on Knowledge Discovery and Data Mining,4461,10.1145/956750.956769,United States,Conference Paper,Ithaca,0,Conference Proceeding,2-s2.0-33747172362
Moreno Y.,,Epidemic incidence in correlated complex networks,2003,"Physical Review E - Statistical, Nonlinear, and Soft Matter Physics",153,,Spain,Article,Zaragoza,0,Journal,2-s2.0-0242411922
Newman M.E.J.,,Properties of highly clustered networks,2003,"Physical Review E - Statistical, Nonlinear, and Soft Matter Physics",289,,United States,Article,Ann Arbor,0,Journal,2-s2.0-42749099621
Chung F.,,Spectra of random graphs with given expected degrees,2003,Proceedings of the National Academy of Sciences of the United States of America,313,10.1073/pnas.0937490100,United States,Article,San Diego,1,Journal,2-s2.0-0038652158
Vázquez A.,,Topology and correlations in structured scale-free networks,2003,"Physical Review E - Statistical, Nonlinear, and Soft Matter Physics",74,,Italy,Article,Genoa,0,Journal,2-s2.0-0038542266
Meyers L.,,Applying network theory to epidemics: Control measures for Mycoplasma pneumoniae outbreaks,2003,Emerging Infectious Diseases,141,10.3201/eid0902.020188,United States;United States,Article,Santa Fe;Austin,1,Journal,2-s2.0-0037324329
Park J.,,Origin of degree correlations in the Internet and other networks,2003,"Physical Review E - Statistical Physics, Plasmas, Fluids, and Related Interdisciplinary Topics",14,10.1103/PhysRevE.68.026112,United States,Article,Ann Arbor,0,Journal,2-s2.0-85035213985
Liu Z.,,Propagation and immunization of infection on general networks with both homogeneous and heterogeneous components,2003,"Physical Review E - Statistical Physics, Plasmas, Fluids, and Related Interdisciplinary Topics",116,10.1103/PhysRevE.67.031911,United States,Article,Tempe,0,Journal,2-s2.0-85037256323
Braunstein L.,,Optimal paths in disordered complex networks,2003,Physical Review Letters,146,10.1103/PhysRevLett.91.168701,United States;Argentina,Article,Boston;Mar de Plata,0,Journal,2-s2.0-17344391583
Vázquez A.,,Resilience to damage of graphs with degree correlations,2003,"Physical Review E - Statistical, Nonlinear, and Soft Matter Physics",160,,Italy,Article,Trieste,0,Journal,2-s2.0-0038523739
Boguñá M.,,Absence of Epidemic Threshold in Scale-Free Networks with Degree Correlations,2003,Physical Review Letters,407,10.1103/PhysRevLett.90.028701,Spain,Article,Barcelona,0,Journal,2-s2.0-0037449781
Cohen R.,,Efficient immunization strategies for computer networks and populations,2003,Physical Review Letters,694,10.1103/PhysRevLett.91.247901,Israel,Article,Ramat Gan,0,Journal,2-s2.0-0942268259
Ravasz E.,,Hierarchical organization in complex networks,2003,"Physical Review E - Statistical Physics, Plasmas, Fluids, and Related Interdisciplinary Topics",1243,10.1103/PhysRevE.67.026112,United States,Article,Notre Dame,0,Journal,2-s2.0-84930064585
Newman M.,,The structure and function of complex networks,2003,SIAM Review,11537,10.1137/S003614450342480,United States,Review,Ann Arbor,0,Journal,2-s2.0-0038718854
Motter A.E.,,Cascade-based attacks on complex networks,2002,"Physical Review E - Statistical Physics, Plasmas, Fluids, and Related Interdisciplinary Topics",1193,10.1103/PhysRevE.66.065102,United States,Article,Tempe,0,Journal,2-s2.0-41349094978
Warren C.P.,,Geography in a scale-free network model,2002,"Physical Review E - Statistical Physics, Plasmas, Fluids, and Related Interdisciplinary Topics",113,10.1103/PhysRevE.66.056105,United States,Article,Ann Arbor,0,Journal,2-s2.0-41349097269
Boguñá M.,,Epidemic spreading in correlated complex networks,2002,"Physical Review E - Statistical Physics, Plasmas, Fluids, and Related Interdisciplinary Topics",360,10.1103/PhysRevE.66.047104,Spain,Article,Barcelona,0,Journal,2-s2.0-41349119541
Eames K.,,Modeling dynamic and network heterogeneities in the spread of sexually transmitted diseases,2002,Proceedings of the National Academy of Sciences of the United States of America,305,10.1073/pnas.202244299,,Article,,1,Journal,2-s2.0-0036790984
Cohen R.,,Percolation critical exponents in scale-free networks,2002,"Physical Review E - Statistical Physics, Plasmas, Fluids, and Related Interdisciplinary Topics",191,10.1103/PhysRevE.66.036113,Israel,Article,Ramat Gan,0,Journal,2-s2.0-41349120185
Albert R.,,Statistical mechanics of complex networks,2002,Reviews of Modern Physics,13645,10.1103/RevModPhys.74.47,United States;United States,Article,Minneapolis;Notre Dame,0,Journal,2-s2.0-0036013593
Schwartz N.,,Percolation in directed scale-free networks,2002,"Physical Review E - Statistical Physics, Plasmas, Fluids, and Related Interdisciplinary Topics",144,10.1103/PhysRevE.66.015104,Israel,Article,Ramat Gan,0,Journal,2-s2.0-41349101495
Newman M.E.J.,,Spread of epidemic disease on networks,2002,"Physical Review E - Statistical Physics, Plasmas, Fluids, and Related Interdisciplinary Topics",1841,10.1103/PhysRevE.66.016128,United States;United States,Article,Santa Fe;Ann Arbor,1,Journal,2-s2.0-41349106348
Vázquez A.,,Large-scale topological and dynamical properties of the Internet,2002,"Physical Review E - Statistical Physics, Plasmas, Fluids, and Related Interdisciplinary Topics",532,10.1103/PhysRevE.65.066130,Italy,Article,Trieste,0,Journal,2-s2.0-41349090299
Dorogovtsev S.,,Evolution of networks,2002,Advances in Physics,2215,10.1080/00018730110112519,Portugal,Article,Porto,0,Journal,2-s2.0-0036610173
Maslov S.,,Specificity and stability in topology of protein networks,2002,Science,1958,10.1126/science.1065103,United States,Article,Upton,0,Journal,2-s2.0-0037012880
Dezso Z.,,Halting viruses in scale-free networks,2002,"Physical Review E - Statistical, Nonlinear, and Soft Matter Physics",401,10.1103/PhysRevE.65.055103,United States,Article,Notre Dame,0,Journal,2-s2.0-41349118476
Holme P.,,Attack vulnerability of complex networks,2002,"Physical Review E - Statistical, Nonlinear, and Soft Matter Physics",1090,10.1103/PhysRevE.65.056109,Sweden,Article,Umea,0,Journal,2-s2.0-41349120887
Watts D.,,A simple model of global cascades on random networks,2002,Proceedings of the National Academy of Sciences of the United States of America,1444,10.1073/pnas.082090499,United States,Article,New York,1,Journal,2-s2.0-0037197979
Moreno Y.,,Epidemic outbreaks in complex heterogeneous networks,2002,European Physical Journal B,712,10.1007/s10051-002-8996-y,Italy,Article,Trieste,0,Journal,2-s2.0-0000494582
Keeling M.,,Estimating spatial coupling in epidemiological systems: A mechanistic approach,2002,Ecology Letters,129,10.1046/j.1461-0248.2002.00268.x,United Kingdom,Article,Cambridge,0,Journal,2-s2.0-0036168704
Eguíluz V.,,Epidemic Threshold in Structured Scale-Free Networks,2002,Physical Review Letters,284,10.1103/PhysRevLett.89.108701,Spain;Denmark;Spain,Article,Esporlas;Copenhagen;Palma,0,Journal,2-s2.0-4043049130
