Authors,Author(s) ID,Title,Year,Source tittle,Cited by,DOI,Country,Document Type,City,Access Type,aggregationType,EID
Mossel E.,,Submodularity of influence in social networks: From local to global,2010,SIAM Journal on Computing,61,10.1137/080714452,United States;Israel,Article,Berkeley;Rehovot,0,Journal,2-s2.0-77952254476
Kostka J.,,Word of mouth: Rumor dissemination in social networks,2008,Lecture Notes in Computer Science (including subseries Lecture Notes in Artificial Intelligence and Lecture Notes in Bioinformatics),117,10.1007/978-3-540-69355-0_16,Switzerland,Conference Paper,"Zurich ZH,",0,Book Series,2-s2.0-48349112328
Carnes T.,,Maximizing influence in a competitive social network: A follower's perspective,2007,ACM International Conference Proceeding Series,133,10.1145/1282100.1282167,United States,Conference Paper,Ithaca,0,Conference Proceeding,2-s2.0-36849059175
Bharathi S.,,Competitive influence maximization in social networks,2007,Lecture Notes in Computer Science (including subseries Lecture Notes in Artificial Intelligence and Lecture Notes in Bioinformatics),281,10.1007/978-3-540-77105-0_31,United States,Conference Paper,Los Angeles,0,Book Series,2-s2.0-38449123148
Kempe D.,,Maximizing the spread of influence through a social network,2003,Proceedings of the ACM SIGKDD International Conference on Knowledge Discovery and Data Mining,4461,10.1145/956750.956769,United States,Conference Paper,Ithaca,0,Conference Proceeding,2-s2.0-33747172362
Domingos P.,,Mining the network value of customers,2001,Proceedings of the Seventh ACM SIGKDD International Conference on Knowledge Discovery and Data Mining,1681,10.1145/502512.502525,United States,Conference Paper,Seattle,0,Conference Proceeding,2-s2.0-0035789667
Nemhauser G.,,An analysis of approximations for maximizing submodular set functions-I,1978,Mathematical Programming,2096,10.1007/BF01588971,Belgium,Article,Louvain-la-Neuve,0,Journal,2-s2.0-0000095809
