Authors,Author(s) ID,Title,Year,Source tittle,Cited by,DOI,Country,Document Type,City,Access Type,aggregationType,EID
Givan O.,,Predicting epidemic thresholds on complex networks: Limitations of mean-field approaches,2011,Journal of Theoretical Biology,24,10.1016/j.jtbi.2011.07.015,Israel,Article,Tel Aviv-Yafo,0,Journal,2-s2.0-80051953857
Keeling M.,,Modeling infectious diseases in humans and animals,2011,Modeling Infectious Diseases in Humans and Animals,1375,,,Book,,0,Book,2-s2.0-84924261283
Karrer B.,,Competing epidemics on complex networks,2011,"Physical Review E - Statistical, Nonlinear, and Soft Matter Physics",124,10.1103/PhysRevE.84.036106,United States,Article,Ann Arbor,1,Journal,2-s2.0-80052994416
Van Mieghem P.,,Lognormal distribution in the digg online social network,2011,European Physical Journal B,23,10.1140/epjb/e2011-20124-0,Netherlands,Article,Delft,0,Journal,2-s2.0-80755175692
Merler S.,,Determinants of the spatiotemporal dynamics of the 2009 h1n1 pandemic in europe: Implications for real-time modelling,2011,PLoS Computational Biology,79,10.1371/journal.pcbi.1002205,Italy,Article,Trento,1,Journal,2-s2.0-80053458172
Youssef M.,,An individual-based approach to SIR epidemics in contact networks,2011,Journal of Theoretical Biology,66,10.1016/j.jtbi.2011.05.029,United States,Article,Manhattan,0,Journal,2-s2.0-79958294924
Perra N.,,Towards a characterization of behavior-disease models,2011,PLoS ONE,121,10.1371/journal.pone.0023084,United States;Italy,Article,Bloomington;Cagliari,1,Journal,2-s2.0-79961051637
Gonçalves B.,,Modeling users' activity on twitter networks: Validation of Dunbar's number,2011,PLoS ONE,294,10.1371/journal.pone.0022656,United States;United States,Article,Bloomington;Bloomington,1,Journal,2-s2.0-84856312781
Marceau V.,,Modeling the dynamical interaction between epidemics on overlay networks,2011,"Physical Review E - Statistical, Nonlinear, and Soft Matter Physics",95,10.1103/PhysRevE.84.026105,Canada,Article,Quebec,0,Journal,2-s2.0-80051651728
Gleeson J.,,High-accuracy approximation of binary-state dynamics on networks,2011,Physical Review Letters,115,10.1103/PhysRevLett.107.068701,Ireland,Article,Limerick,0,Journal,2-s2.0-79961179436
Youssef M.,,Viral conductance: Quantifying the robustness of networks with respect to spread of epidemics,2011,Journal of Computational Science,32,10.1016/j.jocs.2011.03.001,United States,Article,Manhattan,0,Journal,2-s2.0-80052871974
Payne J.L.,,"Exact solutions for social and biological contagion models on mixed directed and undirected, degree-correlated random networks",2011,"Physical Review E - Statistical, Nonlinear, and Soft Matter Physics",10,10.1103/PhysRevE.84.016110,United States,Article,Hanover,0,Journal,2-s2.0-79961120922
Stehlé J.,,Simulation of an SEIR infectious disease model on the dynamic contact network of conference attendees,2011,BMC Medicine,195,10.1186/1741-7015-9-87,France,Article,Paris,1,Journal,2-s2.0-79960559609
Nishiura H.,,Prediction of pandemic influenza,2011,European Journal of Epidemiology,10,10.1007/s10654-011-9597-y,Japan;Hong Kong,Letter,Kawaguchi;Pokfulam,1,Journal,2-s2.0-79960977394
Deijfen M.,,Epidemics and vaccination on weighted graphs,2011,Mathematical Biosciences,25,10.1016/j.mbs.2011.04.003,Sweden,Article,Stockholm,0,Journal,2-s2.0-79957633039
Sharkey K.,,Deterministic epidemic models on contact networks: Correlations and unbiological terms,2011,Theoretical Population Biology,34,10.1016/j.tpb.2011.01.004,United Kingdom,Article,Liverpool,1,Journal,2-s2.0-79955479657
Dodds P.S.,,"Direct, physically motivated derivation of the contagion condition for spreading processes on generalized random networks",2011,"Physical Review E - Statistical, Nonlinear, and Soft Matter Physics",6,10.1103/PhysRevE.83.056122,United States,Article,Burlington,0,Journal,2-s2.0-79961075771
Hackett A.,,Cascades on a class of clustered random networks,2011,"Physical Review E - Statistical, Nonlinear, and Soft Matter Physics",64,10.1103/PhysRevE.83.056107,Ireland,Article,Limerick,0,Journal,2-s2.0-79961079201
Shalizi C.,,Homophily and contagion are generically confounded in observational social network studies,2011,Sociological Methods and Research,421,10.1177/0049124111404820,United States,Article,Pittsburgh,0,Journal,2-s2.0-79956110272
Kenah E.,,"Epidemic percolation networks, epidemic outcomes, and interventions",2011,Interdisciplinary Perspectives on Infectious Diseases,22,10.1155/2011/543520,United States,Review,Seattle,1,Journal,2-s2.0-79955118095
Keeling M.J.,,Networks and the epidemiology of infectious disease,2011,Interdisciplinary Perspectives on Infectious Diseases,178,10.1155/2011/284909,United Kingdom;United Kingdom,Review,Coventry;Coventry,1,Journal,2-s2.0-79955108361
Simon P.,,Exact epidemic models on graphs using graph-automorphism driven lumping,2011,Journal of Mathematical Biology,60,10.1007/s00285-010-0344-x,Hungary,Article,Budapest,0,Journal,2-s2.0-79952575000
Min B.,,Spreading dynamics following bursty human activity patterns,2011,"Physical Review E - Statistical, Nonlinear, and Soft Matter Physics",82,10.1103/PhysRevE.83.036102,South Korea,Article,Seoul,0,Journal,2-s2.0-79953142517
Miller J.,,A note on a paper by Erik Volz: SIR dynamics in random networks,2011,Journal of Mathematical Biology,104,10.1007/s00285-010-0337-9,United States,Article,Boston,0,Journal,2-s2.0-79951515510
Rocha L.,,"Simulated epidemics in an empirical spatiotemporal network of 50,185 sexual contacts",2011,PLoS Computational Biology,172,10.1371/journal.pcbi.1001109,Sweden,Article,Umea,1,Journal,2-s2.0-79953671188
Karsai M.,,Small but slow world: How network topology and burstiness slow down spreading,2011,"Physical Review E - Statistical, Nonlinear, and Soft Matter Physics",384,10.1103/PhysRevE.83.025102,Finland,Article,Espoo,0,Journal,2-s2.0-79952504668
Bajardi P.,,"Human mobility networks, travel restrictions, and the global spread of 2009 H1N1 pandemic",2011,PLoS ONE,173,10.1371/journal.pone.0016591,Italy;France,Article,Turin;Marseille,1,Journal,2-s2.0-79551627200
Fujiwara N.,,Synchronization in networks of mobile oscillators,2011,"Physical Review E - Statistical, Nonlinear, and Soft Matter Physics",107,10.1103/PhysRevE.83.025101,Germany,Article,Potsdam,0,Journal,2-s2.0-79952529824
Lagorio C.,,Quarantine-generated phase transition in epidemic spreading,2011,"Physical Review E - Statistical, Nonlinear, and Soft Matter Physics",43,10.1103/PhysRevE.83.026102,Argentina,Article,Mar de Plata,0,Journal,2-s2.0-79952512050
Broeck W.V.D.,,"The GLEaMviz computational tool, a publicly available software to explore realistic epidemic spreading scenarios at the global scale",2011,BMC Infectious Diseases,120,10.1186/1471-2334-11-37,Italy,Article,Turin,1,Journal,2-s2.0-79251637834
Chu X.,,Epidemic spreading with nonlinear infectivity in weighted scale-free networks,2011,Physica A: Statistical Mechanics and its Applications,60,10.1016/j.physa.2010.09.038,China,Article,Shanghai,0,Journal,2-s2.0-78649951759
Lindquist J.,,Effective degree network disease models,2011,Journal of Mathematical Biology,119,10.1007/s00285-010-0331-2,Canada,Article,Victoria,0,Journal,2-s2.0-78651482188
House T.,,Insights from unifying modern approximations to infections on networks,2011,Journal of the Royal Society Interface,103,10.1098/rsif.2010.0179,United Kingdom,Article,Coventry,1,Journal,2-s2.0-78650846890
Balcan D.,,Phase transitions in contagion processes mediated by recurrent mobility patterns,2011,Nature Physics,117,10.1038/nphys1944,United States;United States,Article,Bloomington;Bloomington,0,Journal,2-s2.0-79960004379
Cohen R.,,"Complex networks: Structure, robustness and function",2011,"Complex Networks: Structure, Robustness and Function",372,10.1017/CBO9780511780356,Israel,Book,Ramat Gan,0,Book,2-s2.0-84922962285
Bisanzio D.,,Modeling the spread of vector-borne diseases on bipartite networks,2010,PLoS ONE,19,10.1371/journal.pone.0013796,Italy,Article,Turin,1,Journal,2-s2.0-78649756671
Lerman K.,,Information contagion: An empirical study of the spread of news on Digg and Twitter social networks,2010,ICWSM 2010 - Proceedings of the 4th International AAAI Conference on Weblogs and Social Media,492,,United States,Conference Paper,Marina del Rey,0,Conference Proceeding,2-s2.0-84890653327
Castellano C.,,Thresholds for epidemic spreading in networks,2010,Physical Review Letters,370,10.1103/PhysRevLett.105.218701,Italy,Article,Rome,0,Journal,2-s2.0-78349292558
Jackson M.O.,,Social and Economic Networks,2010,Social and Economic Networks,360,,,Book,,0,Book,2-s2.0-84923967286
Marceau V.,,Adaptive networks: Coevolution of disease and topology,2010,"Physical Review E - Statistical, Nonlinear, and Soft Matter Physics",120,10.1103/PhysRevE.82.036116,Canada,Article,Quebec,0,Journal,2-s2.0-78651229801
Muñoz M.A.,,Griffiths phases on complex networks,2010,Physical Review Letters,83,10.1103/PhysRevLett.105.128701,Spain,Article,Granada,0,Journal,2-s2.0-77957147536
Funk S.,,Modelling the influence of human behaviour on the spread of infectious diseases: A review,2010,Journal of the Royal Society Interface,531,10.1098/rsif.2010.0142,United Kingdom,Review,Egham,1,Journal,2-s2.0-77956581464
Centola D.,,The spread of behavior in an online social network experiment,2010,Science,1285,10.1126/science.1185231,United States,Article,Cambridge,0,Journal,2-s2.0-77956296152
Newman M.,,Networks: An Introduction,2010,Networks: An Introduction,6212,10.1093/acprof:oso/9780199206650.001.0001,United States,Book,Ann Arbor,0,Book,2-s2.0-77954826067
Cattuto C.,,Dynamics of person-to-person interactions from distributed RFID sensor networks,2010,PLoS ONE,410,10.1371/journal.pone.0011596,Italy,Article,Turin,1,Journal,2-s2.0-77955352798
van Segbroeck S.,,Adaptive contact networks change effective disease infectiousness and dynamics,2010,PLoS Computational Biology,49,10.1371/journal.pcbi.1000895,Belgium;Belgium;Portugal,Article,Brussels;Brussels;Lisbon,1,Journal,2-s2.0-78049437678
Van Mieghem P.,,Influence of assortativity and degree-preserving rewiring on the spectra of networks,2010,European Physical Journal B,78,10.1140/epjb/e2010-00219-x,Netherlands,Article,Delft,0,Journal,2-s2.0-77956737842
Baronchelli A.,,Mean-field diffusive dynamics on weighted networks,2010,"Physical Review E - Statistical, Nonlinear, and Soft Matter Physics",69,10.1103/PhysRevE.82.011111,Spain,Article,Barcelona,0,Journal,2-s2.0-77954511795
Karrer B.,,Message passing approach for general epidemic models,2010,"Physical Review E - Statistical, Nonlinear, and Soft Matter Physics",160,10.1103/PhysRevE.82.016101,United States,Article,Ann Arbor,0,Journal,2-s2.0-77954322317
Bancal J.,,Steady-state dynamics of the forest fire model on complex networks,2010,European Physical Journal B,22,10.1140/epjb/e2010-00165-7,Switzerland,Article,Lausanne,0,Journal,2-s2.0-77954504125
Parshani R.,,Epidemic threshold for the susceptible-infectious-susceptible model on random networks,2010,Physical Review Letters,127,10.1103/PhysRevLett.104.258701,Israel,Article,Ramat Gan,0,Journal,2-s2.0-77953934901
Tang J.,,Small-world behavior in time-varying graphs,2010,"Physical Review E - Statistical, Nonlinear, and Soft Matter Physics",175,10.1103/PhysRevE.81.055101,United Kingdom,Article,Cambridge,0,Journal,2-s2.0-77953098690
Nian F.,,Efficient immunization strategies on complex networks,2010,Journal of Theoretical Biology,53,10.1016/j.jtbi.2010.01.007,China;China,Article,Lanzhou;Dalian,0,Journal,2-s2.0-77649238152
Trpevski D.,,Model for rumor spreading over networks,2010,"Physical Review E - Statistical, Nonlinear, and Soft Matter Physics",132,10.1103/PhysRevE.81.056102,North Macedonia,Article,Skopje,0,Journal,2-s2.0-77952026080
Ben-Zion Y.,,Modeling epidemics dynamics on heterogenous networks,2010,Journal of Theoretical Biology,24,10.1016/j.jtbi.2010.01.029,Israel,Article,Ramat Gan,0,Journal,2-s2.0-77951652611
Dorogovtsev S.,,Lectures on Complex Networks,2010,Lectures on Complex Networks,164,10.1093/acprof:oso/9780199548927.001.0001,Portugal;Russian Federation,Book,Aveiro;Saint Petersburg (ex Leningrad),0,Book,2-s2.0-84922509134
Shaw L.B.,,Enhanced vaccine control of epidemics in adaptive networks,2010,"Physical Review E - Statistical, Nonlinear, and Soft Matter Physics",95,10.1103/PhysRevE.81.046120,United States,Article,Williamsburg,0,Journal,2-s2.0-77951742798
Salathé M.,,Dynamics and control of diseases in networks with community structure,2010,PLoS Computational Biology,295,10.1371/journal.pcbi.1000736,United States,Article,Palo Alto,1,Journal,2-s2.0-77954594423
Funk S.,,Interacting epidemics on overlay networks,2010,"Physical Review E - Statistical, Nonlinear, and Soft Matter Physics",107,10.1103/PhysRevE.81.036118,United Kingdom,Article,Egham,0,Journal,2-s2.0-77950449117
Durrett R.,,Some features of the spread of epidemics and information on a random graph,2010,Proceedings of the National Academy of Sciences of the United States of America,91,10.1073/pnas.0914402107,United States,Article,Ithaca,1,Journal,2-s2.0-77949647264
Peng C.,,Epidemic threshold and immunization on generalized networks,2010,Physica A: Statistical Mechanics and its Applications,32,10.1016/j.physa.2009.09.047,China;China,Article,Hangzhou;Ningbo,0,Journal,2-s2.0-70350571231
Gómez S.,,Discrete-time Markov chain approach to contact-based disease spreading in complex networks,2010,EPL,235,10.1209/0295-5075/89/38009,Spain,Article,Tarragona,0,Journal,2-s2.0-77957266190
Fortunato S.,,Community detection in graphs,2010,Physics Reports,5864,10.1016/j.physrep.2009.11.002,Italy,Review,Turin,0,Journal,2-s2.0-74049087026
Van Mieghem P.,,Performance analysis of complex networks and systems,2010,Performance Analysis of Complex Networks and Systems,71,10.1017/CBO9781107415874,Netherlands,Book,Delft,0,Book,2-s2.0-84923174114
Kimura M.,,Extracting influential nodes on a social network for information diffusion,2010,Data Mining and Knowledge Discovery,151,10.1007/s10618-009-0150-5,Japan,Article,Kyoto,0,Journal,2-s2.0-76749098758
Chao D.L.,,"FluTE, a publicly available stochastic influenza epidemic simulation model",2010,PLoS Computational Biology,166,10.1371/journal.pcbi.1000656,United States,Article,Seattle,1,Journal,2-s2.0-76749154557
Christakis N.A.,,Social network sensors for early detection of contagious outbreaks,2010,PLoS ONE,291,10.1371/journal.pone.0012948,United States;United States,Article,Cambridge;Boston,1,Journal,2-s2.0-77958594601
Mieghem P.,,Graph spectra for complex networks,2010,Graph Spectra for Complex Networks,355,10.1017/CBO9780511921681,Netherlands,Book,Delft,0,Book,2-s2.0-84925118135
Caldarelli G.,,Scale-Free Networks: Complex Webs in Nature and Technology,2010,Scale-Free Networks: Complex Webs in Nature and Technology,390,10.1093/acprof:oso/9780199211517.001.0001,Italy,Book,Rome,0,Book,2-s2.0-84921882515
Kitsak M.,,Identification of influential spreaders in complex networks,2010,Nature Physics,1473,10.1038/nphys1746,United States;United States,Article,San Diego;Boston,1,Journal,2-s2.0-78149283685
Balcan D.,,Multiscale mobility networks and the spatial spreading of infectious diseases,2009,Proceedings of the National Academy of Sciences of the United States of America,593,10.1073/pnas.0906910106,United States;United States,Article,Bloomington;Bloomington,1,Journal,2-s2.0-76049115282
Miller J.,,Spread of infectious disease through clustered populations,2009,Journal of the Royal Society Interface,92,10.1098/rsif.2008.0524,United States;Canada,Review,Boston;Vancouver,1,Journal,2-s2.0-69249147221
Peng S.,,Dynamic behavior of a new SEIRS model on complex networks,2009,"Proceedings - 2009 International Conference on Computational Intelligence and Software Engineering, CiSE 2009",1,10.1109/CISE.2009.5365379,China,Conference Paper,Wuhan,0,Conference Proceeding,2-s2.0-77949702616
Chatterjee S.,,Contact processes on random graphs with power law degree distributions have critical value 0,2009,Annals of Probability,92,10.1214/09-AOP471,United States,Article,Ithaca,1,Journal,2-s2.0-77049093438
Omic J.,,Protecting against network infections: A game theoretic perspective,2009,Proceedings - IEEE INFOCOM,69,10.1109/INFCOM.2009.5062065,Netherlands,Conference Paper,Delft,0,Conference Proceeding,2-s2.0-67650416963
Lorenza J.,,Systemic risk in a unifying framework for cascading processes on networks,2009,European Physical Journal B,104,10.1140/epjb/e2009-00347-4,Switzerland,Article,"Zurich ZH,",0,Journal,2-s2.0-84870803062
Balcan D.,,Seasonal transmission potential and activity peaks of the new influenza A(H1N1): A Monte Carlo likelihood analysis based on human mobility,2009,BMC Medicine,236,10.1186/1741-7015-7-45,United States;United States,Article,Bloomington;Bloomington,1,Journal,2-s2.0-70350687996
Iribarren J.L.,,Impact of human activity patterns on the dynamics of information diffusion,2009,Physical Review Letters,269,10.1103/PhysRevLett.103.038702,Spain,Article,Madrid,0,Journal,2-s2.0-68649108167
Miller J.C.,,Percolation and epidemics in random clustered networks,2009,"Physical Review E - Statistical, Nonlinear, and Soft Matter Physics",131,10.1103/PhysRevE.80.020901,United States;United States,Article,Boston;Bethesda,0,Journal,2-s2.0-77549087023
Butts C.,,Revisiting the foundations of network analysis,2009,Science,286,10.1126/science.1171022,United States,Short Survey,Irvine,0,Journal,2-s2.0-67749102377
Vespignani A.,,Predicting the behavior of techno-social systems,2009,Science,322,10.1126/science.1171990,Italy;United States,Review,Turin;Bloomington,0,Journal,2-s2.0-67749145794
Kooij R.E.,,A new metric for robustness with respect to virus spread,2009,Lecture Notes in Computer Science (including subseries Lecture Notes in Artificial Intelligence and Lecture Notes in Bioinformatics),11,10.1007/978-3-642-01399-7_44,Netherlands;Netherlands;United States,Conference Paper,The Hague;Delft;Manhattan,1,Book Series,2-s2.0-67650296386
Dodds P.S.,,Analysis of a threshold model of social contagion on degree-correlated networks,2009,"Physical Review E - Statistical, Nonlinear, and Soft Matter Physics",35,10.1103/PhysRevE.79.066115,United States,Article,Burlington,0,Journal,2-s2.0-67650109623
Joh R.,,Dynamics of indirectly transmitted infectious diseases with immunological threshold,2009,Bulletin of Mathematical Biology,70,10.1007/s11538-008-9384-4,United States,Article,Atlanta,0,Journal,2-s2.0-64449088427
Funk S.,,The spread of awareness and its impact on epidemic outbreaks,2009,Proceedings of the National Academy of Sciences of the United States of America,441,10.1073/pnas.0810762106,United Kingdom,Article,Egham,1,Journal,2-s2.0-66149153486
Risau-Gusman S.,,Contact switching as a control strategy for epidemic outbreaks,2009,Journal of Theoretical Biology,69,10.1016/j.jtbi.2008.10.027,Argentina,Article,Rio Negro,0,Journal,2-s2.0-59649118898
Volz E.,,Epidemic thresholds in dynamic contact networks,2009,Journal of the Royal Society Interface,118,10.1098/rsif.2008.0218,United States,Article,Austin,0,Journal,2-s2.0-64549088983
Boguñá M.,,Langevin approach for the dynamics of the contact process on annealed scale-free networks,2009,"Physical Review E - Statistical, Nonlinear, and Soft Matter Physics",76,10.1103/PhysRevE.79.036110,Spain,Article,Barcelona,0,Journal,2-s2.0-64549125164
Lagorio C.,,Effects of epidemic threshold definition on disease spread statistics,2009,Physica A: Statistical Mechanics and its Applications,21,10.1016/j.physa.2008.10.045,Argentina,Article,Mar de Plata,0,Journal,2-s2.0-58149187866
Eames K.,,Epidemic prediction and control in weighted networks,2009,Epidemics,48,10.1016/j.epidem.2008.12.001,United Kingdom,Article,Cambridge,1,Journal,2-s2.0-63349085482
Noël P.A.,,Time evolution of epidemic disease on finite and infinite networks,2009,"Physical Review E - Statistical, Nonlinear, and Soft Matter Physics",44,10.1103/PhysRevE.79.026101,Canada;Canada,Article,Quebec;Vancouver,0,Journal,2-s2.0-60949109906
Ni S.,,Impact of travel patterns on epidemic dynamics in heterogeneous spatial metapopulation networks,2009,"Physical Review E - Statistical, Nonlinear, and Soft Matter Physics",44,10.1103/PhysRevE.79.016111,China,Article,Beijing,0,Journal,2-s2.0-60749090008
Van Mieghem P.,,Virus spread in networks,2009,IEEE/ACM Transactions on Networking,524,10.1109/TNET.2008.925623,Netherlands,Article,Delft,0,Journal,2-s2.0-61449222889
Salathé M.,,The effect of opinion clustering on disease outbreaks,2008,Journal of the Royal Society Interface,98,10.1098/rsif.2008.0271,United States,Article,Palo Alto,0,Journal,2-s2.0-58749113283
Goltsev A.V.,,Percolation on correlated networks,2008,"Physical Review E - Statistical, Nonlinear, and Soft Matter Physics",76,10.1103/PhysRevE.78.051105,Portugal;Russian Federation,Article,Aveiro;Saint Petersburg (ex Leningrad),0,Journal,2-s2.0-56649115608
Dorogovtsev S.,,Critical phenomena in complex networks,2008,Reviews of Modern Physics,1308,10.1103/RevModPhys.80.1275,Portugal;Russian Federation,Article,Aveiro;Saint Petersburg (ex Leningrad),0,Journal,2-s2.0-56549085272
Sharkey K.,,Deterministic epidemiological models at the individual level,2008,Journal of Mathematical Biology,45,10.1007/s00285-008-0161-7,United Kingdom;United Kingdom,Article,Liverpool;Manchester,1,Journal,2-s2.0-45049087008
Chen Y.,,Finding a better immunization strategy,2008,Physical Review Letters,198,10.1103/PhysRevLett.101.058701,United States,Article,Boston,0,Journal,2-s2.0-49149084034
Saldaña J.,,Continuous-time formulation of reaction-diffusion processes on heterogeneous metapopulations,2008,"Physical Review E - Statistical, Nonlinear, and Soft Matter Physics",28,10.1103/PhysRevE.78.012902,Spain,Article,Girona,0,Journal,2-s2.0-48849089295
Baronchelli A.,,Bosonic reaction-diffusion processes on scale-free networks,2008,"Physical Review E - Statistical, Nonlinear, and Soft Matter Physics",41,10.1103/PhysRevE.78.016111,Spain,Article,Barcelona,0,Journal,2-s2.0-48349123941
Shaw L.B.,,Fluctuating epidemics on adaptive networks,2008,"Physical Review E - Statistical, Nonlinear, and Soft Matter Physics",179,10.1103/PhysRevE.77.066101,United States,Article,Williamsburg,0,Journal,2-s2.0-44849085150
Christakis N.,,The collective dynamics of smoking in a large social network,2008,New England Journal of Medicine,1323,10.1056/NEJMsa0706154,United States;United States;United States,Article,Cambridge;Cambridge;Boston,0,Journal,2-s2.0-44249122799
Gleeson J.P.,,Cascades on correlated and modular random networks,2008,"Physical Review E - Statistical, Nonlinear, and Soft Matter Physics",130,10.1103/PhysRevE.77.046117,Ireland,Article,Limerick,0,Journal,2-s2.0-43049086711
Nardini C.,,Who's talking first? Consensus or lack thereof in coevolving opinion formation models,2008,Physical Review Letters,126,10.1103/PhysRevLett.100.158701,France;Italy,Article,Orsay;Padua,0,Journal,2-s2.0-42449102717
Gautreau A.,,Global disease spread: Statistics and estimation of arrival times,2008,Journal of Theoretical Biology,49,10.1016/j.jtbi.2007.12.001,France;France,Article,Saint-Aubin;Paris,0,Journal,2-s2.0-40849086157
Colizza V.,,Epidemic modeling in metapopulation systems with heterogeneous coupling pattern: Theory and simulations,2008,Journal of Theoretical Biology,216,10.1016/j.jtbi.2007.11.028,Italy,Article,Turin,0,Journal,2-s2.0-40849087804
Zanette D.H.,,Infection spreading in a population with evolving contacts,2008,Journal of Biological Physics,95,10.1007/s10867-008-9060-9,Argentina,Article,San Carlos de Bariloche,0,Journal,2-s2.0-55349117165
Liben-Nowell D.,,Tracing information flow on a global scale using Internet chain-letter data,2008,Proceedings of the National Academy of Sciences of the United States of America,266,10.1073/pnas.0708471105,United States,Article,Northfield,1,Journal,2-s2.0-42449155545
Halloran M.E.,,Modeling targeted layered containment of an influenza pandemic in the United States,2008,Proceedings of the National Academy of Sciences of the United States of America,377,10.1073/pnas.0706849105,United States;United States,Article,Seattle;Seattle,1,Journal,2-s2.0-42449139659
Gross T.,,Adaptive coevolutionary networks: A review,2008,Journal of the Royal Society Interface,594,10.1098/rsif.2007.1229,Germany,Review,Dresden,1,Journal,2-s2.0-38349157799
Volz E.,,SIR dynamics in random networks with heterogeneous connectivity,2008,Journal of Mathematical Biology,183,10.1007/s00285-007-0116-4,United States,Article,Austin,0,Journal,2-s2.0-36749049140
Gómez-Gardeñes J.,,Spreading of sexually transmitted diseases in heterosexual populations,2008,Proceedings of the National Academy of Sciences of the United States of America,80,10.1073/pnas.0707332105,Italy;Spain,Article,Catania;Zaragoza,1,Journal,2-s2.0-40349114409
Wu X.,,How community structure influences epidemic spread in social networks,2008,Physica A: Statistical Mechanics and its Applications,92,10.1016/j.physa.2007.09.039,China,Article,Shanghai,0,Journal,2-s2.0-36448984381
Chakrabarti D.,,Epidemic thresholds in real networks,2008,ACM Transactions on Information and System Security,410,10.1145/1284680.1284681,United States,Article,Pittsburgh,0,Journal,2-s2.0-39349087037
Fowler J.,,Dynamic spread of happiness in a large social network: longitudinal analysis over 20 years in the Framingham Heart Study.,2008,BMJ (Clinical research ed.),814,10.1136/bmj.a2338,United States,Article,San Diego,1,Journal,2-s2.0-58149387739
Barrat A.,,Dynamical processes on complex networks,2008,Dynamical Processes on Complex Networks,1582,10.1017/CBO9780511791383,France;France;Italy,Book,Saint-Aubin;Paris;,0,Book,2-s2.0-84924517160
Bagnoli F.,,Risk perception in epidemic modeling,2007,"Physical Review E - Statistical, Nonlinear, and Soft Matter Physics",85,10.1103/PhysRevE.76.061904,Italy;Italy,Article,Sesto Fiorentino;Florence,0,Journal,2-s2.0-36849044096
