Authors,Author(s) ID,Title,Year,Source tittle,Cited by,DOI,Country,Document Type,City,Access Type,aggregationType,EID
Csomai A.,,Investigations in unsupervised back-of-the-book indexing,2007,"Proceedings of the Twentieth International Florida Artificial Intelligence Research Society Conference, FLAIRS 2007",16,,United States,Conference Paper,Denton,0,Conference Proceeding,2-s2.0-37349068168
Reilly J.,,Formal distinctiveness of high- and low-imageability nouns: Analyses and theoretical implications,2007,Cognitive Science,65,10.1080/03640210709336988,United States,Article,Philadelphia,1,Journal,2-s2.0-33947388447
Rennie J.,,Using term informativeness for named entity detection,2005,SIGIR 2005 - Proceedings of the 28th Annual International ACM SIGIR Conference on Research and Development in Information Retrieval,37,10.1145/1076034.1076095,United States,Conference Paper,Cambridge,0,Conference Proceeding,2-s2.0-84885598197
Landauer T.,,"A Solution to Plato's Problem: The Latent Semantic Analysis Theory of Acquisition, Induction, and Representation of Knowledge",1997,Psychological Review,3303,10.1037/0033-295X.104.2.211,United States,Article,Boulder,0,Journal,2-s2.0-0000600219
Church K.,,Poisson mixtures,1995,Natural Language Engineering,194,10.1017/S1351324900000139,United States,Article,Murray,0,Journal,2-s2.0-84974402096
Miller G.,,Introduction to wordnet: An on-line lexical database,1990,International Journal of Lexicography,2167,10.1093/ijl/3.4.235,United States,Article,Princeton,0,Journal,2-s2.0-34248833974
Deerwester S.,,Indexing by latent semantic analysis,1990,Journal of the American Society for Information Science,7497,10.1002/(SICI)1097-4571(199009)41:6<391::AID-ASI1>3.0.CO;2-9,United States,Article,Chicago,0,Journal,2-s2.0-84989525001
Jones K.,,A statistical interpretation of term specificity and its application in retrieval,1972,Journal of Documentation,1773,10.1108/eb026526,United Kingdom,Review,Cambridge,0,Journal,2-s2.0-84953744816
Gorman A.,,Recognition memory for nouns as a function of abstractness and frequency,1961,Journal of Experimental Psychology,117,10.1037/h0040561,,Article,,0,Journal,2-s2.0-0003040960
