Authors,Author(s) ID,Title,Year,Source tittle,Cited by,DOI,Country,Document Type,City,Access Type,aggregationType,EID
Chen P.,,Local Fiedler vector centrality for detection of deep and overlapping communities in networks,2014,"ICASSP, IEEE International Conference on Acoustics, Speech and Signal Processing - Proceedings",27,10.1109/ICASSP.2014.6853771,United States,Conference Paper,Ann Arbor,0,Conference Proceeding,2-s2.0-84905278442
Chen P.Y.,,Assessing and safeguarding network resilience to nodal attacks,2014,IEEE Communications Magazine,28,10.1109/MCOM.2014.6957154,United States,Article,Ann Arbor,0,Journal,2-s2.0-84914816852
Chen P.,,Node removal vulnerability of the largest component of a network,2013,"2013 IEEE Global Conference on Signal and Information Processing, GlobalSIP 2013 - Proceedings",14,10.1109/GlobalSIP.2013.6736946,United States,Conference Paper,Ann Arbor,0,Conference Proceeding,2-s2.0-84897705146
Newman M.E.J.,,Spectral methods for community detection and graph partitioning,2013,"Physical Review E - Statistical, Nonlinear, and Soft Matter Physics",180,10.1103/PhysRevE.88.042822,United States,Article,Ann Arbor,0,Journal,2-s2.0-84887308017
Bertrand A.,,Distributed computation of the Fiedler vector with application to topology inference in ad hoc networks,2013,Signal Processing,46,10.1016/j.sigpro.2012.12.002,Belgium;Belgium,Article,3000 Leuven;Leuven,0,Journal,2-s2.0-84872119877
Bertrand A.,,Seeing the bigger picture: How nodes can learn their place within a complex ad hoc network topology,2013,IEEE Signal Processing Magazine,49,10.1109/MSP.2012.2232713,Belgium,Article,3000 Leuven,0,Journal,2-s2.0-85032751678
Radicchi F.,,Abrupt transition in the structural formation of interconnected networks,2013,Nature Physics,211,10.1038/nphys2761,Spain;United States,Article,Tarragona;Bloomington,1,Journal,2-s2.0-84887234607
Shuman D.,,The emerging field of signal processing on graphs: Extending high-dimensional data analysis to networks and other irregular domains,2013,IEEE Signal Processing Magazine,1355,10.1109/MSP.2012.2235192,Switzerland,Article,Lausanne,0,Journal,2-s2.0-85032751310
Nadakuditi R.,,On hard limits of eigen-analysis based planted clique detection,2012,"2012 IEEE Statistical Signal Processing Workshop, SSP 2012",21,10.1109/SSP.2012.6319639,United States,Conference Paper,Ann Arbor,0,Conference Proceeding,2-s2.0-84868221902
Benaych-Georges F.,,The singular values and vectors of low rank perturbations of large rectangular random matrices,2012,Journal of Multivariate Analysis,107,10.1016/j.jmva.2012.04.019,France;France,Article,Palaiseau;Paris,1,Journal,2-s2.0-84862305511
Nadakuditi R.,,Graph spectra and the detectability of community structure in networks,2012,Physical Review Letters,174,10.1103/PhysRevLett.108.188701,United States,Article,Ann Arbor,1,Journal,2-s2.0-84860628853
Cantador I.,,Second Workshop on Information Heterogeneity and Fusion in Recommender Systems (HetRec2011),2011,RecSys'11 - Proceedings of the 5th ACM Conference on Recommender Systems,200,10.1145/2043932.2044016,Spain,Conference Paper,Madrid,0,Conference Proceeding,2-s2.0-82555195625
Balakrishnan S.,,Noise thresholds for spectral clustering,2011,"Advances in Neural Information Processing Systems 24: 25th Annual Conference on Neural Information Processing Systems 2011, NIPS 2011",38,,United States,Conference Paper,Pittsburgh,0,Conference Proceeding,2-s2.0-84860641664
Coscia M.,,A classification for community discovery methods in complex networks,2011,Statistical Analysis and Data Mining,190,10.1002/sam.10133,Italy;Italy;United States,Review,Pisa;Pisa;Boston,0,Journal,2-s2.0-80053078116
Wen H.,,Improving community detection in networks by targeted node removal,2011,"Physical Review E - Statistical, Nonlinear, and Soft Matter Physics",12,10.1103/PhysRevE.83.016114,United States,Article,San Diego,1,Journal,2-s2.0-79951687050
Karrer B.,,Stochastic blockmodels and community structure in networks,2011,"Physical Review E - Statistical, Nonlinear, and Soft Matter Physics",760,10.1103/PhysRevE.83.016107,United States,Article,Ann Arbor,1,Journal,2-s2.0-79951710564
Miller B.,,Subgraph detection using eigenvector L1 norms,2010,"Advances in Neural Information Processing Systems 23: 24th Annual Conference on Neural Information Processing Systems 2010, NIPS 2010",40,,United States,Conference Paper,Cambridge,0,Conference Proceeding,2-s2.0-84860608460
Miller B.,,Toward signal processing theory for graphs and non-Euclidean data,2010,"ICASSP, IEEE International Conference on Acoustics, Speech and Signal Processing - Proceedings",39,10.1109/ICASSP.2010.5494930,United States,Conference Paper,Cambridge,0,Conference Proceeding,2-s2.0-78049365565
Newman M.,,Networks: An Introduction,2010,Networks: An Introduction,6212,10.1093/acprof:oso/9780199206650.001.0001,United States,Book,Ann Arbor,0,Book,2-s2.0-77954826067
Good B.H.,,Performance of modularity maximization in practical contexts,2010,"Physical Review E - Statistical, Nonlinear, and Soft Matter Physics",545,10.1103/PhysRevE.81.046106,United States;United States,Article,Santa Fe;Swarthmore,0,Journal,2-s2.0-77951138987
Fortunato S.,,Community detection in graphs,2010,Physics Reports,5864,10.1016/j.physrep.2009.11.002,Italy,Review,Turin,0,Journal,2-s2.0-74049087026
Lancichinetti A.,,Community detection algorithms: A comparative analysis,2009,"Physical Review E - Statistical, Nonlinear, and Soft Matter Physics",1150,10.1103/PhysRevE.80.056117,Italy;Italy,Article,Turin;Turin,0,Journal,2-s2.0-71849108522
Airoldi E.,,Mixed membership stochastic blockmodels,2008,Journal of Machine Learning Research,906,,United States;,Article,Princeton;,0,Journal,2-s2.0-54249110594
Von Luxburg U.,,A tutorial on spectral clustering,2007,Statistics and Computing,4571,10.1007/s11222-007-9033-z,Germany,Article,Tubingen,0,Journal,2-s2.0-34548583274
Schaeffer S.,,Graph clustering,2007,Computer Science Review,1125,10.1016/j.cosrev.2007.05.001,Finland,Article,Espoo,0,Journal,2-s2.0-35248893285
de Abreu N.,,Old and new results on algebraic connectivity of graphs,2007,Linear Algebra and Its Applications,212,10.1016/j.laa.2006.08.017,Brazil,Article,Rio de Janeiro,1,Journal,2-s2.0-33947178314
Spielman D.,,Spectral partitioning works: Planar graphs and finite element meshes,2007,Linear Algebra and Its Applications,106,10.1016/j.laa.2006.07.020,United States,Article,New Haven,1,Journal,2-s2.0-33846251992
Fortunato S.,,Resolution limit in community detection,2007,Proceedings of the National Academy of Sciences of the United States of America,1725,10.1073/pnas.0605965104,Italy;Germany;United States,Review,Turin;Bielefeld;Bloomington,1,Journal,2-s2.0-33846126275
Newman M.,,Modularity and community structure in networks,2006,Proceedings of the National Academy of Sciences of the United States of America,5550,10.1073/pnas.0601602103,United States,Article,Ann Arbor,1,Journal,2-s2.0-33745012299
Newman M.E.J.,,Finding community structure in networks using the eigenvectors of matrices,2006,"Physical Review E - Statistical, Nonlinear, and Soft Matter Physics",2559,10.1103/PhysRevE.74.036104,United States,Article,Ann Arbor,0,Journal,2-s2.0-33749468596
Guo J.,,A new upper bound for the Laplacian spectral radius of graphs,2005,Linear Algebra and Its Applications,19,10.1016/j.laa.2004.10.022,China;China,Article,Qingdao;Shanghai,1,Journal,2-s2.0-15844396440
Latala R.,,Some estimates of norms of random matrices,2005,Proceedings of the American Mathematical Society,95,10.1090/S0002-9939-04-07800-1,Poland,Article,Warsaw,1,Journal,2-s2.0-18144366601
Everett M.,,Ego network betweenness,2005,Social Networks,346,10.1016/j.socnet.2004.11.007,United Kingdom,Article,London,0,Journal,2-s2.0-13944256675
Radicchi F.,,Defining and identifying communities in networks,2004,Proceedings of the National Academy of Sciences of the United States of America,1536,10.1073/pnas.0400054101,Italy,Article,Rome,1,Journal,2-s2.0-1542357701
Lusseau D.,,The bottlenose dolphin community of doubtful sound features a large proportion of long-lasting associations: Can geographic isolation explain this unique trait?,2003,Behavioral Ecology and Sociobiology,1311,10.1007/s00265-003-0651-y,New Zealand;United Kingdom,Article,Dunedin;Aberdeen,0,Journal,2-s2.0-0042311400
Girvan M.,,Community structure in social and biological networks,2002,Proceedings of the National Academy of Sciences of the United States of America,8662,10.1073/pnas.122653799,United States;United States,Article,Santa Fe;Ithaca,1,Journal,2-s2.0-0037062448
Shi J.,,Normalized cuts and image segmentation,2000,IEEE Transactions on Pattern Analysis and Machine Intelligence,9931,10.1109/34.868688,United States,Article,Pittsburgh,0,Journal,2-s2.0-0034244751
Alon N.,,Finding a large hidden clique in a random graph,1998,Random Structures and Algorithms,135,10.1002/(sici)1098-2418(199810/12)13:3/4<457::aid-rsa14>3.0.co;2-w,Israel,Article,Tel Aviv-Yafo,0,Journal,2-s2.0-0032221884
Snijders T.,,Estimation and prediction for stochastic blockmodels for graphs with latent block structure,1997,Journal of Classification,289,10.1007/s003579900004,Netherlands,Article,Groningen,0,Journal,2-s2.0-0031495186
Talagrand M.,,Concentration of measure and isoperimetric inequalities in product spaces,1995,Publications Mathématiques de l'Institut des Hautes Scientifiques,442,10.1007/BF02699376,France,Article,Paris,0,Journal,2-s2.0-51249165477
Merris R.,,Laplacian matrices of graphs: a survey,1994,Linear Algebra and Its Applications,1058,10.1016/0024-3795(94)90486-3,United States,Article,Hayward,1,Journal,2-s2.0-33750999449
Holland P.W.,,Stochastic blockmodels: First steps,1983,Social Networks,919,10.1016/0378-8733(83)90021-7,United States,Article,Princeton,0,Journal,2-s2.0-0012864758
Nemhauser G.,,An analysis of approximations for maximizing submodular set functions-I,1978,Mathematical Programming,2096,10.1007/BF01588971,Belgium,Article,Louvain-la-Neuve,0,Journal,2-s2.0-0000095809
Sabidussi G.,,The centrality index of a graph,1966,Psychometrika,1175,10.1007/BF02289527,Canada,Article,Hamilton,0,Journal,2-s2.0-0013987194
