Authors,Author(s) ID,Title,Year,Source tittle,Cited by,DOI,Country,Document Type,City,Access Type,aggregationType,EID
Czyzżak P.,,Pareto simulated annealing-a metaheuristic technique for multiple-objective combinatorial optimization,1998,Journal of Multi-Criteria Decision Analysis,499,10.1002/(SICI)1099-1360(199801)7:1<34::AID-MCDA161>3.0.CO;2-6,Poland,Article,Poznan,0,Journal,2-s2.0-85018104842
Osman I.H.,,Metaheuristics: A bibliography,1996,Annals of Operations Research,358,10.1007/bf02125421,United Kingdom,Article,Canterbury,0,Journal,2-s2.0-27844568382
Brandimarte P.,,A hierarchical bicriterion approach to integrated process plan selection and job shop scheduling,1995,International Journal of Production Research,66,10.1080/00207549508930142,Italy,Article,Turin,0,Journal,2-s2.0-0000955243
Freville A.,,An efficient preprocessing procedure for the multidimensional 0-1 knapsack problem,1994,Discrete Applied Mathematics,80,10.1016/0166-218X(94)90209-7,France,Article,Valenciennes,1,Journal,2-s2.0-38149146140
Ulungu E.,,Multi‐objective combinatorial optimization problems: A survey,1994,Journal of Multi‐Criteria Decision Analysis,203,10.1002/mcda.4020030204,Belgium,Article,Mons,0,Journal,2-s2.0-84994926936
Malakooti B.,,A sensor-based accelerated approach for multi-attribute machinability and tool life evaluation,1990,International Journal of Production Research,27,10.1080/00207549008942872,United States,Article,Cleveland,0,Journal,2-s2.0-0025643727
Van Wassenhove L.,,Solving a bicriterion scheduling problem,1980,European Journal of Operational Research,158,10.1016/0377-2217(80)90038-7,Belgium,Article,3000 Leuven,0,Journal,2-s2.0-0018924243
