Authors,Author(s) ID,Title,Year,Source tittle,Cited by,DOI,Country,Document Type,City,Access Type,aggregationType,EID
Chui C.,,Kalman filtering: With real-time applications,2009,Kalman Filtering: With Real-Time Applications,739,10.1007/978-3-540-87849-0,United States,Book,College Station,0,Book,2-s2.0-84892340060
Albert R.,,Statistical mechanics of complex networks,2002,Reviews of Modern Physics,13645,10.1103/RevModPhys.74.47,United States;United States,Article,Minneapolis;Notre Dame,0,Journal,2-s2.0-0036013593
Wang X.,,Synchronization in small-world dynamical networks,2002,International Journal of Bifurcation and Chaos in Applied Sciences and Engineering,749,10.1142/S0218127402004292,China,Article,Shanghai,0,Journal,2-s2.0-0036340313
Wang X.,,Synchronization in scale-free dynamical networks: Robustness and fragility,2002,IEEE Transactions on Circuits and Systems I: Fundamental Theory and Applications,981,10.1109/81.974874,China;United Kingdom;United States,Article,Shanghai;Bristol;New York,0,Journal,2-s2.0-0036125429
Park K.,,On the effectiveness of route-based packet filtering for distributed DoS attack prevention in power-law Internets,2001,Computer Communication Review,258,10.1145/964723.383061,United States,Conference Paper,West Lafayette,0,Conference Proceeding,2-s2.0-0034776786
Floyd S.,,Difficulties in simulating the Internet,2001,IEEE/ACM Transactions on Networking,527,10.1109/90.944338,United States;United States,Article,Berkeley;New York,0,Journal,2-s2.0-0035416013
Newman M.E.J.,,Random graphs with arbitrary degree distributions and their applications,2001,"Physical Review E - Statistical, Nonlinear, and Soft Matter Physics",2213,,United States;United States,Article,Santa Fe;Ithaca,0,Journal,2-s2.0-0035420732
Newman M.E.J.,,Scientific collaboration networks. I. Network construction and fundamental results,2001,"Physical Review E - Statistical, Nonlinear, and Soft Matter Physics",1361,,United States,Article,Santa Fe,0,Journal,2-s2.0-0035395881
Newman M.E.J.,,"Scientific collaboration networks. II. Shortest paths, weighted networks, and centrality",2001,"Physical Review E - Statistical, Nonlinear, and Soft Matter Physics",1499,,United States,Article,Santa Fe,0,Journal,2-s2.0-0042635247
Yook S.,,Weighted evolving networks,2001,Physical Review Letters,344,10.1103/PhysRevLett.86.5835,United States,Article,Notre Dame,0,Journal,2-s2.0-0035907404
Cohen R.,,Breakdown of the internet under intentional attack,2001,Physical Review Letters,1004,10.1103/PhysRevLett.86.3682,Israel,Article,Ramat Gan,0,Journal,2-s2.0-0035896667
Pastor-Satorras R.,,Epidemic spreading in scale-free networks,2001,Physical Review Letters,3738,10.1103/PhysRevLett.86.3200,Spain,Article,Barcelona,0,Journal,2-s2.0-0035794256
Tadić B.,,Dynamics of directed graphs: The world-wide Web,2001,Physica A: Statistical Mechanics and its Applications,105,10.1016/S0378-4371(01)00014-0,Slovenia,Article,Ljubljana,0,Journal,2-s2.0-0034817838
Strogatz S.,,Exploring complex networks,2001,Nature,5562,10.1038/35065725,United States,Review,Ithaca,1,Journal,2-s2.0-0035826155
Newman M.,,The structure of scientific collaboration networks,2001,Proceedings of the National Academy of Sciences of the United States of America,2978,10.1073/pnas.98.2.404,United States,Article,Santa Fe,1,Journal,2-s2.0-0035895239
Bohland J.,,Efficient associative memory using small-world architecture,2001,Neurocomputing,102,10.1016/S0925-2312(01)00378-2,United States,Article,Cincinnati,0,Journal,2-s2.0-16444379205
Pastor-Satorras R.,,Epidemic dynamics and endemic states in complex networks,2001,"Physical Review E - Statistical Physics, Plasmas, Fluids, and Related Interdisciplinary Topics",1153,10.1103/PhysRevE.63.066117,Spain,Article,Barcelona,0,Journal,2-s2.0-0035363452
Callaway D.,,Network robustness and fragility: percolation on random graphs,2000,Physical Review Letters,1632,10.1103/PhysRevLett.85.5468,United States,Article,Ithaca,0,Journal,2-s2.0-4243939794
Comellas F.,,Deterministic small-world communication networks,2000,Information Processing Letters,105,10.1016/S0020-0190(00)00118-6,Spain,Article,Barcelona,0,Journal,2-s2.0-0343878196
Krapivsky P.,,Connectivity of growing random networks,2000,Physical Review Letters,817,10.1103/PhysRevLett.85.4629,France;United States,Article,Toulouse;Boston,0,Journal,2-s2.0-0034310714
Cohen R.,,Resilience of the Internet to random breakdowns,2000,Physical Review Letters,1644,10.1103/PhysRevLett.85.4626,Israel,Article,Ramat Gan,0,Journal,2-s2.0-0034323311
Caldarelli G.,,The fractal properties of Internet,2000,Europhysics Letters,146,10.1209/epl/i2000-00450-8,Italy,Article,Rome,0,Journal,2-s2.0-0034597461
Amaral L.A.N.,,Classes of small-world networks,2000,Proceedings of the National Academy of Sciences of the United States of America,2116,10.1073/pnas.200327197,United States,Conference Paper,Boston,1,Journal,2-s2.0-0034633749
Jeong H.,,The large-scale organization of metabolic networks,2000,Nature,3533,10.1038/35036627,United States,Article,Notre Dame,0,Journal,2-s2.0-0034609791
Tu Y.,,How robust is the Internet?,2000,Nature,55,10.1038/35019222,United States,Short Survey,Yorktown Heights,0,Journal,2-s2.0-0034721125
Albert R.,,Error and attack tolerance of complex networks,2000,Nature,5597,10.1038/35019019,United States,Article,Notre Dame,0,Journal,2-s2.0-0034721164
Barabási A.,,Scale-free characteristics of random networks: The topology of the world-wide web,2000,Physica A: Statistical Mechanics and its Applications,866,10.1016/S0378-4371(00)00018-2,United States,Article,Notre Dame,0,Journal,2-s2.0-0342521525
Doyle J.,,"Power laws, highly optimized tolerance, and generalized source coding",2000,Physical Review Letters,77,10.1103/PhysRevLett.84.5656,United States,Article,Pasadena,0,Journal,2-s2.0-0033720015
Barrat A.,,On the properties of small-world network models,2000,European Physical Journal B,609,10.1007/s100510050067,France,Article,Saint-Aubin,0,Journal,2-s2.0-0042527883
Hayes B.,,Graph theory in practice: Part II,2000,American Scientist,68,10.1511/2000.2.104,,Article,,0,Journal,2-s2.0-0000836238
Pecora L.,,Synchronization stability in coupled oscillator arrays: Solution for arbitrary configurations,2000,International Journal of Bifurcation and Chaos in Applied Sciences and Engineering,87,10.1142/S0218127400000189,United States,Article,"Washington, D.C.",0,Journal,2-s2.0-0034134720
Gade P.M.,,Synchronous chaos in coupled map lattices with small-world interactions,2000,"Physical Review E - Statistical Physics, Plasmas, Fluids, and Related Interdisciplinary Topics",222,10.1103/PhysRevE.62.6409,Taiwan,Article,Taipei,0,Journal,2-s2.0-0034316686
Carlson J.,,Highly optimized tolerance: Robustness and design in complex systems,2000,Physical Review Letters,228,10.1103/PhysRevLett.84.2529,United States,Article,Santa Barbara,0,Journal,2-s2.0-0000188718
Medina A.,,On the origin of power laws in internet topologies,2000,Computer Communication Review,279,10.1145/505680.505683,United States,Article,Boston,0,Conference Proceeding,2-s2.0-0009536021
Newman M.,,Mean-field solution of the small-world network model,2000,Physical Review Letters,313,10.1103/PhysRevLett.84.3201,United States,Article,Santa Fe,0,Journal,2-s2.0-0034599275
Lago-Fernández L.,,Fast response and temporal coherent oscillations in small-world networks,2000,Physical Review Letters,485,10.1103/PhysRevLett.84.2758,Spain,Article,Madrid,0,Journal,2-s2.0-0034688893
Newman M.E.J.,,Models of the small world,2000,Journal of Statistical Physics,519,10.1023/a:1026485807148,United States,Article,Santa Fe,0,Journal,2-s2.0-0034310033
Moore C.,,Epidemics and percolation in small-world networks,2000,"Physical Review E - Statistical Physics, Plasmas, Fluids, and Related Interdisciplinary Topics",664,10.1103/PhysRevE.61.5678,United States;Mexico,Article,Albuquerque;,0,Journal,2-s2.0-0034186340
Albert R.,,Topology of evolving networks: Local events and universality,2000,Physical Review Letters,988,10.1103/PhysRevLett.85.5234,United States,Article,Notre Dame,0,Journal,2-s2.0-0142077573
Broder A.,,Graph structure in the Web,2000,Computer Networks,1699,10.1016/S1389-1286(00)00083-9,United States,Article,San Mateo,0,Journal,2-s2.0-0033721503
Newman M.E.J.,,Renormalization group analysis of the small-world network model,1999,"Physics Letters, Section A: General, Atomic and Solid State Physics",1023,10.1016/S0375-9601(99)00757-4,United States,Article,Santa Fe,0,Journal,2-s2.0-0347334779
Barabási A.,,Emergence of scaling in random networks,1999,Science,22122,10.1126/science.286.5439.509,United States,Article,Notre Dame,0,Journal,2-s2.0-0038483826
Barabási A.,,Mean-field theory for scale-free random networks,1999,Physica A: Statistical Mechanics and its Applications,1765,10.1016/S0378-4371(99)00291-5,United States,Article,Notre Dame,0,Journal,2-s2.0-18744421488
Huberman B.,,Growth dynamics of the world-wide web,1999,Nature,605,10.1038/43604,United States,Article,Palo Alto,0,Journal,2-s2.0-0344631083
Albert R.,,Diameter of the world-wide web,1999,Nature,3115,10.1038/43601,United States,Article,Notre Dame,0,Journal,2-s2.0-0033539175
Wang X.,,On feedback anticontrol of discrete chaos,1999,International Journal of Bifurcation and Chaos in Applied Sciences and Engineering,103,10.1142/S0218127499000985,China,Article,Nanjing,0,Journal,2-s2.0-0033164097
Carlson J.M.,,Highly optimized tolerance: A mechanism for power laws in designed systems,1999,"Physical Review E - Statistical Physics, Plasmas, Fluids, and Related Interdisciplinary Topics",372,10.1103/PhysRevE.60.1412,United States,Article,Santa Barbara,0,Journal,2-s2.0-0000290649
Newman M.E.J.,,Scaling and percolation in the small-world network model,1999,"Physical Review E - Statistical Physics, Plasmas, Fluids, and Related Interdisciplinary Topics",891,10.1103/PhysRevE.60.7332,Mexico,Article,,0,Journal,2-s2.0-0033487710
Faloutsos M.,,On power-law relationships of the internet topology,1999,Computer Communication Review,3084,10.1145/316194.316229,United States;United States;Canada,Article,Riverside;Pittsburgh;Toronto,0,Journal,2-s2.0-0033204106
Watts D.J.,,Collective dynamics of 'small-world9 networks,1998,Nature,25779,10.1038/30918,United States,Article,Ithaca,0,Journal,2-s2.0-0032482432
Redner S.,,How popular is your paper? An empirical study of the citation distribution,1998,European Physical Journal B,985,10.1007/s100510050359,United States,Article,Boston,0,Journal,2-s2.0-0031622508
Calvert K.,,Modeling internet topology,1997,IEEE Communications Magazine,645,10.1109/35.587723,United States;United States;United States;United States;United States,Article,Cambridge;Murray;Atlanta;Austin;Palo Alto,0,Journal,2-s2.0-0000178416
Wu C.,,Synchronization in an Array of Linearly Coupled Dynamical Systems,1995,IEEE Transactions on Circuits and Systems I: Fundamental Theory and Applications,803,10.1109/81.404047,United States,Article,Berkeley,0,Journal,2-s2.0-0029358909
Molloy M.,,A critical point for random graphs with a given degree sequence,1995,Random Structures &amp; Algorithms,1427,10.1002/rsa.3240060204,United States,Article,Pittsburgh,0,Journal,2-s2.0-84990671447
Floyd S.,,The Synchronization of Periodic Routing Messages,1994,IEEE/ACM Transactions on Networking,127,10.1109/90.298431,United States,Article,Berkeley,0,Journal,2-s2.0-0028408748
Heagy J.F.,,Synchronous chaos in coupled oscillator systems,1994,Physical Review E,442,10.1103/PhysRevE.50.1874,United States,Article,"Washington, D.C.",0,Journal,2-s2.0-0000265121
Chua L.,,A Universal Circuit for Studying and Generating Chaos—Part I: Routes to Chaos,1993,IEEE Transactions on Circuits and Systems I: Fundamental Theory and Applications,374,10.1109/81.246149,United States,Article,Berkeley,0,Journal,2-s2.0-0027681883
Ott E.,,Controlling chaos,1990,Physical Review Letters,5376,10.1103/PhysRevLett.64.1196,United States,Article,College Park,0,Journal,2-s2.0-4243489552
Pecora L.,,Synchronization in chaotic systems,1990,Physical Review Letters,8806,10.1103/PhysRevLett.64.821,United States,Article,"Washington, D.C.",0,Journal,2-s2.0-0343689904
Clark D.,,The design philosophy of the DARPA internet protocols,1988,"Symposium Proceedings on Communications Architectures and Protocols, SIGCOMM 1988",488,10.1145/52324.52336,United States,Conference Paper,Cambridge,0,Conference Proceeding,2-s2.0-84967701397
Borosh I.,,On chagnes of signs in infinite series,1978,Analysis Mathematica,2,10.1007/BF01904853,United States,Article,College Station,0,Journal,2-s2.0-0009922807
