Authors,Author(s) ID,Title,Year,Source tittle,Cited by,DOI,Country,Document Type,City,Access Type,aggregationType,EID
Zhang P.,,Evaluating accuracy of community detection using the relative normalized mutual information,2015,Journal of Statistical Mechanics: Theory and Experiment,26,10.1088/1742-5468/2015/11/P11006,United States;China,Article,Santa Fe;Beijing,0,Journal,2-s2.0-84947998862
Yang J.,,Defining and evaluating network communities based on ground-truth,2015,Knowledge and Information Systems,497,10.1007/s10115-013-0693-z,United States,Article,Palo Alto,0,Journal,2-s2.0-84929145888
Hric D.,,Community detection in networks: Structural communities versus ground truth,2014,"Physical Review E - Statistical, Nonlinear, and Soft Matter Physics",111,10.1103/PhysRevE.90.062805,Finland,Article,Espoo,0,Journal,2-s2.0-84918499937
Romano S.,,Standardized mutual information for clustering comparisons: One step further in adjustment for chance,2014,"31st International Conference on Machine Learning, ICML 2014",20,,Australia,Conference Paper,Parkville,0,Conference Proceeding,2-s2.0-84919792012
Papadopoulos S.,,Community detection in social media performance and application considerations,2012,Data Mining and Knowledge Discovery,318,10.1007/s10618-011-0224-z,Greece;Greece,Article,Thessaloniki;Thessaloniki,0,Journal,2-s2.0-84861734734
Xie J.,,Community detection using a neighborhood strength driven Label Propagation Algorithm,2011,"Proceedings of the 2011 IEEE 1st International Network Science Workshop, NSW 2011",87,10.1109/NSW.2011.6004645,United States,Conference Paper,Troy,0,Conference Proceeding,2-s2.0-80053206492
Orman G.,,The effect of network realism on community detection algorithms,2010,"Proceedings - 2010 International Conference on Advances in Social Network Analysis and Mining, ASONAM 2010",16,10.1109/ASONAM.2010.70,Turkey,Conference Paper,Istanbul,0,Conference Proceeding,2-s2.0-77958167935
Lancichinetti A.,,Characterizing the community structure of complex networks,2010,PLoS ONE,158,10.1371/journal.pone.0011976,Italy,Article,Turin,1,Journal,2-s2.0-77957873035
Vinh N.,,"Information theoretic measures for clusterings comparison: Variants, properties, normalization and correction for chance",2010,Journal of Machine Learning Research,699,,Australia;Australia,Article,Sydney;Sydney,0,Journal,2-s2.0-78649420560
Fortunato S.,,Community detection in graphs,2010,Physics Reports,5864,10.1016/j.physrep.2009.11.002,Italy,Review,Turin,0,Journal,2-s2.0-74049087026
Peel L.,,Estimating network parameters for selecting community detection algorithms,2010,"13th Conference on Information Fusion, Fusion 2010",15,10.1109/icif.2010.5712065,United Kingdom,Conference Paper,Farnborough,0,Conference Proceeding,2-s2.0-79952434266
Rosvall M.,,The map equation,2009,European Physical Journal: Special Topics,295,10.1140/epjst/e2010-01179-1,Sweden,Article,Umea,0,Journal,2-s2.0-77952159452
Lancichinetti A.,,Community detection algorithms: A comparative analysis,2009,"Physical Review E - Statistical, Nonlinear, and Soft Matter Physics",1150,10.1103/PhysRevE.80.056117,Italy;Italy,Article,Turin;Turin,0,Journal,2-s2.0-71849108522
Orman G.,,A comparison of community detection algorithms on artificial networks,2009,Lecture Notes in Computer Science (including subseries Lecture Notes in Artificial Intelligence and Lecture Notes in Bioinformatics),46,10.1007/978-3-642-04747-3_20,Turkey;Turkey,Conference Paper,Kocaeli;Istanbul,0,Book Series,2-s2.0-71049173346
Traag V.A.,,Community detection in networks with positive and negative links,2009,"Physical Review E - Statistical, Nonlinear, and Soft Matter Physics",223,10.1103/PhysRevE.80.036115,Netherlands;Belgium,Article,Amsterdam;Louvain-la-Neuve,0,Journal,2-s2.0-70349930102
Lancichinetti A.,,Benchmarks for testing community detection algorithms on directed and weighted graphs with overlapping communities,2009,"Physical Review E - Statistical, Nonlinear, and Soft Matter Physics",613,10.1103/PhysRevE.80.016118,Italy,Article,Turin,0,Journal,2-s2.0-68949111730
Lancichinetti A.,,Benchmark graphs for testing community detection algorithms,2008,"Physical Review E - Statistical, Nonlinear, and Soft Matter Physics",1641,10.1103/PhysRevE.78.046110,Italy,Article,Turin,0,Journal,2-s2.0-55849088356
Blondel V.D.,,Fast unfolding of communities in large networks,2008,Journal of Statistical Mechanics: Theory and Experiment,7102,10.1088/1742-5468/2008/10/P10008,Belgium,Article,Louvain-la-Neuve,0,Journal,2-s2.0-56349094785
Poncela J.,,Complex cooperative networks from evolutionary preferential attachment,2008,PLoS ONE,143,10.1371/journal.pone.0002449,Spain,Article,Zaragoza,1,Journal,2-s2.0-49449083189
Bagrow J.,,Evaluating local community methods in networks,2008,Journal of Statistical Mechanics: Theory and Experiment,132,10.1088/1742-5468/2008/05/P05001,United States,Article,Potsdam,0,Journal,2-s2.0-44949088447
Raghavan U.N.,,Near linear time algorithm to detect community structures in large-scale networks,2007,"Physical Review E - Statistical, Nonlinear, and Soft Matter Physics",1760,10.1103/PhysRevE.76.036106,United States,Article,University Park,1,Journal,2-s2.0-34548856552
Rosvall M.,,An information-theoretic framework for resolving community structure in complex networks,2007,Proceedings of the National Academy of Sciences of the United States of America,481,10.1073/pnas.0611034104,United States,Article,Seattle,1,Journal,2-s2.0-34250655368
Fortunato S.,,Resolution limit in community detection,2007,Proceedings of the National Academy of Sciences of the United States of America,1725,10.1073/pnas.0605965104,Italy;Germany;United States,Review,Turin;Bielefeld;Bloomington,1,Journal,2-s2.0-33846126275
Danon L.,,The effect of size heterogeneity on community identification in complex networks,2006,Journal of Statistical Mechanics: Theory and Experiment,141,10.1088/1742-5468/2006/11/P11010,Spain,Review,Barcelona,0,Journal,2-s2.0-42749108928
Reichardt J.,,Statistical mechanics of community detection,2006,"Physical Review E - Statistical, Nonlinear, and Soft Matter Physics",924,10.1103/PhysRevE.74.016110,Germany,Article,Bremen,0,Journal,2-s2.0-33746227724
Boccaletti S.,,Complex networks: Structure and dynamics,2006,Physics Reports,6606,10.1016/j.physrep.2005.10.009,Italy,Review,Sesto Fiorentino,0,Journal,2-s2.0-31344474880
Newman M.E.J.,,Finding community structure in networks using the eigenvectors of matrices,2006,"Physical Review E - Statistical, Nonlinear, and Soft Matter Physics",2559,10.1103/PhysRevE.74.036104,United States,Article,Ann Arbor,0,Journal,2-s2.0-33749468596
Danon L.,,Comparing community structure identification,2005,Journal of Statistical Mechanics: Theory and Experiment,1482,10.1088/1742-5468/2005/09/P09008,Spain;Spain,Article,Tarragona;Barcelona,0,Journal,2-s2.0-26244464025
Palla G.,,Uncovering the overlapping community structure of complex networks in nature and society,2005,Nature,3512,10.1038/nature03607,Hungary;Hungary,Article,Budapest;Budapest,0,Journal,2-s2.0-20444504323
Clauset A.,,Finding community structure in very large networks,2004,"Physical Review E - Statistical, Nonlinear, and Soft Matter Physics",3159,10.1103/PhysRevE.70.066111,United States,Article,Albuquerque,0,Journal,2-s2.0-41349117788
Radicchi F.,,Defining and identifying communities in networks,2004,Proceedings of the National Academy of Sciences of the United States of America,1536,10.1073/pnas.0400054101,Italy,Article,Rome,1,Journal,2-s2.0-1542357701
Guimerà R.,,Self-similar community structure in a network of human interactions,2003,"Physical Review E - Statistical, Nonlinear, and Soft Matter Physics",769,,Spain;United States,Article,Tarragona;Evanston,0,Journal,2-s2.0-1842616539
Newman M.,,The structure and function of complex networks,2003,SIAM Review,11537,10.1137/S003614450342480,United States,Review,Ann Arbor,0,Journal,2-s2.0-0038718854
Girvan M.,,Community structure in social and biological networks,2002,Proceedings of the National Academy of Sciences of the United States of America,8662,10.1073/pnas.122653799,United States;United States,Article,Santa Fe;Ithaca,1,Journal,2-s2.0-0037062448
Condon A.,,Algorithms for graph partitioning on the planted partition model,2001,Random Structures and Algorithms,274,10.1002/1098-2418(200103)18:2<116::AID-RSA1001>3.0.CO;2-2,United States;Canada,Article,Madison;Vancouver,0,Journal,2-s2.0-0035580899
Barabási A.,,Emergence of scaling in random networks,1999,Science,22122,10.1126/science.286.5439.509,United States,Article,Notre Dame,0,Journal,2-s2.0-0038483826
Molloy M.,,A critical point for random graphs with a given degree sequence,1995,Random Structures &amp; Algorithms,1427,10.1002/rsa.3240060204,United States,Article,Pittsburgh,0,Journal,2-s2.0-84990671447
Kirkpatrick S.,,Optimization by simulated annealing: Quantitative studies,1984,Journal of Statistical Physics,1266,10.1007/BF01009452,United States,Article,Yorktown Heights,0,Journal,2-s2.0-0343136966
Wu F.,,The Potts model,1982,Reviews of Modern Physics,2607,10.1103/RevModPhys.54.235,United States;Germany,Article,Boston;Jülich,0,Journal,2-s2.0-0042492825
Freeman L.,,Centrality in social networks conceptual clarification,1978/1979,Social Networks,8414,10.1016/0378-8733(78)90021-7,United States,Article,Bethlehem,0,Journal,2-s2.0-33750177351
