Authors,Author(s) ID,Title,Year,Source tittle,Cited by,DOI,Country,Document Type,City,Access Type,aggregationType,EID
Liu J.,,Locating influential nodes via dynamics-sensitive centrality,2016,Scientific Reports,88,10.1038/srep21380,China;China,Article,Shanghai;Shanghai,1,Journal,2-s2.0-84959186343
Pastor-Satorras R.,,Distinct types of eigenvector localization in networks,2016,Scientific Reports,42,10.1038/srep18847,Spain,Article,Barcelona,1,Journal,2-s2.0-84954342141
Radicchi F.,,Breaking of the site-bond percolation universality in networks,2015,Nature Communications,32,10.1038/ncomms10196,United States,Article,Bloomington,1,Journal,2-s2.0-84950114125
Pastor-Satorras R.,,Epidemic processes in complex networks,2015,Reviews of Modern Physics,1119,10.1103/RevModPhys.87.925,Spain,Article,Barcelona,1,Journal,2-s2.0-84942305442
Liu Y.,,Improving the accuracy of the k-shell method by removing redundant links: From a perspective of spreading dynamics,2015,Scientific Reports,66,10.1038/srep13172,China;Austria;China,Article,Chengdu;Vienna;Chengdu,1,Journal,2-s2.0-84939535375
Morone F.,,Influence maximization in complex networks through optimal percolation,2015,Nature,455,10.1038/nature14604,United States,Article,New York,0,Journal,2-s2.0-84938769668
Radicchi F.,,Percolation in real interdependent networks,2015,Nature Physics,106,10.1038/nphys3374,United States,Article,Bloomington,0,Journal,2-s2.0-84934847696
Liu Y.,,Core-like groups result in invalidation of identifying super-spreader by k-shell decomposition,2015,Scientific Reports,109,10.1038/srep09602,China;China,Article,Chengdu;Chengdu,1,Journal,2-s2.0-84929191771
Hamilton K.,,Tight lower bound for percolation threshold on an infinite graph,2014,Physical Review Letters,39,10.1103/PhysRevLett.113.208701,United States,Article,Riverside,0,Journal,2-s2.0-84910650245
Martin T.,,Localization and centrality in networks,2014,"Physical Review E - Statistical, Nonlinear, and Soft Matter Physics",117,10.1103/PhysRevE.90.052808,United States,Article,Ann Arbor,0,Journal,2-s2.0-84912572339
Karrer B.,,Percolation on sparse networks,2014,Physical Review Letters,117,10.1103/PhysRevLett.113.208702,United States,Article,Ann Arbor,0,Journal,2-s2.0-84910612910
De Arruda G.F.,,Role of centrality for the identification of influential spreaders in complex networks,2014,"Physical Review E - Statistical, Nonlinear, and Soft Matter Physics",70,10.1103/PhysRevE.90.032812,Brazil,Article,Sao Carlos,0,Journal,2-s2.0-84907260796
Pei S.,,Searching for superspreaders of information in real-world social media,2014,Scientific Reports,207,10.1038/srep05547,United States;China,Article,New York;Beijing,1,Journal,2-s2.0-84903996783
Ren Z.,,Iterative resource allocation for ranking spreaders in complex networks,2014,EPL,59,10.1209/0295-5075/106/48005,Switzerland;China,Article,Fribourg;Shanghai,0,Journal,2-s2.0-84901786491
Krzakala F.,,Spectral redemption in clustering sparse networks,2013,Proceedings of the National Academy of Sciences of the United States of America,280,10.1073/pnas.1312486110,France;France,Article,Paris;Paris,1,Journal,2-s2.0-84891363833
Pei S.,,Spreading dynamics in complex networks,2013,Journal of Statistical Mechanics: Theory and Experiment,146,10.1088/1742-5468/2013/12/P12002,United States;China,Article,New York;Beijing,0,Journal,2-s2.0-84891274026
Liu J.,,Ranking the spreading influence in complex networks,2013,Physica A: Statistical Mechanics and its Applications,171,10.1016/j.physa.2013.04.037,China,Article,Shanghai,0,Journal,2-s2.0-84879684235
Altarelli F.,,Optimizing spread dynamics on graphs by message passing,2013,Journal of Statistical Mechanics: Theory and Experiment,48,10.1088/1742-5468/2013/09/P09011,Italy;Italy,Article,Turin;Torino,0,Journal,2-s2.0-84885091186
Bauer F.,,Identifying influential spreaders and efficiently estimating infection numbers in epidemic models: A walk counting approach,2012,EPL,64,10.1209/0295-5075/99/68007,Germany,Article,Leipzig,0,Journal,2-s2.0-84867497055
Da Silva R.,,Predicting epidemic outbreak from individual features of the spreaders,2012,Journal of Statistical Mechanics: Theory and Experiment,18,10.1088/1742-5468/2012/07/P07005,Brazil,Article,Sao Paulo,0,Journal,2-s2.0-84863917864
Klemm K.,,A measure of individual role in collective dynamics,2012,Scientific Reports,117,10.1038/srep00292,Spain;Germany,Article,Palma;Leipzig,1,Journal,2-s2.0-84859773717
Borge-Holthoefer J.,,Absence of influential spreaders in rumor dynamics,2012,"Physical Review E - Statistical, Nonlinear, and Soft Matter Physics",151,10.1103/PhysRevE.85.026116,Spain,Article,Zaragoza,0,Journal,2-s2.0-84857764370
Chen D.,,Identifying influential nodes in complex networks,2012,Physica A: Statistical Mechanics and its Applications,594,10.1016/j.physa.2011.09.017,China,Article,Chengdu,0,Journal,2-s2.0-84655175098
Ratkiewicz J.,,Truthy: Mapping the spread of astroturf in microblog streams,2011,"Proceedings of the 20th International Conference Companion on World Wide Web, WWW 2011",248,10.1145/1963192.1963301,United States,Conference Paper,Bloomington,0,Conference Proceeding,2-s2.0-79955135282
González-Bailón S.,,The dynamics of protest recruitment through an online network,2011,Scientific Reports,311,10.1038/srep00197,United Kingdom,Article,Oxford,1,Journal,2-s2.0-84859770295
Newman M.,,Networks: An Introduction,2010,Networks: An Introduction,6212,10.1093/acprof:oso/9780199206650.001.0001,United States,Book,Ann Arbor,0,Book,2-s2.0-77954826067
Kitsak M.,,Identification of influential spreaders in complex networks,2010,Nature Physics,1473,10.1038/nphys1746,United States;United States,Article,San Diego;Boston,1,Journal,2-s2.0-78149283685
Bakshy E.,,Social influence and the diffusion of user-created content,2009,Proceedings of the ACM Conference on Electronic Commerce,189,10.1145/1566374.1566421,United States,Conference Paper,Ann Arbor,0,Conference Proceeding,2-s2.0-77950563730
Colizza V.,,Epidemic modeling in metapopulation systems with heterogeneous coupling pattern: Theory and simulations,2008,Journal of Theoretical Biology,216,10.1016/j.jtbi.2007.11.028,Italy,Article,Turin,0,Journal,2-s2.0-40849087804
Kenah E.,,Second look at the spread of epidemics on networks,2007,"Physical Review E - Statistical, Nonlinear, and Soft Matter Physics",143,10.1103/PhysRevE.76.036113,United States,Article,Boston,0,Journal,2-s2.0-34848857029
Miller J.C.,,Epidemic size and probability in populations with heterogeneous infectivity and susceptibility,2007,"Physical Review E - Statistical, Nonlinear, and Soft Matter Physics",99,10.1103/PhysRevE.76.010101,United States,Article,Los Alamos,0,Journal,2-s2.0-34547378068
Leskovec J.,,Graph evolution: Densification and shrinking diameters,2007,ACM Transactions on Knowledge Discovery from Data,1331,10.1145/1217299.1217301,United States,Article,Pittsburgh,0,Journal,2-s2.0-34248205060
Meyers L.,,Predicting epidemics on directed contact networks,2006,Journal of Theoretical Biology,174,10.1016/j.jtbi.2005.10.004,United States;United States,Article,Santa Fe;Austin,0,Journal,2-s2.0-33646271598
Catanzaro M.,,Generation of uncorrelated random scale-free networks 027103,2005,"Physical Review E - Statistical, Nonlinear, and Soft Matter Physics",470,10.1103/PhysRevE.71.027103,Spain,Article,Barcelona,0,Journal,2-s2.0-34548491989
Kempe D.,,Maximizing the spread of influence through a social network,2003,Proceedings of the ACM SIGKDD International Conference on Knowledge Discovery and Data Mining,4461,10.1145/956750.956769,United States,Conference Paper,Ithaca,0,Conference Proceeding,2-s2.0-33747172362
Albert R.,,Statistical mechanics of complex networks,2002,Reviews of Modern Physics,13645,10.1103/RevModPhys.74.47,United States;United States,Article,Minneapolis;Notre Dame,0,Journal,2-s2.0-0036013593
Newman M.E.J.,,Spread of epidemic disease on networks,2002,"Physical Review E - Statistical Physics, Plasmas, Fluids, and Related Interdisciplinary Topics",1841,10.1103/PhysRevE.66.016128,United States;United States,Article,Santa Fe;Ann Arbor,1,Journal,2-s2.0-41349106348
Grenfell B.,,(Meta) population dynamics of infectious diseases,1997,Trends in Ecology and Evolution,282,10.1016/S0169-5347(97)01174-9,United Kingdom,Review,Cambridge,0,Journal,2-s2.0-0031418824
Grassberger P.,,On the critical behavior of the general epidemic process and dynamical percolation,1983,Mathematical Biosciences,422,10.1016/0025-5564(82)90036-0,Germany;Israel,Article,Wuppertal;Rehovot,0,Journal,2-s2.0-0020737985
Seidman S.,,Network structure and minimum degree,1983,Social Networks,901,10.1016/0378-8733(83)90028-X,United States,Article,Fairfax,0,Journal,2-s2.0-0000488788
Bonacich P.,,Factoring and weighting approaches to status scores and clique identification,1972,The Journal of Mathematical Sociology,1364,10.1080/0022250X.1972.9989806,United States,Article,Los Angeles,0,Journal,2-s2.0-0001316531
