Authors,Author(s) ID,Title,Year,Source tittle,Cited by,DOI,Country,Document Type,City,Access Type,aggregationType,EID
Wu Z.,,Numerical evaluation of the upper critical dimension of percolation in scale-free networks,2007,"Physical Review E - Statistical, Nonlinear, and Soft Matter Physics",23,10.1103/PhysRevE.75.066110,United States,Article,Boston,0,Journal,2-s2.0-34547265672
Braunstein L.,,Optimal path and minimal spanning trees in random weighted networks,2007,International Journal of Bifurcation and Chaos,49,10.1142/S0218127407018361,Argentina,Article,Mar de Plata,0,Journal,2-s2.0-34548490765
Meyers L.,,Contact network epidemiology: Bond percolation applied to infectious disease prediction and control,2007,Bulletin of the American Mathematical Society,195,10.1090/S0273-0979-06-01148-7,United States,Article,Austin,1,Journal,2-s2.0-34547299719
Serrano M.A.,,Percolation and epidemic thresholds in clustered networks,2006,Physical Review Letters,136,10.1103/PhysRevLett.97.088701,United States,Article,Bloomington,0,Journal,2-s2.0-33747656394
Newman M.,,Modularity and community structure in networks,2006,Proceedings of the National Academy of Sciences of the United States of America,5550,10.1073/pnas.0601602103,United States,Article,Ann Arbor,1,Journal,2-s2.0-33745012299
Vojta T.,,"Rare region effects at classical, quantum and nonequilibrium phase transitions",2006,Journal of Physics A: Mathematical and General,264,10.1088/0305-4470/39/22/R01,United States,Article,Rolla,0,Journal,2-s2.0-33646893732
Gross T.,,Epidemic dynamics on an adaptive network,2006,Physical Review Letters,535,10.1103/PhysRevLett.96.208701,Germany,Article,Potsdam,1,Journal,2-s2.0-33646855384
Wu Z.,,Transport in weighted networks: Partition into superhighways and roads,2006,Physical Review Letters,101,10.1103/PhysRevLett.96.148702,United States,Article,Boston,0,Journal,2-s2.0-33645789735
Liu Z.,,Epidemic spreading in community networks,2005,Europhysics Letters,176,10.1209/epl/i2004-10550-5,China;Hong Kong,Article,Shanghai;,0,Journal,2-s2.0-27444434464
Newman M.,,Threshold effects for two pathogens spreading on a network,2005,Physical Review Letters,158,10.1103/PhysRevLett.95.108701,United States;United States,Article,Santa Fe;Ann Arbor,0,Journal,2-s2.0-27144516752
Tomé T.,,Stationary distribution of finite-size systems with absorbing states,2005,"Physical Review E - Statistical, Nonlinear, and Soft Matter Physics",13,10.1103/PhysRevE.72.026130,Brazil,Article,Sao Paulo,0,Journal,2-s2.0-27244440595
Barthélemy M.,,Dynamical patterns of epidemic outbreaks in complex heterogeneous networks,2005,Journal of Theoretical Biology,301,10.1016/j.jtbi.2005.01.011,France,Article,Bruyeres-les-Chatel,0,Journal,2-s2.0-18044384806
Barabási A.,,The origin of bursts and heavy tails in human dynamics,2005,Nature,1453,10.1038/nature03459,United States,Article,Notre Dame,0,Journal,2-s2.0-18744406314
Yan G.,,Epidemic spread in weighted scale-free networks,2005,Chinese Physics Letters,188,10.1088/0256-307X/22/2/068,China,Article,Hefei,0,Journal,2-s2.0-21144433206
Song C.,,Self-similarity of complex networks,2005,Nature,866,10.1038/nature03248,United States,Article,New York,0,Journal,2-s2.0-13444263410
Meyers L.A.,,Network theory and SARS: Predicting outbreak diversity,2005,Journal of Theoretical Biology,402,10.1016/j.jtbi.2004.07.026,United States;United States,Article,Santa Fe;Austin,0,Journal,2-s2.0-6344287794
Dodds P.S.,,Universal behavior in a generalized model of contagion,2004,Physical Review Letters,320,10.1103/PhysRevLett.92.218701,United States,Article,New York,0,Journal,2-s2.0-3142519922
Barthélemy M.,,Velocity and hierarchical spread of epidemic outbreaks in scale-free networks,2004,Physical review letters,491,,France,Article,Bruyeres-les-Chatel,0,Journal,2-s2.0-2942573513
Clauset A.,,Finding community structure in very large networks,2004,"Physical Review E - Statistical Physics, Plasmas, Fluids, and Related Interdisciplinary Topics",617,10.1103/PhysRevE.70.066111,United States,Article,Albuquerque,0,Journal,2-s2.0-85028479137
Chung F.,,Spectra of random graphs with given expected degrees,2003,Proceedings of the National Academy of Sciences of the United States of America,313,10.1073/pnas.0937490100,United States,Article,San Diego,1,Journal,2-s2.0-0038652158
Moreno Y.,,Epidemic incidence in correlated complex networks,2003,"Physical Review E - Statistical Physics, Plasmas, Fluids, and Related Interdisciplinary Topics",11,10.1103/PhysRevE.68.035103,Spain,Article,Zaragoza,0,Journal,2-s2.0-84891273997
Braunstein L.,,Optimal paths in disordered complex networks,2003,Physical Review Letters,146,10.1103/PhysRevLett.91.168701,United States;Argentina,Article,Boston;Mar de Plata,0,Journal,2-s2.0-17344391583
Boguñá M.,,Absence of Epidemic Threshold in Scale-Free Networks with Degree Correlations,2003,Physical Review Letters,407,10.1103/PhysRevLett.90.028701,Spain,Article,Barcelona,0,Journal,2-s2.0-0037449781
Cohen R.,,Efficient immunization strategies for computer networks and populations,2003,Physical Review Letters,694,10.1103/PhysRevLett.91.247901,Israel,Article,Ramat Gan,0,Journal,2-s2.0-0942268259
Newman M.,,The structure and function of complex networks,2003,SIAM Review,11537,10.1137/S003614450342480,United States,Review,Ann Arbor,0,Journal,2-s2.0-0038718854
Milo R.,,Network motifs: Simple building blocks of complex networks,2002,Science,4255,10.1126/science.298.5594.824,Israel,Article,Rehovot,0,Journal,2-s2.0-0037174670
Eames K.,,Modeling dynamic and network heterogeneities in the spread of sexually transmitted diseases,2002,Proceedings of the National Academy of Sciences of the United States of America,305,10.1073/pnas.202244299,,Article,,1,Journal,2-s2.0-0036790984
Cohen R.,,Percolation critical exponents in scale-free networks,2002,"Physical Review E - Statistical Physics, Plasmas, Fluids, and Related Interdisciplinary Topics",191,10.1103/PhysRevE.66.036113,Israel,Article,Ramat Gan,0,Journal,2-s2.0-41349120185
Albert R.,,Statistical mechanics of complex networks,2002,Reviews of Modern Physics,13645,10.1103/RevModPhys.74.47,United States;United States,Article,Minneapolis;Notre Dame,0,Journal,2-s2.0-0036013593
Newman M.E.J.,,Spread of epidemic disease on networks,2002,"Physical Review E - Statistical Physics, Plasmas, Fluids, and Related Interdisciplinary Topics",1841,10.1103/PhysRevE.66.016128,United States;United States,Article,Santa Fe;Ann Arbor,1,Journal,2-s2.0-41349106348
Moreno Y.,,Epidemic outbreaks in complex heterogeneous networks,2002,European Physical Journal B,712,10.1007/s10051-002-8996-y,Italy,Article,Trieste,0,Journal,2-s2.0-0000494582
Pastor-Satorras R.,,Epidemic dynamics in finite size scale-free networks,2002,"Physical Review E - Statistical Physics, Plasmas, Fluids, and Related Interdisciplinary Topics",522,10.1103/PhysRevE.65.035108,Spain,Article,Barcelona,0,Journal,2-s2.0-41349112686
Pastor-Satorras R.,,Immunization of complex networks,2002,"Physical Review E - Statistical Physics, Plasmas, Fluids, and Related Interdisciplinary Topics",799,10.1103/PhysRevE.65.036104,Spain,Article,Barcelona,0,Journal,2-s2.0-41349106738
Newman M.E.J.,,Clustering and preferential attachment in growing networks,2001,"Physical Review E - Statistical, Nonlinear, and Soft Matter Physics",964,,United States,Article,Santa Fe,0,Journal,2-s2.0-0035420724
Newman M.E.J.,,Scientific collaboration networks. I. Network construction and fundamental results,2001,"Physical Review E - Statistical, Nonlinear, and Soft Matter Physics",1361,,United States,Article,Santa Fe,0,Journal,2-s2.0-0035395881
Newman M.E.J.,,"Scientific collaboration networks. II. Shortest paths, weighted networks, and centrality",2001,"Physical Review E - Statistical, Nonlinear, and Soft Matter Physics",1499,,United States,Article,Santa Fe,0,Journal,2-s2.0-0042635247
Pastor-Satorras R.,,Epidemic spreading in scale-free networks,2001,Physical Review Letters,3738,10.1103/PhysRevLett.86.3200,Spain,Article,Barcelona,0,Journal,2-s2.0-0035794256
Cohen R.,,Resilience of the Internet to random breakdowns,2000,Physical Review Letters,1644,10.1103/PhysRevLett.85.4626,Israel,Article,Ramat Gan,0,Journal,2-s2.0-0034323311
Grassberger P.,,On the critical behavior of the general epidemic process and dynamical percolation,1983,Mathematical Biosciences,422,10.1016/0025-5564(82)90036-0,Germany;Israel,Article,Wuppertal;Rehovot,0,Journal,2-s2.0-0020737985
