Authors,Author(s) ID,Title,Year,Source tittle,Cited by,DOI,Country,Document Type,City,Access Type,aggregationType,EID
Barabási A.,,Emergence of scaling in random networks,1999,Science,22122,10.1126/science.286.5439.509,United States,Article,Notre Dame,0,Journal,2-s2.0-0038483826
Albert R.,,Diameter of the world-wide web,1999,Nature,3115,10.1038/43601,United States,Article,Notre Dame,0,Journal,2-s2.0-0033539175
Abello J.,,A functional approach to external graph algorithms,1998,Lecture Notes in Computer Science (including subseries Lecture Notes in Artificial Intelligence and Lecture Notes in Bioinformatics),66,10.1007/3-540-68530-8_28,United States,Conference Paper,Florham Park,0,Book Series,2-s2.0-84896746147
Molloy M.,,The Size of the Giant Component of a Random Graph with a Given Degree Sequence,1998,Combinatorics Probability and Computing,533,10.1017/S0963548398003526,Canada,Article,Toronto,0,Journal,2-s2.0-0032286776
Molloy M.,,A critical point for random graphs with a given degree sequence,1995,Random Structures &amp; Algorithms,1427,10.1002/rsa.3240060204,United States,Article,Pittsburgh,0,Journal,2-s2.0-84990671447
Wormald N.,,The asymptotic connectivity of labelled regular graphs,1981,"Journal of Combinatorial Theory, Series B",75,10.1016/S0095-8956(81)80021-4,United States,Article,Baton Rouge,1,Journal,2-s2.0-58149404605
Erdős P.,,On the strength of connectedness of a random graph,1964,Acta Mathematica Academiae Scientiarum Hungaricae,409,10.1007/BF02066689,,Article,,0,Journal,2-s2.0-0000207615
