Authors,Author(s) ID,Title,Year,Source tittle,Cited by,DOI,Country,Document Type,City,Access Type,aggregationType,EID
Cohen R.,,Breakdown of the internet under intentional attack,2001,Physical Review Letters,1004,10.1103/PhysRevLett.86.3682,Israel,Article,Ramat Gan,0,Journal,2-s2.0-0035896667
Pastor-Satorras R.,,Epidemic spreading in scale-free networks,2001,Physical Review Letters,3738,10.1103/PhysRevLett.86.3200,Spain,Article,Barcelona,0,Journal,2-s2.0-0035794256
Kuperman M.,,Small world effect in an epidemiological model,2001,Physical Review Letters,435,10.1103/PhysRevLett.86.2909,Argentina,Article,San Carlos de Bariloche,0,Journal,2-s2.0-4243756311
Strogatz S.,,Exploring complex networks,2001,Nature,5562,10.1038/35065725,United States,Review,Ithaca,1,Journal,2-s2.0-0035826155
Polletta F.,,Collective identity and social movements,2001,Annual Review of Sociology,1161,10.1146/annurev.soc.27.1.283,United States,Article,New York,0,Book Series,2-s2.0-0035647297
Pastor-Satorras R.,,Epidemic dynamics and endemic states in complex networks,2001,"Physical Review E - Statistical Physics, Plasmas, Fluids, and Related Interdisciplinary Topics",1153,10.1103/PhysRevE.63.066117,Spain,Article,Barcelona,0,Journal,2-s2.0-0035363452
Domingos P.,,Mining the network value of customers,2001,Proceedings of the Seventh ACM SIGKDD International Conference on Knowledge Discovery and Data Mining,1681,10.1145/502512.502525,United States,Conference Paper,Seattle,0,Conference Proceeding,2-s2.0-0035789667
Brandes U.,,A faster algorithm for betweenness centrality,2001,Journal of Mathematical Sociology,2218,10.1080/0022250X.2001.9990249,Germany,Article,Konstanz,0,Journal,2-s2.0-0035648637
Albert R.,,Error and attack tolerance of complex networks,2000,Nature,5597,10.1038/35019019,United States,Article,Notre Dame,0,Journal,2-s2.0-0034721164
Moore C.,,Epidemics and percolation in small-world networks,2000,"Physical Review E - Statistical Physics, Plasmas, Fluids, and Related Interdisciplinary Topics",664,10.1103/PhysRevE.61.5678,United States;Mexico,Article,Albuquerque;,0,Journal,2-s2.0-0034186340
Hethcote H.,,Mathematics of infectious diseases,2000,SIAM Review,2759,10.1137/S0036144500371907,United States,Article,Iowa City,0,Journal,2-s2.0-0034486891
Barabási A.,,Emergence of scaling in random networks,1999,Science,22122,10.1126/science.286.5439.509,United States,Article,Notre Dame,0,Journal,2-s2.0-0038483826
Watts D.J.,,Collective dynamics of 'small-world9 networks,1998,Nature,25779,10.1038/30918,United States,Article,Ithaca,0,Journal,2-s2.0-0032482432
Strang D.,,Diffusion in organizations and social movements: From Hybrid Corn to Poison Pills,1998,Annual Review of Sociology,892,10.1146/annurev.soc.24.1.265,United States,Article,Ithaca,0,Book Series,2-s2.0-0032347320
Page L.,,The anatomy of a large-scale hypertextual Web search engine,1998,Computer Networks,7260,,United States,Article,Palo Alto,0,Journal,2-s2.0-0038589165
Glaeser E.,,Crime and social interactions,1996,Quarterly Journal of Economics,743,10.2307/2946686,,Article,,0,Journal,2-s2.0-0008848582
Blume L.,,The Statistical Mechanics of Strategic Interaction,1993,Games and Economic Behavior,699,10.1006/game.1993.1023,United States,Article,Ithaca,0,Journal,2-s2.0-43949168352
Glance N.,,The outbreak of cooperation,1993,The Journal of Mathematical Sociology,78,10.1080/0022250X.1993.9990112,United States,Article,Palo Alto,0,Journal,2-s2.0-0000151587
Bikhchandani S.,,"A theory of fads, fashion, custom, and cultural change as informational cascades",1992,Journal of Political Economy,2851,10.1086/261849,United States,Article,Los Angeles,0,Journal,2-s2.0-27744568768
Granovetter M.,,Threshold models of diffusion and collective behavior,1983,The Journal of Mathematical Sociology,208,10.1080/0022250X.1983.9989941,United States,Article,Stony Brook,0,Journal,2-s2.0-84948874363
Grassberger P.,,On the critical behavior of the general epidemic process and dynamical percolation,1983,Mathematical Biosciences,422,10.1016/0025-5564(82)90036-0,Germany;Israel,Article,Wuppertal;Rehovot,0,Journal,2-s2.0-0020737985
Seidman S.,,Network structure and minimum degree,1983,Social Networks,901,10.1016/0378-8733(83)90028-X,United States,Article,Fairfax,0,Journal,2-s2.0-0000488788
Nemhauser G.,,An analysis of approximations for maximizing submodular set functions-I,1978,Mathematical Programming,2096,10.1007/BF01588971,Belgium,Article,Louvain-la-Neuve,0,Journal,2-s2.0-0000095809
Freeman L.,,Centrality in social networks conceptual clarification,1978/1979,Social Networks,8414,10.1016/0378-8733(78)90021-7,United States,Article,Bethlehem,0,Journal,2-s2.0-33750177351
Johnson D.,,Efficient Algorithms for Shortest Paths in Sparse Networks,1977,Journal of the ACM (JACM),585,10.1145/321992.321993,United States,Article,University Park,0,Journal,2-s2.0-84976789814
Schelling T.,,"Hockey Helmets, Concealed Weapons, and Daylight Saving: A Study of Binary Choices With Externalities",1973,Journal of Conflict Resolution,267,10.1177/002200277301700302,United States,Article,Cambridge,0,Journal,2-s2.0-84965432357
Bonacich P.,,Factoring and weighting approaches to status scores and clique identification,1972,The Journal of Mathematical Sociology,1364,10.1080/0022250X.1972.9989806,United States,Article,Los Angeles,0,Journal,2-s2.0-0001316531
Brush S.,,History of the Lenz-Ising model,1967,Reviews of Modern Physics,275,10.1103/RevModPhys.39.883,United States,Article,Cambridge,0,Journal,2-s2.0-36049055166
Sabidussi G.,,The centrality index of a graph,1966,Psychometrika,1175,10.1007/BF02289527,Canada,Article,Hamilton,0,Journal,2-s2.0-0013987194
Daley D.,,Epidemics and Rumours [49],1964,Nature,312,10.1038/2041118a0,United Kingdom,Letter,Cambridge,0,Journal,2-s2.0-4143136066
Floyd R.,,Algorithm 97: Shortest path,1962,Communications of the ACM,2153,10.1145/367766.368168,United States,Article,Chicago,0,Journal,2-s2.0-84945709831
