Authors,Author(s) ID,Title,Year,Source tittle,Cited by,DOI,Country,Document Type,City,Access Type,aggregationType,EID
Lakhina A.,,Sampling biases in IP topology measurements,2003,Proceedings - IEEE INFOCOM,198,,United States,Conference Paper,Boston,0,Conference Proceeding,2-s2.0-0042475168
Chen Q.,,The origin of power laws in Internet topologies revisited,2002,Proceedings - IEEE INFOCOM,282,10.1109/INFCOM.2002.1019306,United States,Article,Ann Arbor,0,Journal,2-s2.0-0036346132
Broido A.,,Internet topology: Connectivity of IP graphs,2001,Proceedings of SPIE - The International Society for Optical Engineering,85,10.1117/12.434393,United States,Conference Paper,San Diego,0,Conference Proceeding,2-s2.0-0035171853
Barford P.,,On the Marginal Utility of Network Topology Measurements,2001,Proceedings of the ACM SIGCOMM Internet Measurement Workshop,116,10.1145/505203.505204,United States,Conference Paper,Madison,0,Conference Proceeding,2-s2.0-1542330215
Dharsee M.,,MoBiDiCK: A tool for distributed computing on the Internet,2000,"Proceedings of the Heterogeneous Computing Workshop, HCW",3,,Canada,Article,Toronto,0,Conference Proceeding,2-s2.0-0033887187
Govindan R.,,Heuristics for Internet map discovery,2000,Proceedings - IEEE INFOCOM,481,,United States,Conference Paper,Marina del Rey,0,Conference Proceeding,2-s2.0-0033892689
Burch H.,,Mapping the Internet,1999,Computer,110,10.1109/2.755008,United Kingdom,Article,Sudbury,0,Journal,2-s2.0-84992267980
