Authors,Author(s) ID,Title,Year,Source tittle,Cited by,DOI,Country,Document Type,City,Access Type,aggregationType,EID
Parshani R.,,Epidemic threshold for the susceptible-infectious-susceptible model on random networks,2010,Physical Review Letters,127,10.1103/PhysRevLett.104.258701,Israel,Article,Ramat Gan,0,Journal,2-s2.0-77953934901
Durrett R.,,Some features of the spread of epidemics and information on a random graph,2010,Proceedings of the National Academy of Sciences of the United States of America,91,10.1073/pnas.0914402107,United States,Article,Ithaca,1,Journal,2-s2.0-77949647264
Berchenko Y.,,Emergence and size of the giant component in clustered random graphs with a given degree distribution,2009,Physical Review Letters,16,10.1103/PhysRevLett.102.138701,Israel,Article,Ramat Gan,0,Journal,2-s2.0-63849226106
Van Mieghem P.,,Virus spread in networks,2009,IEEE/ACM Transactions on Networking,524,10.1109/TNET.2008.925623,Netherlands,Article,Delft,0,Journal,2-s2.0-61449222889
Peyrard N.,,Long-range correlations improve understanding of the influence of network structure on contact dynamics,2008,Theoretical Population Biology,9,10.1016/j.tpb.2007.12.006,France,Article,Castanet-Tolosan,0,Journal,2-s2.0-41249083355
Chakrabarti D.,,Epidemic thresholds in real networks,2008,ACM Transactions on Information and System Security,410,10.1145/1284680.1284681,United States,Article,Pittsburgh,0,Journal,2-s2.0-39349087037
Kenah E.,,Second look at the spread of epidemics on networks,2007,"Physical Review E - Statistical, Nonlinear, and Soft Matter Physics",143,10.1103/PhysRevE.76.036113,United States,Article,Boston,0,Journal,2-s2.0-34848857029
Aparicio J.,,Building epidemiological models from R<inf>0</inf>: An implicit treatment of transmission in networks,2007,Proceedings of the Royal Society B: Biological Sciences,53,10.1098/rspb.2006.0057,Puerto Rico,Article,San Juan,0,Journal,2-s2.0-34447339425
Peyrard N.,,Cluster variation approximations for a contact process living on a graph,2005,Physica A: Statistical Mechanics and its Applications,4,10.1016/j.physa.2005.04.017,France,Article,Avignon,0,Journal,2-s2.0-26444618518
Ganesh A.,,The effect of network topology on the spread of epidemics,2005,Proceedings - IEEE INFOCOM,478,10.1109/INFCOM.2005.1498374,United Kingdom,Conference Paper,Cambridge,0,Conference Proceeding,2-s2.0-25844439630
Madar N.,,Immunization and epidemic dynamics in complex networks,2004,European Physical Journal B,198,10.1140/epjb/e2004-00119-8,Israel,Conference Paper,Ramat Gan,0,Journal,2-s2.0-2942672808
Chung F.,,Spectra of random graphs with given expected degrees,2003,Proceedings of the National Academy of Sciences of the United States of America,313,10.1073/pnas.0937490100,United States,Article,San Diego,1,Journal,2-s2.0-0038652158
Cohen R.,,Efficient immunization strategies for computer networks and populations,2003,Physical Review Letters,694,10.1103/PhysRevLett.91.247901,Israel,Article,Ramat Gan,0,Journal,2-s2.0-0942268259
Cohen R.,,Percolation critical exponents in scale-free networks,2002,"Physical Review E - Statistical Physics, Plasmas, Fluids, and Related Interdisciplinary Topics",191,10.1103/PhysRevE.66.036113,Israel,Article,Ramat Gan,0,Journal,2-s2.0-41349120185
Albert R.,,Statistical mechanics of complex networks,2002,Reviews of Modern Physics,13645,10.1103/RevModPhys.74.47,United States;United States,Article,Minneapolis;Notre Dame,0,Journal,2-s2.0-0036013593
Newman M.E.J.,,Spread of epidemic disease on networks,2002,"Physical Review E - Statistical Physics, Plasmas, Fluids, and Related Interdisciplinary Topics",1841,10.1103/PhysRevE.66.016128,United States;United States,Article,Santa Fe;Ann Arbor,1,Journal,2-s2.0-41349106348
Pastor-Satorras R.,,Immunization of complex networks,2002,"Physical Review E - Statistical Physics, Plasmas, Fluids, and Related Interdisciplinary Topics",799,10.1103/PhysRevE.65.036104,Spain,Article,Barcelona,0,Journal,2-s2.0-41349106738
Lloyd A.,,How viruses spread among computers and people,2001,Science,473,10.1126/science.1061076,United States,Short Survey,Princeton,0,Journal,2-s2.0-0035907006
Pastor-Satorras R.,,Epidemic spreading in scale-free networks,2001,Physical Review Letters,3738,10.1103/PhysRevLett.86.3200,Spain,Article,Barcelona,0,Journal,2-s2.0-0035794256
May R.M.,,Infection dynamics on scale-free networks,2001,"Physical Review E - Statistical, Nonlinear, and Soft Matter Physics",552,10.1103/PhysRevE.64.066112,United Kingdom,Article,Oxford,0,Journal,2-s2.0-0035689341
Iwan J.,,Temporally disordered bond percolation on the directed square lattice,1996,Physical Review Letters,52,10.1103/PhysRevLett.77.4988,Australia,Article,Parkville,0,Journal,2-s2.0-4243647448
Kephart J.,,Directed-graph epidemiological models of computer viruses,1991,Proceedings of the Symposium on Security and Privacy,519,,United States,Conference Paper,Yorktown Heights,0,Conference Proceeding,2-s2.0-0026156688
May R.,,The transmission dynamics of human immunodeficiency virus (HIV).,1988,"Philosophical transactions of the Royal Society of London. Series B, Biological sciences",174,10.1098/rstb.1988.0108,United States,Review,Princeton,0,Journal,2-s2.0-0024300994
Essam J.W.,,Analysis of extended series for bond percolation on the directed square lattice,1986,Physical Review B,87,10.1103/PhysRevB.33.1982,United Kingdom,Article,Egham,0,Journal,2-s2.0-0001370981
May R.,,Spatial heterogeneity and the design of immunization programs,1984,Mathematical Biosciences,158,10.1016/0025-5564(84)90063-4,United States,Article,Princeton,0,Journal,2-s2.0-0021529194
Füredi Z.,,The eigenvalues of random symmetric matrices,1981,Combinatorica,344,10.1007/BF02579329,Hungary,Article,Budapest,0,Journal,2-s2.0-51249182622
Domany E.,,Directed percolation in two dimensions: Numerical analysis and an exact solution,1981,Physical Review Letters,59,10.1103/PhysRevLett.47.5,Israel,Article,Rehovot,0,Journal,2-s2.0-0038931762
Gillespie D.,,Exact stochastic simulation of coupled chemical reactions,1977,Journal of Physical Chemistry,6199,10.1021/j100540a008,United States,Conference Paper,China Lake,0,Journal,2-s2.0-33645429016
