Authors,Author(s) ID,Title,Year,Source tittle,Cited by,DOI,Country,Document Type,City,Access Type,aggregationType,EID
Woolley-Meza O.,,Complexity in human transportation networks: A comparative analysis of worldwide air transportation and global cargo-ship movements,2011,European Physical Journal B,50,10.1140/epjb/e2011-20208-9,United States,Conference Paper,Evanston,0,Journal,2-s2.0-84855359769
Radicchi F.,,Information filtering in complex weighted networks,2011,"Physical Review E - Statistical, Nonlinear, and Soft Matter Physics",40,10.1103/PhysRevE.83.046101,United States,Article,Evanston,0,Journal,2-s2.0-79961090405
Barthélemy M.,,Spatial networks,2011,Physics Reports,1176,10.1016/j.physrep.2010.11.002,France;France,Review,Paris;Gif-sur-Yvette,0,Journal,2-s2.0-79451475362
Thiemann C.,,The structure of borders in a small world,2010,PLoS ONE,106,10.1371/journal.pone.0015422,Germany;United States,Article,Gottingen;Evanston,1,Journal,2-s2.0-78649529039
Newman M.,,Networks: An Introduction,2010,Networks: An Introduction,6212,10.1093/acprof:oso/9780199206650.001.0001,United States,Book,Ann Arbor,0,Book,2-s2.0-77954826067
Kaluza P.,,The complex network of global cargo ship movements,2010,Journal of the Royal Society Interface,494,10.1098/rsif.2009.0495,Germany,Review,Oldenburg,1,Journal,2-s2.0-77954463662
Brockmann D.,,Following the money,2010,Physics World,15,10.1088/2058-7058/23/02/37,United States,Article,Evanston,0,Trade Journal,2-s2.0-77952977873
Caldarelli G.,,Scale-Free Networks: Complex Webs in Nature and Technology,2010,Scale-Free Networks: Complex Webs in Nature and Technology,390,10.1093/acprof:oso/9780199211517.001.0001,Italy,Book,Rome,0,Book,2-s2.0-84921882515
Clauset A.,,Power-law distributions in empirical data,2009,SIAM Review,4486,10.1137/070710111,United States;United States,Review,Albuquerque;Santa Fe,0,Journal,2-s2.0-65549085067
Vespignani A.,,Predicting the behavior of techno-social systems,2009,Science,322,10.1126/science.1171990,Italy;United States,Review,Turin;Bloomington,0,Journal,2-s2.0-67749145794
Serrano M.A.,,Extracting the multiscale backbone of complex weighted networks,2009,Proceedings of the National Academy of Sciences of the United States of America,313,10.1073/pnas.0808904106,Spain,Article,Madrid,1,Journal,2-s2.0-66449123352
Lazer D.,,Social science: Computational social science,2009,Science,1714,10.1126/science.1167742,United States,Short Survey,Cambridge,0,Journal,2-s2.0-59849122652
Brockmann D.,,"Money circulation, trackable items, and the emergence of universal human mobility patterns",2008,IEEE Pervasive Computing,46,10.1109/MPRV.2008.77,United States,Article,Evanston,0,Journal,2-s2.0-54849423235
Allesina S.,,A general model for food web structure,2008,Science,172,10.1126/science.1156269,United States;United States,Article,Ann Arbor;Santa Barbara,0,Journal,2-s2.0-43249130522
Wang H.,,Betweenness centrality in a weighted network,2008,"Physical Review E - Statistical, Nonlinear, and Soft Matter Physics",80,10.1103/PhysRevE.77.046105,Netherlands,Article,Delft,0,Journal,2-s2.0-41949084159
Sales-Pardo M.,,Extracting the hierarchical organization of complex systems,2007,Proceedings of the National Academy of Sciences of the United States of America,362,10.1073/pnas.0703740104,United States,Article,Evanston,1,Journal,2-s2.0-34848890341
Alon U.,,Network motifs: Theory and experimental approaches,2007,Nature Reviews Genetics,1864,10.1038/nrg2102,Israel,Review,Rehovot,0,Journal,2-s2.0-34249079154
Guimerà R.,,Classes of complex networks defined by role-to-role connectivity profiles,2007,Nature Physics,267,10.1038/nphys489,United States,Article,Evanston,0,Journal,2-s2.0-33845969217
Borgatti S.,,A Graph-theoretic perspective on centrality,2006,Social Networks,748,10.1016/j.socnet.2005.11.005,United States,Article,Chestnut Hill,0,Journal,2-s2.0-33746192198
Wu Z.,,Transport in weighted networks: Partition into superhighways and roads,2006,Physical Review Letters,101,10.1103/PhysRevLett.96.148702,United States,Article,Boston,0,Journal,2-s2.0-33645789735
Dall'Asta L.,,Vulnerability of weighted networks,2006,Journal of Statistical Mechanics: Theory and Experiment,80,10.1088/1742-5468/2006/04/P04006,France,Article,Orsay,0,Journal,2-s2.0-33646417635
Colizza V.,,The role of the airline transportation network in the prediction and predictability of global epidemics,2006,Proceedings of the National Academy of Sciences of the United States of America,608,10.1073/pnas.0510525103,United States,Article,Bloomington,1,Journal,2-s2.0-33144474437
Boccaletti S.,,Complex networks: Structure and dynamics,2006,Physics Reports,6606,10.1016/j.physrep.2005.10.009,Italy,Review,Sesto Fiorentino,0,Journal,2-s2.0-31344474880
Brockmann D.,,The scaling laws of human travel,2006,Nature,1313,10.1038/nature04292,Germany;Germany,Article,Gottingen;Gottingen,0,Journal,2-s2.0-31444431866
Holme P.,,Core-periphery organization of complex networks,2005,"Physical Review E - Statistical, Nonlinear, and Soft Matter Physics",132,10.1103/PhysRevE.72.046111,United States,Article,Ann Arbor,0,Journal,2-s2.0-33244492393
Garlaschelli D.,,Structure and evolution of the world trade network,2005,Physica A: Statistical Mechanics and its Applications,220,10.1016/j.physa.2005.02.075,Italy;Italy,Conference Paper,Genoa;Siena,0,Journal,2-s2.0-21544444193
Tumminello M.,,A tool for filtering information in complex systems,2005,Proceedings of the National Academy of Sciences of the United States of America,413,10.1073/pnas.0500298102,Italy,Article,Palermo,1,Journal,2-s2.0-23044444732
Guimerà R.,,"The worldwide air transportation network: Anomalous centrality, community structure, and cities' global roles",2005,Proceedings of the National Academy of Sciences of the United States of America,1048,10.1073/pnas.0407994102,United States,Article,Evanston,1,Journal,2-s2.0-20344377406
Newman M.E.J.,,Analysis of weighted networks,2004,"Physical Review E - Statistical, Nonlinear, and Soft Matter Physics",1212,10.1103/PhysRevE.70.056131,United States;United States,Article,Santa Fe;Ann Arbor,0,Journal,2-s2.0-41349096036
Garlaschelli D.,,Fitness-dependent topological properties of the world trade web,2004,Physical Review Letters,198,10.1103/PhysRevLett.93.188701,Italy;Italy,Article,Genoa;Siena,0,Journal,2-s2.0-13544255314
Hufnagel L.,,Forecast and control of epidemics in a globalized world,2004,Proceedings of the National Academy of Sciences of the United States of America,621,10.1073/pnas.0308344101,,Article,,1,Journal,2-s2.0-6344221308
Barrat A.,,The architecture of complex weighted networks,2004,Proceedings of the National Academy of Sciences of the United States of America,2202,10.1073/pnas.0400087101,France,Article,Orsay,1,Journal,2-s2.0-1642308591
Almaas E.,,Global organization of metabolic fluxes in the bacterium Escherichia coli,2004,Nature,520,10.1038/nature02289,United States,Article,Notre Dame,0,Journal,2-s2.0-1542288938
Barabási A.,,Network biology: Understanding the cell's functional organization,2004,Nature Reviews Genetics,5033,10.1038/nrg1272,United States,Review,Notre Dame,0,Journal,2-s2.0-0742305866
Newman M.E.J.,,Finding and evaluating community structure in networks,2004,"Physical Review E - Statistical, Nonlinear, and Soft Matter Physics",7687,10.1103/PhysRevE.69.026113,United States;United States,Article,Santa Fe;Ann Arbor,0,Journal,2-s2.0-37649028224
Serrano M.A.,,Topology of the world trade web,2003,"Physical Review E - Statistical, Nonlinear, and Soft Matter Physics",294,,Spain,Article,Barcelona,0,Journal,2-s2.0-4544324641
Reed J.,,An expanded genome-scale model of Escherichia coli K-12 (iJR904 GSM/GPR).,2003,Genome biology,749,,United States,Article,San Diego,0,Journal,2-s2.0-0344328817
Ravasz E.,,Hierarchical organization in complex networks,2003,"Physical Review E - Statistical Physics, Plasmas, Fluids, and Related Interdisciplinary Topics",1243,10.1103/PhysRevE.67.026112,United States,Article,Notre Dame,0,Journal,2-s2.0-84930064585
Newman M.,,The structure and function of complex networks,2003,SIAM Review,11537,10.1137/S003614450342480,United States,Review,Ann Arbor,0,Journal,2-s2.0-0038718854
Albert R.,,Statistical mechanics of complex networks,2002,Reviews of Modern Physics,13645,10.1103/RevModPhys.74.47,United States;United States,Article,Minneapolis;Notre Dame,0,Journal,2-s2.0-0036013593
Camacho J.,,Robust patterns in food web structure,2002,Physical review letters,228,,United States,Article,Boston,0,Journal,2-s2.0-0011822339
Newman M.,,Assortative Mixing in Networks,2002,Physical Review Letters,3012,10.1103/PhysRevLett.89.208701,United States,Article,Ann Arbor,0,Journal,2-s2.0-18744389789
Kleinberg J.,,Network analysis: The structure of the web,2001,Science,182,10.1126/science.1067014,United States,Short Survey,Ithaca,0,Journal,2-s2.0-0035976573
Liljeros F.,,Social networks: The web of human sexual contacts,2001,Nature,1172,10.1038/35082140,Sweden,Article,Stockholm,0,Journal,2-s2.0-0035927795
Strogatz S.,,Exploring complex networks,2001,Nature,5562,10.1038/35065725,United States,Review,Ithaca,1,Journal,2-s2.0-0035826155
Newman M.,,The structure of scientific collaboration networks,2001,Proceedings of the National Academy of Sciences of the United States of America,2978,10.1073/pnas.98.2.404,United States,Article,Santa Fe,1,Journal,2-s2.0-0035895239
Jeong H.,,The large-scale organization of metabolic networks,2000,Nature,3533,10.1038/35036627,United States,Article,Notre Dame,0,Journal,2-s2.0-0034609791
Barabási A.,,Emergence of scaling in random networks,1999,Science,22122,10.1126/science.286.5439.509,United States,Article,Notre Dame,0,Journal,2-s2.0-0038483826
Watts D.J.,,Collective dynamics of 'small-world9 networks,1998,Nature,25779,10.1038/30918,United States,Article,Ithaca,0,Journal,2-s2.0-0032482432
Dijkstra E.,,A note on two problems in connexion with graphs,1959,Numerische Mathematik,13103,10.1007/BF01386390,Netherlands,Article,Amsterdam,0,Journal,2-s2.0-34147120474
