Authors,Author(s) ID,Title,Year,Source tittle,Cited by,DOI,Country,Document Type,City,Access Type,aggregationType,EID
Ives A.,,Stability and diversity of ecosystems,2007,Science,773,10.1126/science.1133258,United States,Review,Madison,0,Journal,2-s2.0-34447324898
Srinivasan U.,,Response of complex food webs to realistic extinction sequences,2007,Ecology,108,10.1890/06-0971,United States,Article,Berkeley,0,Journal,2-s2.0-34247099897
Montoya J.,,Ecological networks and their fragility,2006,Nature,676,10.1038/nature04927,United Kingdom;Spain,Review,London;Barcelona,0,Journal,2-s2.0-33746327503
Allesina S.,,Secondary extinctions in ecological networks: Bottlenecks unveiled,2006,Ecological Modelling,31,10.1016/j.ecolmodel.2005.10.016,United States;Italy,Conference Paper,East Lansing;Parma,0,Journal,2-s2.0-33644695850
Vandermeer J.,,Omnivory and the stability of food webs,2006,Journal of Theoretical Biology,67,10.1016/j.jtbi.2005.06.006,United States,Article,Ann Arbor,0,Journal,2-s2.0-30444446137
Ebenman B.,,Using community viability analysis to identify fragile systems and keystone species,2005,Trends in Ecology and Evolution,117,10.1016/j.tree.2005.06.011,Sweden,Review,Linkoping,0,Journal,2-s2.0-24944564650
Christianou M.,,Keystone species and vulnerable species in ecological communities: Strong or weak interactors?,2005,Journal of Theoretical Biology,37,10.1016/j.jtbi.2004.12.022,Sweden,Article,Linkoping,0,Journal,2-s2.0-17044422586
Memmott J.,,Tolerance of pollination networks to species extinctions,2004,Proceedings of the Royal Society B: Biological Sciences,625,10.1098/rspb.2004.2909,United Kingdom,Article,Bristol,0,Journal,2-s2.0-16644365084
Raffaelli D.,,How extinction patterns affect ecosystems,2004,Science,94,10.1126/science.1106365,United Kingdom,Short Survey,York,0,Journal,2-s2.0-16544393233
Solan M.,,Extinction and ecosystem function in the marine benthos,2004,Science,496,10.1126/science.1103960,United Kingdom,Article,Aberdeen,0,Journal,2-s2.0-8444227404
Allesina S.,,Who dominates whom in the ecosystem? Energy flow bottlenecks and cascading extinctions,2004,Journal of Theoretical Biology,86,10.1016/j.jtbi.2004.05.009,Italy,Article,Parma,0,Journal,2-s2.0-4143132414
Dunne J.A.,,Network structure and robustness of marine food webs,2004,Marine Ecology Progress Series,227,10.3354/meps273291,United States;United States,Article,Santa Fe;Crested Butte,1,Journal,2-s2.0-3042842665
Berlow E.L.,,Interaction strengths in food webs: Issues and opportunities,2004,Journal of Animal Ecology,366,10.1111/j.0021-8790.2004.00833.x,United States;United States,Review,Berkeley;Bishop,1,Journal,2-s2.0-2342472037
Williams R.,,Limits to trophic levels and omnivory in complex food webs: Theory and data,2004,American Naturalist,205,10.1086/381964,United States,Article,Crested Butte,0,Journal,2-s2.0-1842661790
Emmerson M.,,"Weak interactions, omnivory and emergent food-web properties",2004,Proceedings of the Royal Society B: Biological Sciences,104,10.1098/rspb.2003.2592,Ireland,Article,Cork,0,Journal,2-s2.0-1242314715
Kondoh M.,,Foraging adaptation and the relationship between food-web complexity and stability,2003,Science,399,10.1126/science.1079154,United Kingdom;Japan,Article,Cardiff;Kyoto,0,Journal,2-s2.0-0037470443
Worm B.,,"Biodiversity, productivity and stability in real food webs",2003,Trends in Ecology and Evolution,266,10.1016/j.tree.2003.09.003,Germany,Article,Kiel,0,Journal,2-s2.0-0242577742
Newman M.,,The structure and function of complex networks,2003,SIAM Review,11537,10.1137/S003614450342480,United States,Review,Ann Arbor,0,Journal,2-s2.0-0038718854
Dunne J.,,Network structure and biodiversity loss in food webs: Robustness increases with connectance,2002,Ecology Letters,934,10.1046/j.1461-0248.2002.00354.x,United States;United States,Article,Santa Fe;San Francisco,0,Journal,2-s2.0-0036316089
Neutel A.,,Stability in real food webs: Weak links in long loops,2002,Science,460,10.1126/science.1068326,Netherlands,Article,Utrecht,0,Journal,2-s2.0-0037052507
Link J.,,Does food web theory work for marine ecosystems?,2002,Marine Ecology Progress Series,208,10.3354/meps230001,United States,Article,Woods Hole,1,Journal,2-s2.0-0037023614
Montoya J.,,Small world patterns in food webs,2002,Journal of Theoretical Biology,396,10.1006/jtbi.2001.2460,Spain;Spain,Article,Alcala de Henares;Barcelona,0,Journal,2-s2.0-0036353494
Loreau M.,,Ecology: Biodiversity and ecosystem functioning: Current knowledge and future challenges,2001,Science,2689,10.1126/science.1064088,France,Review,Paris,0,Journal,2-s2.0-0035955371
Alstrup S.,,Generalized dominators for structured programs,2000,Algorithmica (New York),5,10.1007/s004530010018,Denmark,Article,Copenhagen,0,Journal,2-s2.0-9644295820
Albert R.,,Error and attack tolerance of complex networks,2000,Nature,5597,10.1038/35019019,United States,Article,Notre Dame,0,Journal,2-s2.0-0034721164
McCann K.,,The diversity-stability,2000,Nature,1707,10.1038/35012234,Canada,Review,Montreal,0,Journal,2-s2.0-0034636310
Borrvall C.,,Biodiversity lessens the risk of cascading extinction in model food webs,2000,Ecology Letters,172,10.1046/j.1461-0248.2000.00130.x,United States;Sweden,Article,New York;Linkoping,0,Journal,2-s2.0-0034008986
Memmott J.,,"Predators, parasitoids and pathogens: Species richness, trophic generality and body sizes in a natural food web",2000,Journal of Animal Ecology,200,10.1046/j.1365-2656.2000.00367.x,United Kingdom;United Kingdom,Article,Bristol;London,1,Journal,2-s2.0-0033965185
Christian R.,,Organizing and understanding a winter's seagrass foodweb network through effective trophic levels,1999,Ecological Modelling,167,10.1016/S0304-3800(99)00022-8,United States,Article,Greenville,0,Journal,2-s2.0-0033120463
Alstrup S.,,Dominators in linear time,1999,SIAM Journal on Computing,90,10.1137/S0097539797317263,Denmark,Article,Copenhagen,0,Journal,2-s2.0-0033330108
Martinez N.,,Effects of sampling effort on characterization of food-web structure,1999,Ecology,185,10.1890/0012-9658(1999)080[1044:EOSEOC]2.0.CO;2,United States,Article,San Francisco,0,Journal,2-s2.0-0032897662
McCann K.,,Weak trophic interactions and the balance of nature,1998,Nature,1034,10.1038/27427,United States,Article,Davis,0,Journal,2-s2.0-0032558786
Townsend C.,,"Disturbance, resource supply, and food-web architecture in streams",1998,Ecology Letters,164,10.1046/j.1461-0248.1998.00039.x,New Zealand,Article,Dunedin,0,Journal,2-s2.0-0001218793
Yodzis P.,,Local trophodynamics and the interaction of marine mammals and fisheries in the Benguela ecosystem,1998,Journal of Animal Ecology,182,10.1046/j.1365-2656.1998.00224.x,Canada,Article,Guelph,1,Journal,2-s2.0-0031875598
Fagan W.,,Omnivory as a stabilizing feature of natural communities,1997,American Naturalist,165,10.1086/286081,United States;United States,Article,Seattle;Tempe,0,Journal,2-s2.0-0030774315
McCann K.,,Re-evaluating the omnivory-stability relationship in food webs,1997,Proceedings of the Royal Society B: Biological Sciences,275,10.1098/rspb.1997.0172,United States,Article,Davis,0,Journal,2-s2.0-0030865359
Alstrup S.,,An O(|V| * |E|) algorithm for finding immediate multiple-vertex dominators,1996,Information Processing Letters,8,10.1016/0020-0190(96)00085-3,Denmark,Article,Copenhagen,0,Journal,2-s2.0-3142703032
Huxham M.,,Do parasites reduce the chances of triangulation in a real food web?,1996,Oikos,114,10.2307/3546201,United Kingdom,Article,Edinburgh,0,Journal,2-s2.0-0030304321
Power M.E.,,Challenges in the quest for keystones: Identifying keystone species is difficult-but essential to understanding how loss of species will affect ecosystems,1996,BioScience,1103,10.2307/1312990,United States,Article,Berkeley,1,Journal,2-s2.0-10244235264
Gupta R.,,Generalized dominators,1995,Information Processing Letters,4,10.1016/0020-0190(94)00192-2,United States,Article,Pittsburgh,0,Journal,2-s2.0-0029244918
Goldwasser L.,,Construction and analysis of a large Caribbean food web,1993,Ecology,158,10.2307/1940492,United States,Article,Palo Alto,0,Journal,2-s2.0-0027383159
Havens K.,,Scale and structure in natural food webs,1992,Science,170,10.1126/science.257.5073.1107,United States,Article,Kent,0,Journal,2-s2.0-0027038905
Hall S.,,Food-web patterns: lessons from a species-rich web,1991,Journal of Animal Ecology,210,10.2307/5416,United Kingdom,Article,Aberdeen,0,Journal,2-s2.0-0026307942
Martinez N.,,Artifacts or attributes? Effects of resolution on the Little Rock Lake food web,1991,Ecological Monographs,438,10.2307/2937047,United States,Article,Berkeley,0,Journal,2-s2.0-0026277992
Polis G.,,Complex trophic interactions in deserts: an empirical critique of food-web theory,1991,American Naturalist,659,10.1086/285208,United States,Article,Nashville,0,Journal,2-s2.0-0026296262
Warren P.,,Spatial and temporal variation in the structure of a freshwater food web,1989,Oikos,215,10.2307/3565588,United Kingdom,Article,London,0,Journal,2-s2.0-0024944556
Baird D.,,The seasonal dynamics of the Chesapeake Bay ecosystem,1989,Ecological Monographs,584,10.2307/1943071,South Africa,Article,,0,Journal,2-s2.0-0024877577
Pimm S.,,On feeding on more than one trophic level [18],1978,Nature,349,10.1038/275542a0,United States,Letter,Lubbock,0,Journal,2-s2.0-0018129208
May R.,,Will a large complex system be stable?,1972,Nature,1363,10.1038/238413a0,United States;Australia,Article,Princeton;Sydney,0,Journal,2-s2.0-0015514970
