Authors,Author(s) ID,Title,Year,Source tittle,Cited by,DOI,Country,Document Type,City,Access Type,aggregationType,EID
Isella L.,,Close encounters in a pediatric ward: Measuring face-to-face proximity and mixing patterns with wearable sensors,2011,PLoS ONE,133,10.1371/journal.pone.0017144,Italy,Article,Turin,1,Journal,2-s2.0-79952215963
Isella L.,,What's in a crowd? Analysis of face-to-face behavioral networks,2011,Journal of Theoretical Biology,398,10.1016/j.jtbi.2010.11.033,Italy,Article,Turin,0,Journal,2-s2.0-78650107510
Salathé M.,,A high-resolution human contact network for infectious disease transmission,2010,Proceedings of the National Academy of Sciences of the United States of America,375,10.1073/pnas.1009094108,United States;United States,Article,Palo Alto;University Park,1,Journal,2-s2.0-78650671288
Polgreen P.M.,,Prioritizing healthcare worker vaccinations on the basis of social network analysis,2010,Infection Control and Hospital Epidemiology,36,10.1086/655466,United States,Article,Iowa City,0,Journal,2-s2.0-77955753110
Cattuto C.,,Dynamics of person-to-person interactions from distributed RFID sensor networks,2010,PLoS ONE,410,10.1371/journal.pone.0011596,Italy,Article,Turin,1,Journal,2-s2.0-77955352798
Merler S.,,The role of population heterogeneity and human mobility in the spread of pandemic influenza,2010,Proceedings of the Royal Society B: Biological Sciences,134,10.1098/rspb.2009.1605,Italy,Article,Trento,1,Journal,2-s2.0-76249125029
Balcan D.,,Multiscale mobility networks and the spatial spreading of infectious diseases,2009,Proceedings of the National Academy of Sciences of the United States of America,593,10.1073/pnas.0906910106,United States;United States,Article,Bloomington;Bloomington,1,Journal,2-s2.0-76049115282
Smieszek T.,,A mechanistic model of infection: Why duration and intensity of contacts should be included in models of disease spread,2009,Theoretical Biology and Medical Modelling,57,10.1186/1742-4682-6-25,Switzerland,Article,"Zurich ZH,",1,Journal,2-s2.0-72849127144
Smieszek T.,,Models of epidemics: When contact repetition and clustering should be included,2009,Theoretical Biology and Medical Modelling,71,10.1186/1742-4682-6-11,Switzerland,Article,"Zurich ZH,",1,Journal,2-s2.0-68249144968
Lazer D.,,Social science: Computational social science,2009,Science,1714,10.1126/science.1167742,United States,Short Survey,Cambridge,0,Journal,2-s2.0-59849122652
Zagheni E.,,Using time-use data to parameterize models for the spread of close-contact infectious diseases,2008,American Journal of Epidemiology,80,10.1093/aje/kwn220,United States,Article,Berkeley,1,Journal,2-s2.0-54949121009
Read J.,,Dynamic social networks and the implications for the spread of infectious disease,2008,Journal of the Royal Society Interface,193,10.1098/rsif.2008.0013,United Kingdom;United Kingdom,Article,Coventry;Liverpool,0,Journal,2-s2.0-47649090559
Mossong J.,,Social contacts and mixing patterns relevant to the spread of infectious diseases,2008,PLoS Medicine,1028,10.1371/journal.pmed.0050074,Luxembourg;Luxembourg,Article,Luxembourg;Luxembourg,1,Journal,2-s2.0-41549103774
Eames K.,,Modelling disease spread through random and regular contacts in clustered populations,2008,Theoretical Population Biology,82,10.1016/j.tpb.2007.09.007,United Kingdom,Article,Coventry,0,Journal,2-s2.0-37849013474
Barrat A.,,Dynamical processes on complex networks,2008,Dynamical Processes on Complex Networks,1582,10.1017/CBO9780511791383,France;France;Italy,Book,Saint-Aubin;Paris;,0,Book,2-s2.0-84924517160
Riley S.,,Large-scale spatial-transmission models of infectious disease,2007,Science,333,10.1126/science.1134695,Hong Kong,Review,,0,Journal,2-s2.0-34249883600
Onnela J.,,Structure and tie strengths in mobile communication networks,2007,Proceedings of the National Academy of Sciences of the United States of America,1134,10.1073/pnas.0610245104,Finland;United Kingdom,Article,Espoo;Oxford,1,Journal,2-s2.0-34250628484
Breban R.,,Theory versus data: How to calculate R<inf>0</inf>?,2007,PLoS ONE,30,10.1371/journal.pone.0000282,United States,Article,Los Angeles,1,Journal,2-s2.0-45149094509
Watts D.,,A twenty-first century science,2007,Nature,201,10.1038/445489a,United States,Short Survey,New York,0,Journal,2-s2.0-33846658194
Beutels P.,,Social mixing patterns for transmission models of close contact infections: Exploring self-evaluation and diary-based data collection through a web-based interface,2006,Epidemiology and Infection,79,10.1017/S0950268806006418,Australia;Belgium,Article,Sydney;Antwerpen,0,Journal,2-s2.0-33748527941
Wallinga J.,,Using data on social contacts to estimate age-specific transmission parameters for respiratory-spread infectious agents,2006,American Journal of Epidemiology,329,10.1093/aje/kwj317,Netherlands,Article,Bilthoven,1,Journal,2-s2.0-33750896281
Ferguson N.M.,,Strategies for mitigating an influenza pandemic,2006,Nature,1220,10.1038/nature04795,United Kingdom,Article,London,0,Journal,2-s2.0-33745836878
Germann T.,,Mitigation strategies for pandemic influenza in the United States,2006,Proceedings of the National Academy of Sciences of the United States of America,722,10.1073/pnas.0601266103,United States,Article,Los Alamos,1,Journal,2-s2.0-33645802797
Colizza V.,,The role of the airline transportation network in the prediction and predictability of global epidemics,2006,Proceedings of the National Academy of Sciences of the United States of America,608,10.1073/pnas.0510525103,United States,Article,Bloomington,1,Journal,2-s2.0-33144474437
Brockmann D.,,The scaling laws of human travel,2006,Nature,1313,10.1038/nature04292,Germany;Germany,Article,Gottingen;Gottingen,0,Journal,2-s2.0-31444431866
Kossinets G.,,Empirical analysis of an evolving social network,2006,Science,966,10.1126/science.1116869,United States,Article,New York,0,Journal,2-s2.0-30344443646
O'Neill E.,,Instrumenting the city: Developing methods for observing and understanding the digital cityscape,2006,Lecture Notes in Computer Science (including subseries Lecture Notes in Artificial Intelligence and Lecture Notes in Bioinformatics),112,10.1007/11853565_19,United Kingdom,Conference Paper,Bath,0,Book Series,2-s2.0-33750290348
Lloyd-Smith J.,,Superspreading and the effect of individual variation on disease emergence,2005,Nature,994,10.1038/nature04153,United States;United States,Article,Berkeley;Berkeley,0,Journal,2-s2.0-27844455994
Longini I.,,Containing pandemic influenza at the source,2005,Science,867,10.1126/science.1115717,United States,Article,Atlanta,0,Journal,2-s2.0-23644457957
Heffernan J.,,Perspectives on the basic reproductive ratio,2005,Journal of the Royal Society Interface,515,10.1098/rsif.2005.0042,Canada,Review,London,0,Journal,2-s2.0-32044460132
Hufnagel L.,,Forecast and control of epidemics in a globalized world,2004,Proceedings of the National Academy of Sciences of the United States of America,621,10.1073/pnas.0308344101,,Article,,1,Journal,2-s2.0-6344221308
Szendroi B.,,Polynomial epidemics and clustering in contact networks,2004,Proceedings of the Royal Society B: Biological Sciences,48,10.1098/rsbl.2004.0188,Netherlands,Article,Utrecht,0,Journal,2-s2.0-3242889980
Eubank S.,,Modelling disease outbreaks in realistic urban social networks,2004,Nature,1155,10.1038/nature02541,United States,Article,Los Alamos,0,Journal,2-s2.0-2442686815
Zaric G.,,Random vs. nonrandom mixing in network epidemic models,2002,Health Care Management Science,19,10.1023/A:1014489218178,Canada,Review,London,0,Journal,2-s2.0-0036551435
Liljeros F.,,Social networks: The web of human sexual contacts,2001,Nature,1172,10.1038/35082140,Sweden,Article,Stockholm,0,Journal,2-s2.0-0035927795
Lloyd A.,,How viruses spread among computers and people,2001,Science,473,10.1126/science.1061076,United States,Short Survey,Princeton,0,Journal,2-s2.0-0035907006
Pastor-Satorras R.,,Epidemic spreading in scale-free networks,2001,Physical Review Letters,3738,10.1103/PhysRevLett.86.3200,Spain,Article,Barcelona,0,Journal,2-s2.0-0035794256
Keeling M.,,The effects of local spatial structure on epidemiological invasions,1999,Proceedings of the Royal Society B: Biological Sciences,543,10.1098/rspb.1999.0716,United Kingdom,Article,Cambridge,0,Journal,2-s2.0-0033594451
Edmunds W.,,Who mixes with whom? A method to determine the contact patterns of adults that may lead to the spread of airborne infections,1997,Proceedings of the Royal Society B: Biological Sciences,190,10.1098/rspb.1997.0131,United Kingdom,Article,Coventry,0,Journal,2-s2.0-0030753597
Diekmann O.,,On the definition and the computation of the basic reproduction ratio R<inf>0</inf> in models for infectious diseases in heterogeneous populations,1990,Journal of Mathematical Biology,2119,10.1007/BF00178324,Netherlands;Netherlands,Article,Leiden;Amsterdam,0,Journal,2-s2.0-0025159677
A. Rvachev L.,,A mathematical model for the global spread of influenza,1985,Mathematical Biosciences,339,10.1016/0025-5564(85)90064-1,Russian Federation,Article,Moscow,0,Journal,2-s2.0-0022394032
