Authors,Author(s) ID,Title,Year,Source tittle,Cited by,DOI,Country,Document Type,City,Access Type,aggregationType,EID
Leland W.,,On the Self-Similar Nature of Ethernet Traffic (Extended Version),1994,IEEE/ACM Transactions on Networking,3680,10.1109/90.282603,United States,Article,Piscataway,0,Journal,2-s2.0-0028377540
Krapivsky P.,,Kinetics of monomer-monomer surface catalytic reactions,1992,Physical Review A,164,10.1103/PhysRevA.45.1067,Russian Federation,Article,Moscow,0,Journal,2-s2.0-0000982046
Łuczak T.,,The chromatic number of random graphs,1991,Combinatorica,123,10.1007/BF01375472,United States,Article,Minneapolis,0,Journal,2-s2.0-34249925281
Costin O.,,Limit probability distributions for an infinite-order phase transition model,1991,Journal of Statistical Physics,8,10.1007/BF01057873,Romania,Article,Bucharest,0,Journal,2-s2.0-2842549493
Scalettar R.,,Critical properties of an Ising model with dilute long range interactions,1991,Physica A: Statistical Mechanics and its Applications,16,10.1016/0378-4371(91)90046-F,United States,Article,Davis,0,Journal,2-s2.0-4243821705
Ben-Abraham D.,,Saturation transition in a monomer-monomer model of heterogeneous catalysis,1990,Journal of Physics A: General Physics,54,10.1088/0305-4470/23/19/015,United States,Article,Potsdam,0,Journal,2-s2.0-11744329382
Frieze A.,,On the independence number of random graphs,1990,Discrete Mathematics,99,10.1016/0012-365X(90)90149-C,United States,Article,Pittsburgh,1,Journal,2-s2.0-0000622849
Costin O.,,Infinite-order phase transition in a classical spin system,1990,Journal of Statistical Physics,16,10.1007/BF01334762,Romania,Article,Bucharest,0,Journal,2-s2.0-0040163063
Lyons R.,,The Ising model and percolation on trees and tree-like graphs,1989,Communications In Mathematical Physics,61,10.1007/BF01217911,United States,Article,Palo Alto,0,Journal,2-s2.0-0000537063
Aizenman A.,,Metastability effects in bootstrap percolation,1988,Journal of Physics A: Mathematical and General,198,10.1088/0305-4470/21/19/017,United States,Article,New York,0,Journal,2-s2.0-36149031851
Thouless D.,,Spin-glass on a bethe lattice,1986,Physical Review Letters,117,10.1103/PhysRevLett.56.1082,United States,Article,Seattle,0,Journal,2-s2.0-4243837055
Strauss D.,,ON A GENERAL CLASS OF MODELS FOR INTERACTION.,Dec,SIAM Review,133,10.1137/1028156,United States,Article,Riverside,0,Journal,2-s2.0-0022904506
Binder K.,,"Spin glasses: Experimental facts, theoretical concepts, and open questions",1986,Reviews of Modern Physics,3975,10.1103/RevModPhys.58.801,Germany;Germany,Article,Mainz;Jülich,0,Journal,2-s2.0-0043230411
Viana L.,,Phase diagrams for dilute spin glasses,1985,Journal of Physics C: Solid State Physics,252,10.1088/0022-3719/18/15/013,United Kingdom,Article,Manchester,0,Journal,2-s2.0-65549088216
Grassberger P.,,On the critical behavior of the general epidemic process and dynamical percolation,1983,Mathematical Biosciences,422,10.1016/0025-5564(82)90036-0,Germany;Israel,Article,Wuppertal;Rehovot,0,Journal,2-s2.0-0020737985
Baxter R.,,The inversion relation method for some two-dimensional exactly solved models in lattice statistics,1982,Journal of Statistical Physics,4078,10.1007/BF01011621,Australia,Article,Canberra,0,Journal,2-s2.0-0002265756
Wu F.,,The Potts model,1982,Reviews of Modern Physics,2607,10.1103/RevModPhys.54.235,United States;Germany,Article,Boston;Jülich,0,Journal,2-s2.0-0042492825
Derrida B.,,Random-energy model: An exactly solvable model of disordered systems,1981,Physical Review B,925,10.1103/PhysRevB.24.2613,France,Article,Gif-sur-Yvette,0,Journal,2-s2.0-4243861085
Bollobás B.,,A Probabilistic Proof of an Asymptotic Formula for the Number of Labelled Regular Graphs,1980,European Journal of Combinatorics,539,10.1016/S0195-6698(80)80030-8,United Kingdom,Article,Cambridge,1,Journal,2-s2.0-85012603843
Chalupa J.,,Bootstrap percolation on a Bethe lattice,1979,Journal of Physics C: Solid State Physics,303,10.1088/0022-3719/12/1/008,United States,Article,New Brunswick,0,Journal,2-s2.0-0002092533
Grassberger P.,,Reggeon field theory (Schlögl's first model) on a lattice: Monte Carlo calculations of critical behaviour,1979,Annals of Physics,518,10.1016/0003-4916(79)90207-0,Germany,Article,Wuppertal,0,Journal,2-s2.0-0012582012
Bender E.,,The asymptotic number of labeled graphs with given degree sequences,1978,"Journal of Combinatorial Theory, Series A",555,10.1016/0097-3165(78)90059-6,United States,Article,San Diego,1,Journal,2-s2.0-0000664045
Appel K.,,Every planar map is four colorable part II: Reducibility<sup>1</sup>,1977,Illinois Journal of Mathematics,398,10.1215/ijm/1256049012,United States;United States,Article,Wilkes-Barre;Urbana,1,Journal,2-s2.0-84972500815
Appel K.,,Every planar map is four colorable part I: Discharging<sup>1</sup>,1977,Illinois Journal of Mathematics,546,10.1215/ijm/1256049011,United States,Article,Urbana,1,Journal,2-s2.0-84972498411
Thouless D.,,Solution of ‘Solvable model of a spin glass’,1977,Philosophical Magazine,875,10.1080/14786437708235992,United Kingdom,Article,Birmingham,0,Journal,2-s2.0-84996241537
Falk H.,,Ising spin system on a Cayley tree: Correlation decomposition and phase transition,1975,Physical Review B,35,10.1103/PhysRevB.12.5184,United States;United Kingdom,Article,New York;Oxford,0,Journal,2-s2.0-35949026207
Harris A.,,"Nature of the ""Griffiths"" singularity in dilute magnets",1975,Physical Review B,58,10.1103/PhysRevB.12.203,United States;United States,Article,Albuquerque;Philadelphia,0,Journal,2-s2.0-33744614344
Mukamel D.,,Two-spin correlation function of spin 1 2 Ising model on a bethe lattice,1974,Physics Letters A,11,10.1016/0375-9601(74)90050-4,United States,Article,Upton,0,Journal,2-s2.0-0942266386
Von Heimburg J.,,Phase transition of the cayley tree with ising interaction,1974,Journal of Physics C: Solid State Physics,45,10.1088/0022-3719/7/19/003,Germany,Article,Frankfurt am Main,0,Journal,2-s2.0-22244485704
Müller-Hartmann E.,,New type of phase transition,1974,Physical Review Letters,151,10.1103/PhysRevLett.33.893,Germany,Article,Koln,0,Journal,2-s2.0-3743143192
Eggarter T.P.,,"Cayley trees, the Ising problem, and the thermodynamic limit",1974,Physical Review B,168,10.1103/PhysRevB.9.2989,France;France,Article,Orsay;Paris,0,Journal,2-s2.0-33846658223
kosterlitz J.,,"Ordering, metastability and phase transitions in two-dimensional systems",1973,Journal of Physics C: Solid State Physics,7555,10.1088/0022-3719/6/7/010,United Kingdom,Article,Birmingham,0,Journal,2-s2.0-33646668033
Fortuin C.,,On the random-cluster model. I. Introduction and relation to other models,1972,Physica,1272,10.1016/0031-8914(72)90045-6,Netherlands,Article,Leiden,0,Journal,2-s2.0-0041855748
Bedeaux D.,,Decay of correlations. III. Relaxation of spin correlations and distribution functions in the one-dimensional ising lattice,1970,Journal of Statistical Physics,49,10.1007/BF01009708,United States,Article,San Diego,0,Journal,2-s2.0-0002146426
Domb C.,,On the theory of cooperative phenomena in crystals,1960,Advances in Physics,134,10.1080/00018736000101199,United Kingdom,Article,London,0,Journal,2-s2.0-84945612853
Kikuchi R.,,A theory of cooperative phenomena,1951,Physical Review,1425,10.1103/PhysRev.81.988,United States;Japan,Article,Pasadena;Tokyo,0,Journal,2-s2.0-36149021742
Solomonoff R.,,Connectivity of random nets,1951,The Bulletin of Mathematical Biophysics,191,10.1007/BF02478357,United States,Article,Chicago,0,Journal,2-s2.0-51649210138
Peierls R.,,On Ising's model of ferromagnetism,1936,Mathematical Proceedings of the Cambridge Philosophical Society,459,10.1017/S0305004100019174,,Article,,0,Journal,2-s2.0-84924799755
