Authors,Author(s) ID,Title,Year,Source tittle,Cited by,DOI,Country,Document Type,City,Access Type,aggregationType,EID
Bonchi F.,,ExAMiner: Optimized level-wise frequent pattern mining with monotone constraints,2003,"Proceedings - IEEE International Conference on Data Mining, ICDM",45,,Italy,Conference Paper,Rome,0,Conference Proceeding,2-s2.0-78149311822
Dhillon I.,,Information-theoretic co-clustering,2003,Proceedings of the ACM SIGKDD International Conference on Knowledge Discovery and Data Mining,816,10.1145/956750.956764,United States,Conference Paper,Austin,0,Conference Proceeding,2-s2.0-77952375075
Kempe D.,,Maximizing the spread of influence through a social network,2003,Proceedings of the ACM SIGKDD International Conference on Knowledge Discovery and Data Mining,4461,10.1145/956750.956769,United States,Conference Paper,Ithaca,0,Conference Proceeding,2-s2.0-33747172362
Blei D.M.,,Latent Dirichlet allocation,2003,Journal of Machine Learning Research,18579,,United States,Article,Berkeley,0,Journal,2-s2.0-0141607824
Aggarwal C.,,A framework for clustering evolving data streams,2003,"Proceedings - 29th International Conference on Very Large Data Bases, VLDB 2003",1193,,United States,Conference Paper,,0,Conference Proceeding,2-s2.0-85012236181
Newman M.,,The structure and function of complex networks,2003,SIAM Review,11537,10.1137/S003614450342480,United States,Review,Ann Arbor,0,Journal,2-s2.0-0038718854
Hoff P.,,Latent space approaches to social network analysis,2002,Journal of the American Statistical Association,781,10.1198/016214502388618906,United States,Article,Seattle,0,Journal,2-s2.0-0036967824
Girvan M.,,Community structure in social and biological networks,2002,Proceedings of the National Academy of Sciences of the United States of America,8662,10.1073/pnas.122653799,United States;United States,Article,Santa Fe;Ithaca,1,Journal,2-s2.0-0037062448
Flake G.W.,,Self-organization and identification of web communities,2002,Computer,734,10.1109/2.989932,United States,Article,Princeton,0,Trade Journal,2-s2.0-0036497195
Boettcher S.,,Optimization with extremal dynamics,2001,Physical Review Letters,273,10.1103/PhysRevLett.86.5211,United States,Article,Atlanta,0,Journal,2-s2.0-0035805828
McPherson M.,,Birds of a feather: Homophily in social networks,2001,Annual Review of Sociology,8124,10.1146/annurev.soc.27.1.415,United States,Article,Tucson,0,Book Series,2-s2.0-0035639140
Watts D.J.,,Collective dynamics of 'small-world9 networks,1998,Nature,25779,10.1038/30918,United States,Article,Ithaca,0,Journal,2-s2.0-0032482432
Everett M.,,Exact colorations of graphs and digraphs,1996,Social Networks,12,10.1016/0378-8733(95)00286-3,United Kingdom,Article,London,0,Journal,2-s2.0-0030269239
Bak P.,,Punctuated equilibrium and criticality in a simple model of evolution,1993,Physical Review Letters,1190,10.1103/PhysRevLett.71.4083,United States,Article,Upton,0,Journal,2-s2.0-4243164875
Borgatti S.,,Graph colorings and power in experimental exchange networks,1992,Social Networks,18,10.1016/0378-8733(92)90006-S,United States,Article,Columbia,0,Journal,2-s2.0-0000075652
Wang Y.,,Stochastic blockmodels for directed graphs,1987,Journal of the American Statistical Association,236,10.1080/01621459.1987.10478385,United States,Article,Camden,0,Journal,2-s2.0-0002736675
Fisher D.,,Knowledge Acquisition Via Incremental Conceptual Clustering,1987,Machine Learning,1145,10.1023/A:1022852608280,,Article,,1,Journal,2-s2.0-0343442766
Holland P.W.,,Stochastic blockmodels: First steps,1983,Social Networks,919,10.1016/0378-8733(83)90021-7,United States,Article,Princeton,0,Journal,2-s2.0-0012864758
Kirkpatrick S.,,Optimization by simulated annealing,1983,Science,26831,10.1126/science.220.4598.671,United States,Article,Yorktown Heights,0,Journal,2-s2.0-26444479778
Rissanen J.,,Modeling by shortest data description,1978,Automatica,3682,10.1016/0005-1098(78)90005-5,United States,Article,San Jose,0,Journal,2-s2.0-0018015137
Bron C.,,Algorithm 457: Finding All Cliques of an Undirected Graph [H],1973,Communications of the ACM,1496,10.1145/362342.362367,Netherlands,Article,Eindhoven,0,Journal,2-s2.0-84976668743
Kettenring J.,,Canonical analysis of several sets of variables,1971,Biometrika,461,10.1093/biomet/58.3.433,United States,Article,Murray,0,Journal,2-s2.0-0000020007
Kernighan B.,,An Efficient Heuristic Procedure for Partitioning Graphs,1970,Bell System Technical Journal,3149,10.1002/j.1538-7305.1970.tb01770.x,,Article,,0,Journal,2-s2.0-84990479742
