Authors,Author(s) ID,Title,Year,Source tittle,Cited by,DOI,Country,Document Type,City,Access Type,aggregationType,EID
Vázquez A.,,Resilience to damage of graphs with degree correlations,2003,"Physical Review E - Statistical, Nonlinear, and Soft Matter Physics",160,,Italy,Article,Trieste,0,Journal,2-s2.0-0038523739
Klemm K.,,Nonequilibrium transitions in complex networks: A model of social interaction,2003,"Physical Review E - Statistical Physics, Plasmas, Fluids, and Related Interdisciplinary Topics",178,10.1103/PhysRevE.67.026120,Spain,Article,Esporlas,0,Journal,2-s2.0-85037194538
Goh K.,,Sandpile on scale-free networks,2003,Physical Review Letters,211,10.1103/PhysRevLett.91.148701,South Korea,Article,Seoul,0,Journal,2-s2.0-0242425251
Boguñá M.,,Absence of Epidemic Threshold in Scale-Free Networks with Degree Correlations,2003,Physical Review Letters,407,10.1103/PhysRevLett.90.028701,Spain,Article,Barcelona,0,Journal,2-s2.0-0037449781
Cohen R.,,Efficient immunization strategies for computer networks and populations,2003,Physical Review Letters,694,10.1103/PhysRevLett.91.247901,Israel,Article,Ramat Gan,0,Journal,2-s2.0-0942268259
Newman M.,,The structure and function of complex networks,2003,SIAM Review,11537,10.1137/S003614450342480,United States,Review,Ann Arbor,0,Journal,2-s2.0-0038718854
Motter A.E.,,Cascade-based attacks on complex networks,2002,"Physical Review E - Statistical Physics, Plasmas, Fluids, and Related Interdisciplinary Topics",1193,10.1103/PhysRevE.66.065102,United States,Article,Tempe,0,Journal,2-s2.0-41349094978
Söderberg B.,,General formalism for inhomogeneous random graphs,2002,"Physical Review E - Statistical Physics, Plasmas, Fluids, and Related Interdisciplinary Topics",139,10.1103/PhysRevE.66.066121,Sweden,Article,Lund,0,Journal,2-s2.0-41349085965
Chung F.,,The average distances in random graphs with given expected degrees,2002,Proceedings of the National Academy of Sciences of the United States of America,435,10.1073/pnas.252631999,United States,Article,San Diego,1,Journal,2-s2.0-0037058980
Mézard M.,,Random [formula presented]-satisfiability problem: From an analytic solution to an efficient algorithm,2002,"Physical Review E - Statistical Physics, Plasmas, Fluids, and Related Interdisciplinary Topics",309,10.1103/PhysRevE.66.056126,France,Article,Orsay,0,Journal,2-s2.0-37649031218
Krapivsky P.,,Finiteness and fluctuations in growing networks,2002,Journal of Physics A: Mathematical and General,85,10.1088/0305-4470/35/45/302,United States,Article,Boston,0,Journal,2-s2.0-0037111694
Kim J.,,Infinite-order percolation and giant fluctuations in a protein interaction network,2002,"Physical Review E - Statistical Physics, Plasmas, Fluids, and Related Interdisciplinary Topics",132,10.1103/PhysRevE.66.055101,South Korea,Article,Seoul,0,Journal,2-s2.0-37649031137
Boguñá M.,,Epidemic spreading in correlated complex networks,2002,"Physical Review E - Statistical Physics, Plasmas, Fluids, and Related Interdisciplinary Topics",360,10.1103/PhysRevE.66.047104,Spain,Article,Barcelona,0,Journal,2-s2.0-41349119541
Bianconi G.,,Mean field solution of the Ising model on a Barabási-Albert network,2002,"Physics Letters, Section A: General, Atomic and Solid State Physics",134,10.1016/S0375-9601(02)01232-X,United States,Article,Notre Dame,0,Journal,2-s2.0-0037078144
Iglói F.,,First- and second-order phase transitions in scale-free networks,2002,"Physical Review E - Statistical Physics, Plasmas, Fluids, and Related Interdisciplinary Topics",76,10.1103/PhysRevE.66.036140,France;Hungary;Hungary,Article,Nancy;Szeged;Budapest,0,Journal,2-s2.0-41349107969
Tanaka K.,,Statistical-mechanical approach to image processing,2002,Journal of Physics A: Mathematical and General,131,10.1088/0305-4470/35/37/201,Japan,Review,Sendai,0,Journal,2-s2.0-0037144561
Cohen R.,,Percolation critical exponents in scale-free networks,2002,"Physical Review E - Statistical Physics, Plasmas, Fluids, and Related Interdisciplinary Topics",191,10.1103/PhysRevE.66.036113,Israel,Article,Ramat Gan,0,Journal,2-s2.0-41349120185
Albert R.,,Statistical mechanics of complex networks,2002,Reviews of Modern Physics,13645,10.1103/RevModPhys.74.47,United States;United States,Article,Minneapolis;Notre Dame,0,Journal,2-s2.0-0036013593
Moreno Y.,,The Bak-Sneppen model on scale-free networks,2002,Europhysics Letters,35,10.1209/epl/i2002-00529-8,Italy,Article,Trieste,0,Journal,2-s2.0-0036334054
Mézard M.,,Analytic and algorithmic solution of random satisfiability problems,2002,Science,669,10.1126/science.1073287,France,Article,Orsay,0,Journal,2-s2.0-0037008520
Barahona M.,,Synchronization in small-world systems,2002,Physical Review Letters,1250,10.1103/PhysRevLett.89.054101,United States,Article,Pasadena,0,Journal,2-s2.0-3343010976
Schwartz N.,,Percolation in directed scale-free networks,2002,"Physical Review E - Statistical Physics, Plasmas, Fluids, and Related Interdisciplinary Topics",144,10.1103/PhysRevE.66.015104,Israel,Article,Ramat Gan,0,Journal,2-s2.0-41349101495
Newman M.E.J.,,Spread of epidemic disease on networks,2002,"Physical Review E - Statistical Physics, Plasmas, Fluids, and Related Interdisciplinary Topics",1841,10.1103/PhysRevE.66.016128,United States;United States,Article,Santa Fe;Ann Arbor,1,Journal,2-s2.0-41349106348
Hong H.,,Comment on “Ising model on a small world network”,2002,"Physical Review E - Statistical Physics, Plasmas, Fluids, and Related Interdisciplinary Topics",79,10.1103/PhysRevE.66.018101,South Korea,Note,Seoul,0,Journal,2-s2.0-37649030242
Häggström O.,,Zero-temperature dynamics for the ferromagnetic Ising model on random graphs,2002,Physica A: Statistical Mechanics and its Applications,25,10.1016/S0378-4371(02)00797-5,Sweden,Article,Göteborg,0,Journal,2-s2.0-0037100043
Dorogovtsev S.N.,,Ising model on networks with an arbitrary distribution of connections,2002,"Physical Review E - Statistical Physics, Plasmas, Fluids, and Related Interdisciplinary Topics",249,10.1103/PhysRevE.66.016104,Portugal;Russian Federation,Article,Porto;Saint Petersburg (ex Leningrad),0,Journal,2-s2.0-41349093937
Nåsell I.,,Stochastic models of some endemic infections,2002,Mathematical Biosciences,113,10.1016/S0025-5564(02)00098-6,Sweden,Article,Stockholm,0,Journal,2-s2.0-0036293119
Leone M.,,Ferromagnetic ordering in graphs with arbitrary degree distribution,2002,European Physical Journal B,170,10.1140/epjb/e2002-00220-0,Italy,Article,Genoa,0,Journal,2-s2.0-19044366730
Yamada H.,,Phase-locked and phase-drift solutions of phase oscillators with asymmetric coupling strengths,2002,Progress of Theoretical Physics,3,10.1143/PTP.108.13,Japan,Article,Nagoya,1,Journal,2-s2.0-0036653899
Aleksiejuk A.,,Ferromagnetic phase transition in Barabási-Albert networks,2002,Physica A: Statistical Mechanics and its Applications,180,10.1016/S0378-4371(02)00740-9,Poland,Article,Warsaw,0,Journal,2-s2.0-0036644717
Dorogovtsev S.N.,,Pseudofractal scale-free web,2002,"Physical Review E - Statistical Physics, Plasmas, Fluids, and Related Interdisciplinary Topics",384,10.1103/PhysRevE.65.066122,Portugal;Russian Federation,Article,Porto;Saint Petersburg (ex Leningrad),0,Journal,2-s2.0-41349104020
Herrero C.P.,,Ising model in small-world networks,2002,"Physical Review E - Statistical Physics, Plasmas, Fluids, and Related Interdisciplinary Topics",138,10.1103/PhysRevE.65.066110,Spain,Article,Cantoblanco,0,Journal,2-s2.0-41349106526
Kwon O.,,Coherence resonance in small-world networks of excitable cells,2002,"Physics Letters, Section A: General, Atomic and Solid State Physics",114,10.1016/S0375-9601(02)00575-3,South Korea,Article,Yusong,0,Journal,2-s2.0-0037124310
Dorogovtsev S.,,Evolution of networks,2002,Advances in Physics,2215,10.1080/00018730110112519,Portugal,Article,Porto,0,Journal,2-s2.0-0036610173
De Arcangelis L.,,Self-organized criticality on small world networks,2002,Physica A: Statistical Mechanics and its Applications,44,10.1016/S0378-4371(02)00549-6,Italy,Article,Naples,0,Journal,2-s2.0-0037092917
Maslov S.,,Specificity and stability in topology of protein networks,2002,Science,1958,10.1126/science.1065103,United States,Article,Upton,0,Journal,2-s2.0-0037012880
Jung S.,,Geometric fractal growth model for scale-free networks,2002,"Physical Review E - Statistical, Nonlinear, and Soft Matter Physics",139,10.1103/PhysRevE.65.056101,South Korea,Article,Pohang,0,Journal,2-s2.0-41349097240
Dezso Z.,,Halting viruses in scale-free networks,2002,"Physical Review E - Statistical, Nonlinear, and Soft Matter Physics",401,10.1103/PhysRevE.65.055103,United States,Article,Notre Dame,0,Journal,2-s2.0-41349118476
Watts D.,,A simple model of global cascades on random networks,2002,Proceedings of the National Academy of Sciences of the United States of America,1444,10.1073/pnas.082090499,United States,Article,New York,1,Journal,2-s2.0-0037197979
Moreno Y.,,Epidemic outbreaks in complex heterogeneous networks,2002,European Physical Journal B,712,10.1007/s10051-002-8996-y,Italy,Article,Trieste,0,Journal,2-s2.0-0000494582
Willinger W.,,Scaling phenomena in the internet: Critically examining criticality,2002,Proceedings of the National Academy of Sciences of the United States of America,146,10.1073/pnas.012583099,United States,Article,Florham Park,1,Journal,2-s2.0-0037133194
Lancaster D.,,Cluster growth in two growing network models,2002,Journal of Physics A: Mathematical and General,14,10.1088/0305-4470/35/5/305,United Kingdom,Article,London,0,Journal,2-s2.0-0037040139
Burda Z.,,Wealth condensation in pareto macroeconomics,2002,"Physical Review E - Statistical, Nonlinear, and Soft Matter Physics",63,10.1103/PhysRevE.65.026102,Poland;Germany,Article,Krakow;Bielefeld,0,Journal,2-s2.0-36448948398
Sánchez A.D.,,Nonequilibrium phase transitions in directed small-world networks,2002,Physical Review Letters,120,,Spain,Article,Santander,0,Journal,2-s2.0-19044394391
Newman M.E.J.,,Percolation and epidemics in a two-dimensional small world,2002,"Physical Review E - Statistical Physics, Plasmas, Fluids, and Related Interdisciplinary Topics",113,10.1103/PhysRevE.65.021904,United States,Article,Santa Fe,0,Journal,2-s2.0-84872123888
Berg J.,,Correlated Random Networks,2002,Physical Review Letters,129,10.1103/PhysRevLett.89.228701,Germany,Article,Koln,0,Journal,2-s2.0-18744409361
Mulet R.,,Coloring Random Graphs,2002,Physical Review Letters,146,10.1103/PhysRevLett.89.268701,Cuba;Italy,Article,Havana;Trieste,0,Journal,2-s2.0-0037165015
Jost J.,,Spectral properties and synchronization in coupled map lattices,2002,"Physical Review E - Statistical Physics, Plasmas, Fluids, and Related Interdisciplinary Topics",236,10.1103/PhysRevE.65.016201,United States;Germany,Article,Santa Fe;Leipzig,0,Journal,2-s2.0-37649032132
Hong H.,,Synchronization on small-world networks,2002,"Physical Review E - Statistical Physics, Plasmas, Fluids, and Related Interdisciplinary Topics",354,10.1103/PhysRevE.65.026139,South Korea,Article,Seoul,0,Journal,2-s2.0-33646968991
Guimerà R.,,Optimal Network Topologies for Local Search with Congestion,2002,Physical Review Letters,463,10.1103/PhysRevLett.89.248701,Spain,Article,Tarragona,0,Journal,2-s2.0-0037049530
Pastor-Satorras R.,,Epidemic dynamics in finite size scale-free networks,2002,"Physical Review E - Statistical Physics, Plasmas, Fluids, and Related Interdisciplinary Topics",522,10.1103/PhysRevE.65.035108,Spain,Article,Barcelona,0,Journal,2-s2.0-41349112686
Caldarelli G.,,Scale-Free Networks from Varying Vertex Intrinsic Fitness,2002,Physical Review Letters,530,10.1103/PhysRevLett.89.258702,Italy,Article,Genoa,0,Journal,2-s2.0-18744380679
Wang X.,,Synchronization in small-world dynamical networks,2002,International Journal of Bifurcation and Chaos in Applied Sciences and Engineering,749,10.1142/S0218127402004292,China,Article,Shanghai,0,Journal,2-s2.0-0036340313
Pastor-Satorras R.,,Immunization of complex networks,2002,"Physical Review E - Statistical Physics, Plasmas, Fluids, and Related Interdisciplinary Topics",799,10.1103/PhysRevE.65.036104,Spain,Article,Barcelona,0,Journal,2-s2.0-41349106738
Newman M.,,Assortative Mixing in Networks,2002,Physical Review Letters,3012,10.1103/PhysRevLett.89.208701,United States,Article,Ann Arbor,0,Journal,2-s2.0-18744389789
Goh K.I.,,Universal behavior of load distribution in scale-free networks,2001,Physical Review Letters,825,,South Korea,Article,Seoul,0,Journal,2-s2.0-0035981014
Borgs C.,,The birth of the infinite cluster: Finite-Size scaling in percolation,2001,Communications in Mathematical Physics,46,10.1007/s002200100521,United States,Article,Redmond,0,Journal,2-s2.0-0035539932
Bauer M.,,Core percolation in random graphs: A critical phenomena analysis,2001,European Physical Journal B,68,10.1007/s10051-001-8683-4,France,Article,Gif-sur-Yvette,0,Journal,2-s2.0-0001327869
Dorogovtsev S.N.,,Anomalous percolation properties of growing networks,2001,"Physical Review E - Statistical, Nonlinear, and Soft Matter Physics",83,,Portugal,Article,Porto,0,Journal,2-s2.0-0035689340
Pȩkalski A.,,Ising model on a small world network,2001,"Physical Review E - Statistical, Nonlinear, and Soft Matter Physics",74,,Poland,Article,Wroclaw,0,Journal,2-s2.0-0035510517
Barabási A.,,Deterministic scale-free networks,2001,Physica A: Statistical Mechanics and its Applications,333,10.1016/S0378-4371(01)00369-7,United States,Article,Notre Dame,0,Journal,2-s2.0-0035887972
Callaway D.S.,,Are randomly grown graphs really random?,2001,"Physical Review E - Statistical, Nonlinear, and Soft Matter Physics",281,,United States,Article,Ithaca,0,Journal,2-s2.0-0035474697
Ozana M.,,Incipient spanning cluster on small-world networks,2001,Europhysics Letters,22,10.1209/epl/i2001-00346-7,Sweden,Article,Umea,0,Journal,2-s2.0-0035797769
Svenson P.,,Freezing in random graph ferromagnets,2001,"Physical Review E - Statistical, Nonlinear, and Soft Matter Physics",27,,Sweden,Article,Gothenburg,0,Journal,2-s2.0-0035442717
Dorogovtsev S.N.,,Giant strongly connected component of directed networks,2001,"Physical Review E - Statistical, Nonlinear, and Soft Matter Physics",217,,Portugal;Russian Federation,Article,Porto;Saint Petersburg (ex Leningrad),0,Journal,2-s2.0-17744419466
Newman M.E.J.,,Random graphs with arbitrary degree distributions and their applications,2001,"Physical Review E - Statistical, Nonlinear, and Soft Matter Physics",2213,,United States;United States,Article,Santa Fe;Ithaca,0,Journal,2-s2.0-0035420732
Bianconi G.,,Bose-Einstein condensation in complex networks,2001,Physical Review Letters,471,10.1103/PhysRevLett.86.5632,United States,Article,Notre Dame,0,Journal,2-s2.0-9744225341
Cohen R.,,Breakdown of the internet under intentional attack,2001,Physical Review Letters,1004,10.1103/PhysRevLett.86.3682,Israel,Article,Ramat Gan,0,Journal,2-s2.0-0035896667
Arenas A.,,Communication in networks with hierarchical branching,2001,Physical Review Letters,357,10.1103/PhysRevLett.86.3196,Spain,Article,Tarragona,0,Journal,2-s2.0-0035794255
Pastor-Satorras R.,,Epidemic spreading in scale-free networks,2001,Physical Review Letters,3738,10.1103/PhysRevLett.86.3200,Spain,Article,Barcelona,0,Journal,2-s2.0-0035794256
Bauer M.,,Exactly solvable model with two conductor-insulator transitions driven by impurities,2001,Physical Review Letters,19,10.1103/PhysRevLett.86.2621,France,Article,Gif-sur-Yvette,0,Journal,2-s2.0-0035911705
Mézard M.,,The Bethe lattice spin glass revisited,2001,European Physical Journal B,552,10.1007/PL00011099,France,Article,Orsay,0,Journal,2-s2.0-0038401954
Solé R.V.,,Information transfer and phase transitions in a model of internet traffic,2001,Physica A: Statistical Mechanics and its Applications,158,10.1016/S0378-4371(00)00536-7,United States;Spain,Article,Santa Fe;Barcelona,0,Journal,2-s2.0-0035863447
Weigt M.,,Minimal vertex covers on finite-connectivity random graphs: A hard-sphere lattice-gas picture,2001,"Physical Review E - Statistical Physics, Plasmas, Fluids, and Related Interdisciplinary Topics",69,10.1103/PhysRevE.63.056127,Germany,Article,Gottingen,0,Journal,2-s2.0-0035334408
Kim B.J.,,XY model in small-world networks,2001,"Physical Review E - Statistical, Nonlinear, and Soft Matter Physics",119,10.1103/PhysRevE.64.056135,Sweden,Article,Umea,0,Journal,2-s2.0-0035510374
Burda Z.,,Statistical ensemble of scale-free random graphs,2001,"Physical Review E - Statistical, Nonlinear, and Soft Matter Physics",139,10.1103/PhysRevE.64.046118,Poland;Germany,Article,Krakow;Bielefeld,0,Journal,2-s2.0-0035475792
Dorogovtsev S.N.,,Scaling properties of scale-free evolving networks: Continuous approach,2001,"Physical Review E - Statistical Physics, Plasmas, Fluids, and Related Interdisciplinary Topics",195,10.1103/PhysRevE.63.056125,Portugal,Article,Porto,0,Journal,2-s2.0-0035334069
Dorogovtsev S.N.,,Size-dependent degree distribution of a scale-free growing network,2001,"Physical Review E - Statistical Physics, Plasmas, Fluids, and Related Interdisciplinary Topics",204,10.1103/PhysRevE.63.062101,Portugal;Russian Federation,Article,Porto;Saint Petersburg (ex Leningrad),0,Journal,2-s2.0-0035365355
May R.M.,,Infection dynamics on scale-free networks,2001,"Physical Review E - Statistical, Nonlinear, and Soft Matter Physics",552,10.1103/PhysRevE.64.066112,United Kingdom,Article,Oxford,0,Journal,2-s2.0-0035689341
Callaway D.,,Network robustness and fragility: percolation on random graphs,2000,Physical Review Letters,1632,10.1103/PhysRevLett.85.5468,United States,Article,Ithaca,0,Journal,2-s2.0-4243939794
Gitterman M.,,Small-world phenomena in physics: The Ising model,2000,Journal of Physics A: Mathematical and General,118,10.1088/0305-4470/33/47/304,Israel,Article,Ramat Gan,0,Journal,2-s2.0-0034368612
Krapivsky P.,,Connectivity of growing random networks,2000,Physical Review Letters,817,10.1103/PhysRevLett.85.4629,France;United States,Article,Toulouse;Boston,0,Journal,2-s2.0-0034310714
Dorogovtsev S.,,Structure of growing networks with preferential linking,2000,Physical Review Letters,933,10.1103/PhysRevLett.85.4633,Portugal;Russian Federation,Article,Porto;Saint Petersburg (ex Leningrad),0,Journal,2-s2.0-0034310713
Cohen R.,,Resilience of the Internet to random breakdowns,2000,Physical Review Letters,1644,10.1103/PhysRevLett.85.4626,Israel,Article,Ramat Gan,0,Journal,2-s2.0-0034323311
Hinrichsen H.,,Non-equilibrium critical phenomena and phase transitions into absorbing states,2000,Advances in Physics,1205,10.1080/00018730050198152,Germany,Article,Essen,0,Journal,2-s2.0-0034334818
Freeman W.,,Learning low-level vision,2000,International Journal of Computer Vision,1148,10.1023/A:1026501619075,United States,Article,Cambridge,0,Journal,2-s2.0-0034291933
Strogatz S.,,From Kuramoto to Crawford: Exploring the onset of synchronization in populations of coupled oscillators,2000,Physica D: Nonlinear Phenomena,1699,10.1016/S0167-2789(00)00094-4,United States,Article,Ithaca,0,Journal,2-s2.0-0039592729
Kleinberg J.,,Navigation in a small world,2000,Nature,1147,10.1038/35022643,United States,Article,Ithaca,0,Journal,2-s2.0-0343441557
Albert R.,,Error and attack tolerance of complex networks,2000,Nature,5597,10.1038/35019019,United States,Article,Notre Dame,0,Journal,2-s2.0-0034721164
Bialas P.,,Finite size scaling of the balls in boxes model,2000,Nuclear Physics B,24,10.1016/S0550-3213(00)00114-0,Poland;Germany,Article,Krakow;Bielefeld,0,Journal,2-s2.0-0001562247
Barrat A.,,On the properties of small-world network models,2000,European Physical Journal B,609,10.1007/s100510050067,France,Article,Saint-Aubin,0,Journal,2-s2.0-0042527883
Guardiola X.,,"Synchronization, diversity, and topology of networks of integrate and fire oscillators",2000,"Physical Review E - Statistical Physics, Plasmas, Fluids, and Related Interdisciplinary Topics",54,10.1103/PhysRevE.62.5565,Spain,Article,Barcelona,0,Journal,2-s2.0-0034296001
Weigt M.,,Number of guards needed by a museum: A phase transition in vertex covering of random graphs,2000,Physical Review Letters,115,10.1103/PhysRevLett.84.6118,Germany,Article,Gottingen,0,Journal,2-s2.0-0343536437
Moore C.,,Exact solution of site and bond percolation on small-world networks,2000,"Physical Review E - Statistical Physics, Plasmas, Fluids, and Related Interdisciplinary Topics",148,10.1103/PhysRevE.62.7059,United States;United States,Article,Albuquerque;Santa Fe,0,Journal,2-s2.0-0034310659
Gade P.M.,,Synchronous chaos in coupled map lattices with small-world interactions,2000,"Physical Review E - Statistical Physics, Plasmas, Fluids, and Related Interdisciplinary Topics",222,10.1103/PhysRevE.62.6409,Taiwan,Article,Taipei,0,Journal,2-s2.0-0034316686
Lago-Fernández L.,,Fast response and temporal coherent oscillations in small-world networks,2000,Physical Review Letters,485,10.1103/PhysRevLett.84.2758,Spain,Article,Madrid,0,Journal,2-s2.0-0034688893
Newman M.E.J.,,Models of the small world,2000,Journal of Statistical Physics,519,10.1023/a:1026485807148,United States,Article,Santa Fe,0,Journal,2-s2.0-0034310033
Moore C.,,Epidemics and percolation in small-world networks,2000,"Physical Review E - Statistical Physics, Plasmas, Fluids, and Related Interdisciplinary Topics",664,10.1103/PhysRevE.61.5678,United States;Mexico,Article,Albuquerque;,0,Journal,2-s2.0-0034186340
Newman M.E.J.,,Renormalization group analysis of the small-world network model,1999,"Physics Letters, Section A: General, Atomic and Solid State Physics",1023,10.1016/S0375-9601(99)00757-4,United States,Article,Santa Fe,0,Journal,2-s2.0-0347334779
Walsh T.,,Search in a small world,1999,IJCAI International Joint Conference on Artificial Intelligence,164,,United Kingdom,Conference Paper,Glasgow,0,Conference Proceeding,2-s2.0-84880648873
Barabási A.,,Emergence of scaling in random networks,1999,Science,22122,10.1126/science.286.5439.509,United States,Article,Notre Dame,0,Journal,2-s2.0-0038483826
Albert R.,,Diameter of the world-wide web,1999,Nature,3115,10.1038/43601,United States,Article,Notre Dame,0,Journal,2-s2.0-0033539175
Svenson P.,,Relaxation in graph coloring and satisfiability problems,1999,"Physical Review E - Statistical Physics, Plasmas, Fluids, and Related Interdisciplinary Topics",20,10.1103/PhysRevE.59.3983,Sweden,Article,Gothenburg,0,Journal,2-s2.0-0000757560
Newman M.E.J.,,Scaling and percolation in the small-world network model,1999,"Physical Review E - Statistical Physics, Plasmas, Fluids, and Related Interdisciplinary Topics",891,10.1103/PhysRevE.60.7332,Mexico,Article,,0,Journal,2-s2.0-0033487710
Watts D.J.,,Collective dynamics of 'small-world9 networks,1998,Nature,25779,10.1038/30918,United States,Article,Ithaca,0,Journal,2-s2.0-0032482432
Johnston D.A.,,Equivalence of ferromagnetic spin models on trees and random graphs,1998,Journal of Physics A: Mathematical and General,16,10.1088/0305-4470/31/2/009,United Kingdom,Article,Edinburgh,0,Journal,2-s2.0-0032535929
Stošić T.,,Exact zero-field susceptibility of the Ising model on a Cayley tree,1998,Journal of Magnetism and Magnetic Materials,12,10.1016/s0304-8853(97)00329-6,Serbia,Article,Belgrade,0,Journal,2-s2.0-0031685744
Ohira T.,,Phase transition in a computer network traffic model,1998,"Physical Review E - Statistical Physics, Plasmas, Fluids, and Related Interdisciplinary Topics",220,10.1103/PhysRevE.58.193,Japan,Article,Tokyo,0,Journal,2-s2.0-0001087706
Molloy M.,,The Size of the Giant Component of a Random Graph with a Given Degree Sequence,1998,Combinatorics Probability and Computing,533,10.1017/S0963548398003526,Canada,Article,Toronto,0,Journal,2-s2.0-0032286776
McEliece R.J.,,"Turbo decoding as an instance of Pearl's ""belief propagation"" algorithm",1998,IEEE Journal on Selected Areas in Communications,524,10.1109/49.661103,United States;United Kingdom;United States;United States;United States;United States,Article,Pasadena;Cambridge;Pasadena;Urbana;New York;,0,Journal,2-s2.0-0032001728
Pecora L.,,Master stability functions for synchronized coupled systems,1998,Physical Review Letters,1764,10.1103/PhysRevLett.80.2109,United States,Article,"Washington, D.C.",0,Journal,2-s2.0-4243241129
Bialas P.,,Condensation in the backgammon model,1997,Nuclear Physics B,109,10.1016/S0550-3213(97)00192-2,Netherlands;Poland,Article,Amsterdam;Krakow,0,Journal,2-s2.0-0031548119
Tanaka H.,,First order phase transition resulting from finite inertia in coupled oscillator systems,1997,Physical Review Letters,117,10.1103/PhysRevLett.78.2104,United States,Article,Berkeley,0,Journal,2-s2.0-4243988567
Luijten E.,,Classical critical behavior of spin models with long-range interactions,1997,Physical Review B - Condensed Matter and Materials Physics,163,10.1103/PhysRevB.56.8945,Netherlands,Article,Delft,0,Journal,2-s2.0-0000683629
Mélin R.,,Glassy behaviour in the ferromagnetic Ising model on a Cayley tree,1996,Journal of Physics A: Mathematical and General,29,10.1088/0305-4470/29/18/011,France,Article,Grenoble,0,Journal,2-s2.0-0001076503
Pittel B.,,Sudden emergence of a giant k-core in a random graph,1996,Journal of Combinatorial Theory. Series B,256,10.1006/jctb.1996.0036,United States,Article,Columbus,1,Journal,2-s2.0-0030144334
Baillie C.,,Spin glasses on thin graphs,1995,"Nuclear Physics, Section B",14,10.1016/0550-3213(95)00328-P,United States,Article,Boulder,0,Journal,2-s2.0-0006753767
Bonabeau E.,,Sandpile Dynamics on Random Graphs,1995,Journal of the Physical Society of Japan,32,10.1143/JPSJ.64.327,France,Note,Issy-les-Moulineaux,0,Journal,2-s2.0-21844524714
Antoni M.,,Clustering and relaxation in Hamiltonian long-range dynamics,1995,Physical Review E,433,10.1103/PhysRevE.52.2361,France;Italy,Article,Toulouse;Genoa,1,Journal,2-s2.0-0001214534
Molloy M.,,A critical point for random graphs with a given degree sequence,1995,Random Structures &amp; Algorithms,1427,10.1002/rsa.3240060204,United States,Article,Pittsburgh,0,Journal,2-s2.0-84990671447
