Authors,Author(s) ID,Title,Year,Source tittle,Cited by,DOI,Country,Document Type,City,Access Type,aggregationType,EID
Arendt C.W.,,HIV: Master of the host cell,2001,Genome Biology,25,,United States,Short Survey,Chevy Chase,0,Journal,2-s2.0-0035175924
Quackenbush J.,,Computational analysis of microarray data,2001,Nature Reviews Genetics,1119,10.1038/35076576,United States,Review,Rockville,0,Journal,2-s2.0-0035375137
Del Corno M.,,"HIV-1 gp120 and chemokine activation of Pyk2 and mitogen-activated protein kinases in primary macrophages mediated by calcium-dependent, pertussis toxin-insensitive chemokine receptor signaling",2001,Blood,120,10.1182/blood.V98.10.2909,Belgium;Italy;United States,Article,Leuven;Rome;Philadelphia,0,Journal,2-s2.0-0035892099
Lane B.,,Interleukin-8 stimulates human immunodeficiency virus Type 1 replication and is a potential new target for antiretroviral therapy,2001,Journal of Virology,107,10.1128/JVI.75.17.8195-8202.2001,,Article,,1,Journal,2-s2.0-0034879050
Corbeil J.,,Temporal gene regulation during HIV-1 infection of human CD4<sup>+</sup> T cells,2001,Genome Research,95,10.1101/gr.GR-1802R,United States;United States,Letter,San Diego;,1,Journal,2-s2.0-0034916701
Liao Z.,,Lipid rafts and HIV pathogenesis: Host membrane cholesterol is required for infection by HIV type 1,2001,AIDS Research and Human Retroviruses,271,10.1089/088922201300343690,United States,Article,Baltimore,0,Journal,2-s2.0-0034834457
Stantchev T.,,Human immunodeficiency virus type-1 and chemokines: Beyond competition for common cellular receptors,2001,Cytokine and Growth Factor Reviews,72,10.1016/S1359-6101(00)00033-2,United States,Review,Bethesda,0,Journal,2-s2.0-0034955071
Lane B.,,Human immunodeficiency virus type 1 (HIV-1)-induced GRO-α production stimulates HIV-1 replication in macrophages and T lymphocytes,2001,Journal of Virology,34,10.1128/JVI.75.13.5812-5822.2001,,Article,,1,Journal,2-s2.0-0034978985
Tusher V.G.,,Significance analysis of microarrays applied to the ionizing radiation response,2001,Proceedings of the National Academy of Sciences of the United States of America,9216,10.1073/pnas.091062498,United States,Article,Palo Alto,1,Journal,2-s2.0-0035942271
Dermine J.F.,,Flotillin-1-enriched Lipid Raft Domains Accumulate on Maturing Phagosomes,2001,Journal of Biological Chemistry,235,10.1074/jbc.M101113200,Canada,Article,Montreal,1,Journal,2-s2.0-0035947599
Shukla A.,,Regulated exocytosis in immune function: Are SNARE-proteins involved?,2001,Respiratory Medicine,6,10.1053/rmed.2001.1167,Denmark,Review,Aarhus,1,Journal,2-s2.0-0034752510
Eckstein D.,,HIV-1 actively replicates in naive CD4<sup>+</sup> T cells residing within human lymphoid tissues,2001,Immunity,189,10.1016/S1074-7613(01)00217-5,United States;United States,Article,San Francisco;San Francisco,1,Journal,2-s2.0-17944375042
Simmons A.,,Nef triggers a transcriptional program in T cells imitating single-signal T cell activation and inducing HIV virulence mediators,2001,Immunity,218,10.1016/S1074-7613(01)00158-3,United Kingdom,Article,Oxford,1,Journal,2-s2.0-0034948709
Jones M.V.,,Immunolocalization of HIV envelope gp120 in HIV encephalitis with dementia,2000,AIDS,99,10.1097/00002030-200012010-00010,United States,Article,Lexington,0,Journal,2-s2.0-0034495603
Parsons J.,,Focal Adhesion Kinase: A regulator of focal adhesion dynamics and cell movement,2000,Oncogene,530,10.1038/sj.onc.1203877,United States,Review,Charlottesville,1,Journal,2-s2.0-0034693854
Popik W.,,Exploitation of cellular signaling by HIV-1: Unwelcome guests with master keys that signal their entry,2000,Virology,68,10.1006/viro.2000.0581,United States;United States,Article,Baltimore;Baltimore,1,Journal,2-s2.0-0034633829
Arthos J.,,CCR5 signal transduction in macrophages by human immunodeficiency virus and simian immunodeficiency virus envelopes,2000,Journal of Virology,84,10.1128/JVI.74.14.6418-6424.2000,United States;United States,Article,Bethesda;Bethesda,1,Journal,2-s2.0-0033918949
Popik W.,,Inhibition of CD3/CD28-mediated activation of the MEK/ERK signaling pathway represses replication of X4 but not R5 human immunodeficiency virus type 1 in peripheral blood CD4<sup>+</sup> T lymphocytes,2000,Journal of Virology,39,10.1128/JVI.74.6.2558-2566.2000,United States;United States,Article,Baltimore;Baltimore,1,Journal,2-s2.0-0034005659
Blaak H.,,In vivo HIV-1 infection of CD45RA<sup>+</sup>CD4<sup>+</sup> T cells is established primarily by syncytium-inducing variants and correlates with the rate of CD4<sup>+</sup> T cell decline,2000,Proceedings of the National Academy of Sciences of the United States of America,220,10.1073/pnas.97.3.1269,Netherlands,Article,Amsterdam,1,Journal,2-s2.0-0033961745
Geiss G.,,Large-scale monitoring of host cell gene expression during HIV-1 infection using cDNA microarrays,2000,Virology,221,10.1006/viro.1999.0044,United States,Article,Seattle,1,Journal,2-s2.0-0034606682
Bentz J.,,Deployment of membrane fusion protein domains during fusion,2000,Cell Biology International,33,10.1006/cbir.2000.0632,United States,Article,Philadelphia,0,Journal,2-s2.0-0033740756
Cron R.Q.,,NFAT1 enhances HIV-1 gene expression in primary human CD4 T cells,2000,Clinical Immunology,92,10.1006/clim.1999.4831,United States,Article,Stanford,0,Journal,2-s2.0-0034011644
Kinter A.,,"Chemokines, cytokines and HIV: A complex network of interactions that influence HIV pathogenesis",2000,Immunological Reviews,93,10.1034/j.1600-065X.2000.17708.x,,Review,,0,Journal,2-s2.0-0033659666
Zhang Z.,,Sexual transmission and propagation of SIV and HIV in resting and activated CD4<sup>+</sup> T cells,1999,Science,694,10.1126/science.286.5443.1353,United States,Article,Minneapolis,0,Journal,2-s2.0-0032742547
Cicala C.,,Induction of phosphorylation and intracellular association of CC chemokine receptor 5 and focal adhesion kinase in primary human CD4<sup>+</sup> T cells by macrophage-tropic HIV envelope,1999,Journal of Immunology,89,,United States,Article,Bethesda,0,Journal,2-s2.0-0033168542
Gerst J.,,SNAREs and SNARE regulators in membrane fusion and exocytosis,1999,Cellular and Molecular Life Sciences,181,10.1007/s000180050328,Israel,Review,Rehovot,0,Journal,2-s2.0-0033065245
Ostrowski M.A.,,Both memory and CD45RA<sup>+</sup>/CD62L<sup>+</sup> naive CD4<sup>+</sup> T cells are infected in human immunodeficiency virus type 1-infected individuals,1999,Journal of Virology,181,10.1128/jvi.73.8.6430-6435.1999,United States,Article,Bethesda,1,Journal,2-s2.0-0032775436
Kinoshita S.,,Host control of HIV-1 parasitism in T cells by the nuclear factor of activated T cells,1998,Cell,191,10.1016/S0092-8674(00)81630-X,United States,Article,Stanford,1,Journal,2-s2.0-0032567042
Kelly M.,,Cutting edge: Dichotomous effects of β-chemokines on HIV replication in monocytes and monocyte-derived macrophages,1998,Journal of Immunology,89,,Australia,Article,Sydney,0,Journal,2-s2.0-0032038626
Weissman D.,,Macrophage-tropic HIV and SIV envelope proteins induce a signal through the CCR5 chemokine receptor,1997,Nature,298,10.1038/40173,United States,Article,Philadelphia,0,Journal,2-s2.0-0030724356
Davis C.B.,,Signal transduction due to HIV-1 envelope interactions with chernokine receptors CXCR4 or CCR5,1997,Journal of Experimental Medicine,336,10.1084/jem.186.10.1793,United States,Article,New York,1,Journal,2-s2.0-0030695342
Rao A.,,Transcription factors of the NFAT family: Regulation and function,1997,Annual Review of Immunology,2076,10.1146/annurev.immunol.15.1.707,United States,Review,Boston,0,Book Series,2-s2.0-0030973579
Bassuk A.G.,,Physical interactions between Ets and NF-κB/NFAT proteins play an important role in their cooperative activation of the human immunodeficiency virus enhancer in T cells,1997,Journal of Virology,111,10.1128/jvi.71.5.3563-3573.1997,United States,Article,Chicago,1,Journal,2-s2.0-0030978193
Fauci A.,,Host factors and the pathogenesis of HIV-induced disease,1996,Nature,730,10.1038/384529a0,United States,Review,Bethesda,0,Journal,2-s2.0-0029805203
Kinter A.,,HIV replication in CD4<sup>+</sup> T cells of HIV-infected individuals is regulated by a balance between the viral suppressive effects of endogenous β-chemokines and the viral inductive effects of other endogenous cytokines,1996,Proceedings of the National Academy of Sciences of the United States of America,104,10.1073/pnas.93.24.14076,United States,Article,Bethesda,1,Journal,2-s2.0-0030465244
Li W.,,Regulation of the nuclear factor of activated T cells in stably transfected Jurkat cell clones,1996,Biochemical and Biophysical Research Communications,12,10.1006/bbrc.1996.0187,United States,Article,New Haven,0,Journal,2-s2.0-0030045730
Mossman S.P.,,Protection against lethal simian immunodeficiency virus SIVsmmPBj14 disease by a recombinant Semliki forest virus gp160 vaccine and by a gp120 subunit vaccine,1996,Journal of Virology,139,10.1128/jvi.70.3.1953-1960.1996,United States;United States,Article,Seattle;Fort Collins,1,Journal,2-s2.0-0344192533
Hivroz C.,,Human immunodeficiency virus gp120 and derived peptides activate protein tyrosine kinase p56<sup>Ick</sup> in human CD4 T lymphocytes,1993,European Journal of Immunology,111,10.1002/eji.1830230303,Canada,Article,Montreal,0,Journal,2-s2.0-0027476817
Bukrinsky M.,,A nuclear localization signal within HIV-1 matrix protein that governs infection of non-dividing cells,1993,Nature,708,10.1038/365666a0,United States;United States,Article,Omaha;Manhasset,0,Journal,2-s2.0-0027376309
Oh S.K.,,Identification of hIV-1 envelope glycoprotein in the serum of aids and arc patients,1992,Journal of Acquired Immune Deficiency Syndromes,198,10.1097/00126334-199203000-00005,,Article,,0,Journal,2-s2.0-0026588930
Zack J.A.,,Incompletely reverse-transcribed human immunodeficiency virus type 1 genomes in quiescent cells can function as intermediates in the retroviral life cycle,1992,Journal of Virology,344,10.1128/jvi.66.3.1717-1725.1992,United States,Article,Los Angeles,1,Journal,2-s2.0-0026526144
Zack J.,,HIV-1 production from infected peripheral blood T cells after HTLV-I induced mitogenic stimulation,1988,Science,118,10.1126/science.2835813,,Article,,0,Journal,2-s2.0-0023910959
Kornfeld H.,,Lymphocyte activation by HIV-1 envelope glycoprotein,1988,Nature,179,10.1038/335445a0,United States,Article,Boston,0,Journal,2-s2.0-0023759046
Koyanagi Y.,,Dual infection of the central nervous system by AIDS viruses with distinct cellular tropisms,1987,Science,603,10.1126/science.3646751,United States,Article,Los Angeles,0,Journal,2-s2.0-0023214674
