Authors,Author(s) ID,Title,Year,Source tittle,Cited by,DOI,Country,Document Type,City,Access Type,aggregationType,EID
Plummer M.,,Global burden of gastric cancer attributable to pylori,2015,International Journal of Cancer,307,10.1002/ijc.28999,France,Article,Lyon,1,Journal,2-s2.0-84912068268
Ford A.C.,,Helicobacter pylorieradication therapy to prevent gastric cancer in healthy asymptomatic infected individuals: Systematic review and meta-analysis of randomised controlled trials,2014,BMJ (Online),319,10.1136/bmj.g3174,United Kingdom;United Kingdom,Article,Leeds;Leeds,1,Journal,2-s2.0-84901390048
Gatta L.,,Global eradication rates for Helicobacter pylori infection: Systematic review and meta-analysis of sequential therapy,2013,BMJ (Online),188,10.1136/bmj.f4587,Italy;Italy,Article,Parma;Parma,1,Journal,2-s2.0-84882442131
Lansdorp-Vogelaar I.,,Cost-effectiveness of screening and treating Helicobacter pylori for gastric cancer prevention,2013,Best Practice and Research: Clinical Gastroenterology,41,10.1016/j.bpg.2013.09.005,Netherlands,Review,Rotterdam,0,Journal,2-s2.0-84887137683
Ma J.L.,,"Fifteen-year effects of helicobacter pylori, garlic, and vitamin treatments on gastric cancer incidence and mortality",2012,Journal of the National Cancer Institute,257,10.1093/jnci/djs003,China,Article,Beijing,0,Journal,2-s2.0-84859065840
Mariotto A.B.,,Projections of the cost of cancer care in the United States: 2010-2020,2011,Journal of the National Cancer Institute,1448,10.1093/jnci/djq495,United States,Article,Bethesda,1,Journal,2-s2.0-79251470391
Lane J.A.,,"Impact of Helicobacter pylori eradication on dyspepsia, health resource use, and quality of life in the Bristol helicobacter project: Randomised controlled trial",2006,British Medical Journal,46,10.1136/bmj.38702.662546.55,United Kingdom,Article,Bristol,0,Journal,2-s2.0-31644435845
