Authors,Author(s) ID,Title,Year,Source tittle,Cited by,DOI,Country,Document Type,City,Access Type,aggregationType,EID
Shi L.,,hsa-mir-181a and hsa-mir-181b function as tumor suppressors in human glioma cells,2008,Brain Research,334,10.1016/j.brainres.2008.07.085,China,Article,Nanjing,0,Journal,2-s2.0-53049107572
Asangani I.,,"MicroRNA-21 (miR-21) post-transcriptionally downregulates tumor suppressor Pdcd4 and stimulates invasion, intravasation and metastasis in colorectal cancer",2008,Oncogene,1424,10.1038/sj.onc.1210856,Germany,Article,Mannheim,1,Journal,2-s2.0-41749113108
Dalmay T.,,MicroRNAs and cancer,2008,Journal of Internal Medicine,111,10.1111/j.1365-2796.2008.01926.x,United Kingdom,Review,Norwich,1,Journal,2-s2.0-40349100260
Frankel L.,,Programmed cell death 4 (PDCD4) is an important functional target of the microRNA miR-21 in breast cancer cells,2008,Journal of Biological Chemistry,897,10.1074/jbc.M707224200,Denmark,Article,Copenhagen,1,Journal,2-s2.0-38149042783
Nicoloso M.,,MicroRNA involvement in brain tumors: From bench to bedside,2008,Brain Pathology,78,10.1111/j.1750-3639.2007.00119.x,United States,Conference Paper,Houston,1,Journal,2-s2.0-38349131955
Cho W.,,OncomiRs: The discovery and progress of microRNAs in cancers,2007,Molecular Cancer,576,10.1186/1476-4598-6-60,China,Review,Hong Kong,1,Journal,2-s2.0-36649025655
Ro S.,,Tissue-dependent paired expression of miRNAs,2007,Nucleic Acids Research,232,10.1093/nar/gkm641,United States,Article,Reno,1,Journal,2-s2.0-34848860582
Gillies J.K.,,Report regulation of p27<sup>Kip1</sup> by miRNA 221/222 in glioblastoma,2007,Cell Cycle,198,10.4161/cc.6.16.4526,Canada;Canada,Article,Ottawa;Ottawa,1,Journal,2-s2.0-34548268220
Le Sage C.,,Regulation of the p27<sup>Kip1</sup> tumor suppressor by miR-221 and miR-222 promotes cancer cell proliferation,2007,EMBO Journal,642,10.1038/sj.emboj.7601790,Netherlands,Article,Amsterdam,0,Journal,2-s2.0-34547791273
Louis D.,,The 2007 WHO classification of tumours of the central nervous system,2007,Acta Neuropathologica,6859,10.1007/s00401-007-0243-4,United States,Review,Boston,0,Journal,2-s2.0-34547122001
Landgraf P.,,A Mammalian microRNA Expression Atlas Based on Small RNA Library Sequencing,2007,Cell,2644,10.1016/j.cell.2007.04.040,United States,Article,New York,1,Journal,2-s2.0-34250877841
Zhu S.,,MicroRNA-21 targets the tumor suppressor gene tropomyosin 1 (TPM1),2007,Journal of Biological Chemistry,864,10.1074/jbc.M611393200,United States,Article,IL,1,Journal,2-s2.0-34347266556
Si M.,,miR-21-mediated tumor growth,2007,Oncogene,1232,10.1038/sj.onc.1210083,United States,Article,IL,1,Journal,2-s2.0-34247495591
Eun J.,,Expression profiling identifies microRNA signature in pancreatic cancer,2007,International Journal of Cancer,749,10.1002/ijc.22394,United States,Article,Columbus,1,Journal,2-s2.0-33846813656
Gao F.,,Frequent loss of PDCD4 expression in human glioma: Possible role in the tumorigenesis of glioma,2007,Oncology Reports,87,10.3892/or.17.1.123,China,Article,Jinan,1,Journal,2-s2.0-38149139712
Ohgaki H.,,Genetic pathways to primary and secondary glioblastoma,2007,American Journal of Pathology,942,10.2353/ajpath.2007.070011,France,Review,Lyon,0,Journal,2-s2.0-34250877865
Meng F.,,MicroRNA-21 Regulates Expression of the PTEN Tumor Suppressor Gene in Human Hepatocellular Cancer,2007,Gastroenterology,2095,10.1053/j.gastro.2007.05.022,United States;United States,Article,College Station;Columbus,0,Journal,2-s2.0-34547524771
Pekarsky Y.,,Tcl1 expression in chronic lymphocytic leukemia is regulated by miR-29 and miR-181,2006,Cancer Research,496,10.1158/0008-5472.CAN-06-3613,United States;United States,Article,Columbus;Columbus,1,Journal,2-s2.0-33846190181
Calin G.,,MicroRNA signatures in human cancers,2006,Nature Reviews Cancer,5856,10.1038/nrc1997,United States,Review,Columbus,0,Journal,2-s2.0-33750370444
Zhang H.,,Involvement of programmed cell death 4 in transforming growth factor-β1-induced apoptosis in human hepatocellular carcinoma,2006,Oncogene,202,10.1038/sj.onc.1209634,Japan;China,Article,Saga;Shenyang,1,Journal,2-s2.0-33749868662
Pallante P.,,MicroRNA deregulation in human thyroid papillary carcinomas,2006,Endocrine-Related Cancer,425,10.1677/erc.1.01209,Italy;Italy,Article,Naples;Naples,1,Journal,2-s2.0-33745077330
Volinia S.,,A microRNA expression signature of human solid tumors defines cancer gene targets,2006,Proceedings of the National Academy of Sciences of the United States of America,4511,10.1073/pnas.0510565103,Italy;United States,Article,Ferrara;Columbus,1,Journal,2-s2.0-33144490646
Chen C.,,Real-time quantification of microRNAs by stem-loop RT-PCR,2005,Nucleic Acids Research,3520,10.1093/nar/gni178,United States,Article,Foster City,1,Journal,2-s2.0-29144470346
Stark A.,,Animal microRNAs confer robustness to gene expression and have a significant impact on 3′UTR evolution,2005,Cell,823,10.1016/j.cell.2005.11.023,Germany;United States;United States,Article,Heidelberg;Cambridge;Cambridge,1,Journal,2-s2.0-28944439309
Sun M.,,Evidence for a preferential targeting of 3′-UTRs by cis-encoded natural antisense transcripts,2005,Nucleic Acids Research,75,10.1093/nar/gki852,United States,Article,Chicago,1,Journal,2-s2.0-26944454054
Alvarez-Garcia I.,,MicroRNA functions in animal development and human disease,2005,Development,1009,10.1242/dev.02073,United Kingdom,Review,Cambridge,1,Journal,2-s2.0-28044471565
Robins H.,,Human microRNAs target a functionally distinct population of genes with AT-rich 3′ UTRs,2005,Proceedings of the National Academy of Sciences of the United States of America,70,10.1073/pnas.0507443102,United States,Article,Princeton,1,Journal,2-s2.0-27344448283
Cheng A.,,Antisense inhibition of human miRNAs and indications for an involvement of miRNA in cell growth and apoptosis,2005,Nucleic Acids Research,1110,10.1093/nar/gki200,United States,Article,Austin,1,Journal,2-s2.0-14844364472
Abelson J.,,Medicine: Sequence variants in SLITRK1 are associated with Tourette's syndrome,2005,Science,710,10.1126/science.1116502,United States;United States,Article,New Haven;New Haven,0,Journal,2-s2.0-26844498125
Cimmino A.,,miR-15 and miR-16 induce apoptosis by targeting BCL2,2005,Proceedings of the National Academy of Sciences of the United States of America,2704,10.1073/pnas.0506654102,United States,Article,Columbus,1,Journal,2-s2.0-25444520537
Ciafrè S.,,Extensive modulation of a set of microRNAs in primary glioblastoma,2005,Biochemical and Biophysical Research Communications,871,10.1016/j.bbrc.2005.07.030,Italy,Article,Rome,0,Journal,2-s2.0-23044464236
Iorio M.,,MicroRNA gene expression deregulation in human breast cancer,2005,Cancer Research,3167,10.1158/0008-5472.CAN-05-1783,United States,Article,Columbus,1,Journal,2-s2.0-23844555119
Chan J.,,MicroRNA-21 is an antiapoptotic factor in human glioblastoma cells,2005,Cancer Research,2044,10.1158/0008-5472.CAN-05-0137,United States;United States,Article,Boston;Boston,1,Journal,2-s2.0-22244467087
Hatfield S.D.,,Stem cell division is regulated by the microRNA pathway,2005,Nature,543,10.1038/nature03816,United States,Article,Seattle,0,Journal,2-s2.0-20544458318
Meltzer P.,,Cancer genomics: Small RNAs with big impacts,2005,Nature,268,10.1038/435745a,United States,Short Survey,Bethesda,0,Journal,2-s2.0-20444436381
He L.,,A microRNA polycistron as a potential human oncogene,2005,Nature,2923,10.1038/nature03552,United States,Article,Cold Spring Harbor,0,Journal,2-s2.0-20444467290
Cheng L.,,Stem cells: From epigeneticsto microRNAs,2005,Neuron,103,10.1016/j.neuron.2005.04.027,United States,Short Survey,New York,1,Journal,2-s2.0-18144377056
Berezikov E.,,Phylogenetic shadowing and computational identification of human microRNA genes,2005,Cell,948,10.1016/j.cell.2004.12.031,Netherlands,Letter,Utrecht,1,Journal,2-s2.0-11844262661
Lewis B.P.,,"Conserved seed pairing, often flanked by adenosines, indicates that thousands of human genes are microRNA targets",2005,Cell,8815,10.1016/j.cell.2004.12.035,United States;United States,Letter,Cambridge;Cambridge,1,Journal,2-s2.0-11844278458
De Moor C.,,Mechanisms of translational control by the 3′ UTR in development and differentiation,2005,Seminars in Cell and Developmental Biology,276,10.1016/j.semcdb.2004.11.007,United Kingdom,Article,Nottingham,0,Journal,2-s2.0-12344290346
Denli A.,,Processing of primary microRNAs by the Microprocessor complex,2004,Nature,1663,10.1038/nature03049,United States,Article,Cold Spring Harbor,0,Journal,2-s2.0-9144224451
Calin G.A.,,MicroRNA profiling reveals distinct signatures in B cell chronic lymphocytic leukemias,2004,Proceedings of the National Academy of Sciences of the United States of America,1092,10.1073/pnas.0404432101,United States,Article,Philadelphia,1,Journal,2-s2.0-4143142117
Takamizawa J.,,Reduced expression of the let-7 microRNAs in human lung cancers in association with shortened postoperative survival,2004,Cancer Research,2000,10.1158/0008-5472.CAN-04-0637,Japan;Japan,Article,Nagoya;Nagoya,1,Journal,2-s2.0-2542626605
Michael M.Z.,,Reduced Accumulation of Specific MicroRNAs in Colorectal Neoplasia,2003,Molecular Cancer Research,1379,,Australia,Article,Adelaide,0,Journal,2-s2.0-0142120587
González T.,,Inhibition of Cdk4 activity enhances translation of p27<sup>kip1</sup> in quiescent Rb-negative cells,2003,Journal of Biological Chemistry,14,10.1074/jbc.M207530200,Spain,Article,Santiago de Compostela,1,Journal,2-s2.0-17544395776
Lai E.,,Micro RNAs are complementary to 3′ UTR sequence motifs that mediate negative post-transcriptional regulation,2002,Nature Genetics,1027,10.1038/ng865,United States,Article,Berkeley,0,Journal,2-s2.0-0036544755
Lee R.,,An extensive class of small RNAs in Caenorhabditis elegans,2001,Science,2112,10.1126/science.1065329,United States,Article,Hanover,0,Journal,2-s2.0-0035955366
Lau N.,,An abundant class of tiny RNAs with probable regulatory roles in Caenorhabditis elegans,2001,Science,2478,10.1126/science.1065062,United States,Article,Cambridge,0,Journal,2-s2.0-0035955361
Lagos-Quintana M.,,Identification of novel genes coding for small expressed RNAs,2001,Science,3532,10.1126/science.1064921,Germany,Article,Gottingen,0,Journal,2-s2.0-0035955374
Pasquinelli A.E.,,Conservation of the sequence and temporal expression of let-7 heterochronic regulatory RNA,2000,Nature,1649,10.1038/35040556,United States,Article,Boston,0,Journal,2-s2.0-0034597777
Hammond S.M.,,An RNA-directed nuclease mediates post-transcriptional gene silencing in Drosophila cells,2000,Nature,2223,10.1038/35005107,United States,Article,Cold Spring Harbor,0,Journal,2-s2.0-0034673638
Slingerland J.,,Regulation of the Cdk inhibitor p27 and its deregulation in cancer,2000,Journal of Cellular Physiology,612,10.1002/(SICI)1097-4652(200004)183:1<10::AID-JCP2>3.0.CO;2-I,Canada;Canada,Article,Toronto;Toronto,0,Journal,2-s2.0-0034092911
Reinhart B.J.,,The 21-nucleotide let-7 RNA regulates developmental timing in Caenorhabditis elegans,2000,Nature,3334,10.1038/35002607,United States,Article,Boston,0,Journal,2-s2.0-0034708122
Ishii N.,,"Frequent Co-alterations of TP53, p16/CDKN2A, p14(ARF), PTEN tumor suppressor genes in human glioma cell lines",1999,Brain Pathology,442,10.1111/j.1750-3639.1999.tb00536.x,Switzerland,Article,Lausanne,0,Journal,2-s2.0-0032977124
Lee R.,,The C. elegans heterochronic gene lin-4 encodes small RNAs with antisense complementarity to lin-14,1993,Cell,8085,10.1016/0092-8674(93)90529-Y,United States,Article,Cambridge,1,Journal,2-s2.0-0027751663
