Authors,Author(s) ID,Title,Year,Source tittle,Cited by,DOI,Country,Document Type,City,Access Type,aggregationType,EID
Maquat L.,,Unstable β-globin mRNA in mRNA-deficient β<sup>0</sup> thalassemia,1981,Cell,155,10.1016/0092-8674(81)90396-2,United States,Article,Madison,0,Journal,2-s2.0-0019733025
Brawerman G.,,The role of the poly(a) sequence in mammalian messenger RN,1981,Critical Reviews in Biochemistry and Molecular Biology,169,10.3109/10409238109114634,United States,Article,Boston,0,Journal,2-s2.0-0019398073
Losson R.,,Interference of nonsense mutations with eukaryotic messenger RNA stability,1979,Proceedings of the National Academy of Sciences of the United States of America,285,10.1073/pnas.76.10.5134,France,Article,Paris,1,Journal,2-s2.0-0009461277
Darnell J.,,An adenylic acid-rich sequence in messenger RNA of HeLa cells and its possible relationship to reiterated sites in DNA.,1971,Proceedings of the National Academy of Sciences of the United States of America,352,10.1073/pnas.68.6.1321,,Article,,1,Journal,2-s2.0-0015070067
Lim L.,,Adenine-rich polymer associated with rabbit reticulocyte messenger RNA,1970,Nature,218,10.1038/227710a0,United States,Article,New Haven,0,Journal,2-s2.0-0014948973
