Authors,Author(s) ID,Title,Year,Source tittle,Cited by,DOI,Country,Document Type,City,Access Type,aggregationType,EID
Zisoulis D.,,Comprehensive discovery of endogenous Argonaute binding sites in Caenorhabditis elegans,2010,Nature Structural and Molecular Biology,225,10.1038/nsmb.1745,United States,Article,San Diego,0,Journal,2-s2.0-76349122201
Hausser J.,,Relative contribution of sequence and structure features to the mRNA binding of Argonaute/EIF2C-miRNA complexes and the degradation of miRNA targets,2009,Genome Research,67,10.1101/gr.091181.109,Switzerland,Article,Basel,1,Journal,2-s2.0-70350707749
Wang Y.,,"Nucleation, propagation and cleavage of target RNAs in Ago silencing complexes",2009,Nature,339,10.1038/nature08434,United States,Article,New York,0,Journal,2-s2.0-70349961432
Chi S.,,Argonaute HITS-CLIP decodes microRNA-mRNA interaction maps,2009,Nature,1247,10.1038/nature08170,United States,Article,New York,0,Journal,2-s2.0-67749132423
Granneman S.,,Identification of protein binding sites on U3 snoRNA and pre-rRNA by UV cross-linking and high-throughput analysis of cDNAs,2009,Proceedings of the National Academy of Sciences of the United States of America,216,10.1073/pnas.0901997106,United Kingdom,Article,Edinburgh,1,Journal,2-s2.0-67649854477
Sanford J.,,Splicing factor SFRS1 recognizes a functionally diverse landscape of RNA transcripts,2009,Genome Research,206,10.1101/gr.082503.108,United States,Article,Santa Cruz,1,Journal,2-s2.0-61849139645
Moore M.,,Pre-mRNA Processing Reaches Back toTranscription and Ahead to Translation,2009,Cell,585,10.1016/j.cell.2009.02.001,United States,Review,Worcester,1,Journal,2-s2.0-60149110358
Martin K.C.,,mRNA Localization: Gene Expression in the Spatial Dimension,2009,Cell,591,10.1016/j.cell.2009.01.044,United States,Review,Los Angeles,1,Journal,2-s2.0-60149086205
Sonenberg N.,,Regulation of Translation Initiation in Eukaryotes: Mechanisms and Biological Targets,2009,Cell,1825,10.1016/j.cell.2009.01.042,Canada,Review,Montreal,1,Journal,2-s2.0-60149091189
Gu S.,,Biological basis for restriction of microRNA targets to the 3′ untranslated region in mammalian mRNAs,2009,Nature Structural and Molecular Biology,249,10.1038/nsmb.1552,United States,Article,Stanford,0,Journal,2-s2.0-59649125888
Yeo G.,,An RNA code for the FOX2 splicing regulator revealed by mapping RNA-protein interactions in stem cells,2009,Nature Structural and Molecular Biology,384,10.1038/nsmb.1545,United States;United States,Article,San Diego;San Diego,0,Journal,2-s2.0-59649107040
Bartel D.,,MicroRNAs: Target Recognition and Regulatory Functions,2009,Cell,13032,10.1016/j.cell.2009.01.002,United States;United States,Review,Cambridge;Cambridge,1,Journal,2-s2.0-58249088751
Friedman R.,,Most mammalian mRNAs are conserved targets of microRNAs,2009,Genome Research,5184,10.1101/gr.082701.108,United States;United States,Article,Cambridge;Chevy Chase,1,Journal,2-s2.0-60149095444
Wang Y.,,Structure of an argonaute silencing complex with a seed-containing guide DNA and target RNA duplex,2008,Nature,376,10.1038/nature07666,United States,Review,New York,0,Journal,2-s2.0-57749206034
Landthaler M.,,Molecular characterization of human Argonaute-containing ribonucleoprotein complexes and their bound target mRNAs,2008,RNA,255,10.1261/rna.1351608,United States,Article,New York,1,Journal,2-s2.0-57049148002
Licatalosi D.,,HITS-CLIP yields genome-wide insights into brain alternative RNA processing,2008,Nature,861,10.1038/nature07488,United States,Article,Chevy Chase,0,Journal,2-s2.0-56549105330
Tay Y.,,"MicroRNAs to Nanog, Oct4 and Sox2 coding regions modulate embryonic stem cell differentiation",2008,Nature,1033,10.1038/nature07299,Singapore;Singapore,Article,Singapore City;Singapore City,0,Journal,2-s2.0-54549108798
Kirino Y.,,Site-specific crosslinking of human microRNPs to RNA targets,2008,RNA,9,10.1261/rna.1133808,United States,Article,Philadelphia,0,Journal,2-s2.0-52949131911
Forman J.,,A search for conserved sequences in coding regions reveals that the let-7 microRNA targets Dicer within its coding sequence,2008,Proceedings of the National Academy of Sciences of the United States of America,408,10.1073/pnas.0803230105,United States,Article,Princeton,1,Journal,2-s2.0-54449097149
Galgano A.,,Comparative analysis of mRNA targets for human PUF-family proteins suggests extensive interaction with the miRNA regulatory system,2008,PLoS ONE,177,10.1371/journal.pone.0003164,Switzerland,Article,"Zurich ZH,",1,Journal,2-s2.0-52349122355
Selbach M.,,Widespread changes in protein synthesis induced by microRNAs,2008,Nature,2487,10.1038/nature07228,Germany,Article,Berlin,0,Journal,2-s2.0-49949117302
Baek D.,,The impact of microRNAs on protein output,2008,Nature,2648,10.1038/nature07242,United States;United States,Article,Cambridge;Cambridge,0,Journal,2-s2.0-49949116902
Ørom U.,,MicroRNA-10a Binds the 5′UTR of Ribosomal Protein mRNAs and Enhances Their Translation,2008,Molecular Cell,884,10.1016/j.molcel.2008.05.001,Denmark,Article,Copenhagen,1,Journal,2-s2.0-43449090367
Boyerinas B.,,Identification of let-7-regulated oncofetal genes,2008,Cancer Research,165,10.1158/0008-5472.CAN-08-0264,United States,Article,Chicago,1,Journal,2-s2.0-41649096450
Chénard C.,,New implications for the QUAKING RNA binding protein in human disease,2008,Journal of Neuroscience Research,87,10.1002/jnr.21485,,Review,,0,Journal,2-s2.0-38849206330
Hafner M.,,Identification of microRNAs and other small regulatory RNAs using cDNA library sequencing,2008,Methods,331,10.1016/j.ymeth.2007.09.009,United States,Article,New York,0,Journal,2-s2.0-37349130959
Dimitriadis E.,,Expression of oncofetal RNA-binding protein CRD-BP/IMP1 predicts clinical outcome in colon cancer,2007,International Journal of Cancer,44,10.1002/ijc.22716,Greece,Article,Athens,1,Journal,2-s2.0-34250814465
Easow G.,,Isolation of microRNA targets by miRNP immunopurification,2007,RNA,236,10.1261/rna.563707,Germany,Article,Heidelberg,1,Journal,2-s2.0-34447521718
Grimson A.,,MicroRNA Targeting Specificity in Mammals: Determinants beyond Seed Pairing,2007,Molecular Cell,2720,10.1016/j.molcel.2007.06.017,United States;United States,Article,Cambridge;Cambridge,1,Journal,2-s2.0-34250805982
Guil S.,,The multifunctional RNA-binding protein hnRNP A1 is required for processing of miR-18a,2007,Nature Structural and Molecular Biology,390,10.1038/nsmb1250,United Kingdom,Article,Edinburgh,0,Journal,2-s2.0-34447115822
Keene J.,,RNA regulons: Coordination of post-transcriptional events,2007,Nature Reviews Genetics,892,10.1038/nrg2111,United States,Review,Durham,0,Journal,2-s2.0-34250735674
Landgraf P.,,A Mammalian microRNA Expression Atlas Based on Small RNA Library Sequencing,2007,Cell,2644,10.1016/j.cell.2007.04.040,United States,Article,New York,1,Journal,2-s2.0-34250877841
Lytle J.,,Target mRNAs are repressed as efficiently by microRNA-binding sites in the 5′ UTR as in the 3′ UTR,2007,Proceedings of the National Academy of Sciences of the United States of America,780,10.1073/pnas.0703820104,United States,Article,New Haven,1,Journal,2-s2.0-34547441263
Lunde B.,,RNA-binding proteins: Modular design for efficient function,2007,Nature Reviews Molecular Cell Biology,674,10.1038/nrm2178,United States,Review,Seattle,0,Journal,2-s2.0-34249316905
Saxena R.,,Genome-wide association analysis identifies loci for type 2 diabetes and triglyceride levels,2007,Science,2024,10.1126/science.1142358,United States;United States;United States,Article,Boston;Cambridge;Boston,0,Journal,2-s2.0-34249888775
Gaidatzis D.,,Inference of miRNA targets using evolutionary conservation and pathway analysis,2007,BMC Bioinformatics,234,10.1186/1471-2105-8-69,Switzerland;Switzerland,Article,Geneva;Basel,1,Journal,2-s2.0-34347398567
Gerber A.,,Genome-wide identification of mRNAs associated with the translational regulator PUMILIO in Drosophila melanogaster,2006,Proceedings of the National Academy of Sciences of the United States of America,216,10.1073/pnas.0509260103,United States;Switzerland,Article,"Stanford;Zurich ZH,",1,Journal,2-s2.0-33645217973
Lall S.,,A genome-wide map of conserved MicroRNA targets in C. elegans,2006,Current Biology,326,10.1016/j.cub.2006.01.050,United States,Article,New York,1,Journal,2-s2.0-33644756532
Rajewsky N.,,Microrna target predictions in animals,2006,Nature Genetics,846,10.1038/ng1798,,Article,,0,Journal,2-s2.0-33745248430
Stark A.,,Animal microRNAs confer robustness to gene expression and have a significant impact on 3′UTR evolution,2005,Cell,823,10.1016/j.cell.2005.11.023,Germany;United States;United States,Article,Heidelberg;Cambridge;Cambridge,1,Journal,2-s2.0-28944439309
Siddharthan R.,,PhyloGibbs: A gibbs sampling motif finder that incorporates phylogeny that incorporates phylogeny,2005,PLoS Computational Biology,195,10.1371/journal.pcbi.0010067.eor).,United States,Article,New York,0,Journal,2-s2.0-33750218960
Galarneau A.,,Target RNA motif and target mRNAs of the Quaking STAR protein,2005,Nature Structural and Molecular Biology,159,10.1038/nsmb963,,Article,,0,Journal,2-s2.0-26944489263
McKee A.,,A genome-wide in situ hybridization map of RNA-binding proteins reveals anatomically restricted expression in the developing mouse brain,2005,BMC Developmental Biology,119,10.1186/1471-213X-5-14,United States;United States,Article,Boston;Boston,1,Journal,2-s2.0-24344452361
Lim L.,,Microarray analysis shows that some microRNAs downregulate large numbers of-target mRNAs,2005,Nature,3652,10.1038/nature03315,United States,Article,Seattle,0,Journal,2-s2.0-13944282215
Lewis B.P.,,"Conserved seed pairing, often flanked by adenosines, indicates that thousands of human genes are microRNA targets",2005,Cell,8815,10.1016/j.cell.2004.12.035,United States;United States,Letter,Cambridge;Cambridge,1,Journal,2-s2.0-11844278458
Yisraeli J.,,VICKZ proteins: A multi-talented family of regulatory RNA-binding proteins,2005,Biology of the Cell,142,10.1042/BC20040151,Israel,Review,Jerusalem,1,Journal,2-s2.0-13544262618
López De Silanes I.,,Identification of a target RNA motif for RNA-binding protein HuR,2004,Proceedings of the National Academy of Sciences of the United States of America,373,10.1073/pnas.0306453101,United States,Article,Bethesda,1,Journal,2-s2.0-1542297742
Vella M.C.,,The C. elegans microRNA let-7 binds to imperfect let-7 complementary sites from the lin-41 3′UTR,2004,Genes and Development,334,10.1101/gad.1165404,United States,Article,New Haven,1,Journal,2-s2.0-0942301280
Ule J.,,CLIP Identifies Nova-Regulated RNA Networks in the Brain,2003,Science,715,10.1126/science.1090095,United States,Article,New York,0,Journal,2-s2.0-0242497663
Wang X.,,Modular recognition of RNA by a human Pumilio-homology domain,2002,Cell,339,10.1016/S0092-8674(02)00873-5,United States,Article,Research Triangle Park,1,Journal,2-s2.0-0037162703
Wickens M.,,A PUF family portrait: 3′UTR regulation as a way of life,2002,Trends in Genetics,440,10.1016/S0168-9525(01)02616-6,United States,Review,Madison,0,Journal,2-s2.0-0036498828
Tenenbaum S.,,Identifying mRNA subsets in messenger ribonucleoprotein complexes by using cDNA arrays,2000,Proceedings of the National Academy of Sciences of the United States of America,304,10.1073/pnas.97.26.14085,United States,Article,Durham,1,Journal,2-s2.0-0034687794
Meisenheimer K.,,Photocross-linking of nucleic acids to associated proteins,1997,Critical Reviews in Biochemistry and Molecular Biology,204,10.3109/10409239709108550,United States,Review,Boulder,0,Journal,2-s2.0-0030979415
Sharp P.,,"The codon adaptation index-a measure of directional synonymous codon usage bias, and its potential applications",1987,Nucleic Acids Research,2265,10.1093/nar/15.3.1281,United States;Ireland,Article,;Dublin,0,Journal,2-s2.0-0023650543
Favre A.,,4-thiouridine photosensitized RNA-protein crosslinking in mammalian cells,1986,Biochemical and Biophysical Research Communications,35,10.1016/S0006-291X(86)80250-9,France,Article,Paris,0,Journal,2-s2.0-0022869948
Dreyfuss G.,,Characterization of heterogeneous nuclear RNA-protein complexes in vivo with monoclonal antibodies,1984,Molecular and Cellular Biology,143,10.1128/MCB.4.6.1104,United States,Article,Evanston,1,Journal,2-s2.0-0021219155
Mayrand S.,,Structure of nuclear ribonucleoprotein: Identification of proteins in contact with poly(A)<sup>+</sup> heterogeneous nuclear RNA in living HeLa cells,1981,Journal of Cell Biology,48,10.1083/jcb.90.2.380,United States,Article,Shrewsbury,1,Journal,2-s2.0-0019513774
WAGENMAKERS A.,,Cross‐linking of mRNA to Proteins by Irradiation of Intact Cells with Ultraviolet Light,1980,European Journal of Biochemistry,77,10.1111/j.1432-1033.1980.tb07207.x,Netherlands,Article,Nijmegen,1,Journal,2-s2.0-0019086007
Greenberg J.,,Ultraviolet light-induced crosslinking of mRNA to proteins,1979,Nucleic Acids Research,69,10.1093/nar/6.2.715,United States,Article,Worcester,0,Journal,2-s2.0-0018432123
