Authors,Author(s) ID,Title,Year,Source tittle,Cited by,DOI,Country,Document Type,City,Access Type,aggregationType,EID
Robinson M.,,FunSpec: A web-based cluster interpreter for yeast,2002,BMC Bioinformatics,309,10.1186/1471-2105-3-35,Canada,Article,Toronto,1,Journal,2-s2.0-0013203966
Gibbons F.,,Judging the quality of gene expression-based clustering methods using gene annotation,2002,Genome Research,237,10.1101/gr.397002,United States,Article,Boston,1,Journal,2-s2.0-0036798238
Yekutieli D.,,Resampling-based false discovery rate controlling multiple test procedures for correlated test statistics,1999,Journal of Statistical Planning and Inference,361,10.1016/s0378-3758(99)00041-5,Israel,Article,Tel Aviv-Yafo,0,Journal,2-s2.0-0033472709
Tavazoie S.,,Systematic determination of genetic network architecture,1999,Nature Genetics,1871,10.1038/10343,United States,Article,Boston,0,Journal,2-s2.0-0033028596
Holland B.S.,,An improved sequentially rejective Bonferroni test procedure,1987,Biometrics,243,10.2307/2531823,United States,Article,Philadelphia,0,Journal,2-s2.0-0022965475
