Authors,Author(s) ID,Title,Year,Source tittle,Cited by,DOI,Country,Document Type,City,Access Type,aggregationType,EID
Stamler J.S.,,Blood flow regulation by S-nitrosohemoglobin in the physiological oxygen gradient,1997,Science,899,10.1126/science.276.5321.2034,United States,Article,Durham,0,Journal,2-s2.0-0030791742
Jia L.,,S-nitrosohaemoglobin: A dynamic activity of blood involved in vascular control,1996,Nature,1399,10.1038/380221a0,United States,Review,Durham,0,Journal,2-s2.0-0029875840
Zhuang J.,,Smaller alveolar-arterial O<inf>2</inf> gradients in Tibetan than Han residents of Lhasa (3658 m),1996,Respiration Physiology,67,10.1016/0034-5687(95)00041-0,China,Article,,0,Journal,2-s2.0-0030070304
Grote J.,,The effect of increased blood carbon monoxide levels on the hemoglobin oxygen affinity during pregnancy,1994,Advances in Experimental Medicine and Biology,3,10.1007/978-1-4615-2468-7_19,Germany,Conference Paper,Bonn,0,Book Series,2-s2.0-0028351073
Jessen T.H.,,Adaptation of bird hemoglobins to high altitudes: Demonstration of molecular mechanism by protein engineering,1991,Proceedings of the National Academy of Sciences of the United States of America,139,10.1073/pnas.88.15.6519,United Kingdom;Germany,Article,Cambridge;Planegg,1,Journal,2-s2.0-0026095651
Frisancho A.,,Origins of differences in hemoglobin concentration between Himalayan and Andean populations,1988,Respiration Physiology,22,10.1016/0034-5687(88)90075-8,United States,Article,Ann Arbor,0,Journal,2-s2.0-0023832443
Beall C.,,"Hemoglobin concentration of pastoral nomads permanently resident at 4,850–5,450 meters in Tibet",1987,American Journal of Physical Anthropology,48,10.1002/ajpa.1330730404,United States,Article,Cleveland,0,Journal,2-s2.0-0023583847
Edsall J.T.,,Understanding blood and hemoglobin: an example of international relations in science.,Spring,Perspectives in biology and medicine,15,10.1353/pbm.1986.0052,,Article,,0,Journal,2-s2.0-0022675848
Wagner P.D.,,Pulmonary gas exchange in humans exercising at sea level and simulated altitude,1986,Journal of Applied Physiology,369,10.1152/jappl.1986.61.1.260,United States,Article,Durham,0,Journal,2-s2.0-0022443741
Winslow R.,,Normal whole blood Bohr effect in Peruvian natives of high altitude,1985,Respiration Physiology,10,10.1016/0034-5687(85)90126-4,United States,Article,Atlanta,0,Journal,2-s2.0-0022259761
Dempsey J.,,Exercise‐induced arterial hypoxaemia in healthy human subjects at sea level.,1984,The Journal of Physiology,417,10.1113/jphysiol.1984.sp015412,,Article,,1,Journal,2-s2.0-0021285271
Winslow R.M.,,Red cell function at extreme altitude on Mount Everest,1984,Journal of Applied Physiology Respiratory Environmental and Exercise Physiology,66,10.1152/jappl.1984.56.1.109,United States,Article,Atlanta,0,Journal,2-s2.0-0021324125
Piiper J.,,Comparison of diffusion and perfuion limitations in alveolar gas exchange,1983,Respiration Physiology,20,10.1016/0034-5687(83)90023-3,Germany,Article,Gottingen,0,Journal,2-s2.0-0020531599
West J.B.,,Pulmonary gas exchange on the summit of Mount Everest,1983,Journal of Applied Physiology Respiratory Environmental and Exercise Physiology,143,10.1152/jappl.1983.55.3.678,United States,Article,San Diego,0,,2-s2.0-0020635508
Moore L.,,Beneficial effect of rightward hemoglobin-oxygen dissociation curve shift for short-term high-altitude adaptation,1981,The Journal of Laboratory and Clinical Medicine,9,,United States,Article,Ann Arbor,0,Journal,2-s2.0-0019466769
Piiper J.,,Model for capillary-alveolar equilibration with special reference to O<inf>2</inf> uptake in hypoxia,1981,Respiration Physiology,128,10.1016/0034-5687(81)90121-3,Germany,Article,Gottingen,0,Journal,2-s2.0-0019782112
Edsall J.,,Hemoglobin and the origins of the concept of allosterism,1980,Federation Proceedings,38,,United States,Article,Cambridge,0,Journal,2-s2.0-0018892665
Sanaja M.,,Oxygen affinity of blood in altitude Sherpas,1979,Journal of Applied Physiology Respiratory Environmental and Exercise Physiology,46,,Italy,Article,Milan,0,Journal,2-s2.0-0018687647
Gill S.,,Oxygen binding to sickle cell hemoglobin,1979,Journal of Molecular Biology,29,10.1016/0022-2836(79)90425-X,United States,Article,Boulder,0,Journal,2-s2.0-0018747309
Ueda Y.,,An increased bohr effect in sickle cell anemia,1979,Blood,35,10.1182/blood.v53.3.472.bloodjournal533472,United States,Article,New York,1,Journal,2-s2.0-0018341449
Hebbel R.,,Human llamas. Adaptation to altitude in subjects with high hemoglobin oxygen affinity,1978,Journal of Clinical Investigation,64,10.1172/JCI109165,United States,Article,Minneapolis,1,,2-s2.0-0018167153
Petschow D.,,Causes of high blood O<inf>2</inf> affinity of animals living at high altitude,1977,J.APPL.PHYS.RESP.ENV.EXERC.PHYSIOL.,109,10.1152/jappl.1977.42.2.139,Germany,Article,Hannover,0,,2-s2.0-0017334415
Dempsey J.,,HbO<inf>2</inf> dissociation in man during prolonged work in chronic hypoxia,1975,Journal of Applied Physiology,21,10.1152/jappl.1975.38.6.1022,United States,Article,Madison,0,Journal,2-s2.0-0016590872
Reynafarje C.,,Oxygen transport of hemoglobin in high altitude animals (Camelidae),1975,Journal of Applied Physiology,46,10.1152/jappl.1975.38.5.806,Peru,Article,Lima,0,,2-s2.0-0016749902
Eaton J.W.,,Survival at extreme altitude: Protective effect of increased hemoglobin-oxygen affinity,1974,Science,88,10.1126/science.183.4126.743,United States,Article,Minneapolis,0,Journal,2-s2.0-0015970875
Klocke R.A.,,Mechanism and kinetics of the Haldane effect in human erythrocytes,1973,Journal of Applied Physiology,22,10.1152/jappl.1973.35.5.673,United States,Article,Buffalo,0,Journal,2-s2.0-0015761265
Kilmartin J.,,"Interaction of hemoglobin with hydrogen ions, carbon dioxide, and organic phosphates",1973,Physiological Reviews,159,10.1152/physrev.1973.53.4.836,United Kingdom,Review,Cambridge,0,Journal,2-s2.0-0015911368
Bauer C.,,Carbamino compounds of haemoglobin in human adult and foetal blood,1972,The Journal of Physiology,39,10.1113/jphysiol.1972.sp010042,,Article,,1,Journal,2-s2.0-0015450469
Mitchell J.,,The effects of acid-base disturbances on cardiovascular and pulmonary function.,1972,Kidney international,152,10.1038/ki.1972.48,,Article,,1,Journal,2-s2.0-0015343758
Sherwood L.,,Control of Hemoglobin Function within the Red Cell,1970,New England Journal of Medicine,44,10.1056/NEJM197006182822507,,Review,,0,Journal,2-s2.0-0014954011
Torrance J.,,Oxygen transport mechanisms in residents at high altitude,1971,Respiration Physiology,36,10.1016/0034-5687(70)90098-8,United States,Article,Seattle,0,Journal,2-s2.0-0014897763
Lenfant C.,,Effect of chronic hypoxic hypoxia on the O<inf>2</inf>-Hb dissociation curve and respiratory gas transport in man,1969,Respiration Physiology,65,10.1016/0034-5687(69)90066-8,United States,Article,Seattle,0,Journal,2-s2.0-0014530332
Lenfant C.,,Effect of altitude on oxygen binding by hemoglobin and on organic phosphate levels.,1968,The Journal of clinical investigation,234,10.1172/JCI105948,,Article,,1,Journal,2-s2.0-0014383734
Kelman G.R.,,"Nomograms for correction of blood Po2, Pco2, pH, and base excess for time and temperature.",1966,Journal of applied physiology,290,10.1152/jappl.1966.21.5.1484,,Article,,0,Journal,2-s2.0-0013951527
Kelman G.R.,,Digital computer subroutine for the conversion of oxygen tension into saturation.,1966,Journal of applied physiology,349,10.1152/jappl.1966.21.4.1375,,Article,,0,Journal,2-s2.0-0013934131
Monod J.,,On the nature of allosteric transitions: A plausible model,1965,Journal of Molecular Biology,5740,10.1016/S0022-2836(65)80285-6,Italy;France,Article,Roma;Paris,0,Journal,2-s2.0-78651189765
SEVERINGHAUS J.W.,,Oxyhemoglobin dissociation curve correction for temperature and pH variation in human blood,1958,Journal of applied physiology,115,10.1152/jappl.1958.12.3.485,,Article,,0,Journal,2-s2.0-0001058565
CHIODI H.,,Respiratory adaptations to chronic high altitude hypoxia,1957,Journal of applied physiology,99,10.1152/jappl.1957.10.1.81,,Article,,0,Journal,2-s2.0-0001921578
Christiansen J.,,The absorption and dissociation of carbon dioxide by human blood,1914,The Journal of Physiology,139,10.1113/jphysiol.1914.sp001659,,Article,,0,Journal,2-s2.0-0001442563
Bohr C.,,"Ueber einen in biologischer Beziehung wichtigen Einfluss, den die Kohlensäurespannung des Blutes auf dessen Sauerstoffbindung übt",1904,Skandinavisches Archiv Für Physiologie,347,10.1111/j.1748-1716.1904.tb01382.x,Denmark,Article,Copenhagen,1,Journal,2-s2.0-84935023004
