Authors,Author(s) ID,Title,Year,Source tittle,Cited by,DOI,Country,Document Type,City,Access Type,aggregationType,EID
Greenlee R.,,"Cancer statistics, 2000",2000,Ca-A Cancer Journal for Clinicians,3833,10.3322/canjclin.50.1.7,United States,Article,Atlanta,1,Journal,2-s2.0-0033959520
Bosset J.,,Chemoradiotherapy followed by surgery compared with surgery alone in squamous-cell cancer of the esophagus,1997,New England Journal of Medicine,1194,10.1056/NEJM199707173370304,France,Article,Besancon,0,Journal,2-s2.0-0030793423
al-Sarraf M.,,Progress report of combined chemoradiotherapy versus radiotherapy alone in patients with esophageal cancer: An intergroup study,1997,Journal of Clinical Oncology,619,10.1200/JCO.1997.15.1.277,United States,Article,Southfield,0,Journal,2-s2.0-0031022804
Chen A.Y.,,DNA topoisomerases: Essential enzymes and lethal targets,1994,Annual Review of Pharmacology and Toxicology,754,10.1146/annurev.pa.34.040194.001203,United States,Review,Piscataway,0,Book Series,2-s2.0-0028174984
Müller J.M.,,Surgical therapy of oesophageal carcinoma,1990,British Journal of Surgery,866,10.1002/bjs.1800770804,Germany,Review,Koln,0,Journal,2-s2.0-0025160290
Hsiang Y.,,Identification of mammalian dna topoisomerase i as an intracellular target of the anticancer drug camptothecin,1988,Cancer Research,826,,United States,Article,Baltimore,0,Journal,2-s2.0-0023924786
Hsiang Y.,,Camptothecin induces protein-linked DNA breaks via mammalian DNA topoisomerase I,1985,Journal of Biological Chemistry,2062,,United States,Article,Baltimore,0,Journal,2-s2.0-0022340594
Earlam R.,,Oesophageal squamous cell carcinoma: II. A critical review of radiotherapy,1980,British Journal of Surgery,389,10.1002/bjs.1800670702,United Kingdom,Review,London,0,Journal,2-s2.0-0018909902
