Authors,Author(s) ID,Title,Year,Source tittle,Cited by,DOI,Country,Document Type,City,Access Type,aggregationType,EID
Han J.,,Molecular Basis for the Recognition of Primary microRNAs by the Drosha-DGCR8 Complex,2006,Cell,1051,10.1016/j.cell.2006.03.043,South Korea,Article,Seoul,1,Journal,2-s2.0-33744520104
Dye M.,,Exon tethering in transcription by RNA polymerase II,2006,Molecular Cell,107,10.1016/j.molcel.2006.01.032,United Kingdom,Article,Oxford,1,Journal,2-s2.0-33644856084
Valencia-Sanchez M.,,Control of translation and mRNA degradation by miRNAs and siRNAs,2006,Genes and Development,1560,10.1101/gad.1399806,Mexico;United States,Review,Hermosillo;Tucson,1,Journal,2-s2.0-33644768174
Ying S.,,Current perspectives in intronic micro RNAs (miRNAs),2006,Journal of Biomedical Science,72,10.1007/s11373-005-9036-8,United States,Article,Los Angeles,1,Journal,2-s2.0-31544436362
Pillai R.,,MicroRNA function: Multiple mechanisms for a tiny RNA?,2005,RNA,542,10.1261/rna.2248605,Switzerland,Review,Basel,1,Journal,2-s2.0-28344440823
Houbaviy H.,,Characterization of a highly variable eutherian microRNA gene,2005,RNA,116,10.1261/rna.2890305,United States,Article,Cambridge,1,Journal,2-s2.0-23644450595
Kim V.,,MicroRNA biogenesis: Coordinated cropping and dicing,2005,Nature Reviews Molecular Cell Biology,1775,10.1038/nrm1644,South Korea,Review,Seoul,0,Journal,2-s2.0-18344369543
Baskerville S.,,Microarray profiling of microRNAs reveals frequent coexpression with neighboring miRNAs and host genes,2005,RNA,1088,10.1261/rna.7240905,United States,Article,Cambridge,1,Journal,2-s2.0-13944260434
Han J.,,The Drosha-DGCR8 complex in primary microRNA processing,2004,Genes and Development,1322,10.1101/gad.1262504,South Korea,Article,Seoul,1,Journal,2-s2.0-10644234841
Landthaler M.,,The human DiGeorge syndrome critical region gene 8 and its D. melanogaster homolog are required for miRNA biogenesis,2004,Current Biology,596,10.1016/j.cub.2004.11.001,United States,Article,New York,1,Journal,2-s2.0-10344248903
Cai X.,,"Human microRNAs are processed from capped, polyadenylated transcripts that can also function as mRNAs",2004,RNA,1242,10.1261/rna.7135204,United States,Article,Durham,1,Journal,2-s2.0-9344235449
Denli A.,,Processing of primary microRNAs by the Microprocessor complex,2004,Nature,1663,10.1038/nature03049,United States,Article,Cold Spring Harbor,0,Journal,2-s2.0-9144224451
Gregory R.,,The Microprocessor complex mediates the genesis of microRNAs,2004,Nature,1843,10.1038/nature03120,United States,Article,Philadelphia,0,Journal,2-s2.0-9144225636
Lee Y.,,MicroRNA genes are transcribed by RNA polymerase II,2004,EMBO Journal,2798,10.1038/sj.emboj.7600385,South Korea,Article,Seoul,0,Journal,2-s2.0-8144225486
Rodriguez A.,,Identification of mammalian microRNA host genes and transcription units,2004,Genome Research,1363,10.1101/gr.2722704,United Kingdom,Article,Hinxton,1,Journal,2-s2.0-6344281172
Bohnsack M.,,Exportin 5 is a RanGTP-dependent dsRNA-binding protein that mediates nuclear export of pre-miRNAs,2004,RNA,918,10.1261/rna.5167604,Germany,Article,Heidelberg,1,Journal,2-s2.0-1642499415
Bartel D.,,"MicroRNAs: Genomics, Biogenesis, Mechanism, and Function",2004,Cell,25016,10.1016/S0092-8674(04)00045-5,United States;United States,Review,Cambridge;Cambridge,1,Journal,2-s2.0-0347444723
Lund E.,,Nuclear Export of MicroRNA Precursors,2004,Science,1845,10.1126/science.1090599,United States,Article,Madison,0,Journal,2-s2.0-0347988235
Griffiths-Jones S.,,The microRNA registry,2004,Nucleic Acids Research,1627,,United Kingdom,Article,Hinxton,0,Journal,2-s2.0-0347755643
Yi R.,,Exportin-5 mediates the nuclear export of pre-microRNAs and short hairpin RNAs,2003,Genes and Development,1956,10.1101/gad.1158803,United States,Article,Durham,1,Journal,2-s2.0-0347361541
Khvorova A.,,Functional siRNAs and miRNAs exhibit strand bias,2003,Cell,1847,10.1016/S0092-8674(03)00801-8,United States;United States,Article,Lafayette;Thousand Oaks,1,Journal,2-s2.0-0142165224
Schwarz D.,,Asymmetry in the assembly of the RNAi enzyme complex,2003,Cell,2042,10.1016/S0092-8674(03)00759-1,United States,Article,Worcester,1,Journal,2-s2.0-10744225153
Lee Y.,,The nuclear RNase III Drosha initiates microRNA processing,2003,Nature,3490,10.1038/nature01957,South Korea,Article,Seoul,0,Journal,2-s2.0-0141843656
Karolchik D.,,The UCSC Genome Browser Database,2003,Nucleic Acids Research,1109,10.1093/nar/gkg129,United States,Review,Santa Cruz,1,Journal,2-s2.0-0037250168
Filipowicz W.,,Biogenesis of small nucleolar ribonucleoproteins,2002,Current Opinion in Cell Biology,303,10.1016/S0955-0674(02)00334-4,Switzerland,Review,Basel,0,Journal,2-s2.0-0036591884
Kent W.,,BLAT - The BLAST-like alignment tool,2002,Genome Research,5216,10.1101/gr.229202. Article published online before March 2002,United States,Article,Santa Cruz,0,Journal,2-s2.0-0036226603
Ketting R.,,Dicer functions in RNA interference and in synthesis of small RNA involved in developmental timing in C. elegans,2001,Genes and Development,1321,10.1101/gad.927801,United States,Article,Cold Spring Harbor,1,Journal,2-s2.0-0035887005
Knight S.,,A role for the RNase III enzyme DCR-1 in RNA interference and germ line development in Caenorhabditis elegans,2001,Science,641,10.1126/science.1062039,United States,Article,Salt Lake City,0,Journal,2-s2.0-0035929322
Hutvágner G.,,A cellular function for the RNA-interference enzyme dicer in the maturation of the let-7 small temporal RNA,2001,Science,1975,10.1126/science.1062961,United States,Article,Worcester,0,Journal,2-s2.0-0035800521
Grishok A.,,Genes and mechanisms related to RNA interference regulate expression of the small temporal RNAs that control C. elegans developmental timing,2001,Cell,1388,10.1016/S0092-8674(01)00431-7,United States,Article,Worcester,1,Journal,2-s2.0-17844364875
Bernstein E.,,Role for a bidentate ribonuclease in the initiation step of RNA interference,2001,Nature,3416,10.1038/35053110,United States;United States,Article,Cold Spring Harbor;Stony Brook,0,Journal,2-s2.0-0035905766
