Authors,Author(s) ID,Title,Year,Source tittle,Cited by,DOI,Country,Document Type,City,Access Type,aggregationType,EID
Li Y.,,Microrna-mediated positive feedback loop and optimized bistable switch in a cancer network involving miR-17-92,2011,PLoS ONE,33,10.1371/journal.pone.0026302,China;China,Article,Lanzhou;Lanzhou,1,Journal,2-s2.0-80054711591
Inui M.,,MicroRNA control of signal transduction,2010,Nature Reviews Molecular Cell Biology,839,10.1038/nrm2868,Italy,Review,Padua,0,Journal,2-s2.0-77949875682
Pulikkan J.,,Cell-cycle regulator E2F1 and microRNA-223 comprise an autoregulatory negative feedback loop in acute myeloid leukemia,2010,Blood,213,10.1182/blood-2009-08-240101,Germany,Article,Halle,0,Journal,2-s2.0-77950354353
Passos J.F.,,Feedback between p21 and reactive oxygen production is necessary for cell senescence,2010,Molecular Systems Biology,425,10.1038/msb.2010.5,United Kingdom,Article,Newcastle,1,Journal,2-s2.0-77149164811
Tian X.J.,,Interlinking positive and negative feedback loops creates a tunable motif in gene regulatory networks,2009,"Physical Review E - Statistical, Nonlinear, and Soft Matter Physics",73,10.1103/PhysRevE.80.011926,China,Article,Nanjing,0,Journal,2-s2.0-68949136612
Nevozhay D.,,Negative autoregulation linearizes the dose-response and suppresses the heterogeneity of gene expression,2009,Proceedings of the National Academy of Sciences of the United States of America,192,10.1073/pnas.0809901106,United States,Article,Houston,1,Journal,2-s2.0-62549083590
Wee K.,,Oscillations of the p53-Akt network: Implications on cell survival and death,2009,PLoS ONE,56,10.1371/journal.pone.0004407,Singapore,Article,Singapore City,1,Journal,2-s2.0-84887212582
Zhao H.,,Autoregulatory feedback loop in human hematopoietic cells the c-myb proto-oncogene and microRNA-15a comprise an active,2009,Blood,127,10.1182/blood-2008-01-136218,United States,Article,Philadelphia,0,Journal,2-s2.0-60249101120
Pfeuty B.,,The combination of positive and negative feedback loops confers exquisite flexibility to biochemical switches,2009,Physical Biology,51,10.1088/1478-3975/6/4/046013,,Article,,0,Journal,2-s2.0-70450228872
Aguda B.,,"MicroRNA regulation of a cancer network: Consequences of the feedback loops involving miR-17-92, E2F, and Myc",2008,Proceedings of the National Academy of Sciences of the United States of America,297,10.1073/pnas.0811166106,United States,Article,Columbus,1,Journal,2-s2.0-58149382580
Cheng Z.,,Robustness analysis of cellular memory in an autoactivating positive feedback system,2008,FEBS Letters,29,10.1016/j.febslet.2008.10.005,China,Article,Nanjing,1,Journal,2-s2.0-54849407133
Papagiannakopoulos T.,,MicroRNA-21 targets a network of key tumor-suppressive pathways in glioblastoma cells,2008,Cancer Research,534,10.1158/0008-5472.CAN-08-1305,United States,Article,Santa Barbara,1,Journal,2-s2.0-54249136806
Yao G.,,A bistable Rb-E2F switch underlies the restriction point,2008,Nature Cell Biology,245,10.1038/ncb1711,United States;United States,Article,Durham;Durham,0,Journal,2-s2.0-43149108161
Tsai T.,,"Robust, tunable biological oscillations from interlinked positive and negative feedback loops",2008,Science,460,10.1126/science.1156951,United States,Article,Stanford,0,Journal,2-s2.0-46849090495
Mitrophanov A.,,Positive feedback in cellular control systems,2008,BioEssays,153,10.1002/bies.20769,United States,Review,St. Louis,0,Journal,2-s2.0-45549097452
Shahrezaei V.,,Colored extrinsic fluctuations and stochastic gene expression,2008,Molecular Systems Biology,175,10.1038/msb.2008.31,Canada,Article,Montreal,1,Journal,2-s2.0-43249118966
Pedraza J.,,Effects of molecular memory and bursting on fluctuations in gene expression,2008,Science,261,10.1126/science.1144331,United States,Article,Cambridge,0,Journal,2-s2.0-38349185928
Kim J.,,Coupled feedback loops form dynamic motifs of cellular networks,2008,Biophysical Journal,101,10.1529/biophysj.107.105106,South Korea,Article,Yusong,1,Journal,2-s2.0-38349013623
Ma J.,,Coherence resonance induced by colored noise near Hopf bifurcation,2008,Chaos,22,10.1063/1.3013178,China,Article,Hefei,0,Journal,2-s2.0-58149348675
Hornung G.,,Noise propagation and signaling sensitivity in biological networks: A role for positive feedback,2008,PLoS Computational Biology,125,10.1371/journal.pcbi.0040008,Israel,Article,Rehovot,1,Journal,2-s2.0-38949194331
Kaufmann B.,,Heritable stochastic switching revealed by single-cell genealogy,2007,PLoS Biology,79,10.1371/journal.pbio.0050239,United States;United States,Article,Cambridge;Cambridge,1,Journal,2-s2.0-34548686549
Süel G.,,Tunability and noise dependence in differentiation dynamics,2007,Science,329,10.1126/science.1137455,United States,Article,Dallas,0,Journal,2-s2.0-34047118521
Kim D.,,Coupled positive and negative feedback circuits form an essential building block of cellular signaling pathways,2007,BioEssays,63,10.1002/bies.20511,South Korea,Review,Seoul,0,Journal,2-s2.0-33846694082
Dublanche Y.,,Noise in transcription negative feedback loops: Simulation and experimental analysis,2006,Molecular Systems Biology,180,10.1038/msb4100081,United Kingdom,Article,,0,Journal,2-s2.0-33846108256
Kholodenko B.,,Cell-signalling dynamics in time and space,2006,Nature Reviews Molecular Cell Biology,893,10.1038/nrm1838,United States,Review,Philadelphia,0,Journal,2-s2.0-33644524741
Hooshangi S.,,The effect of negative feedback on noise propagation in transcriptional gene networks,2006,Chaos,60,10.1063/1.2208927,United States,Article,Princeton,0,Journal,2-s2.0-33745725673
Sigal A.,,Variability and memory of protein levels in human cells,2006,Nature,368,10.1038/nature05316,Israel,Article,Rehovot,0,Journal,2-s2.0-33845257870
Hornstein E.,,Canalization of development by micrornas,2006,Nature Genetics,437,10.1038/ng1803,Israel,Article,Rehovot,0,Journal,2-s2.0-84984765621
Brandman O.,,Systems biology: Interlinked fast and slow positive feedback loops drive reliable cell decisions,2005,Science,348,10.1126/science.1113834,United States;United States,Article,Stanford;Woods Hole,0,Journal,2-s2.0-27144517984
Bratsun D.,,Delay-induced stochastic oscillations in gene regulation,2005,Proceedings of the National Academy of Sciences of the United States of America,387,10.1073/pnas.0503858102,United States,Article,San Diego,1,Journal,2-s2.0-26844581913
Pomerening J.,,Systems-level dissection of the cell-cycle oscillator: Bypassing positive feedback produces damped oscillations,2005,Cell,252,10.1016/j.cell.2005.06.016,United States,Article,Stanford,1,Journal,2-s2.0-23944469094
Paulsson J.,,Models of stochastic gene expression,2005,Physics of Life Reviews,482,10.1016/j.plrev.2005.03.003,United Kingdom,Review,Cambridge,0,Journal,2-s2.0-20344389483
Pedraza J.,,Noise propagations in gene networks,2005,Science,573,10.1126/science.1109090,United States,Article,Cambridge,0,Journal,2-s2.0-15544388848
Rosenfeld N.,,Gene regulation at the single-cell level,2005,Science,763,10.1126/science.1106914,Israel,Article,Rehovot,0,Journal,2-s2.0-15544371346
Cole F.,,Positive regulation of myogenic bHLH factors and skeletal muscle development by the cell surface receptor CDO,2004,Developmental Cell,70,10.1016/j.devcel.2004.10.009,United States,Article,New York,1,Journal,2-s2.0-8444240141
Lee S.,,Regulation of muscle mass by myostatin,2004,Annual Review of Cell and Developmental Biology,558,10.1146/annurev.cellbio.20.012103.135836,United States,Review,Baltimore,0,Book Series,2-s2.0-8444243360
Wedlich-Soldner R.,,Robust cell polarity is a dynamic state established by coupling transport and GTPase signaling,2004,Journal of Cell Biology,160,10.1083/jcb.200405061,United States,Article,Boston,1,Journal,2-s2.0-4544295912
Raser J.,,Control of stochasticity in eukaryotic gene expression,2004,Science,1006,10.1126/science.1098641,United States,Article,San Francisco,0,Journal,2-s2.0-2942718723
Korobkova E.,,From molecular noise to behavioural variability in a single bacterium,2004,Nature,311,10.1038/nature02404,United States,Article,Chicago,0,Journal,2-s2.0-1842484290
Lindner B.,,Effects of noise in excitable systems,2004,Physics Reports,989,10.1016/j.physrep.2003.10.015,Canada,Review,Ottawa,0,Journal,2-s2.0-1142283165
Paulsson J.,,Summing up the noise in gene networks,2004,Nature,923,10.1038/nature02257,United Kingdom;United States,Review,Cambridge;Princeton,0,Journal,2-s2.0-0842285841
Xiong W.,,A positive-feedback-based bistable 'memory module' that governs a cell fate decision,2003,Nature,528,10.1038/nature02089,United States,Article,Stanford,0,Journal,2-s2.0-0345359924
Simpson M.,,Frequency domain analysis of noise in autoregulated gene circuits,2003,Proceedings of the National Academy of Sciences of the United States of America,151,10.1073/pnas.0736140100,United States;United States,Article,Oak Ridge;Knoxville,1,Journal,2-s2.0-0037447260
Blake W.J.,,Noise in eukaryotic gene expression,2003,Nature,1160,10.1038/nature01546,United States,Article,Boston,0,Journal,2-s2.0-0242416539
Pomerening J.,,Building a cell cycle oscillator: Hysteresis and bistability in the activation of Cdc2,2003,Nature Cell Biology,510,10.1038/ncb954,United States,Article,Stanford,0,Journal,2-s2.0-0345700833
Wolf D.,,"Motifs, modules and games in bacteria",2003,Current Opinion in Microbiology,219,10.1016/S1369-5274(03)00033-X,United States,Review,Berkeley,0,Journal,2-s2.0-0037676107
Swain P.,,Intrinsic and extrinsic contributions to stochasticity in gene expression,2002,Proceedings of the National Academy of Sciences of the United States of America,1049,10.1073/pnas.162041399,United States;Canada,Article,New York;Montreal,1,Journal,2-s2.0-0036790975
Elowitz M.,,Stochastic gene expression in a single cell,2002,Science,3324,10.1126/science.1070919,United States,Article,New York,0,Journal,2-s2.0-0037119587
Bhalla U.,,MAP kinase phosphatase as a locus of flexibility in a mitogen-activated protein kinase signaling network,2002,Science,502,10.1126/science.1068873,India,Article,Bengaluru,0,Journal,2-s2.0-0037047611
Ren B.,,"E2F integrates cell cycle progression with DNA repair, replication, and G<inf>2</inf>/M checkpoints",2002,Genes and Development,822,10.1101/gad.949802,United States;United States,Article,San Diego;Cambridge,1,Journal,2-s2.0-0037080483
Ozbudak E.,,Regulation of noise in the expression of a single gene,2002,Nature Genetics,1105,10.1038/ng869,United States,Article,Cambridge,0,Journal,2-s2.0-0036578645
Shen-Orr S.S.,,Network motifs in the transcriptional regulation network of Escherichia coli,2002,Nature Genetics,1954,10.1038/ng881,,Article,,0,Journal,2-s2.0-0036578795
Berridge M.,,The versatility and complexity of calcium signalling,2001,Novartis Foundation Symposium,91,,United Kingdom,Article,Cambridge,0,Book Series,2-s2.0-0035224759
Ueda M.,,Single-molecule analysis of chemotactic signaling in Dictyostelium cells,2001,Science,266,10.1126/science.1063951,Japan,Article,Suita,0,Journal,2-s2.0-0035955356
Becskei A.,,Positive feedback in eukaryotic gene networks: Cell differentiation by graded to binary response conversion,2001,EMBO Journal,528,10.1093/emboj/20.10.2528,Germany,Article,Heidelberg,0,Journal,2-s2.0-17144456808
Abrieu A.,,The interplay between cyclin-B-Cdc2 kinase (MPF) and MAP kinase during maturation of oocytes,2001,Journal of Cell Science,117,,United States,Note,San Diego,0,Journal,2-s2.0-0035125306
Freeman M.,,Feedback control of intercellular signalling in development,2000,Nature,397,10.1038/35042500,United Kingdom,Review,Cambridge,0,Journal,2-s2.0-0034676456
Sako Y.,,Single-molecule imaging of EGFR signalling on the surface of living cells,2000,Nature Cell Biology,687,10.1038/35004044,Japan,Article,Suita,0,Journal,2-s2.0-0033779765
Lee K.,,Interconnected feedback loops in the Neurospora circadian system,2000,Science,273,10.1126/science.289.5476.107,United States,Article,Hanover,0,Journal,2-s2.0-0034617102
Becskel A.,,Engineering stability in gene networks by autoregulation,2000,Nature,1076,10.1038/35014651,Germany,Article,Heidelberg,0,Journal,2-s2.0-0034212551
Shearman L.,,Interacting molecular loops in the mammalian circadian clock,2000,Science,995,10.1126/science.288.5468.1013,United States,Article,Boston,0,Journal,2-s2.0-0034640253
Ferrell J.,,The biochemical basis of an all-or-none cell fate switch in xenopus oocytes,1998,Science,800,10.1126/science.280.5365.895,United States,Article,Stanford,0,Journal,2-s2.0-0032496358
Mcadams H.,,Stochastic mechanisms in gene expression,1997,Proceedings of the National Academy of Sciences of the United States of America,1351,10.1073/pnas.94.3.814,,Article,,1,Journal,2-s2.0-0031029852
Kasdin N.,,Runge-kutta algorithm for the numerical integration of stochastic differential equations,1995,"Journal of Guidance, Control, and Dynamics",46,10.2514/3.56665,United States,Article,Palo Alto,0,Journal,2-s2.0-0029211663
Keizer J.,,InsP<inf>3</inf>-induced Ca<sup>2+</sup> excitability of the endoplasmic reticulum,1995,Molecular Biology of the Cell,86,10.1091/mbc.6.8.945,United States,Article,Davis,0,Journal,2-s2.0-0028984310
McAdams H.,,Circuit simulation of genetic networks,1995,Science,368,10.1126/science.7624793,,Review,,0,Journal,2-s2.0-0029028963
Singh P.,,Overexpression of E2F-1 in rat embryo fibroblasts leads to neoplastic transformation,1994,EMBO Journal,190,10.1002/j.1460-2075.1994.tb06635.x,Singapore,Article,Singapore City,0,Journal,2-s2.0-0028360766
Heitzler P.,,The choice of cell fate in the epidermis of Drosophila,1991,Cell,563,10.1016/0092-8674(91)90263-X,France;France,Article,Strasbourg;Paris,0,Journal,2-s2.0-0025971830
