Authors,Author(s) ID,Title,Year,Source tittle,Cited by,DOI,Country,Document Type,City,Access Type,aggregationType,EID
Asangani I.,,"MicroRNA-21 (miR-21) post-transcriptionally downregulates tumor suppressor Pdcd4 and stimulates invasion, intravasation and metastasis in colorectal cancer",2008,Oncogene,1424,10.1038/sj.onc.1210856,Germany,Article,Mannheim,1,Journal,2-s2.0-41749113108
Ozen M.,,Widespread deregulation of microRNA expression in human prostate cancer,2008,Oncogene,532,10.1038/sj.onc.1210809,Turkey;United States;United States,Article,Istanbul;Houston;Houston,1,Journal,2-s2.0-40749090479
Frankel L.,,Programmed cell death 4 (PDCD4) is an important functional target of the microRNA miR-21 in breast cancer cells,2008,Journal of Biological Chemistry,897,10.1074/jbc.M707224200,Denmark,Article,Copenhagen,1,Journal,2-s2.0-38149042783
Gottardo F.,,Micro-RNA profiling in kidney and bladder cancers,2007,Urologic Oncology: Seminars and Original Investigations,528,10.1016/j.urolonc.2007.01.019,Italy;United States,Article,Padua;Philadelphia,0,Journal,2-s2.0-34548388833
Zygalaki E.,,Quantitative real-time reverse transcription-PCR study of the expression of vascular endothelial growth factor (VEGF) splice variants and VEGF receptors (VEGFR-I and VEGFR-2) in non-small cell lung cancer,2007,Clinical Chemistry,27,10.1373/clinchem.2007.086819,Greece,Article,Athens,1,Journal,2-s2.0-34547681351
Zhu S.,,MicroRNA-21 targets the tumor suppressor gene tropomyosin 1 (TPM1),2007,Journal of Biological Chemistry,864,10.1074/jbc.M611393200,United States,Article,IL,1,Journal,2-s2.0-34347266556
Si M.,,miR-21-mediated tumor growth,2007,Oncogene,1232,10.1038/sj.onc.1210083,United States,Article,IL,1,Journal,2-s2.0-34247495591
Zhang B.,,microRNAs as oncogenes and tumor suppressors,2007,Developmental Biology,1857,10.1016/j.ydbio.2006.08.028,United States,Review,Lubbock,1,Journal,2-s2.0-33846188098
Ryan D.,,MicroRNAs of the mammalian eye display distinct and overlapping tissue specificity,2006,Molecular Vision,246,,United States,Article,Chicago,0,Journal,2-s2.0-33750404987
Takada S.,,Mouse microRNA profiles determined with a new and sensitive cloning method,2006,Nucleic Acids Research,87,10.1093/nar/gkl653,Japan,Article,Kawachi District,1,Journal,2-s2.0-33750246178
Castoldi M.,,A sensitive array for microRNA expression profiling (miChip) based on locked nucleic acids (LNA),2006,RNA,338,10.1261/rna.2332406,Germany;Germany,Article,Heidelberg;Heidelberg,1,Journal,2-s2.0-33646178285
Esquela-Kerscher A.,,Oncomirs - MicroRNAs with a role in cancer,2006,Nature Reviews Cancer,5574,10.1038/nrc1840,United States,Review,New Haven,0,Journal,2-s2.0-33645294070
Hwang H.,,"MicroRNAs in cell proliferation, cell death, and tumorigenesis",2006,British Journal of Cancer,822,10.1038/sj.bjc.6603023,United States,Short Survey,Baltimore,1,Journal,2-s2.0-33645321647
Cummins J.,,The colorectal microRNAome,2006,Proceedings of the National Academy of Sciences of the United States of America,784,10.1073/pnas.0511155103,United States,Article,Baltimore,1,Journal,2-s2.0-33644853907
Yanaihara N.,,Unique microRNA molecular profiles in lung cancer diagnosis and prognosis,2006,Cancer Cell,2500,10.1016/j.ccr.2006.01.025,United States,Article,Bethesda,1,Journal,2-s2.0-33644819964
Volinia S.,,A microRNA expression signature of human solid tumors defines cancer gene targets,2006,Proceedings of the National Academy of Sciences of the United States of America,4511,10.1073/pnas.0510565103,Italy;United States,Article,Ferrara;Columbus,1,Journal,2-s2.0-33144490646
Hammond S.,,MicroRNAs as oncogenes,2006,Current Opinion in Genetics and Development,328,10.1016/j.gde.2005.12.005,United States,Review,Chapel Hill,0,Journal,2-s2.0-30644475098
Tang F.,,MicroRNA expression profiling of single whole embryonic stem cells,2006,Nucleic Acids Research,277,10.1093/nar/gnj009,United Kingdom,Article,Cambridge,1,Journal,2-s2.0-32644439132
Chen C.,,Real-time quantification of microRNAs by stem-loop RT-PCR,2005,Nucleic Acids Research,3520,10.1093/nar/gni178,United States,Article,Foster City,1,Journal,2-s2.0-29144470346
Jiang J.,,Real-time expression profiling of microRNA precursors in human cancer cell lines,2005,Nucleic Acids Research,426,10.1093/nar/gki863,United States,Article,Columbus,1,Journal,2-s2.0-27244433702
Hayashita Y.,,"A polycistronic MicroRNA cluster, miR-17-92, is overexpressed in human lung cancers and enhances cell proliferation",2005,Cancer Research,1261,10.1158/0008-5472.CAN-05-2352,Japan;Japan,Article,Yufu;Nagoya,1,Journal,2-s2.0-27544495514
Ciafrè S.,,Extensive modulation of a set of microRNAs in primary glioblastoma,2005,Biochemical and Biophysical Research Communications,871,10.1016/j.bbrc.2005.07.030,Italy,Article,Rome,0,Journal,2-s2.0-23044464236
Iorio M.,,MicroRNA gene expression deregulation in human breast cancer,2005,Cancer Research,3167,10.1158/0008-5472.CAN-05-1783,United States,Article,Columbus,1,Journal,2-s2.0-23844555119
Zygalaki E.,,Real-time reverse transcription-PCR quantification of vascular endothelial growth factor splice variants,2005,Clinical Chemistry,21,10.1373/clinchem.2004.046987,Greece,Article,Athens,1,Journal,2-s2.0-23044452192
Chan J.,,MicroRNA-21 is an antiapoptotic factor in human glioblastoma cells,2005,Cancer Research,2044,10.1158/0008-5472.CAN-05-0137,United States;United States,Article,Boston;Boston,1,Journal,2-s2.0-22244467087
Eder M.,,MicroRNA and lung cancer,2005,New England Journal of Medicine,94,10.1056/NEJMcibr051201,Germany,Article,Hannover,0,Journal,2-s2.0-20344367792
Lu J.,,MicroRNA expression profiles classify human cancers,2005,Nature,7356,10.1038/nature03702,United States;United States,Article,Boston;Cambridge,0,Journal,2-s2.0-20444460289
Gregory R.,,MicroRNA biogenesis and cancer,2005,Cancer Research,518,10.1158/0008-5472.CAN-05-0298,United States,Review,Philadelphia,1,Journal,2-s2.0-18144365478
Lim L.,,Microarray analysis shows that some microRNAs downregulate large numbers of-target mRNAs,2005,Nature,3652,10.1038/nature03315,United States,Article,Seattle,0,Journal,2-s2.0-13944282215
Berezikov E.,,Phylogenetic shadowing and computational identification of human microRNA genes,2005,Cell,948,10.1016/j.cell.2004.12.031,Netherlands,Letter,Utrecht,1,Journal,2-s2.0-11844262661
Lewis B.P.,,"Conserved seed pairing, often flanked by adenosines, indicates that thousands of human genes are microRNA targets",2005,Cell,8815,10.1016/j.cell.2004.12.035,United States;United States,Letter,Cambridge;Cambridge,1,Journal,2-s2.0-11844278458
Liu C.G.,,An oligonucleotide microchip for genome-wide microRNA profiling in human and mouse tissues,2004,Proceedings of the National Academy of Sciences of the United States of America,772,10.1073/pnas.0403293101,United States,Article,Philadelphia,1,Journal,2-s2.0-3042752769
Takamizawa J.,,Reduced expression of the let-7 microRNAs in human lung cancers in association with shortened postoperative survival,2004,Cancer Research,2000,10.1158/0008-5472.CAN-04-0637,Japan;Japan,Article,Nagoya;Nagoya,1,Journal,2-s2.0-2542626605
Calin G.,,Human microRNA genes are frequently located at fragile sites and genomic regions involved in cancers,2004,Proceedings of the National Academy of Sciences of the United States of America,3260,10.1073/pnas.0307323101,United States,Article,Philadelphia,1,Journal,2-s2.0-12144290519
Bartel D.,,"MicroRNAs: Genomics, Biogenesis, Mechanism, and Function",2004,Cell,25016,10.1016/S0092-8674(04)00045-5,United States;United States,Review,Cambridge;Cambridge,1,Journal,2-s2.0-0347444723
Nelson P.,,"Microarray-based, high-throughput gene expression profiling of microRNAs",2004,Nature Methods,482,10.1038/nmeth717,United States,Article,Philadelphia,0,Journal,2-s2.0-13944283031
Livak K.J.,,Analysis of relative gene expression data using real-time quantitative PCR and the 2<sup>-ΔΔC</sup>T method,2001,Methods,92026,10.1006/meth.2001.1262,United States,Article,Foster City,0,Journal,2-s2.0-0035710746
Ramalingam S.,,"Lung cancer in young patients: Analysis of a surveillance, epidemiology, and end results database",1998,Journal of Clinical Oncology,175,10.1200/JCO.1998.16.2.651,United States,Article,Detroit,0,Journal,2-s2.0-0031894532
