Authors,Author(s) ID,Title,Year,Source tittle,Cited by,DOI,Country,Document Type,City,Access Type,aggregationType,EID
Eischen C.,,Bcl-2 is an apoptotic target suppressed by both c-Myc and E2F-1,2001,Oncogene,119,10.1038/sj.onc.1204892,United States,Article,"Memphis TN,",1,Journal,2-s2.0-0035950521
Cao J.,,"RBP1L1, a retinoblastoma-binding protein-related gene encoding an antigenic epitope abundantly expressed in human carcinomas and normal testis",2001,Journal of the National Cancer Institute,28,10.1093/jnci/93.15.1159,United States;United States,Article,Santa Monica;Irvine,1,Journal,2-s2.0-0035421508
Lin W.,,"Selective induction of E2F1 in response to DNA damage, mediated by ATM-dependent phosphorylation",2001,Genes and Development,364,,United States,Article,Durham,0,Journal,2-s2.0-0035878122
Stiewe T.,,Role of the p53-homologue p73 in E2F1-induced apoptosis,2000,Nature Genetics,295,10.1038/82617,Germany,Article,Essen,0,Journal,2-s2.0-0033666776
Irwin M.,,Role for the p53 homologue p73 in E2F-1-induced apoptosis,2000,Nature,509,10.1038/35036614,United States,Article,Boston,0,Journal,2-s2.0-0034609798
Malynn B.,,"N-myc can functionally replace c-myc in murine development, cellular growth, and differentiation",2000,Genes and Development,212,,United States;United States;United States,Article,Boston;Boston;Boston,0,Journal,2-s2.0-0034213414
Adams M.,,Complex transcriptional regulatory mechanisms control expression of the E2F3 locus,2000,Molecular and Cellular Biology,104,10.1128/MCB.20.10.3633-3639.2000,United States;United States,Article,Durham;Chicago,1,Journal,2-s2.0-0034014308
Humbert P.,,E2f3 is critical for normal cellular proliferation,2000,Genes and Development,268,,Australia;United States,Article,Melbourne;Cambridge,0,Journal,2-s2.0-0034654105
Bouillet P.,,"Proapoptotic Bcl-2 relative Bim required for certain apoptotic responses, leukocyte homeostasis, and to preclude autoimmunity",1999,Science,1234,10.1126/science.286.5445.1735,Australia,Article,Melbourne,0,Journal,2-s2.0-0033607506
Pierce A.,,E2F1 has both oncogenic and tumor-suppressive properties in a transgenic model,1999,Molecular and Cellular Biology,134,10.1128/MCB.19.9.6408,United States,Article,Smithville,1,Journal,2-s2.0-0032802177
Phillips A.,,E2F-1 Potentiates cell death by blocking antiapoptotic signaling pathways,1999,Molecular Cell,208,10.1016/S1097-2765(00)80387-1,United States,Article,Frederick,1,Journal,2-s2.0-0033231615
Bates S.,,p14(ARF) links the tumour suppressors RB and p53 [5],1998,Nature,789,10.1038/25867,United States,Letter,Frederick,0,Journal,2-s2.0-0032504783
Dyson N.,,The regulation of E2F by pRB-family proteins,1998,Genes and Development,1860,10.1101/gad.12.15.2245,United States,Review,Boston,1,Journal,2-s2.0-0032146274
Yamasaki L.,,Loss of E2F-1 reduces tumorigenesis and extends the lifespan of Rb1(+/- ) mice,1998,Nature Genetics,244,10.1038/ng0498-360,United States,Article,Boston,0,Journal,2-s2.0-0031897273
Tsai K.Y.,,Mutation of E2f-1 suppresses apoptosis and inappropriate S phase entry and extends survival of Rb-deficient mouse embryos,1998,Molecular Cell,311,10.1016/S1097-2765(00)80274-9,United States;United States,Article,Cambridge;Cambridge,1,Journal,2-s2.0-0032159103
Anzick S.L.,,"AIB1, a steroid receptor coactivator amplified in breast and ovarian cancer",1997,Science,1376,10.1126/science.277.5328.965,United States,Article,Bethesda,0,Journal,2-s2.0-0030797902
Leone G.,,Myc and Ras collaborate in inducing accumulation of active cyclin E/Cdk2 and E2F,1997,Nature,381,10.1038/387422a0,United States,Article,Durham,0,Journal,2-s2.0-0030995824
Yamasaki L.,,Tumor induction and tissue atrophy in mice lacking E2F-1,1996,Cell,621,10.1016/S0092-8674(00)81254-4,United States,Article,Boston,1,Journal,2-s2.0-0029888359
Field S.,,E2F-1 Functions in mice to promote apoptosis and suppress proliferation,1996,Cell,671,10.1016/S0092-8674(00)81255-6,United States,Article,Boston,1,Journal,2-s2.0-0029949784
Xu G.,,Multiple members of the E2F transcription factor family are the products of oncogenes,1995,Proceedings of the National Academy of Sciences of the United States of America,183,10.1073/pnas.92.5.1357,United States,Article,Boston,1,Journal,2-s2.0-0028945789
Lee R.,,The C. elegans heterochronic gene lin-4 encodes small RNAs with antisense complementarity to lin-14,1993,Cell,8085,10.1016/0092-8674(93)90529-Y,United States,Article,Cambridge,1,Journal,2-s2.0-0027751663
Thalmeier K.,,Nuclear factor E2F mediates basic transcription and trans-activation by E1a of the human MYC promoter.,1989,Genes &amp; development,176,10.1101/gad.3.4.527,Germany,Article,Munich,1,Journal,2-s2.0-0024651359
