Authors,Author(s) ID,Title,Year,Source tittle,Cited by,DOI,Country,Document Type,City,Access Type,aggregationType,EID
Antal T.,,Relationships between H<inf>2</inf> photoproduction and different electron transport pathways in sulfur-deprived Chlamydomonas reinhardtii,2009,International Journal of Hydrogen Energy,57,10.1016/j.ijhydene.2009.09.011,Russian Federation,Article,Moscow,0,Journal,2-s2.0-71849095917
Hemschemeier A.,,Analytical approaches to photobiological hydrogen production in unicellular green algae,2009,Photosynthesis Research,131,10.1007/s11120-009-9415-5,Germany,Review,Bochum,1,Journal,2-s2.0-76149124197
Giannelli L.,,"Interplay between light intensity, chlorophyll concentration and culture mixing on the hydrogen production in sulfur-deprived Chlamydomonas reinhardtii cultures grown in laboratory photobioreactors",2009,Biotechnology and Bioengineering,69,10.1002/bit.22384,Italy;Italy,Article,Bologna;Rome,0,Journal,2-s2.0-69249095798
Torzillo G.,,Increased hydrogen photoproduction by means of a sulfur-deprived Chlamydomonas reinhardtii D1 protein mutant,2009,International Journal of Hydrogen Energy,100,10.1016/j.ijhydene.2008.07.093,Italy,Article,Rome,0,Journal,2-s2.0-65949117066
Kosourov S.,,Hydrogen photoproduction by nutrient-deprived Chlamydomonas reinhardtii cells immobilized within thin alginate films under aerobic and anaerobic conditions,2009,Biotechnology and Bioengineering,121,10.1002/bit.22050,United States,Article,Golden,0,Journal,2-s2.0-58149218801
Fouchard S.,,Investigation of H<inf>2</inf> production using the green microalga Chlamydomonas reinhardtii in a fully controlled photobioreactor fitted with on-line gas analysis,2008,International Journal of Hydrogen Energy,56,10.1016/j.ijhydene.2008.03.067,France,Article,Nantes,0,Journal,2-s2.0-47249147499
Hemschemeier A.,,Hydrogen production by Chlamydomonas reinhardtii: An elaborate interplay of electron sources and sinks,2008,Planta,153,10.1007/s00425-007-0626-8,Germany,Article,Bochum,0,Journal,2-s2.0-40949128266
Makarova V.,,Photoproduction of hydrogen by sulfur-deprived C. reinhardtii mutants with impaired Photosystem II photochemical activity,2007,Photosynthesis Research,54,10.1007/s11120-007-9219-4,United States;United States;Russian Federation,Article,Golden;Thousand Oaks;Moscow,0,Journal,2-s2.0-34548189058
Doebbe A.,,Functional integration of the HUP1 hexose symporter gene into the genome of C. reinhardtii: Impacts on biological H<inf>2</inf> production,2007,Journal of Biotechnology,107,10.1016/j.jbiotec.2007.05.017,Germany,Article,Bielefeld,0,Journal,2-s2.0-34447277915
Kosourov S.,,A comparison of hydrogen photoproduction by sulfur-deprived Chlamydomonas reinhardtii under different growth conditions,2007,Journal of Biotechnology,109,10.1016/j.jbiotec.2006.12.025,Russian Federation,Article,Pushchino,0,Journal,2-s2.0-33847340991
Ghirardi M.,,Hydrogen production by photosynthetic green algae,2006,Indian Journal of Biochemistry and Biophysics,41,,United States,Short Survey,Golden,0,Journal,2-s2.0-33751424890
Melis A.,,"Chloroplast sulfate transport in green algae - Genes, proteins and effects",2005,Photosynthesis Research,55,10.1007/s11120-005-7382-z,United States,Review,Berkeley,0,Journal,2-s2.0-29944431657
Kruse O.,,Improved photobiological H<inf>2</inf> production in engineered green algal cells,2005,Journal of Biological Chemistry,262,10.1074/jbc.M503840200,Germany,Article,Bielefeld,1,Journal,2-s2.0-26644462167
Kosourov S.,,The effect of sulfur re-addition on H<inf>2</inf> photoproduction by sulfur-deprived green algae,2005,Photosynthesis Research,53,10.1007/s11120-005-5105-0,Russian Federation;United States,Article,Pushchino;Golden,0,Journal,2-s2.0-25444474427
Fouchard S.,,Autotrophic and mixotrophic hydrogen photoproduction in sulfur-deprived Chlamydomonas cells,2005,Applied and Environmental Microbiology,137,10.1128/AEM.71.10.6199-6205.2005,France,Article,Nantes,1,Journal,2-s2.0-26844473317
Park S.,,Mutations in ClpC2/Hsp100 suppress the requirement for FtsH in thylakoid membrane biogenesis,2004,Proceedings of the National Academy of Sciences of the United States of America,83,10.1073/pnas.0402764101,United States,Article,Ames,1,Journal,2-s2.0-4344577287
Kosourov S.,,"Effects of extracellular pH on the metabolic pathways in sulfur-deprived, H<inf>2</inf>-producing Chlamydomonas reinhardtii cultures",2003,Plant and Cell Physiology,202,10.1093/pcp/pcg020,United States,Article,Golden,1,Journal,2-s2.0-0037330899
Preiss S.,,"Rapid, ATP-dependent degradation of a truncated D1 protein in the chloroplast",2001,European Journal of Biochemistry,28,10.1046/j.1432-1327.2001.02383.x,Germany,Article,Halle,1,Journal,2-s2.0-0034825540
Melis A.,,Hydrogen production. Green algae as a source of energy,2001,Plant Physiology,458,10.1104/pp.010498,United States,Review,Berkeley,1,Journal,2-s2.0-0035197070
Ghirardi M.,,Microalgae: A green source of renewable H<inf>2</inf>,2000,Trends in Biotechnology,459,10.1016/S0167-7799(00)01511-0,United States,Review,Golden,0,Journal,2-s2.0-0034566376
Melis A.,,Sustained photobiological hydrogen gas production upon reversible inactivation of oxygen evolution in the green alga Chlamydomonas reinhardtii,2000,Plant Physiology,779,10.1104/pp.122.1.127,United States,Article,Berkeley,1,Journal,2-s2.0-0033759410
Johanningmeier U.,,Construction of a Chlamydomonas reinhardtii mutant with an intronless psbA gene,1993,Plant Molecular Biology,53,10.1007/BF00038998,Germany,Article,Bochum,0,Journal,2-s2.0-0027583864
Greenbaum E.,,Energetic Efficiency of Hydrogen Photoevolution by Algal Water Splitting,1988,Biophysical Journal,99,10.1016/S0006-3495(88)82968-0,,Article,,1,Journal,2-s2.0-0001090049
Lichtenthaler H.,,Chlorophylls and Carotenoids: Pigments of Photosynthetic Biomembranes,1987,Methods in Enzymology,7035,10.1016/0076-6879(87)48036-1,,Article,,0,Book Series,2-s2.0-77957068711
Godde D.,,NADH as electron donor for the photosynthetic membrane of Chlamydomonas reinhardii,1980,Archives of Microbiology,90,10.1007/BF00427200,Germany,Article,Bochum,0,Journal,2-s2.0-0019126116
Laemmli U.,,Maturation of the head of bacteriophage T4. I. DNA packaging events,1973,Journal of Molecular Biology,2943,10.1016/0022-2836(73)90198-8,United States,Article,Princeton,0,Journal,2-s2.0-0015853344
Dubois M.,,Colorimetric Method for Determination of Sugars and Related Substances,1956,Analytical Chemistry,35186,10.1021/ac60111a017,United States,Article,Minneapolis,0,Journal,2-s2.0-33749946901
LOWRY O.,,Protein measurement with the Folin phenol reagent.,1951,The Journal of biological chemistry,253915,,,Article,,0,Journal,2-s2.0-71849104860
