Authors,Author(s) ID,Title,Year,Source tittle,Cited by,DOI,Country,Document Type,City,Access Type,aggregationType,EID
Marz K.,,Defining the SNARE complex binding surface of α-SNAP. Implications for SNARE complex disassembly,2003,Journal of Biological Chemistry,51,10.1074/jbc.M302003200,,Article,,1,Journal,2-s2.0-0037697285
Söllner T.,,Regulated exocytosis and SNARE function,2003,Molecular Membrane Biology,137,10.1080/0968768031000104953,United States,Review,New York,0,Journal,2-s2.0-0038050215
Davy B.,,"Congenital hydrocephalus in hy3 mice is caused by a frameshift mutation in Hydin, a large novel gene",2003,Human Molecular Genetics,119,10.1093/hmg/ddg122,United States,Article,Columbus,0,Journal,2-s2.0-0038778365
Jahn R.,,Membrane fusion,2003,Cell,1135,10.1016/S0092-8674(03)00112-0,Germany,Review,Gottingen,1,Journal,2-s2.0-0037459076
Waterston R.H.,,Initial sequencing and comparative analysis of the mouse genome,2002,Nature,4845,10.1038/nature01262,United States,Article,St. Louis,1,Journal,2-s2.0-1542563409
Giaever G.,,Functional profiling of the Saccharomyces cerevisiae genome,2002,Nature,2854,10.1038/nature00935,United States,Article,Stanford,0,Journal,2-s2.0-0037173615
Horsnell W.,,Analysis of NSF mutants reveals residues involved in SNAP binding and ATPase stimulation,2002,Biochemistry,15,10.1021/bi0160359,United Kingdom,Article,Liverpool,0,Journal,2-s2.0-0037161267
Kerlavage A.,,The celera discovery system™,2002,Nucleic Acids Research,50,,United States,Article,Rockville,0,Journal,2-s2.0-18444397172
Canitano A.,,"Brain distribution of the Na<sup>+</sup>/Ca<sup>2+</sup> exchanger-encoding genes NCX1, NCX2, and NCX3 and their related proteins in the central nervous system",2002,Annals of the New York Academy of Sciences,62,10.1111/j.1749-6632.2002.tb04766.x,Italy,Conference Paper,Naples,0,Book Series,2-s2.0-0036968904
Rizo J.,,Snares and munc18 in synaptic vesicle fusion,2002,Nature Reviews Neuroscience,406,10.1038/nrn898,United States,Review,Dallastown,0,Journal,2-s2.0-0036673069
Nishiki T.,,Distribution of soluble N-ethylmaleimide fusion protein attachment proteins (SNAPS) in the rat nervous system,2001,Neuroscience,15,10.1016/S0306-4522(01)00370-0,Japan,Article,Tokyo,0,Journal,2-s2.0-0035940839
Schoch S.,,SNARE function analyzed in synaptobrevin/VAMP knockout mice,2001,Science,458,10.1126/science.1064335,United States,Article,Dallas,0,Journal,2-s2.0-0035798088
Brown S.,,Systematic approaches to mouse mutagenesis,2001,Current Opinion in Genetics and Development,89,10.1016/S0959-437X(00)00189-1,United Kingdom,Review,Oxfordshire,0,Journal,2-s2.0-0035370789
Jiménez A.,,A programmed ependymal denudation precedes congenital hydrocephalus in the hyh mutant mouse,2001,Journal of Neuropathology and Experimental Neurology,71,10.1093/jnen/60.11.1105,Spain,Article,Malaga,1,Journal,2-s2.0-0034752867
Korf I.,,Integrating genomic homology into gene structure prediction,2001,Bioinformatics,328,10.1093/bioinformatics/17.suppl_1.S140,United States,Article,St. Louis,1,Journal,2-s2.0-17444437765
Lin R.,,Mechanisms of synaptic vesicle exocytosis,2000,Annual Review of Cell and Developmental Biology,396,10.1146/annurev.cellbio.16.1.19,United States,Review,Stanford,0,Book Series,2-s2.0-0034523701
Smith J.S.,,A transcript map of the chromosome 19q-arm glioma tumor suppressor region,2000,Genomics,107,10.1006/geno.1999.6101,United States,Article,Rochester,0,Journal,2-s2.0-0034652751
Verhage M.,,Synaptic assembly of the brain in the absence of neurotransmitter secretion,2000,Science,896,10.1126/science.287.5454.864,,Article,,0,Journal,2-s2.0-0034603030
Justice M.,,Mouse ENU mutagenesis,1999,Human Molecular Genetics,344,10.1093/hmg/8.10.1955,United States,Review,Houston,1,Journal,2-s2.0-0032837860
Ch'ng Q.,,egl-27 generates anteroposterior patterns of cell fusion in C. elegans by regulating Hox gene expression and Hox protein function,1999,Development,47,,United States,Article,San Francisco,0,Journal,2-s2.0-0032819137
Solari F.,,"The Caenorhabditis elegans genes egl-27 and egr-1 are similar to MTA1, a member of a chromatin regulatory complex, and are redundantly required for embryonic patterning",1999,Development,94,,United Kingdom;United Kingdom,Article,Cambridge;Cambridge,0,Journal,2-s2.0-0032998903
Bearer E.,,2E4 (Kaptin): A novel actin-associated protein from human blood platelets found in lamellipodia and the tips of the stereocilia of the inner ear,1999,European Journal of Cell Biology,25,10.1016/S0171-9335(99)80013-2,United States,Article,Providence,0,Journal,2-s2.0-0033023110
Hong H.,,Pleiotropic skeletal and ocular phenotypes of the mouse mutation congenital hydrocephalus (ch/Mf1) arise from a winged helix/forkhead transcription factor gene,1999,Human Molecular Genetics,81,10.1093/hmg/8.4.625,United States,Article,Cleveland,1,Journal,2-s2.0-0033041178
Rice L.,,Crystal structure of the vesicular transport protein Sec17: Implications for SNAP function in SNARE complex disassembly,1999,Molecular Cell,94,10.1016/S1097-2765(00)80190-2,United States,Article,New Haven,1,Journal,2-s2.0-0033165863
Kume T.,,The forkhead/winged helix gene Mf1 is disrupted in the pleiotropic mouse mutation congenital hydrocephalus,1998,Cell,283,10.1016/S0092-8674(00)81204-0,United States,Article,Nashville,1,Journal,2-s2.0-0032511231
Pérez-Fígares J.M.,,Spontaneous congenital hydrocephalus in the mutant mouse hyh. changes in the ventricular system and the subcommissural organ,1998,Journal of Neuropathology and Experimental Neurology,50,10.1097/00005072-199802000-00010,Spain,Article,Malaga,1,Journal,2-s2.0-2642668470
Hohl T.M.,,"Arrangement of subunits in 20 S particles consisting of NSF, SNAPs, and SNARE complexes",1998,Molecular Cell,102,10.1016/S1097-2765(00)80153-7,United States,Article,New York,1,Journal,2-s2.0-0032214690
Osten P.,,"The AMPA receptor GluR2 C terminus can mediate a reversible, ATP- dependent interaction with NSF and α- and β-SNAPs",1998,Neuron,299,10.1016/S0896-6273(00)80518-8,United States,Article,New York,1,Journal,2-s2.0-0032125884
Xue Y.,,"NURD, a novel complex with both ATP-dependent chromatin-remodeling and histone deacetylase activities",1998,Molecular Cell,707,10.1016/S1097-2765(00)80299-3,United States,Article,Bethesda,1,Journal,2-s2.0-0032252209
Barnard R.,,Stimulation of NSF ATPase activity by α-SNAP is required for SNARE complex disassembly and exocytosis,1997,Journal of Cell Biology,145,10.1083/jcb.139.4.875,United Kingdom,Article,Liverpool,1,Journal,2-s2.0-0030682481
Burge C.,,Prediction of complete gene structures in human genomic DNA,1997,Journal of Molecular Biology,2757,10.1006/jmbi.1997.0951,United States,Article,Palo Alto,0,Journal,2-s2.0-0031586003
Sudlow A.W.,,Similar effects of α- and β-SNAP on Ca<sup>2+</sup>-regulated exocytosis,1996,FEBS Letters,26,10.1016/0014-5793(96)00880-0,United Kingdom,Article,Liverpool,1,Journal,2-s2.0-0030590474
Rothman J.,,Protein sorting by transport vesicles,1996,Science,1002,10.1126/science.272.5259.227,United States,Article,New York,0,Journal,2-s2.0-0029670289
Barnard R.,,Domains of α-SNAP required for the stimulation of exocytosis and for N-ethylmalemide-sensitive fusion protein (NSF) binding and activation,1996,Molecular Biology of the Cell,48,10.1091/mbc.7.5.693,United Kingdom,Article,Liverpool,0,Journal,2-s2.0-0029996161
Sanner M.F.,,Reduced surface: An efficient way to compute molecular surfaces,1996,Biopolymers,1524,10.1002/(sici)1097-0282(199603)38:3<305::aid-bip4>3.0.co;2-y,United States,Article,San Diego,0,Journal,2-s2.0-0030040323
Pallanck L.,,A Drosophila NSF mutant,1995,Nature,95,10.1038/376025a0,United States,Article,Madison,0,Journal,2-s2.0-0029030196
Hanson P.,,The N-ethylmaleimide-sensitive fusion protein and α-SNAP induce a conformational change in syntaxin,1995,Journal of Biological Chemistry,192,10.1074/jbc.270.28.16955,United States,Article,New Haven,1,Journal,2-s2.0-0029075363
Kee Y.,,Distinct domains of syntaxin are required for synaptic vesicle fusion complex formation and dissociation,1995,Neuron,189,10.1016/0896-6273(95)90337-2,United States,Article,Stanford,1,Journal,2-s2.0-0029058496
Hayashi T.,,Disassembly of the reconstituted synaptic vesicle membrane fusion complex in vitro,1995,EMBO Journal,223,10.1002/j.1460-2075.1995.tb07226.x,Germany,Article,Tubingen,0,Journal,2-s2.0-0029004741
Püschel A.,,The N-ethylmaleimide-sensitive fusion protein (NSF) is preferentially expressed in the nervous system,1994,FEBS Letters,43,10.1016/0014-5793(94)00505-2,Germany,Article,Frankfurt am Main,0,Journal,2-s2.0-0028357890
Li Z.,,Cloning of the NCX2 isoform of the plasma membrane Na<sup>+</sup>-Ca<sup>2+</sup> exchanger,1994,Journal of Biological Chemistry,295,,United States,Article,Los Angeles,0,Journal,2-s2.0-0028284776
Rothman J.,,Mechanisms of intracellular protein transport,1994,Nature,1936,10.1038/372055a0,United States,Review,New York,0,Journal,2-s2.0-0028143698
Söllner T.,,"A protein assembly-disassembly pathway in vitro that may correspond to sequential steps of synaptic vesicle docking, activation, and fusion",1993,Cell,1491,10.1016/0092-8674(93)90376-2,United States,Article,New York,0,Journal,2-s2.0-0027517462
Whiteheart S.W.,,SNAP family of NSF attachment proteins includes a brain-specific isoform,1993,Nature,213,10.1038/362353a0,United States,Article,New York,0,Journal,2-s2.0-0027402091
Söllner T.,,SNAP receptors implicated in vesicle targeting and fusion,1993,Nature,2473,10.1038/362318a0,United States,Article,New York,0,Journal,2-s2.0-0027413655
Griff I.,,The yeast SEC17 gene product is functionally equivalent to mammalian α- SNAP protein,1992,Journal of Biological Chemistry,127,,United States,Article,Cambridge,0,Journal,2-s2.0-0026692898
Clary D.,,Purification of three related peripheral membrane proteins needed for vesicular transport,1990,Journal of Biological Chemistry,104,,United States,Article,Princeton,0,Journal,2-s2.0-0025286486
Bronson R.,,Hydrocephalus with hop gait (hyh): a new mutation on chromosome 7 in the mouse,1990,Developmental Brain Research,44,10.1016/0165-3806(90)90073-8,United States;United States,Article,Boston;Bar Harbor,0,Journal,2-s2.0-0025313185
Clary D.,,"SNAPs, a family of NSF attachment proteins involved in intracellular membrane fusion in animals and yeast",1990,Cell,383,10.1016/0092-8674(90)90482-T,United States;United States,Article,Palo Alto;Princeton,0,Journal,2-s2.0-0025359065
Kaiser C.,,Distinct sets of SEC genes govern transport vesicle formation and fusion early in the secretory pathway,1990,Cell,513,10.1016/0092-8674(90)90483-U,United States,Article,Berkeley,0,Journal,2-s2.0-0025277750
Altschul S.,,Basic local alignment search tool,1990,Journal of Molecular Biology,60311,10.1016/S0022-2836(05)80360-2,United States,Article,Bethesda,0,Journal,2-s2.0-0025183708
Siddiqi O.,,Neurophysiological defects in temperature sensitive paralytic mutants of Drosophila melanogaster,1976,Proceedings of the National Academy of Sciences of the United States of America,186,10.1073/pnas.73.9.3253,United States,Article,Pasadena,1,Journal,2-s2.0-0004688543
Borit A.,,New mutant mouse with communicating hydrocephalus and secondary aqueductal stenosis,1972,Acta Neuropathologica,60,10.1007/BF00685139,United States,Article,Boston,0,Journal,2-s2.0-0015272936
