Authors,Author(s) ID,Title,Year,Source tittle,Cited by,DOI,Country,Document Type,City,Access Type,aggregationType,EID
Hinton G.,,Reducing the dimensionality of data with neural networks,2006,Science,8836,10.1126/science.1127647,Canada,Article,Toronto,0,Journal,2-s2.0-33746600649
Hinton G.,,A fast learning algorithm for deep belief nets,2006,Neural Computation,8546,10.1162/neco.2006.18.7.1527,Canada,Article,Toronto,0,Journal,2-s2.0-33745805403
Carreira-Perpiñán M.,,On contrastive divergence learning,2005,AISTATS 2005 - Proceedings of the 10th International Workshop on Artificial Intelligence and Statistics,384,,Canada;United States,Conference Paper,Toronto;Portland,0,Conference Proceeding,2-s2.0-84862612564
Welling M.,,Exponential family harmoniums with an application to information retrieval,2005,Advances in Neural Information Processing Systems,180,,United States,Conference Paper,Irvine,0,Conference Proceeding,2-s2.0-84899000641
Marlin B.,,The multiple multiplicative factor model for collaborative filtering,2004,"Proceedings, Twenty-First International Conference on Machine Learning, ICML 2004",36,,Canada,Conference Paper,Toronto,0,Conference Proceeding,2-s2.0-14344254812
Srebro N.,,Weighted Low-Rank Approximations,2003,"Proceedings, Twentieth International Conference on Machine Learning",466,,United States,Conference Paper,Cambridge,0,Conference Proceeding,2-s2.0-1942516801
Hinton G.E.,,Training products of experts by minimizing contrastive divergence,2002,Neural Computation,2671,10.1162/089976602760128018,United Kingdom,Article,London,0,Journal,2-s2.0-0013344078
Canny J.,,Collaborative filtering with privacy via factor analysis,2002,SIGIR Forum (ACM Special Interest Group on Information Retrieval),318,10.1145/564418.564419,United States,Conference Paper,Berkeley,0,Journal,2-s2.0-0036993076
Deerwester S.,,Indexing by latent semantic analysis,1990,Journal of the American Society for Information Science,7487,10.1002/(SICI)1097-4571(199009)41:6<391::AID-ASI1>3.0.CO;2-9,United States,Article,Chicago,0,Journal,2-s2.0-84989525001
