Authors,Author(s) ID,Title,Year,Source tittle,Cited by,DOI,Country,Document Type,City,Access Type,aggregationType,EID
Seeger M.,,PAC-Bayesian generalisation error bounds for Gaussian process classification,2003,Journal of Machine Learning Research,112,10.1162/153244303765208386,United Kingdom,Article,Edinburgh,0,Journal,2-s2.0-0041464774
Ng A.Y.,,"Link analysis, eigenvectors and stability",2001,IJCAI International Joint Conference on Artificial Intelligence,129,,United States,Conference Paper,Berkeley,0,Conference Proceeding,2-s2.0-84880875744
Boykov Y.,,Fast approximate energy minimization via graph cuts,2001,IEEE Transactions on Pattern Analysis and Machine Intelligence,5351,10.1109/34.969114,United States;United States,Article,New York;New York,0,Journal,2-s2.0-0035509961
Weiss Y.,,Correctness of Belief Propagation in Gaussian Graphical Models of Arbitrary Topology,2001,Neural Computation,320,10.1162/089976601750541769,United States,Article,Berkeley,0,Journal,2-s2.0-0011952756
Chung F.,,Discrete Green's functions,2000,Journal of Combinatorial Theory. Series A,131,10.1006/jcta.2000.3094,United States,Article,San Diego,1,Journal,2-s2.0-0034215984
Shi J.,,Normalized cuts and image segmentation,2000,IEEE Transactions on Pattern Analysis and Machine Intelligence,9925,10.1109/34.868688,United States,Article,Pittsburgh,0,Journal,2-s2.0-0034244751
Freund Y.,,Large margin classification using the perceptron algorithm,1999,Machine Learning,662,10.1023/A:1007662407062,United States,Article,Florham Park,1,Journal,2-s2.0-0033281425
Hull J.,,A Database for Handwritten Text Recognition Research,1994,IEEE Transactions on Pattern Analysis and Machine Intelligence,1001,10.1109/34.291440,United States,Article,Buffalo,0,Journal,2-s2.0-0028428774
