Authors,Author(s) ID,Title,Year,Source tittle,Cited by,DOI,Country,Document Type,City,Access Type,aggregationType,EID
Dal'Molin C.,,"C4GEM, a genome-scale metabolic model to study C<inf>4</inf> plant metabolism",2010,Plant Physiology,138,10.1104/pp.110.166488,Australia,Article,Brisbane,1,Journal,2-s2.0-78649796264
Tyo K.,,Toward design-based engineering of industrial microbes,2010,Current Opinion in Microbiology,66,10.1016/j.mib.2010.02.001,Sweden,Review,Göteborg,0,Journal,2-s2.0-77952888809
Kruse O.,,Microalgal hydrogen production,2010,Current Opinion in Biotechnology,115,10.1016/j.copbio.2010.03.012,Germany,Review,Bielefeld,0,Journal,2-s2.0-77953363891
Scott S.,,Biodiesel from algae: Challenges and prospects,2010,Current Opinion in Biotechnology,748,10.1016/j.copbio.2010.03.005,United Kingdom,Review,Cambridge,0,Journal,2-s2.0-77953361331
Choi H.,,In silico identification of gene amplification targets for improvement of lycopene production,2010,Applied and Environmental Microbiology,158,10.1128/AEM.00115-10,South Korea,Article,Yusong,1,Journal,2-s2.0-77952265112
Sivakumar G.,,Bioethanol and biodiesel: Alternative liquid fuels for future generations,2010,Engineering in Life Sciences,88,10.1002/elsc.200900061,United States,Review,Jonesboro,0,Journal,2-s2.0-77949505522
Dal'Molin C.,,"AraGEM, a genome-scale reconstruction of the primary metabolic network in Arabidopsis",2010,Plant Physiology,233,10.1104/pp.109.148817,Australia,Article,Brisbane,1,Journal,2-s2.0-75949088191
Schmidt B.,,Metabolic systems analysis to advance algal biotechnology,2010,Biotechnology Journal,27,10.1002/biot.201000129,United States;United States,Review,Foster City;Charlottesville,0,Journal,2-s2.0-77954699812
Melzer G.,,Flux Design: In silico design of cell factories based on correlation of pathway fluxes to desired properties,2009,BMC Systems Biology,70,10.1186/1752-0509-3-120,Germany,Article,Braunschweig,1,Journal,2-s2.0-74549189949
Winkler M.,,Characterization of the key step for light-driven hydrogen evolution in green algae,2009,Journal of Biological Chemistry,96,10.1074/jbc.M109.053496,Germany,Article,Bochum,1,Journal,2-s2.0-73649099860
Tepper N.,,Predicting metabolic engineering knockout strategies for chemical production: Accounting for competing pathways,2009,Bioinformatics,142,10.1093/bioinformatics/btp704,Israel,Article,Haifa,1,Journal,2-s2.0-77949495880
Ghirardi M.L.,,Photobiological hydrogen-producing systems,2009,Chemical Society Reviews,212,10.1039/b718939g,United States,Article,Golden,0,Journal,2-s2.0-57649188186
Park J.,,Constraints-based genome-scale metabolic simulation for systems metabolic engineering,2009,Biotechnology Advances,93,10.1016/j.biotechadv.2009.05.019,South Korea,Review,Yusong,0,Journal,2-s2.0-70349770739
Kanehisa M.,,KEGG for representation and analysis of molecular networks involving diseases and drugs,2009,Nucleic Acids Research,1585,10.1093/nar/gkp896,Japan;Japan,Article,Tokyo;Kyoto,1,Journal,2-s2.0-75549090213
Zhang Z.,,PMRD: Plant microRNA database,2009,Nucleic Acids Research,224,10.1093/nar/gkp818,China,Article,Beijing,1,Journal,2-s2.0-75549083571
Chochois V.,,Hydrogen production in Chlamydomonas: Photosystem II-dependent and -independent pathways differ in their requirement for starch metabolism,2009,Plant Physiology,109,10.1104/pp.109.144576,France;France;France,Article,Marseille;Paris;Saint Paul lez Durance,1,Journal,2-s2.0-70349647741
Manichaikul A.,,Metabolic network analysis integrated with transcript verification for sequenced genomes,2009,Nature Methods,66,10.1038/nmeth.1348,United States,Article,Charlottesville,0,Journal,2-s2.0-68349108021
Pienkos P.,,The promise and challenges of microalgal-derived biofuels,2009,"Biofuels, Bioproducts and Biorefining",416,10.1002/bbb.159,United States,Article,Golden,0,Journal,2-s2.0-67650721445
Raman K.,,Flux balance analysis of biological systems: Applications and challenges,2009,Briefings in Bioinformatics,210,10.1093/bib/bbp011,Switzerland,Review,Zurich,1,Journal,2-s2.0-67449096729
May P.,,ChlamyCyc: An integrative systems biology database and web-portal for Chlamydomonas reinhardtii,2009,BMC Genomics,63,10.1186/1471-2164-10-209,Germany,Article,Potsdam,1,Journal,2-s2.0-66349086716
Tolstygina I.,,Hydrogen production by photoautotrophic sulfur-deprived chlamydomonas reinhardtii pre-grown and incubated under high light,2009,Biotechnology and Bioengineering,37,10.1002/bit.22148,Russian Federation,Article,Pushchino,0,Journal,2-s2.0-60549098776
Boyle N.,,Flux balance analysis of primary metabolism in Chlamydomonas reinhardtii,2009,BMC Systems Biology,261,10.1186/1752-0509-3-4,United States,Article,West Lafayette,1,Journal,2-s2.0-58849135386
Ananyev G.,,"Optimization of metabolic capacity and flux through environmental cues to maximize hydrogen production by the Cyanobacterium ""Arthrospira (Spirulina) maxima""",2008,Applied and Environmental Microbiology,95,10.1128/AEM.01078-08,United States,Article,Princeton,1,Journal,2-s2.0-54449090208
Rittmann B.,,Opportunities for renewable bioenergy using microorganisms,2008,Biotechnology and Bioengineering,418,10.1002/bit.21875,United States,Review,Tempe,1,Journal,2-s2.0-44449089547
Hemschemeier A.,,"Biochemical and physiological characterization of the pyruvate formate-lyase pfl1 of chlamydomonas reinhardtii, a typically bacterial enzyme in a eukaryotic alga",2008,Eukaryotic Cell,45,10.1128/EC.00368-07,Germany,Article,Bochum,1,Journal,2-s2.0-40949115388
Quek L.E.,,On the reconstruction of the Mus musculus genome-scale metabolic network model.,2008,Genome informatics. International Conference on Genome Informatics,41,10.1142/9781848163324_0008,Australia,Article,Brisbane,0,Journal,2-s2.0-67651209209
Hemschemeier A.,,Hydrogen production by Chlamydomonas reinhardtii: An elaborate interplay of electron sources and sinks,2008,Planta,153,10.1007/s00425-007-0626-8,Germany,Article,Bochum,0,Journal,2-s2.0-40949128266
Kanehisa M.,,KEGG for linking genomes to life and the environment,2008,Nucleic Acids Research,3292,10.1093/nar/gkm882,Japan;Japan,Article,Tokyo;Kyoto,1,Journal,2-s2.0-38549126643
Melis A.,,Photosynthetic H<inf>2</inf> metabolism in Chlamydomonas reinhardtii (unicellular green algae),2007,Planta,178,10.1007/s00425-007-0609-9,United States,Review,Berkeley,0,Journal,2-s2.0-34548528653
Mo M.,,"A genome-scale, constraint-based approach to systems biology of human metabolism",2007,Molecular BioSystems,42,10.1039/b705597h,United States,Article,San Diego,0,Journal,2-s2.0-34547888003
Doebbe A.,,Functional integration of the HUP1 hexose symporter gene into the genome of C. reinhardtii: Impacts on biological H<inf>2</inf> production,2007,Journal of Biotechnology,107,10.1016/j.jbiotec.2007.05.017,Germany,Article,Bielefeld,0,Journal,2-s2.0-34447277915
Ghirardi M.,,Hydrogenases and hydrogen photoproduction in oxygenic photosynthetic organisms,2007,Annual Review of Plant Biology,277,10.1146/annurev.arplant.58.032806.103848,United States,Review,Golden,0,Book Series,2-s2.0-34250902424
Horton P.,,WoLF PSORT: Protein localization predictor,2007,Nucleic Acids Research,1741,10.1093/nar/gkm259,Japan,Article,Tokyo,1,Journal,2-s2.0-34547560275
Becker S.,,Quantitative prediction of cellular metabolism with constraint-based models: The COBRA Toolbox,2007,Nature Protocols,596,10.1038/nprot.2007.99,United States,Article,San Diego,0,Journal,2-s2.0-34347258175
Kruse O.,,Improved photobiological H<inf>2</inf> production in engineered green algal cells,2005,Journal of Biological Chemistry,262,10.1074/jbc.M503840200,Germany,Article,Bielefeld,1,Journal,2-s2.0-26644462167
Nakamura Y.,,Disruption of the glycolate dehydrogenase gene in the high-CO <inf>2</inf>-requiring mutant HCR89 of Chlamydomonas reinhardtii,2005,Canadian Journal of Botany,49,10.1139/b05-067,United States,Conference Paper,Ames,0,Journal,2-s2.0-29144470338
Stabenau H.,,Glycolate metabolism in green algae,2005,Physiologia Plantarum,37,10.1046/j.1399-3054.2005.00442.x,Germany,Article,Oldenburg,0,Journal,2-s2.0-15544385088
Hackstein J.,,Eukaryotic Fe-hydrogenases - Old eukaryotic heritage or adaptive acquisitions?,2005,Biochemical Society Transactions,19,10.1042/BST0330047,Netherlands,Conference Paper,Nijmegen,0,Journal,2-s2.0-14644440569
Duarte N.,,"Reconstruction and validation of Saccharomyces cerevisiae iND750, a fully compartmentalized genome-scale metabolic model",2004,Genome Research,452,10.1101/gr.2250904,United States,Article,San Diego,1,Journal,2-s2.0-3843128481
Nogales J.,,Functional analysis and regulation of the malate synthase from Chlamydomonas reinhardtii,2004,Planta,11,10.1007/s00425-004-1223-8,Spain,Article,Madrid,0,Journal,2-s2.0-4344568270
Krieger C.,,MetaCyc: A multiorganism database of metabolic pathways and enzymes,2004,Nucleic Acids Research,215,,United States,Article,Menlo Park,0,Journal,2-s2.0-0346494819
Forestier M.,,Expression of two [Fe]-hydrogenases in Chlamydomonas reinhardtii under anaerobic conditions,2003,European Journal of Biochemistry,189,10.1046/j.1432-1033.2003.03656,United States;Switzerland,Article,Golden;Zurich,1,Journal,2-s2.0-0037715163
Zhang L.,,Biochemical and morphological characterization of sulfur-deprived and H<inf>2</inf>-producing Chlamydomonas reinhardtii (green alga),2002,Planta,315,10.1007/s004250100660,United States,Article,Berkeley,0,Journal,2-s2.0-0036481398
Winkler M.,,[Fe]-hydrogenases in green algae: Photo-fermentation and hydrogen evolution under sulfur deprivation,2002,International Journal of Hydrogen Energy,101,10.1016/S0360-3199(02)00095-2,Germany,Conference Paper,Bonn,0,Journal,2-s2.0-0036827189
Zhang L.,,Probing green algal hydrogen production,2002,Philosophical Transactions of the Royal Society B: Biological Sciences,62,10.1098/rstb.2002.1152,United States,Conference Paper,Berkeley,0,Journal,2-s2.0-18644374880
Tamagnini P.,,Hydrogenases and hydrogen metabolism of cyanobacteria,2002,Microbiology and Molecular Biology Reviews,362,10.1128/MMBR.66.1.1-20.2002,Sweden,Review,Uppsala,1,Journal,2-s2.0-0036198693
Happe T.,,Differential regulation of the Fe-hydrogenase during anaerobic adaptation in the green alga Chlamydomonas reinhardtii,2002,European Journal of Biochemistry,197,10.1046/j.0014-2956.2001.02743.x,Germany,Article,Bonn,0,Journal,2-s2.0-0036186921
Thyssen C.,,The CO<inf>2</inf>-concentrating mechanism in the physiological context: Lowering the CO<inf>2</inf> supply diminishes culture growth and economizes starch utilization in Chlamydomonas reinhardtii,2001,Planta,29,10.1007/s004250100534,Germany,Article,Darmstadt,0,Journal,2-s2.0-0034741819
Melis A.,,Hydrogen production. Green algae as a source of energy,2001,Plant Physiology,458,10.1104/pp.010498,United States,Review,Berkeley,1,Journal,2-s2.0-0035197070
Kato J.,,Characterization of catalase from green algae Chlamydomonas reinhardtii,1997,Journal of Plant Physiology,32,10.1016/S0176-1617(97)80251-9,Japan,Article,Higashihiroshima,0,Journal,2-s2.0-0030845693
Nelson E.B.,,Glycolate dehydrogenase in green algae,1970,Archives of Biochemistry and Biophysics,86,10.1016/0003-9861(70)90112-8,United States,Article,East Lansing,0,Journal,2-s2.0-0014873429
Gaffron H.,,Fermentative and photochemical production of hydrogen in algae,1942,Journal of General Physiology,409,10.1085/jgp.26.2.219,United States,Article,Chicago,1,Journal,2-s2.0-84941787599
