Authors,Author(s) ID,Title,Year,Source tittle,Cited by,DOI,Country,Document Type,City,Access Type,aggregationType,EID
Chindelevitch L.,,Local optimization for global alignment of protein interaction networks,2010,"Pacific Symposium on Biocomputing 2010, PSB 2010",37,,United States,Conference Paper,Cambridge,0,Conference Proceeding,2-s2.0-77955495879
Kuchaiev O.,,Topological network alignment uncovers biological function and phylogeny,2010,Journal of the Royal Society Interface,203,10.1098/rsif.2010.0063,United States,Article,Irvine,1,Journal,2-s2.0-77956576710
Milenković T.,,Optimal network alignment with graphlet degree vectors,2010,Cancer Informatics,116,10.4137/cin.s4744,United Kingdom,Article,London,1,Journal,2-s2.0-77955499935
Tian W.,,Pairwise alignment of interaction networks by fast identification of maximal conserved patterns,2009,"Pacific Symposium on Biocomputing 2009, PSB 2009",27,,United States;United States,Conference Paper,Oak Ridge;Raleigh,0,Conference Proceeding,2-s2.0-61949276439
Zaslavskiy M.,,Global alignment of protein - Protein interaction networks by graph matching methods,2009,Bioinformatics,113,10.1093/bioinformatics/btp196,France;France;France,Conference Paper,Paris;Paris;Paris,1,Journal,2-s2.0-66349109783
Liao C.,,IsoRankN: Spectral methods for global alignment of multiple protein networks,2009,Bioinformatics,238,10.1093/bioinformatics/btp203,Taiwan;United States;Taiwan,Conference Paper,Taipei;Cambridge;Taipei,1,Journal,2-s2.0-66349108229
Klau G.,,A new graph-based method for pairwise global network alignment,2009,BMC Bioinformatics,136,10.1186/1471-2105-10-S1-S59,Netherlands,Conference Paper,Amsterdam,1,Journal,2-s2.0-60849107715
Peregrín-Alvarez J.,,The modular organization of protein interactions in Escherichia coli,2009,PLoS Computational Biology,58,10.1371/journal.pcbi.1000523,Canada;Spain,Article,Toronto;Malaga,1,Journal,2-s2.0-73549083239
Fossum E.,,Evolutionarily conserved herpesviral protein interaction networks,2009,PLoS Pathogens,126,10.1371/journal.ppat.1000570,Germany;United Kingdom,Article,Munich;Edinburgh,1,Journal,2-s2.0-70349677166
Simonis N.,,Empirically controlled mapping of the Caenorhabditis elegans protein-protein interactome network,2009,Nature Methods,194,10.1038/nmeth.1279,United States;United States,Article,Boston;Boston,0,Journal,2-s2.0-58149218155
Shimoda Y.,,A large scale analysis of protein-protein interactions in the nitrogen-fixing bacterium Mesorhizobium loti,2008,DNA Research,28,10.1093/dnares/dsm034,Japan,Article,Kisarazu,1,Journal,2-s2.0-73549094892
Singh R.,,Global alignment of multiple protein interaction networks,2008,"Pacific Symposium on Biocomputing 2008, PSB 2008",47,,United States,Conference Paper,Cambridge,0,Conference Proceeding,2-s2.0-40549129437
Radivojac P.,,An integrated approach to inferring gene-disease associations in humans,2008,"Proteins: Structure, Function and Genetics",126,10.1002/prot.21989,United States,Article,Bloomington,0,Journal,2-s2.0-47349128648
Flannick J.,,Automatic parameter learning for multiple network alignment,2008,Lecture Notes in Computer Science (including subseries Lecture Notes in Artificial Intelligence and Lecture Notes in Bioinformatics),54,10.1007/978-3-540-78839-3_19,United States,Conference Paper,Palo Alto,0,Book Series,2-s2.0-47249149365
Milenković T.,,Uncovering biological network function via graphlet degree signatures,2008,Cancer Informatics,200,10.4137/cin.s680,United States,Article,Irvine,1,Journal,2-s2.0-49649109285
Sato S.,,A large-scale protein-protein interaction analysis in synechocystis sp. PCC6803,2007,DNA Research,134,10.1093/dnares/dsm021,Japan,Article,Kisarazu,1,Journal,2-s2.0-39749105401
Parrish J.R.,,A proteome-wide protein interaction map for Campylobacter jejuni,2007,Genome Biology,183,10.1186/gb-2007-8-7-r130,United States,Article,Detroit,1,Journal,2-s2.0-38549161592
Labarga A.,,Web services at the European Bioinformatics Institute,2007,Nucleic Acids Research,141,10.1093/nar/gkm291,United Kingdom,Article,London,1,Journal,2-s2.0-34547579706
Collins S.,,Toward a comprehensive atlas of the physical interactome of Saccharomyces cerevisiae,2007,Molecular and Cellular Proteomics,582,10.1074/mcp.M600381-MCP200,United States;United States;United States,Article,Berkeley;San Francisco;Chevy Chase,1,Journal,2-s2.0-34147121646
Singh R.,,Pairwise global alignment of protein interaction networks by matching neighborhood topology,2007,Lecture Notes in Computer Science (including subseries Lecture Notes in Artificial Intelligence and Lecture Notes in Bioinformatics),180,10.1007/978-3-540-71681-5_2,United States,Conference Paper,Cambridge,0,Book Series,2-s2.0-34547416529
Flannick J.,,Græmlin: General and robust alignment of multiple large interaction networks,2006,Genome Research,236,10.1101/gr.5235706,United States,Article,Palo Alto,1,Journal,2-s2.0-33748257786
McGeoch D.J.,,Topics in herpesvirus genomics and evolution,2006,Virus Research,342,10.1016/j.virusres.2006.01.002,United Kingdom,Review,Glasgow,0,Journal,2-s2.0-33645054794
Krogan N.,,Global landscape of protein complexes in the yeast Saccharomyces cerevisiae,2006,Nature,2047,10.1038/nature04670,United States;Canada,Article,San Francisco;Toronto,0,Journal,2-s2.0-33645453254
Koyutürk M.,,Pairwise alignment of protein interaction networks,2006,Journal of Computational Biology,191,10.1089/cmb.2006.13.182,United States,Conference Paper,West Lafayette,0,Journal,2-s2.0-33645985807
Stelzl U.,,A human protein-protein interaction network: A resource for annotating the proteome,2005,Cell,1688,10.1016/j.cell.2005.08.029,Germany,Article,Berlin,1,Journal,2-s2.0-25144498379
Agrafioti I.,,Comparative analysis of the Saccharomyces cerevisiae and Caenorhabditis elegans protein interaction networks,2005,BMC Evolutionary Biology,48,10.1186/1471-2148-5-23,United Kingdom,Article,London,1,Journal,2-s2.0-17444387503
Sharan R.,,Conserved patterns of protein interaction in multiple species,2005,Proceedings of the National Academy of Sciences of the United States of America,570,10.1073/pnas.0409522102,United States;Israel,Article,Berkeley;Tel Aviv-Yafo,1,Journal,2-s2.0-13844314048
McGeoch D.J.,,Integrating reptilian herpesviruses into the family Herpesviridae,2005,Journal of Virology,86,10.1128/JVI.79.2.725-731.2005,United Kingdom;United Kingdom,Article,Glasgow;Glasgow,1,Journal,2-s2.0-11144244968
Kelley B.,,PathBLAST: A tool for alignment of protein interaction networks,2004,Nucleic Acids Research,300,10.1093/nar/gkh411,United States,Article,Cambridge,1,Journal,2-s2.0-3442886313
Milo R.,,Superfamilies of Evolved and Designed Networks,2004,Science,916,10.1126/science.1089167,Israel,Article,Rehovot,0,Journal,2-s2.0-1542287343
Ho Y.,,Systematic identification of protein complexes in Saccharomyces cerevisiae by mass spectrometry,2002,Nature,2837,10.1038/415180a,Canada,Letter,Toronto,0,Journal,2-s2.0-0037050004
Ashburner M.,,Gene ontology: Tool for the unification of biology,2000,Nature Genetics,21184,10.1038/75556,,Review,,0,Journal,2-s2.0-0034069495
Altschul S.,,Basic local alignment search tool,1990,Journal of Molecular Biology,60311,10.1016/S0022-2836(05)80360-2,United States,Article,Bethesda,0,Journal,2-s2.0-0025183708
Cook S.,,The complexity of theorem-proving procedures,1971,Proceedings of the Annual ACM Symposium on Theory of Computing,3148,10.1145/800157.805047,Canada,Conference Paper,Toronto,0,Conference Proceeding,2-s2.0-85059770931
