Authors,Author(s) ID,Title,Year,Source tittle,Cited by,DOI,Country,Document Type,City,Access Type,aggregationType,EID
Kaiser D.,,Cell fate and organogenesis in bacteria,1999,Trends in Genetics,14,10.1016/S0168-9525(99)01740-0,United States,Note,Stanford,0,Journal,2-s2.0-0033168101
Atkinson M.,,Characterization of the GlnK protein of Escherichia coli,1999,Molecular Microbiology,78,10.1046/j.1365-2958.1999.01349.x,United States,Article,Ann Arbor,1,Journal,2-s2.0-0032895784
Jakoby M.,,Nitrogen regulation in Corynebacterium glutamicum: Isolation of genes involved and biochemical characterization of corresponding proteins,1999,FEMS Microbiology Letters,60,10.1016/S0378-1097(99)00085-3,Germany,Article,Koln,1,Journal,2-s2.0-0345129980
Forchhammer K.,,Heterotrimerization of P(II)-like signalling proteins: Implications for P(II)-mediated signal transduction systems,1999,Molecular Microbiology,45,10.1046/j.1365-2958.1999.01477.x,Germany;Germany,Article,Munich;Giessen,1,Journal,2-s2.0-0032588187
Jack R.,,The signal transduction protein GlnK is required for NifL-dependent nitrogen control of Nif gene expression in Klebsiella pneumoniae,1999,Journal of Bacteriology,80,10.1128/jb.181.4.1156-1162.1999,United Kingdom,Article,Norwich,1,Journal,2-s2.0-0033061058
Jiang P.,,Regulation of autophosphorylation of Escherichia coli nitrogen regulator II by the PII signal transduction protein,1999,Journal of Bacteriology,102,10.1128/jb.181.6.1906-1911.1999,United States,Article,Ann Arbor,1,Journal,2-s2.0-0032994344
Hsieh M.,,A PII-like protein in Arabidopsis: Putative role in nitrogen sensing,1998,Proceedings of the National Academy of Sciences of the United States of America,186,10.1073/pnas.95.23.13965,United States,Article,New York,1,Journal,2-s2.0-0032506028
Jiang P.,,Reconstitution of the signal-transduction bicyclic cascade responsible for the regulation of Ntr gene transcription in Escherichia coli,1998,Biochemistry,91,10.1021/bi9802420,United States,Article,Ann Arbor,0,Journal,2-s2.0-0032530305
Jiang P.,,The regulation of escherichia coli glutamine synthetase revisited: Role of 2-ketoglutarate in the regulation of glutamine synthetase adenylylation state,1998,Biochemistry,119,10.1021/bi980666u,United States,Article,Ann Arbor,0,Journal,2-s2.0-0032530281
Jiang P.,,Enzymological characterization of the signal-transducing uridylyltransferase/uridylyl-removing enzyme (EC 2.7.7.59) of Escherichia coli and its interaction with the PII protein,1998,Biochemistry,166,10.1021/bi980667m,United States,Article,Ann Arbor,0,Journal,2-s2.0-0032530304
Xu Y.,,"GlnK, a P(II)-homologue: Structure reveals ATP binding site and indicates how the T-loops may be involved in molecular recognition",1998,Journal of Molecular Biology,130,10.1006/jmbi.1998.1979,Australia,Article,Canberra,0,Journal,2-s2.0-0032508415
Atkinson M.,,Role of the GlnK signal transduction protein in the regulation of nitrogen assimilation in Escherichia coli,1998,Molecular Microbiology,107,10.1046/j.1365-2958.1998.00932.x,United States,Article,Ann Arbor,0,Journal,2-s2.0-0031824606
Qian Y.,,Expression of glnB and a glnB-like gene (glnK) in a ribulose bisphosphate carboxylase/oxygenase-deficient mutant of Rhodobacter sphaeroides,1998,Journal of Bacteriology,29,10.1128/jb.180.17.4644-4649.1998,United States,Article,Columbus,1,Journal,2-s2.0-0031721765
He L.,,Physiological role for the GlnK protein of enteric bacteria: Relief of NifL inhibition under nitrogen-limiting conditions,1998,Journal of Bacteriology,77,10.1128/jb.180.24.6661-6667.1998,United States,Article,Berkeley,1,Journal,2-s2.0-0032428697
Jiang P.,,Probing interactions of the homotrimeric PII signal transduction protein with its receptors by use of PII heterotrimers formed in vitro from wild- type and mutant subunits,1997,Journal of Bacteriology,32,10.1128/jb.179.13.4354-4360.1997,United States,Article,Ann Arbor,1,Journal,2-s2.0-0030808284
Irmler A.,,Dephosphorylation of the phosphoprotein P(II) in Synechococcus PCC 7942: Identification of an ATP and 2-oxoglutarate-regulated phosphatase activity,1997,Molecular Microbiology,53,10.1046/j.1365-2958.1997.5521918.x,Germany,Article,Munich,1,Journal,2-s2.0-0030881444
Jiang P.,,Structure/function analysis of the PII signal transduction protein of Escherichia coli: Genetic separation of interactions with protein receptors,1997,Journal of Bacteriology,83,10.1128/jb.179.13.4342-4353.1997,United States,Article,Ann Arbor,1,Journal,2-s2.0-0030743733
Carr P.,,X-ray structure of the signal transduction protein P<sup>II</sup> from Escherichia coli at 1.9 Å,1996,Acta Crystallographica Section D: Biological Crystallography,70,10.1107/S0907444995007293,Australia,Article,Canberra,0,Journal,2-s2.0-0030040863
Van Heeswijk W.,,An alternative P(II) protein in the regulation of glutamine synthetase in Escherichia coli,1996,Molecular Microbiology,157,10.1046/j.1365-2958.1996.6281349.x,Netherlands;Netherlands;Netherlands,Article,Amsterdam;Amsterdam;Amsterdam,0,Journal,2-s2.0-0029657995
Reith M.,,Complete nucleotide sequence of the Porphyra purpurea chloroplast genome,1995,Plant Molecular Biology Reporter,333,10.1007/BF02669187,Canada,Article,"Ottawa ON,",0,Journal,2-s2.0-51649139576
Liu J.,,Activation of the dephosphorylation of nitrogen regulator I-phosphate of Escherichia coli,1995,Journal of Bacteriology,24,10.1128/jb.177.4.926-931.1995,United States,Article,Cambridge,1,Journal,2-s2.0-0028891890
Feng J.,,Activation of transcription initiation from the nac promoter of Klebsiella aerogenes,1995,Journal of Bacteriology,36,10.1128/jb.177.19.5523-5534.1995,United States,Article,Ann Arbor,1,Journal,2-s2.0-0029591914
Feng J.,,Repression of the Klebsiella aerogenes nac promoter,1995,Journal of Bacteriology,44,10.1128/jb.177.19.5535-5538.1995,United States,Article,Ann Arbor,1,Journal,2-s2.0-0029591598
Forchhammer K.,,Phosphorylation of the P(II) protein (glnB gene product) in the cyanobacterium Synechococcus sp. strain PCC 7942: Analysis of in vitro kinase activity,1995,Journal of Bacteriology,95,10.1128/jb.177.20.5812-5817.1995,Germany,Article,Munich,1,Journal,2-s2.0-0028822145
Kamberov E.,,The Escherichia coli PII signal transduction protein is activated upon binding 2-ketoglutarate and ATP,1995,Journal of Biological Chemistry,146,10.1074/jbc.270.30.17797,United States,Article,Ann Arbor,1,Journal,2-s2.0-0029051027
Atkinson M.,,Reversible uridylylation of the Escherichia coli PII signal transduction protein regulates its ability to stimulate the dephosphorylation of the transcription factor nitrogen regulator I (NRI or NtrC),1994,Journal of Biological Chemistry,81,,United States,Article,Ann Arbor,0,Journal,2-s2.0-0028061944
Zinchenko V.,,Nucleotide sequence and characterization of the Rhodobacter sphaeroides glnB and glnA genes,1994,Microbiology,20,10.1099/13500872-140-8-2143,Russian Federation,Article,Moscow,1,Journal,2-s2.0-0027938369
Wray L.,,The nitrogen-regulated Bacillus subtilis nrgAB operon encodes a membrane protein and a protein highly similar to the Escherichia coli glnB-encoded P(II) protein,1994,Journal of Bacteriology,71,10.1128/jb.176.1.108-114.1994,United States,Article,Boston,1,Journal,2-s2.0-0028069556
Cheah E.,,Structure of the Escherichia coli signal transducing protein P<inf>II</inf>,1994,Structure,75,10.1016/S0969-2126(94)00100-6,Australia,Article,Canberra,1,Journal,2-s2.0-0028774333
Forchhammer K.,,The P(II) protein in the cyanobacterium Synechococcus sp. strain PCC 7942 is modified by serine phosphorylation and signals the cellular N-status,1994,Journal of Bacteriology,136,10.1128/jb.176.1.84-91.1994,France,Article,Paris,1,Journal,2-s2.0-0028011762
Liu J.,,The glnB region of the Escherichia coli chromosome,1993,Journal of Bacteriology,25,10.1128/jb.175.22.7441-7449.1993,United States,Article,Cambridge,1,Journal,2-s2.0-0027495146
Atkinson M.,,Mutational analysis of the bacterial signal-transducing protein kinase/phosphatase nitrogen regulator II (NR(II) or NtrB),1993,Journal of Bacteriology,54,10.1128/jb.175.21.7016-7023.1993,United States,Article,Detroit,1,Journal,2-s2.0-0027441194
van Heeswijk W.,,The genes of the glutamine synthetase adenylylation cascade are not regulated by nitrogen in Escherichia coli,1993,Molecular Microbiology,64,10.1111/j.1365-2958.1993.tb01706.x,Netherlands;Netherlands,Article,Amsterdam;Amsterdam,0,Journal,2-s2.0-0027281747
Santero E.,,Role of integration host factor in stimulating transcription from the σ<sup>54</sup>-dependent nifH promoter,1992,Journal of Molecular Biology,75,10.1016/0022-2836(92)90211-2,United States,Article,Berkeley,0,Journal,2-s2.0-0026792836
Shiau S.,,"Role of nitrogen regulator I (NtrC), the transcriptional activator of glnA in enteric bacteria, in reducing expression of glnA during nitrogen-limited growth",1992,Journal of Bacteriology,18,10.1128/jb.174.1.179-185.1992,United States,Article,Richardson,1,Journal,2-s2.0-0026533766
Tsinoremas N.,,Photosynthetic electron transport controls nitrogen assimilation in cyanobacteria by means of posttranslational modification of the glnB gene product,1991,Proceedings of the National Academy of Sciences of the United States of America,65,10.1073/pnas.88.11.4565,United Kingdom;France,Article,Leeds;Paris,1,Journal,2-s2.0-0025727050
Sibold L.,,Nucleotide sequence of nifH regions from Methanobacterium ivanovii and Methanosarcina barkeri 227 and characterization of glnB-like genes,1991,Research in Microbiology,28,10.1016/0923-2508(91)90091-N,France,Article,Paris,0,Journal,2-s2.0-0025776672
Tonlolo C.,,The polypeptide 3<inf>10</inf>-helix,1991,Trends in Biochemical Sciences,624,10.1016/0968-0004(91)90142-I,Italy,Article,Rome,0,Journal,2-s2.0-0025923535
de Zamaroczy M.,,Characterization of three different nitrogen-regulated promoter regions for the expression of glnB and glnA in Azospirillum brasilense,1990,MGG Molecular &amp; General Genetics,38,10.1007/BF00262437,France,Article,Paris,0,Journal,2-s2.0-0025612734
Wedel A.,,A bacterial enhancer functions to tether a transcriptional activator near a promoter,1990,Science,147,10.1126/science.1970441,United States,Article,Berkeley,0,Journal,2-s2.0-0025361357
Ninfa A.,,Initiation of transcription at the bacterial glnAp2 promoter by purified E. coli components is facilitated by enhancers,1987,Cell,166,10.1016/0092-8674(87)90170-X,United States,Article,Cambridge,0,Journal,2-s2.0-0023665129
Colonna-Romano S.,,Tight linkage of ginA and a putative regulatory gene in Rhizobium leguminosarum,1987,Nucleic Acids Research,43,10.1093/nar/15.5.1951,Italy,Article,Naples,0,Journal,2-s2.0-0023650569
Wong P.,,In vitro transcription of the nitrogen fixation regulatory operon nifLA of Klebsiella pneumoniae,1987,Journal of Bacteriology,31,10.1128/jb.169.6.2876-2880.1987,United States,Article,Berkeley,1,Journal,2-s2.0-0023225024
Ninfa A.,,"Covalent modification of the glnG product, NR(I), by the glnL product, NR(II), regulates the transcription of the glnALG operon in Escherichia coli",1986,Proceedings of the National Academy of Sciences of the United States of America,374,10.1073/pnas.83.16.5909,United States,Article,Cambridge,1,Journal,2-s2.0-0000451424
Reitzer L.J.,,"Isolation of the nitrogen assimilation regulator NR(I), the product of the glnG gene of Escherichia coli",1983,Proceedings of the National Academy of Sciences of the United States of America,58,10.1073/pnas.80.18.5554,United States,Article,Cambridge,1,Journal,2-s2.0-0021057134
Senior P.J.,,Regulation of nitrogen metabolism in Escherichia coli and Klebsiella aerogenes: studies with the continuous culture technique,1975,Journal of Bacteriology,154,10.1128/jb.123.2.407-418.1975,United States,Article,Bethesda,1,Journal,2-s2.0-0016744341
Mangum J.,,Regulation of glutamine synthetase adenylylation and deadenylylation by the enzymatic uridylylation and deuridylylation of the P<inf>II</inf> regulatory protein,1973,Archives of Biochemistry and Biophysics,45,10.1016/0003-9861(73)90543-2,United States,Article,Bethesda,0,Journal,2-s2.0-0015835725
Shapiro B.,,"The Glutamine Synthetase Deadenylylating Enzyme System from Escherichia Coli. Resolution Into Two Components, Specific Nucleotide Stimulation, and Cofactor Requirements",1969,Biochemistry,52,10.1021/bi00830a030,United States,Article,Bethesda,0,Journal,2-s2.0-0014472279
Shapiro B.,,Regulation of glutamine synthetase. VII. Adenylyl glutamine synthetase: a new form of the enzyme with altered regulatory and kinetic properties.,1967,Proceedings of the National Academy of Sciences of the United States of America,109,10.1073/pnas.58.2.642,,Article,,1,Journal,2-s2.0-0014118692
