Authors,Author(s) ID,Title,Year,Source tittle,Cited by,DOI,Country,Document Type,City,Access Type,aggregationType,EID
Coifman R.,,Geometric diffusions as a tool for harmonic analysis and structure definition of data: Multiscale methods,2005,Proceedings of the National Academy of Sciences of the United States of America,188,10.1073/pnas.0500896102,United States,Article,New Haven,1,Journal,2-s2.0-19644366699
Belkin M.,,Laplacian eigenmaps for dimensionality reduction and data representation,2003,Neural Computation,4760,10.1162/089976603321780317,United States,Article,Chicago,0,Journal,2-s2.0-0042378381
Donoho D.,,Hessian eigenmaps: Locally linear embedding techniques for high-dimensional data,2003,Proceedings of the National Academy of Sciences of the United States of America,1010,10.1073/pnas.1031596100,United States,Article,Palo Alto,1,Journal,2-s2.0-0037948870
Gear C.,,'Coarse' integration/bifurcation analysis via microscopic simulators: Micro-Galerkin methods,2002,Computers and Chemical Engineering,156,10.1016/S0098-1354(02)00020-0,United States;United States,Article,Princeton;Princeton,0,Journal,2-s2.0-0037104864
Huggins P.S.,,Representing edge models via local principal component analysis,2002,Lecture Notes in Computer Science (including subseries Lecture Notes in Artificial Intelligence and Lecture Notes in Bioinformatics),6,10.1007/3-540-47969-4_26,United States,Conference Paper,New Haven,0,Book Series,2-s2.0-0142176722
Pedersen K.S.,,Toward a full probability model of edges in natural images,2002,Lecture Notes in Computer Science (including subseries Lecture Notes in Artificial Intelligence and Lecture Notes in Bioinformatics),12,10.1007/3-540-47969-4_22,Denmark,Conference Paper,Copenhagen,0,Book Series,2-s2.0-84944405740
Roweis S.T.,,Nonlinear dimensionality reduction by locally linear embedding,2000,Science,10053,10.1126/science.290.5500.2323,United Kingdom,Article,London,0,Journal,2-s2.0-0034704222
Shi J.,,Normalized cuts and image segmentation,2000,IEEE Transactions on Pattern Analysis and Machine Intelligence,9925,10.1109/34.868688,United States,Article,Pittsburgh,0,Journal,2-s2.0-0034244751
Weiss Y.,,Segmentation using eigenvectors: A unifying view,1999,Proceedings of the IEEE International Conference on Computer Vision,497,10.1109/iccv.1999.790354,United States,Conference Paper,Berkeley,0,Conference Proceeding,2-s2.0-0033285447
