Authors,Author(s) ID,Title,Year,Source tittle,Cited by,DOI,Country,Document Type,City,Access Type,aggregationType,EID
Al-Shahrour F.,,FatiGO: A web tool for finding significant associations of Gene Ontology terms with groups of genes,2004,Bioinformatics,823,10.1093/bioinformatics/btg455,Spain,Article,Madrid,0,Journal,2-s2.0-1542399989
Draghici S.,,"Onto-Tools, the toolkit of the modern biologist: Onto-Express, Onto-Compare, Onto-Design and Onto-Translate",2003,Nucleic Acids Research,291,10.1093/nar/gkg624,United States,Article,Detroit,1,Journal,2-s2.0-0042121055
Doniger S.,,MAPPFinder: using Gene Ontology and GenMAPP to create a global gene-expression profile from microarray data.,2003,Genome biology,737,,United States,Article,San Francisco,0,Journal,2-s2.0-0037263812
Dennis G.,,"DAVID: Database for Annotation, Visualization, and Integrated Discovery.",2003,Genome biology,6156,,United States,Article,Frederick,0,Journal,2-s2.0-0038005018
Masys D.,,Use of keyword hierarchies to interpret gene expression patterns,2001,Bioinformatics,96,10.1093/bioinformatics/17.4.319,United States,Article,San Diego,1,Journal,2-s2.0-0035022821
Ashburner M.,,Gene ontology: Tool for the unification of biology,2000,Nature Genetics,21184,10.1038/75556,,Review,,0,Journal,2-s2.0-0034069495
Boguski M.,,Establishing a human transcript map,1995,Nature Genetics,324,10.1038/ng0895-369,United States,Article,Bethesda,0,Journal,2-s2.0-0029355897
Shaffer J.,,Multiple hypothesis testing,1995,Annual Review of Psychology,1035,10.1146/annurev.ps.46.020195.003021,United States,Article,Berkeley,0,Book Series,2-s2.0-11944262819
