Authors,Author(s) ID,Title,Year,Source tittle,Cited by,DOI,Country,Document Type,City,Access Type,aggregationType,EID
Leordeanu M.,,A spectral technique for correspondence problems using pairwise constraints,2005,Proceedings of the IEEE International Conference on Computer Vision,790,10.1109/ICCV.2005.20,United States,Conference Paper,Pittsburgh,0,Conference Proceeding,2-s2.0-33745886518
Sturm J.F.,,"Using SeDuMi 1.02, a MATLAB toolbox for optimization over symmetric cones",1999,Optimization Methods and Software,4942,10.1080/10556789908805766,Canada;Netherlands,Article,Hamilton;Maastricht,0,Journal,2-s2.0-0033296299
Gold S.,,A graduated assignment algorithm for graph matching,1996,IEEE Transactions on Pattern Analysis and Machine Intelligence,782,10.1109/34.491619,United States,Article,New Haven,0,Journal,2-s2.0-0030125842
Scott G.L.,,An algorithm for associating the features of two images,1991,Proceedings of the Royal Society B: Biological Sciences,402,10.1098/rspb.1991.0045,United Kingdom,Article,Oxford,0,Journal,2-s2.0-0026288231
Sinkhorn R.,,Concerning nonnegative matrices and doubly stochastic matrices,1967,Pacific Journal of Mathematics,253,10.2140/pjm.1967.21.343,United States,Article,Houston,1,Journal,2-s2.0-84972533495
