Authors,Author(s) ID,Title,Year,Source tittle,Cited by,DOI,Country,Document Type,City,Access Type,aggregationType,EID
Friso G.,,"In-Depth Analysis of the Thylakoid Membrane Proteome of Arabidopsis thaliana Chloroplasts: New Proteins, New Functions, and a Plastid Proteome Database",2004,Plant Cell,361,10.1105/tpc.017814,United States,Article,Ithaca,1,Journal,2-s2.0-1042279117
Andreoli C.,,"MitoP2, an integrated database on mitochondrial proteins in yeast and man",2004,Nucleic Acids Research,69,,Germany,Article,Neuherberg,0,Journal,2-s2.0-0347269094
Heazlewood J.,,"Experimental Analysis of the Arabidopsis Mitochondrial Proteome Highlights Signaling and Regulatory Components, Provides Assessment of Targeting Prediction Programs, and Indicates Plant-Specific Mitochondrial Proteins",2004,Plant Cell,447,10.1105/tpc.016055,Australia,Article,Perth,1,Journal,2-s2.0-0842270043
Heazlewood J.,,What makes a mitochondrion?,2003,Genome Biology,12,10.1186/gb-2003-4-6-218,Australia,Short Survey,Perth,1,Journal,2-s2.0-0038576866
Richly E.,,Evolutionary diversification of mitochondrial proteomes: Implications for human disease,2003,Trends in Genetics,58,10.1016/S0168-9525(03)00137-9,Germany,Short Survey,Koln,0,Journal,2-s2.0-0038015611
Chenna R.,,Multiple sequence alignment with the Clustal series of programs,2003,Nucleic Acids Research,3790,10.1093/nar/gkg500,Germany,Article,Heidelberg,1,Journal,2-s2.0-0042121237
Heazlewood J.,,Towards an analysis of the rice mitochondrial proteome,2003,Plant Physiology,153,10.1104/pp.102.018986,Australia,Article,Perth,1,Journal,2-s2.0-0037509843
Taylor S.,,Characterization of the human heart mitochondrial proteome,2003,Nature Biotechnology,564,10.1038/nbt793,Canada,Article,Vancouver,0,Journal,2-s2.0-0037336905
Boeckmann B.,,The SWISS-PROT protein knowledgebase and its supplement TrEMBL in 2003,2003,Nucleic Acids Research,2392,10.1093/nar/gkg095,Switzerland,Review,Geneva,1,Journal,2-s2.0-0037255072
Miras S.,,Non-canonical transit peptide for import into the chloroplast,2002,Journal of Biological Chemistry,132,10.1074/jbc.M207477200,France,Article,Grenoble,1,Journal,2-s2.0-0037033102
Bauer M.F.,,Import of mitochondrial proteins,2002,International Review of Neurobiology,11,10.1016/s0074-7742(02)53004-x,Germany,Review,Munich,0,Book Series,2-s2.0-0036985778
Soll J.,,Protein import into chloroplasts,2002,Current Opinion in Plant Biology,54,10.1016/S1369-5266(02)00296-0,Germany,Review,Munich,0,Journal,2-s2.0-0036883476
Peltier J.,,Central functions of the lumenal and peripheral thylakoid proteome of arabidopsis determined by experimentation and genome-wide prediction,2002,Plant Cell,356,10.1105/tpc.010304,United States,Article,Ithaca,1,Journal,2-s2.0-0036007922
Bannai H.,,Extensive feature detection of N-terminal protein sorting signals,2002,Bioinformatics,553,10.1093/bioinformatics/18.2.298,Japan,Article,Tokyo,1,Journal,2-s2.0-0036187913
Peeters N.,,Dual targeting to mitochondria and chloroplasts,2001,Biochimica et Biophysica Acta - Molecular Cell Research,196,10.1016/S0167-4889(01)00146-X,United States,Review,Ithaca,1,Journal,2-s2.0-0035852247
Schein A.I.,,Chloroplast transit peptide prediction: a peek inside the black box.,2001,Nucleic acids research,66,10.1093/nar/29.16.e82,United States,Article,Philadelphia,1,Journal,2-s2.0-17344395359
Kruft V.,,Proteomic approach to identify novel mitochondrial proteins in Arabidopsis,2001,Plant Physiology,304,10.1104/pp.010474,Germany,Article,Hannover,1,Journal,2-s2.0-85047683107
Millar A.,,Analysis of the Arabidopsis mitochondrial proteome,2001,Plant Physiology,353,10.1104/pp.010387,Australia,Article,Perth,1,Journal,2-s2.0-67651108027
Emanuelsson O.,,Predicting subcellular localization of proteins based on their N-terminal amino acid sequence,2000,Journal of Molecular Biology,3337,10.1006/jmbi.2000.3903,Sweden,Article,Stockholm,0,Journal,2-s2.0-0034697980
Chou K.C.,,Protein subcellular location prediction,1999,Protein Engineering,370,10.1093/protein/12.2.107,United States,Article,Kalamazoo,1,Journal,2-s2.0-0032940342
Nielsen H.,,Machine learning approaches for the prediction of signal peptides and other protein sorting signals,1999,Protein Engineering,521,10.1093/protein/12.1.3,Denmark,Review,Lyngby,1,Journal,2-s2.0-0033044637
Emanuelsson O.,,"ChloroP, a neural network-based method for predicting chloroplast transit peptides and their cleavage sites",1999,Protein Science,1392,10.1110/ps.8.5.978,Sweden,Article,Stockholm,0,Journal,2-s2.0-0032935861
Kyngäs J.,,Unreliability of the Chou-Fasman parameters in predicting protein secondary structure,1998,Protein Engineering,17,10.1093/protein/11.5.345,Finland,Article,Kuopio,1,Journal,2-s2.0-0031865005
Glaser E.,,"Mitochondrial protein import in plants: Signals, sorting, targeting, processing and regulation",Sep,Plant Molecular Biology,119,10.1023/a:1006020208140,Sweden,Article,Stockholm,0,Journal,2-s2.0-0032169540
Nielsen H.,,A neural network method for identification of prokaryotic and eukaryotic signal peptides and prediction of their cleavage sites.,Oct-Dec,International journal of neural systems,575,10.1142/s0129065797000537,Denmark,Article,Lyngby,0,Journal,2-s2.0-0031240609
Claros M.,,Computational method to predict mitochondrially imported proteins and their targeting sequences,1996,European Journal of Biochemistry,1263,10.1111/j.1432-1033.1996.00779.x,Spain;France,Article,Malaga;Paris,1,Journal,2-s2.0-0029915525
Franzen L.,,Chloroplast transit peptides from the green alga Chlamydomonas reinhardtii share features with both mitochondrial and higher plant chloroplast presequences,1990,FEBS Letters,98,10.1016/0014-5793(90)80093-X,Sweden,Article,Stockholm,1,Journal,2-s2.0-0025017279
Altschul S.,,Basic local alignment search tool,1990,Journal of Molecular Biology,60311,10.1016/S0022-2836(05)80360-2,United States,Article,Bethesda,0,Journal,2-s2.0-0025183708
von HEIJNE G.,,Domain structure of mitochondrial and chloroplast targeting peptides,1989,European Journal of Biochemistry,872,10.1111/j.1432-1033.1989.tb14679.x,Sweden,Article,Stockholm,1,Journal,2-s2.0-0024542834
Cornette J.,,Hydrophobicity scales and computational techniques for detecting amphipathic structures in proteins,1987,Journal of Molecular Biology,547,10.1016/0022-2836(87)90189-6,United States;United States,Article,Bethesda;Ames,0,Journal,2-s2.0-0023645034
Chou P.,,"Conformational Parameters for Amino Acids in Helical, β-Sheet, and Random Coil Regions Calculated from Proteins",1974,Biochemistry,1756,10.1021/bi00699a001,United States,Article,Waltham,0,Journal,2-s2.0-0015967881
Aboderin A.,,An empirical hydrophobicity scale for α-amino-acids and some of its applications,1971,International Journal of Biochemistry,76,10.1016/0020-711X(71)90023-1,Nigeria,Article,Lagos,0,Journal,2-s2.0-0000104080
