Authors,Author(s) ID,Title,Year,Source tittle,Cited by,DOI,Country,Document Type,City,Access Type,aggregationType,EID
Picard-Bennoun M.,,Change in cytoplasmic ribosome properties during gametogenesis in the alga Chlamydomonas reinhardtii,1985,Current Genetics,15,10.1007/BF00420318,France,Article,Saint-Aubin,0,Journal,2-s2.0-0022002042
Pineda M.,,Urate oxidase of Chlamydomonas reinhardii,1984,Physiologia Plantarum,46,10.1111/j.1399-3054.1984.tb04602.x,Spain,Article,Cordoba,0,Journal,2-s2.0-84989738195
Schloss J.,,mRNA abundance changes during flagellar regeneration in Chlamydomonas reinhardtii,1984,Molecular and Cellular Biology,93,10.1128/MCB.4.3.424,United States,Article,New Haven,1,Journal,2-s2.0-0021328895
Florencio F.,,"Utilization of nitrate, nitrite and ammonium by Chlamydomonas reinhardii - Photoproduction of ammonium",1983,Planta,61,10.1007/BF00397329,Spain;Spain,Article,Sevilla;Madrid,0,Journal,2-s2.0-0001330387
Gardemann A.,,Control of CO<inf>2</inf> fixation. Regulation of spinach ribulose-5-phosphate kinase by stromal metabolite levels,1983,BBA - Bioenergetics,86,10.1016/0005-2728(83)90156-1,Germany,Article,Gottingen,0,Journal,2-s2.0-0002012772
Gresshoff P.,,Amide metabolism of Chlamydomonas reinhardi,1981,Archives of Microbiology,6,10.1007/BF00422535,Australia,Article,Canberra,0,Journal,2-s2.0-0019166510
Cullimore J.,,Pathway of ammonia assimilation in illuminated and darkened Chlamydomonas reinhardii,1981,Phytochemistry,66,10.1016/0031-9422(81)83002-6,United Kingdom,Article,Norwich,0,Journal,2-s2.0-0000238519
Martin N.C.,,Turnover of chloroplast and cytoplasmic ribosomes during gametogenesis in Chlamydomonas reinhardi,1976,Developmental Biology,46,10.1016/0012-1606(76)90137-8,United States;United States,Article,Chicago;Cambridge,0,Journal,2-s2.0-0017170959
Hodson R.,,Metabolic control of urea catabolism in Chlamydomonas reinhardi and Chlorella pyrenoidosa,1975,Journal of Bacteriology,22,,United States,Article,Newark,0,Journal,2-s2.0-0016641179
Martin N.,,Gametic differentiation in Chlamydomonas Reinhardtii: I. production of gametes and their fine structure,1975,Journal of Cell Biology,124,10.1083/jcb.67.3.587,United States,Article,Cambridge,0,Journal,2-s2.0-0016796673
Miflin B.,,Glutamine and asparagine as nitrogen donors for reductant dependent glutamate synthesis in pea roots,1975,Biochemical Journal,72,10.1042/bj1490403,United Kingdom,Article,Harpenden,0,Journal,2-s2.0-0016807113
Schötz F.,,The architecture and organization of the Chlamydomonas cell - Results of serial-section electron microscopy and a three-dimensional reconstruction,1972,Protoplasma,52,10.1007/BF01279818,Germany;Germany,Article,Munich;Erlangen,0,Journal,2-s2.0-0015490471
Siersma P.W.,,Conservation and degradation of cytoplasmic and chloroplast ribosomes in Chlamydomonas reinhardtii,1971,Journal of Molecular Biology,42,10.1016/0022-2836(71)90239-7,United States,Article,Chicago,0,Journal,2-s2.0-0015243249
LOWRY O.,,Protein measurement with the Folin phenol reagent.,1951,The Journal of biological chemistry,253915,,,Article,,0,Journal,2-s2.0-71849104860
