Authors,Author(s) ID,Title,Year,Source tittle,Cited by,DOI,Country,Document Type,City,Access Type,aggregationType,EID
Ravasi T.,,Experimental validation of the regulated expression of large numbers of non-coding RNAs from the mouse genome,2006,Genome Research,377,10.1101/gr.4200206,United States;Australia,Article,San Diego;Brisbane,1,Journal,2-s2.0-30044434769
Pang K.C.,,Rapid evolution of noncoding RNAs: Lack of conservation does not mean lack of function,2006,Trends in Genetics,433,10.1016/j.tig.2005.10.003,Australia;Australia,Short Survey,Brisbane;Melbourne,0,Journal,2-s2.0-29444457713
Bentwich I.,,Identification of hundreds of conserved and nonconserved human microRNAs,2005,Nature Genetics,1442,10.1038/ng1590,Israel,Article,Rehovot,0,Journal,2-s2.0-22844440427
Mattick J.S.,,The functional genomics of noncoding RNA,2005,Science,220,10.1126/science.1117806,Australia,Review,Brisbane,0,Journal,2-s2.0-24644443227
Willingham A.,,Molecular biology: A strategy for probing the function of noncoding RNAs finds a repressor of NFAT,2005,Science,543,10.1126/science.1115901,United States,Article,San Diego,0,Journal,2-s2.0-24644481406
Katayama S.,,Molecular biology: Antisense transcription in the mammalian transcriptome,2005,Science,1207,10.1126/science.1112009,Japan,Article,Yokohama,0,Journal,2-s2.0-24644472515
Carninci P.,,Molecular biology: The transcriptional landscape of the mammalian genome,2005,Science,2416,10.1126/science.1112014,,Article,,0,Journal,2-s2.0-24644519490
Navarro P.,,Tsix transcription across the Xist gene alters chromatin conformation without affecting Xist transcription: Implications for X-chromosome inactivation,2005,Genes and Development,140,10.1101/gad.341105,France,Article,Paris,1,Journal,2-s2.0-22344451854
Wyers F.,,Cryptic Pol II transcripts are degraded by a nuclear quality control pathway involving a new poly(A) polymerase,2005,Cell,619,10.1016/j.cell.2005.04.030,France,Article,Gif-sur-Yvette,1,Journal,2-s2.0-20444368036
Cheng J.,,Transcriptional maps of 10 human chromosomes at 5-nucleotide resolution,2005,Science,892,10.1126/science.1108625,United States,Article,Waltham,0,Journal,2-s2.0-21044431735
Mattick J.S.,,Small regulatory RNAs in mammals,2005,Human Molecular Genetics,367,10.1093/hmg/ddi101,Australia,Review,Brisbane,1,Journal,2-s2.0-15944402920
Bernstein B.,,Genomic maps and comparative analysis of histone modifications in human and mouse,2005,Cell,1079,10.1016/j.cell.2005.01.001,United States;United States,Article,Boston;Cambridge,1,Journal,2-s2.0-19944430797
Jen C.,,Natural antisense transcripts with coding capacity in Arabidopsis may have a regulatory role that is not linked to double-stranded RNA degradation.,2005,Genome biology,95,,United Kingdom,Article,Leeds,0,Journal,2-s2.0-24644488895
Pang K.C.,,RNAdb - A comprehensive mammalian noncoding RNA database,2005,Nucleic Acids Research,122,10.1093/nar/gki089,Australia;Australia,Article,Brisbane;Melbourne,1,Journal,2-s2.0-13444293342
Kasukawa T.,,"Construction of representative transcript and protein sets of human, mouse, and rat as a platform for their transcriptome and proteome analysis",2004,Genomics,18,10.1016/j.ygeno.2004.08.011,Japan;Japan,Article,Tokyo;Yokohama,0,Journal,2-s2.0-7944237950
Chen J.,,Over 20% of human transcripts might form sense-antisense pairs,2004,Nucleic Acids Research,252,10.1093/nar/gkh818,United States,Article,Chicago,1,Journal,2-s2.0-4444376317
Nóbrega M.,,Megabase deletions of gene deserts result in viable mice,2004,Nature,136,10.1038/nature03022,,Article,,0,Journal,2-s2.0-7244259100
Rodriguez A.,,Identification of mammalian microRNA host genes and transcription units,2004,Genome Research,1361,10.1101/gr.2722704,United Kingdom,Article,Hinxton,1,Journal,2-s2.0-6344281172
Landers M.,,Regulation of the large (∼1000 kb) imprinted murine Ube3a antisense transcript by alternative exons upstream of Snurf/Snrpn,2004,Nucleic Acids Research,108,10.1093/nar/gkh670,United States,Article,Farmington,1,Journal,2-s2.0-3042821931
Seitz H.,,A large imprinted microRNA gene cluster at the mouse Dlk1-Gtl2 domain,2004,Genome Research,391,10.1101/gr.2743304,France,Article,Toulouse,1,Journal,2-s2.0-4644253753
Suzuki H.,,Identification of region-specific transcription factor genes in the adult mouse brain by medium-scale real-time RT-PCR,2004,FEBS Letters,17,10.1016/j.febslet.2004.07.068,Japan;Japan,Article,Wako;Yokohama,0,Journal,2-s2.0-4344594885
Corcoran M.,,DLEU2 encodes an antisense RNA for the putative bicistronic RFP2/LEU5 gene in humans and mouse,2004,Genes Chromosomes and Cancer,37,10.1002/gcc.20046,United Kingdom;Sweden,Article,Bournemouth;Stockholm,0,Journal,2-s2.0-3142544706
Martens J.,,Intergenic transcription is required to repress the Saccharomyces cerevisiae SER3 gene,2004,Nature,434,10.1038/nature02538,United States,Article,Boston,0,Journal,2-s2.0-2942560254
Pfeffer S.,,Identification of Virus-Encoded MicroRNAs,2004,Science,1170,10.1126/science.1096781,United States,Article,New York,0,Journal,2-s2.0-2342420041
Su A.I.,,A gene atlas of the mouse and human protein-encoding transcriptomes,2004,Proceedings of the National Academy of Sciences of the United States of America,2670,10.1073/pnas.0400782101,United States,Article,San Diego,1,Journal,2-s2.0-11144358198
Delaval K.,,Epigenetic regulation of mammalian genomic imprinting,2004,Current Opinion in Genetics and Development,305,10.1016/j.gde.2004.01.005,France,Review,Montpellier,0,Journal,2-s2.0-1942471150
Cawley S.,,Unbiased Mapping of Transcription Factor Binding Sites along Human Chromosomes 21 and 22 Points to Widespread Regulation of Noncoding RNAs,2004,Cell,898,10.1016/S0092-8674(04)00127-8,United States,Article,Waltham,1,Journal,2-s2.0-10744226888
Bartel D.,,"MicroRNAs: Genomics, Biogenesis, Mechanism, and Function",2004,Cell,24943,10.1016/S0092-8674(04)00045-5,United States;United States,Review,Cambridge;Cambridge,1,Journal,2-s2.0-0347444723
Lavorgna G.,,In search of antisense,2004,Trends in Biochemical Sciences,241,10.1016/j.tibs.2003.12.002,Italy,Review,Milan,0,Journal,2-s2.0-0442307970
Griffiths-Jones S.,,The microRNA registry,2004,Nucleic Acids Research,1626,,United Kingdom,Article,Hinxton,0,Journal,2-s2.0-0347755643
Kent W.,,"Evolution's cauldron: Duplication, deletion, and rearrangement in the mouse and human genomes",2003,Proceedings of the National Academy of Sciences of the United States of America,529,10.1073/pnas.1932072100,United States,Article,Santa Cruz,1,Journal,2-s2.0-0141815478
Nikaido I.,,Discovery of imprinted transcripts in the mouse transcriptome using large-scale expression profiling,2003,Genome Research,88,10.1101/gr.1055303,Japan;Japan,Article,Yokohama;Yokohama,1,Journal,2-s2.0-0038349507
Numata K.,,Identification of putative noncoding RNAs among the RIKEN mouse full-length cDNA collection,2003,Genome Research,115,10.1101/gr.1011603,Japan,Review,Tokyo,1,Journal,2-s2.0-0038688072
Carninci P.,,Targeting a complex transcriptome: The construction of the mouse full-length cDNA encyclopedia,2003,Genome Research,145,10.1101/gr.1119703,Japan;Japan,Review,Wako;Yokohama,1,Journal,2-s2.0-0037673675
Kiyosawa H.,,Antisense transcripts with FANTOM2 clone set and their implications for gene regulation,2003,Genome Research,200,10.1101/gr.982903,Japan;Japan;Japan,Review,Tsukuba;Yokohama;Yokohama,1,Journal,2-s2.0-0037673656
Yelin R.,,Widespread occurrence of antisense transcription in the human genome,2003,Nature Biotechnology,511,10.1038/nbt808,Israel,Article,Tel Aviv-Yafo,0,Journal,2-s2.0-12244275645
Noonan F.,,Antisense transcripts at the EMX2 locus in human and mouse,2003,Genomics,32,10.1016/S0888-7543(02)00023-X,United States,Article,St. Louis,0,Journal,2-s2.0-0037288939
Okazaki Y.,,"Analysis of the mouse transcriptome based on functional annotation of 60,770 full-length cDNAs",2002,Nature,1234,10.1038/nature01266,Japan;Japan,Article,Yokohama;Saitama,1,Journal,2-s2.0-0142104045
Dennis C.,,The brave new world of RNA,2002,Nature,75,10.1038/418122a,,Short Survey,,0,Journal,2-s2.0-0037062973
James Kent W.,,The human genome browser at UCSC,2002,Genome Research,5344,10.1101/gr.229102. Article published online before print in May 2002,United States,Article,Santa Cruz,0,Journal,2-s2.0-0036079158
Cavaillé J.,,Identification of tandemly-repeated C/D snoRNA genes at the imprinted human 14q32 domain reminiscent of those at the Prader-Willi/Angelman syndrome region,2002,Human Molecular Genetics,164,10.1093/hmg/11.13.1527,France,Article,Toulouse,1,Journal,2-s2.0-0037096916
Nam D.,,Oligo(dT) primer generates a high frequency of truncated cDNAs through internal poly(A) priming during reverse transcription,2002,Proceedings of the National Academy of Sciences of the United States of America,104,10.1073/pnas.092140899,United States,Article,Chicago,1,Journal,2-s2.0-0037197827
Eddy S.,,Computational genomics of noncoding RNA genes,2002,Cell,179,10.1016/S0092-8674(02)00727-4,United States,Review,St. Louis,1,Journal,2-s2.0-0037133945
Sleutels F.,,The non-coding Air RNA is required for silencing autosomal imprinted genes,2002,Nature,803,10.1038/415810a,Netherlands,Article,Amsterdam,0,Journal,2-s2.0-0037075032
Williamson C.,,"Alternative non-coding splice variants of Nespas, an imprinted gene antisense to Nesp in the Gnas imprinting cluster",2002,Mammalian Genome,28,10.1007/s00335-001-2102-2,United Kingdom,Article,Oxfordshire,0,Journal,2-s2.0-0036146828
Carninci P.,,Cytoplasmic RNA extraction from fresh and frozen mammalian tissues,2002,BioTechniques,11,10.2144/02332st01,Japan,Article,Wako,1,Journal,2-s2.0-0036023462
Hatada I.,,"Identification of a new imprinted gene, Rian, on mouse chromosome 12 by fluorescent differential display screening",2001,Journal of Biochemistry,57,10.1093/oxfordjournals.jbchem.a002971,Japan,Article,Maebashi,0,Journal,2-s2.0-0034866588
Engemann S.,,Sequence and functional comparison in the Beckwith-Wiedemann region: Implications for a novel imprinting centre and extended imprinting,2000,Human Molecular Genetics,123,10.1093/hmg/9.18.2691,Germany,Article,Berlin,1,Journal,2-s2.0-0034326859
Kelley R.,,Noncoding RNA genes in dosage compensation and imprinting,2000,Cell,98,10.1016/S0092-8674(00)00099-4,United States,Review,Houston,1,Journal,2-s2.0-0034730317
Lyle R.,,The imprinted antisense RNA at the lgf2r locus overlaps but does not imprint Mas1,2000,Nature Genetics,206,10.1038/75546,Switzerland;Netherlands,Article,Geneva;Amsterdam,0,Journal,2-s2.0-0034118382
Rozen S.,,Primer3 on the WWW for general users and for biologist programmers.,2000,"Methods in molecular biology (Clifton, N.J.)",12781,,United States,Article,Cambridge,0,Journal,2-s2.0-0033990048
Eisen M.,,Cluster analysis and display of genome-wide expression patterns,1998,Proceedings of the National Academy of Sciences of the United States of America,12573,10.1073/pnas.95.25.14863,United States,Article,Stanford,0,Journal,2-s2.0-0032441150
Wutz A.,,Imprinted expression of the Igf2r gene depends on an intronic CpG island,1997,Nature,453,10.1038/39631,Austria,Article,Vienna,0,Journal,2-s2.0-0030694713
Brockdorff N.,,The product of the mouse Xist gene is a 15 kb inactive X-specific transcript containing no conserved ORF and located in the nucleus,1992,Cell,737,10.1016/0092-8674(92)90519-I,United Kingdom,Article,London,0,Journal,2-s2.0-0026489906
Borsani G.,,Characterization of a murine gene expressed from the inactive X chromosome,1991,Nature,422,10.1038/351325a0,United States,Article,Houston,0,Journal,2-s2.0-0025829449
Chomczynski P.,,Single-step method of RNA isolation by acid guanidinium thiocyanate-phenol-chloroform extraction,1987,Analytical Biochemistry,61656,10.1016/0003-2697(87)90021-2,United States,Article,Bethesda,0,Journal,2-s2.0-0023277545
Hastie N.,,The expression of three abundance classes of messenger RNA in mouse tissues,1976,Cell,295,10.1016/0092-8674(76)90139-2,United Kingdom,Article,Edinburgh,0,Journal,2-s2.0-0017220998
