Authors,Author(s) ID,Title,Year,Source tittle,Cited by,DOI,Country,Document Type,City,Access Type,aggregationType,EID
Keogh M.C.,,Cotranscriptional set2 methylation of histone H3 lysine 36 recruits a repressive Rpd3 complex,2005,Cell,555,10.1016/j.cell.2005.10.025,United States,Article,Boston,1,Journal,2-s2.0-27744587302
Carrozza M.,,Histone H3 methylation by Set2 directs deacetylation of coding regions by Rpd3S to suppress spurious intragenic transcription,2005,Cell,880,10.1016/j.cell.2005.10.023,United States,Article,Kansas City,1,Journal,2-s2.0-27744577727
Schuldiner M.,,Exploration of the function and organization of the yeast early secretory pathway through an epistatic miniarray profile,2005,Cell,638,10.1016/j.cell.2005.08.031,United States,Article,San Francisco,1,Journal,2-s2.0-26844489762
Joy M.P.,,High-betweenness proteins in the yeast protein interaction network,2005,Journal of Biomedicine and Biotechnology,318,10.1155/JBB.2005.96,United States,Article,Boston,1,Journal,2-s2.0-27744469130
Butland G.,,Interaction network containing conserved and essential protein complexes in Escherichia coli,2005,Nature,876,10.1038/nature03239,Canada,Article,Toronto,0,Journal,2-s2.0-13444283630
Sampath V.,,Rpb4 and Rpb7: A sub-complex integral to multi-subunit RNA polymerases performs a multitude of functions,2005,IUBMB Life,29,10.1080/15216540500078905,,Review,,1,Journal,2-s2.0-18244371928
Krogan N.,,Proteasome involvement in the repair of DNA double-strand breaks,2004,Molecular Cell,166,10.1016/j.molcel.2004.11.033,Canada,Article,Toronto,1,Journal,2-s2.0-19944388882
Jansen R.,,Analyzing protein function on a genomic scale: The importance of gold-standard positives and negatives for network prediction,2004,Current Opinion in Microbiology,135,10.1016/j.mib.2004.08.012,United States,Review,New York,0,Journal,2-s2.0-4644306020
Xia Y.,,Analyzing cellular biochemistry in terms of molecular networks,2004,Annual Review of Biochemistry,114,10.1146/annurev.biochem.73.011303.073950,United States,Review,New Haven,0,Book Series,2-s2.0-3943087720
Korber P.,,SWRred not shaken: Mixing the histones,2004,Cell,51,10.1016/S0092-8674(04)00296-X,Germany,Review,Munich,1,Journal,2-s2.0-11144355550
Krogan N.J.,,High-Definition Macromolecular Composition of Yeast RNA-Processing Complexes,2004,Molecular Cell,296,10.1016/S1097-2765(04)00003-6,Canada,Article,Toronto,1,Journal,2-s2.0-10744227471
Mewes H.,,MIPS: Analysis and annotation of proteins from whole genomes,2004,Nucleic Acids Research,451,,Germany;Germany,Article,Neuherberg;Munich,0,Journal,2-s2.0-9144242935
Shannon P.,,Cytoscape: A software Environment for integrated models of biomolecular interaction networks,2003,Genome Research,14368,10.1101/gr.1239303,United States,Article,Seattle,1,Journal,2-s2.0-0242490780
Jansen R.,,A Bayesian Networks Approach for Predicting Protein-Protein Interactions from Genomic Data,2003,Science,980,10.1126/science.1087361,United States;United States,Article,New York;New Haven,0,Journal,2-s2.0-0142052944
Ghaemmaghami S.,,Global analysis of protein expression in yeast,2003,Nature,2794,10.1038/nature02046,United States,Article,San Francisco,0,Journal,2-s2.0-0142215475
Huh W.,,Global analysis of protein localization in budding yeast,2003,Nature,2990,10.1038/nature02026,United States,Article,San Francisco,0,Journal,2-s2.0-0142184341
Lord P.,,Investigating semantic similarity measures across the gene ontology: The relationship between sequence and annotation,2003,Bioinformatics,599,10.1093/bioinformatics/btg153,United Kingdom,Article,Manchester,1,Journal,2-s2.0-0037480738
Fraser H.,,A simple dependence between protein evolution rate and the number of protein-protein interactions,2003,BMC Evolutionary Biology,130,10.1186/1471-2148-3-11,United States,Article,Berkeley,1,Journal,2-s2.0-0242284421
Hampsey M.,,Tails of intrigue: Phosphorylation of RNA polymerase II mediates histone methylation,2003,Cell,249,10.1016/S0092-8674(03)00360-X,United States,Short Survey,Piscataway,1,Journal,2-s2.0-0038740693
Regelmann J.,,"Catabolite degradation of fructose-1,6-bisphosphatase in the yeast Saccharomyces cerevisiae: A genome-wide screen identifies eight novel GID genes and indicates the existence of two degradation pathways",2003,Molecular Biology of the Cell,98,10.1091/mbc.E02-08-0456,Germany,Article,Stuttgart,0,Journal,2-s2.0-0038709277
Zhu H.,,Protein chip technology,2003,Current Opinion in Chemical Biology,803,10.1016/S1367-5931(02)00005-4,United States,Review,New Haven,0,Journal,2-s2.0-0037307131
Krogan N.,,RNA polymerase II elongation factors of Saccharomyces cerevisiae: A targeted proteomics approach,2002,Molecular and Cellular Biology,376,10.1128/MCB.22.20.6979-6992.2002,Canada,Article,Toronto,1,Journal,2-s2.0-0036787862
Eissenberg J.C.,,dELL is an essential RNA polymerase II elongation factor with a general role in development,2002,Proceedings of the National Academy of Sciences of the United States of America,56,10.1073/pnas.152193699,United States,Article,St. Louis,1,Journal,2-s2.0-0037162540
von Mering C.,,Comparative assessment of large-scale data sets of protein-protein interactions,2002,Nature,1785,10.1038/nature750,Germany,Article,Heidelberg,0,Journal,2-s2.0-0037161731
Enright A.J.,,An efficient algorithm for large-scale detection of protein families,2002,Nucleic Acids Research,2117,10.1093/nar/30.7.1575,United Kingdom,Review,Cambridge,1,Journal,2-s2.0-0036529479
Kumar A.,,Subcellular localization of the yeast proteome,2002,Genes and Development,614,10.1101/gad.970902,United States,Article,New Haven,1,Journal,2-s2.0-0037087575
Ho Y.,,Systematic identification of protein complexes in Saccharomyces cerevisiae by mass spectrometry,2002,Nature,2837,10.1038/415180a,Canada,Letter,Toronto,0,Journal,2-s2.0-0037050004
Gavin A.C.,,Functional organization of the yeast proteome by systematic analysis of protein complexes,2002,Nature,3691,10.1038/415141a,United Kingdom,Article,Brentford,0,Journal,2-s2.0-0037050026
Tong A.H.Y.,,Systematic genetic analysis with ordered arrays of yeast deletion mutants,2001,Science,1510,10.1126/science.1065810,Canada,Article,Toronto,0,Journal,2-s2.0-0035861532
Scholes D.T.,,Multiple regulators of Ty1 transposition in Saccharomyces cerevisiae have conserved roles in genome maintenance,2001,Genetics,186,,United States,Article,Albany,0,Journal,2-s2.0-0035692614
Krogan N.,,Characterization of a six-subunit Holo-Elongator complex required for the regulated expression of a group of genes in Saccharomyces cerevisiae,2001,Molecular and Cellular Biology,125,10.1128/MCB.21.23.8203-8212.2001,Canada,Article,Toronto,1,Journal,2-s2.0-0035171624
Ito T.,,A comprehensive two-hybrid analysis to explore the yeast protein interactome,2001,Proceedings of the National Academy of Sciences of the United States of America,2800,10.1073/pnas.061034498,Japan,Article,Kanazawa,1,Journal,2-s2.0-0035836765
Aravind L.,,"The BED finger, a novel DNA-binding domain in chromatin-boundary-element-binding proteins and transposases",2000,Trends in Biochemical Sciences,103,10.1016/S0968-0004(00)01620-0,United States,Article,Bethesda,0,Journal,2-s2.0-0034284435
Hughes T.,,Functional discovery via a compendium of expression profiles,2000,Cell,2000,10.1016/S0092-8674(00)00015-5,United States,Article,Seattle,1,Journal,2-s2.0-0034616930
Uetz P.,,A comprehensive analysis of protein-protein interactions in Saccharomyces cerevisiae,2000,Nature,3756,10.1038/35001009,United States,Article,Seattle,0,Journal,2-s2.0-0034628508
Ross-Macdonald P.,,Large-scale analysis of the yeast genome by transposon tagging and gene disruption,1999,Nature,446,10.1038/46558,United States,Article,New Haven,0,Journal,2-s2.0-0033604566
Martien M.,,A biochemical genomics approach for identifying genes by the activity of their products,1999,Science,345,10.1126/science.286.5442.1153,United States,Article,Rochester,0,Journal,2-s2.0-0033527694
Rigaut G.,,A generic protein purification method for protein complex characterization and proteome exploration,1999,Nature Biotechnology,2182,10.1038/13732,Germany,Article,Heidelberg,0,Journal,2-s2.0-0032828715
Barabási A.,,Emergence of scaling in random networks,1999,Science,22102,10.1126/science.286.5439.509,United States,Article,Notre Dame,0,Journal,2-s2.0-0038483826
Winzeler E.A.,,Functional characterization of the S. cerevisiae genome by gene deletion and parallel analysis,1999,Science,2882,10.1126/science.285.5429.901,United States,Article,Stanford,0,Journal,2-s2.0-0033529707
Link A.,,Direct analysis of protein complexes using mass spectrometry,1999,Nature Biotechnology,1981,10.1038/10890,United States;United States,Article,Seattle;Cambridge,0,Journal,2-s2.0-0033051101
Fourel G.,,Cohabitation of insulators and silencing elements in yeast subtelomeric regions,1999,EMBO Journal,188,10.1093/emboj/18.9.2522,France,Article,Lyon,0,Journal,2-s2.0-0033522443
McCormack A.,,Direct Analysis and Identification of Proteins in Mixtures by LC/MS/MS and Database Searching at the Low-Femtomole Level,1997,Analytical Chemistry,424,10.1021/ac960799q,United States,Article,Seattle,0,Journal,2-s2.0-0031568420
Goffeau A.,,Life with 6000 genes,1996,Science,2967,10.1126/science.274.5287.546,,Article,,0,Journal,2-s2.0-10244239321
Brigati C.,,An essential yeast gene encoding a TTAGGG repeat-binding protein,1993,Molecular and Cellular Biology,62,10.1128/MCB.13.2.1306,United States,Article,New York,1,Journal,2-s2.0-0027393752
Wolpert D.,,Stacked generalization,1992,Neural Networks,3005,10.1016/S0893-6080(05)80023-1,United States,Article,Los Alamos,0,Journal,2-s2.0-0026692226
Allison L.,,Extensive homology among the largest subunits of eukaryotic and prokaryotic RNA polymerases,1985,Cell,428,10.1016/0092-8674(85)90117-5,Canada,Article,Toronto,0,Journal,2-s2.0-0022132080
