Authors,Author(s) ID,Title,Year,Source tittle,Cited by,DOI,Country,Document Type,City,Access Type,aggregationType,EID
Staiger D.,,Chemical strategies for iron acquisition in plants,2002,Angewandte Chemie - International Edition,19,10.1002/1521-3773(20020703)41:13<2259::AID-ANIE2259>3.0.CO;2-I,Switzerland,Short Survey,"Zurich ZH,",0,Journal,2-s2.0-0037007827
Connolly E.,,Expression of the IRT1 metal transporter is controlled by metals at the levels of transcript and protein accumulation,2002,Plant Cell,492,10.1105/tpc.001263,United States,Article,Hanover,1,Journal,2-s2.0-0035983847
Ruiz F.A.,,The Polyphosphate Bodies of Chlamydomonas reinhardtii Possess a Proton-pumping Pyrophosphatase and Are Similar to Acidocalcisomes,2001,Journal of Biological Chemistry,141,10.1074/jbc.M105268200,United States,Article,Urbana,1,Journal,2-s2.0-0035824644
Rubio V.,,A conserved MYB transcription factor involved in phosphate starvation signaling both in vascular plants and in unicellular algae,2001,Genes and Development,707,10.1101/gad.204401,Spain,Article,Madrid,1,Journal,2-s2.0-0035881704
Li L.,,CCC1 Is a Transporter That Mediates Vacuolar Iron Storage in Yeast,2001,Journal of Biological Chemistry,239,10.1074/jbc.M103944200,United States,Article,Salt Lake City,1,Journal,2-s2.0-0035800856
McKie A.T.,,An iron-regulated ferric reductase associated with the absorption of dietary iron,2001,Science,741,10.1126/science.1057206,United Kingdom,Article,London,0,Journal,2-s2.0-0035793856
Whelan S.,,A general empirical model of protein evolution derived from multiple protein families using a maximum-likelihood approach,2001,Molecular Biology and Evolution,1764,10.1093/oxfordjournals.molbev.a003851,United Kingdom,Article,Cambridge,1,Journal,2-s2.0-0035031966
Livak K.J.,,Analysis of relative gene expression data using real-time quantitative PCR and the 2<sup>-ΔΔC</sup>T method,2001,Methods,91649,10.1006/meth.2001.1262,United States,Article,Foster City,0,Journal,2-s2.0-0035710746
Trost P.,,Purification of cytochrome b-561 from bean hypocotyls plasma membrane. Evidence for the presence of two heme centers,2000,Biochimica et Biophysica Acta - Biomembranes,28,10.1016/S0005-2736(00)00283-2,Italy,Article,Bologna,1,Journal,2-s2.0-0342844282
Thomine S.,,Cadmium and iron transport by members of a plant metal transporter family in Arabidopsis with homology to Nramp genes,2000,Proceedings of the National Academy of Sciences of the United States of America,563,10.1073/pnas.97.9.4991,United States,Article,San Diego,1,Journal,2-s2.0-0034712741
Portnoy M.E.,,Saccharomyces cerevisiae expresses three functionally distinct homologues of the Nramp family of metal transporters,2000,Molecular and Cellular Biology,163,10.1128/MCB.20.21.7893-7902.2000,United States,Article,Baltimore,1,Journal,2-s2.0-0033773040
Andrews N.,,Iron homeostasis: Insights from genetics and animal models,2000,Nature Reviews Genetics,287,10.1038/35042073,United States,Review,Boston,0,Journal,2-s2.0-0034572933
Wykoff D.,,"Psr1, a nuclear localized protein that regulates phosphorus metabolism in Chlamydomonas",1999,Proceedings of the National Academy of Sciences of the United States of America,159,10.1073/pnas.96.26.15336,United States,Article,"Washington, D.C.",1,Journal,2-s2.0-0033592977
Briat J.F.,,Regulation of plant ferritin synthesis: How and why,1999,Cellular and Molecular Life Sciences,113,10.1007/s000180050014,France,Review,Montpellier,0,Journal,2-s2.0-0033214513
Douglas S.E.,,"The plastid genome of the cryptophyte alga, Guillardia theta: Complete sequence and conserved synteny groups confirm its common ancestry with red algae",1999,Journal of Molecular Evolution,228,10.1007/PL00006462,Canada,Article,"Ottawa ON,",0,Journal,2-s2.0-0032900424
Quinn J.,,Copper-responsive gene expression during adaptation to copper deficiency,1998,Methods in Enzymology,65,10.1016/S0076-6879(98)97020-3,,Article,,0,Book Series,2-s2.0-0031721060
Sonnhammer E.,,A hidden Markov model for predicting transmembrane helices in protein sequences.,1998,Proceedings / ... International Conference on Intelligent Systems for Molecular Biology ; ISMB. International Conference on Intelligent Systems for Molecular Biology,1928,,United States,Article,Bethesda,0,Journal,2-s2.0-0031614678
Briat J.F.,,Iron transport and storage in plants,1997,Trends in Plant Science,220,10.1016/S1360-1385(97)01033-9,France,Review,Montpellier,0,Journal,2-s2.0-0343145729
Fleming M.,,"Microcytic anaemia mice have a mutation in Nramp2, a candidate iron transporter gene",1997,Nature Genetics,979,10.1038/ng0897-383,United States,Article,Boston,0,Journal,2-s2.0-0030763856
Riedel H.,,Characterization and partial purification of a ferrireductase from human duodenal microvillus membranes,1995,Biochemical Journal,74,10.1042/bj3090745,Germany,Article,Heidelberg,0,Journal,2-s2.0-0029086987
Guerinot M.,,"Iron: Nutritious, noxious, and not readily available",1994,Plant Physiology,501,10.1104/pp.104.3.815,United States,Review,Hanover,1,Journal,2-s2.0-0028045384
Miyake C.,,Thylakoid-bound ascorbate peroxidase in spinach chloroplasts and photoreduction of its primary oxidation product monodehydroascorbate radicals in thylakoids,1992,Plant and Cell Physiology,375,,Japan,Article,Kyoto,0,Journal,2-s2.0-77957181306
Howe G.,,Heavy metal-activated synthesis of peptides in Chlamydomonas reinhardtii,1992,Plant Physiology,107,10.1104/pp.98.1.127,United States,Article,Los Angeles,1,Journal,2-s2.0-0000734875
Fleming P.,,"Cytochrome b561, ascorbic acid, and transmembrane electron transfer",1991,American Journal of Clinical Nutrition,35,10.1093/ajcn/54.6.1173s,United States,Article,"Washington, D.C.",0,Journal,2-s2.0-0025885657
Morel F.,,Limitation of productivity by trace metals in the sea,1991,Limnology and Oceanography,279,10.4319/lo.1991.36.8.1742,United States,Article,Cambridge,1,Journal,2-s2.0-0026397291
Schloss J.,,A Chlamydomonas gene encodes a G protein β subunit-like polypeptide,1990,MGG Molecular &amp; General Genetics,128,10.1007/BF00259410,United States,Article,Lexington,0,Journal,2-s2.0-0025374557
NJUS D.,,Mechanism of Ascorbic Acid Regeneration Mediated by Cytochrome b<inf>561</inf>,1987,Annals of the New York Academy of Sciences,33,10.1111/j.1749-6632.1987.tb27188.x,United States,Article,Detroit,0,Book Series,2-s2.0-0023082615
