Authors,Author(s) ID,Title,Year,Source tittle,Cited by,DOI,Country,Document Type,City,Access Type,aggregationType,EID
Yu S.,,Bayesian co-training,2009,Advances in Neural Information Processing Systems 20 - Proceedings of the 2007 Conference,36,,United States,Conference Paper,New York,0,Conference Proceeding,2-s2.0-84858788974
Sindhwani V.,,An RKHS for multi-view learning and manifold co-regularization,2008,Proceedings of the 25th International Conference on Machine Learning,161,10.1145/1390156.1390279,United States,Conference Paper,Yorktown Heights,0,Conference Proceeding,2-s2.0-56449131204
Rosenberg D.,,The Rademacher complexity of co-regularized kernel classes,2007,Journal of Machine Learning Research,26,,United States,Conference Paper,Berkeley,0,Journal,2-s2.0-84862283080
Belkin M.,,Manifold regularization: A geometric framework for learning from labeled and unlabeled examples,2006,Journal of Machine Learning Research,2537,,United States,Article,Columbus,0,Journal,2-s2.0-33750729556
Brefeld U.,,Efficient Co-regularised least squares regression,2006,ICML 2006 - Proceedings of the 23rd International Conference on Machine Learning,67,,Germany,Conference Paper,Berlin,0,Conference Proceeding,2-s2.0-33749246419
Sindhwani V.,,Beyond the point cloud: From transductive to semi-supervised learning,2005,ICML 2005 - Proceedings of the 22nd International Conference on Machine Learning,320,,United States,Conference Paper,Chicago,0,Conference Proceeding,2-s2.0-31844440904
Bousquet O.,,Introduction to Statistical Learning Theory,2004,Lecture Notes in Computer Science (including subseries Lecture Notes in Artificial Intelligence and Lecture Notes in Bioinformatics),190,10.1007/978-3-540-28650-9_8,Germany,Article,Tubingen,0,Book Series,2-s2.0-33846313242
